A1: Afghan Investment & Credit Mutual Fund Limited
A2: Working on WPPF for the year ending 2003
K3: Rupees
E5: Units | G5: NOE | I5: Total Units | K5: Amount
A7: Amount allocated to WPPF fund for the year 2003 | K7: 5362540
A9: Units to be allocated Rs. 10 of each | K9: =ROUND(K7/10,0) -> 536254
A11: Category A
B12: No of workers drawing avg. monthly salary not exceeding Rs. 2,500 | E12: 4 | G12: 218 | I12: =E12*G12 -> 872
A14: Category B
B15: No of workers drawing avg. monthly salary not exceeding Rs. 3,200 | E15: 2 | G15: 516 | I15: =E15*G15 -> 1032
A17: Category C
B18: No of workers drawing avg. monthly salary not exceeding Rs. 5,000 | E18: 1 | G18: 419 | I18: =E18*G18 -> 419
G21: =SUM(G12:G18) -> 1153 | I21: =SUM(I12:I18) -> 2323
A22: Per Person Units and Benefit
I23: Max Allow.
G24: Units | I24: Units | K24: Rupees
B26: Share of each worker in category A | E26: ((536,254*4)/2323) | G26: =(K9*E12)/I21 -> 923.38183383555747 | I26: =IF(G26>600,600,G26) -> 600 | K26: =I26*10 -> 6000
B28: Share of each worker in category B | E28: ((536,254*2)/2323) | G28: =(E15*K9)/I21 -> 461.69091691777874 | I28: =IF(G28>600,600,G28) -> 461.69091691777874 | K28: =I28*10 -> 4616.9091691777876
B30: Share of each worker in category C | E30: ((536,254*1)/2323) | G30: =(E18*K9)/I21 -> 230.84545845888937 | I30: =IF(G30>600,600,G30) -> 230.84545845888937 | K30: =I30*10 -> 2308.4545845888938
A33: Category Wise Units and Rupees
I35: Total | K35: Total
I36: Units | K36: Rupees
B37: Share of workers in category A | E37: (600*218) | I37: =I26*G12 -> 130800 | K37: =K26*G12 -> 1308000
B39: Share of workers in category B | E39: (600*516) | I39: =I28*G15 -> 238232.51312957384 | K39: =K28*G15 -> 2382325.1312957383
B41: Share of workers in category C | E41: (600*419) | I41: =I30*G18 -> 96724.247094274644 | K41: =K30*G18 -> 967242.4709427465
A43: TOTAL | I43: =SUM(I37:I42) -> 465756.76022384851 | K43: =SUM(K37:K42) -> 4657567.6022384847
G45: Left over amount: | K45: =K7-K43 -> 704972.39776151534