A1: ABC Bank Limited | O1: Summary
A2: Cutomer: | C2: Manzoor Ahmad Wattoo | O2: =A1 -> ABC Bank Limited
A3: Credit Card No.: | C3: 4965-8500-0038-1970 | O3: Cutomer: | Q3: =C2 -> Manzoor Ahmad Wattoo
A4: Credit Limit: | C4: 150000 | O4: Credit Card No.: | Q4: =C3 -> 4965-8500-0038-1970
A5: Date of default: | C5: =B108 -> 41152 | O5: Credit Limit: | Q5: =C4 -> 150000
M6: =TODAY() -> 41636 | O6: Date of default: | Q6: =C5 -> 41152 | T6: =M6 -> 41636
A7: Date wise withdrawals and payments, as required under the Financial Institutions' (Recovery of Finances') Ordinance, 2001 | O7: Principal | R7: Mark-up including other expenses
A8: S. No. | B8: Date | C8: Principal | D8: Mark up | E8: Other expenses | K8: Payments | L8: Total | M8: Balance | O8: Principal | P8: Payment of Principal | Q8: Balance | R8: Total costs | S8: Payments | T8: Balance
E9: Late payment | F9: Annual fee | G9: Cash advance fee | H9: FED | I9: Facility fee | J9: Over limit fee
A10: 1 | B10: 39717 | F10: 500 | H10: 50 | I10: 2.2 | L10: =SUM(C10:J10)-K10 -> 552.2 | M10: =L10 -> 552.2 | O10: =C10 -> 0 | Q10: =O10-P10 -> 0 | R10: =SUM(D10:J10) -> 552.2 | S10: =K10 -> 0 | T10: =R10-S10 -> 552.2 | U10: =S10-P10 -> 0
A11: =A10+1 -> 2 | B11: 39753 | I11: 75 | L11: =SUM(C11:J11)-K11 -> 75 | M11: =M10+L11 -> 627.2 | O11: =C11 -> 0 | P11: =IF(S11>R11+T10,S11-(R11+T10)) -> FALSE | Q11: =Q10+O11-P11 -> 0 | R11: =SUM(D11:J11) -> 75 | S11: =K11 -> 0 | T11: =IF(S11>T10+R11,0,(T10+R11)-S11) -> 627.2 | U11: =S11-P11 -> 0
A12: =A11+1 -> 3 | B12: 39767 | E12: 600 | H12: 60 | I12: 5.15 | L12: =SUM(C12:J12)-K12 -> 665.15 | M12: =M11+L12 -> 1292.35 | O12: =C12 -> 0 | P12: =IF(S12>R12+T11,S12-(R12+T11)) -> FALSE | Q12: =Q11+O12-P12 -> 0 | R12: =SUM(D12:J12) -> 665.15 | S12: =K12 -> 0 | T12: =IF(S12>T11+R12,0,(T11+R12)-S12) -> 1292.35 | U12: =S12-P12 -> 0
A13: =A12+1 -> 4 | B13: 39777 | K13: 1295 | L13: =SUM(C13:J13)-K13 -> -1295 | M13: =M12+L13 -> -2.6500000000000909 | O13: =C13 -> 0 | P13: =IF(S13>R13+T12,S13-(R13+T12)) -> 2.6500000000000909 | Q13: =Q12+O13-P13 -> -2.6500000000000909 | R13: =SUM(D13:J13) -> 0 | S13: =K13 -> 1295 | T13: =IF(S13>T12+R13,0,(T12+R13)-S13) -> 0 | U13: =S13-P13 -> 1292.35
A14: =A13+1 -> 5 | B14: 39783 | H14: 0.29 | I14: 75 | L14: =SUM(C14:J14)-K14 -> 75.29 | M14: =M13+L14 -> 72.639999999999915 | O14: =C14 -> 0 | P14: =IF(S14>R14+T13,S14-(R14+T13)) -> FALSE | Q14: =Q13+O14-P14 -> -2.6500000000000909 | R14: =SUM(D14:J14) -> 75.29 | S14: =K14 -> 0 | T14: =IF(S14>T13+R14,0,(T13+R14)-S14) -> 75.29 | U14: =S14-P14 -> 0
A15: =A14+1 -> 6 | B15: 39798 | C15: 125000 | E15: 600 | H15: 60 | L15: =SUM(C15:J15)-K15 -> 125660 | M15: =M14+L15 -> 125732.64 | O15: =C15 -> 125000 | P15: =IF(S15>R15+T14,S15-(R15+T14)) -> FALSE | Q15: =Q14+O15-P15 -> 124997.35 | R15: =SUM(D15:J15) -> 660 | S15: =K15 -> 0 | T15: =IF(S15>T14+R15,0,(T14+R15)-S15) -> 735.29 | U15: =S15-P15 -> 0
A16: =A15+1 -> 7 | B16: 39841 | K16: 73 | L16: =SUM(C16:J16)-K16 -> -73 | M16: =M15+L16 -> 125659.64 | O16: =C16 -> 0 | P16: =IF(S16>R16+T15,S16-(R16+T15)) -> FALSE | Q16: =Q15+O16-P16 -> 124997.35 | R16: =SUM(D16:J16) -> 0 | S16: =K16 -> 73 | T16: =IF(S16>T15+R16,0,(T15+R16)-S16) -> 662.29 | U16: =S16-P16 -> 73
A17: =A16+1 -> 8 | B17: 39848 | K17: 125700 | L17: =SUM(C17:J17)-K17 -> -125700 | M17: =M16+L17 -> -40.360000000000582 | O17: =C17 -> 0 | P17: =IF(S17>R17+T16,S17-(R17+T16)) -> 125037.71 | Q17: =Q16+O17-P17 -> -40.360000000000582 | R17: =SUM(D17:J17) -> 0 | S17: =K17 -> 125700 | T17: =IF(S17>T16+R17,0,(T16+R17)-S17) -> 0 | U17: =S17-P17 -> 662.2899999999936
A18: =A17+1 -> 9 | B18: 39850 | C18: 80000 | L18: =SUM(C18:J18)-K18 -> 80000 | M18: =M17+L18 -> 79959.64 | O18: =C18 -> 80000 | P18: =IF(S18>R18+T17,S18-(R18+T17)) -> FALSE | Q18: =Q17+O18-P18 -> 79959.64 | R18: =SUM(D18:J18) -> 0 | S18: =K18 -> 0 | T18: =IF(S18>T17+R18,0,(T17+R18)-S18) -> 0 | U18: =S18-P18 -> 0
A19: =A18+1 -> 10 | B19: 39860 | C19: 2500 | L19: =SUM(C19:J19)-K19 -> 2500 | M19: =M18+L19 -> 82459.64 | O19: =C19 -> 2500 | P19: =IF(S19>R19+T18,S19-(R19+T18)) -> FALSE | Q19: =Q18+O19-P19 -> 82459.64 | R19: =SUM(D19:J19) -> 0 | S19: =K19 -> 0 | T19: =IF(S19>T18+R19,0,(T18+R19)-S19) -> 0 | U19: =S19-P19 -> 0
A20: =A19+1 -> 11 | B20: 39871 | C20: 1400 | L20: =SUM(C20:J20)-K20 -> 1400 | M20: =M19+L20 -> 83859.64 | O20: =C20 -> 1400 | P20: =IF(S20>R20+T19,S20-(R20+T19)) -> FALSE | Q20: =Q19+O20-P20 -> 83859.64 | R20: =SUM(D20:J20) -> 0 | S20: =K20 -> 0 | T20: =IF(S20>T19+R20,0,(T19+R20)-S20) -> 0 | U20: =S20-P20 -> 0
A21: =A20+1 -> 12 | B21: 39883 | H21: 2 | I21: 20 | K21: 82000 | L21: =SUM(C21:J21)-K21 -> -81978 | M21: =M20+L21 -> 1881.64 | O21: =C21 -> 0 | P21: =IF(S21>R21+T20,S21-(R21+T20)) -> 81978 | Q21: =Q20+O21-P21 -> 1881.64 | R21: =SUM(D21:J21) -> 22 | S21: =K21 -> 82000 | T21: =IF(S21>T20+R21,0,(T20+R21)-S21) -> 0 | U21: =S21-P21 -> 22
A22: =A21+1 -> 13 | B22: 39902 | C22: 6000 | L22: =SUM(C22:J22)-K22 -> 6000 | M22: =M21+L22 -> 7881.64 | O22: =C22 -> 6000 | P22: =IF(S22>R22+T21,S22-(R22+T21)) -> FALSE | Q22: =Q21+O22-P22 -> 7881.64 | R22: =SUM(D22:J22) -> 0 | S22: =K22 -> 0 | T22: =IF(S22>T21+R22,0,(T21+R22)-S22) -> 0 | U22: =S22-P22 -> 0
A23: =A22+1 -> 14 | B23: 39904 | H23: 2 | I23: 20 | L23: =SUM(C23:J23)-K23 -> 22 | M23: =M22+L23 -> 7903.64 | O23: =C23 -> 0 | P23: =IF(S23>R23+T22,S23-(R23+T22)) -> FALSE | Q23: =Q22+O23-P23 -> 7881.64 | R23: =SUM(D23:J23) -> 22 | S23: =K23 -> 0 | T23: =IF(S23>T22+R23,0,(T22+R23)-S23) -> 22 | U23: =S23-P23 -> 0
A24: =A23+1 -> 15 | B24: 39906 | K24: 1885 | L24: =SUM(C24:J24)-K24 -> -1885 | M24: =M23+L24 -> 6018.64 | O24: =C24 -> 0 | P24: =IF(S24>R24+T23,S24-(R24+T23)) -> 1863 | Q24: =Q23+O24-P24 -> 6018.64 | R24: =SUM(D24:J24) -> 0 | S24: =K24 -> 1885 | T24: =IF(S24>T23+R24,0,(T23+R24)-S24) -> 0 | U24: =S24-P24 -> 22
A25: =A24+1 -> 16 | B25: 39914 | C25: 11700 | L25: =SUM(C25:J25)-K25 -> 11700 | M25: =M24+L25 -> 17718.64 | O25: =C25 -> 11700 | P25: =IF(S25>R25+T24,S25-(R25+T24)) -> FALSE | Q25: =Q24+O25-P25 -> 17718.64 | R25: =SUM(D25:J25) -> 0 | S25: =K25 -> 0 | T25: =IF(S25>T24+R25,0,(T24+R25)-S25) -> 0 | U25: =S25-P25 -> 0
A26: =A25+1 -> 17 | B26: 39928 | C26: 2800 | L26: =SUM(C26:J26)-K26 -> 2800 | M26: =M25+L26 -> 20518.64 | O26: =C26 -> 2800 | P26: =IF(S26>R26+T25,S26-(R26+T25)) -> FALSE | Q26: =Q25+O26-P26 -> 20518.64 | R26: =SUM(D26:J26) -> 0 | S26: =K26 -> 0 | T26: =IF(S26>T25+R26,0,(T25+R26)-S26) -> 0 | U26: =S26-P26 -> 0
A27: =A26+1 -> 18 | B27: 39935 | H27: 2 | I27: 20 | L27: =SUM(C27:J27)-K27 -> 22 | M27: =M26+L27 -> 20540.64 | O27: =C27 -> 0 | P27: =IF(S27>R27+T26,S27-(R27+T26)) -> FALSE | Q27: =Q26+O27-P27 -> 20518.64 | R27: =SUM(D27:J27) -> 22 | S27: =K27 -> 0 | T27: =IF(S27>T26+R27,0,(T26+R27)-S27) -> 22 | U27: =S27-P27 -> 0
A28: =A27+1 -> 19 | B28: 39937 | C28: 1680 | L28: =SUM(C28:J28)-K28 -> 1680 | M28: =M27+L28 -> 22220.639999999999 | O28: =C28 -> 1680 | P28: =IF(S28>R28+T27,S28-(R28+T27)) -> FALSE | Q28: =Q27+O28-P28 -> 22198.639999999999 | R28: =SUM(D28:J28) -> 0 | S28: =K28 -> 0 | T28: =IF(S28>T27+R28,0,(T27+R28)-S28) -> 22 | U28: =S28-P28 -> 0
A29: =A28+1 -> 20 | B29: 39934 | C29: 5509 | L29: =SUM(C29:J29)-K29 -> 5509 | M29: =M28+L29 -> 27729.64 | O29: =C29 -> 5509 | P29: =IF(S29>R29+T28,S29-(R29+T28)) -> FALSE | Q29: =Q28+O29-P29 -> 27707.64 | R29: =SUM(D29:J29) -> 0 | S29: =K29 -> 0 | T29: =IF(S29>T28+R29,0,(T28+R29)-S29) -> 22 | U29: =S29-P29 -> 0
A30: =A29+1 -> 21 | B30: 39940 | K30: 17720 | L30: =SUM(C30:J30)-K30 -> -17720 | M30: =M29+L30 -> 10009.64 | O30: =C30 -> 0 | P30: =IF(S30>R30+T29,S30-(R30+T29)) -> 17698 | Q30: =Q29+O30-P30 -> 10009.64 | R30: =SUM(D30:J30) -> 0 | S30: =K30 -> 17720 | T30: =IF(S30>T29+R30,0,(T29+R30)-S30) -> 0 | U30: =S30-P30 -> 22
A31: =A30+1 -> 22 | B31: 39965 | H31: 2 | I31: 20 | L31: =SUM(C31:J31)-K31 -> 22 | M31: =M30+L31 -> 10031.64 | O31: =C31 -> 0 | P31: =IF(S31>R31+T30,S31-(R31+T30)) -> FALSE | Q31: =Q30+O31-P31 -> 10009.64 | R31: =SUM(D31:J31) -> 22 | S31: =K31 -> 0 | T31: =IF(S31>T30+R31,0,(T30+R31)-S31) -> 22 | U31: =S31-P31 -> 0
A32: =A31+1 -> 23 | B32: 39968 | K32: 10010 | L32: =SUM(C32:J32)-K32 -> -10010 | M32: =M31+L32 -> 21.639999999999418 | O32: =C32 -> 0 | P32: =IF(S32>R32+T31,S32-(R32+T31)) -> 9988 | Q32: =Q31+O32-P32 -> 21.639999999999418 | R32: =SUM(D32:J32) -> 0 | S32: =K32 -> 10010 | T32: =IF(S32>T31+R32,0,(T31+R32)-S32) -> 0 | U32: =S32-P32 -> 22
A33: =A32+1 -> 24 | B33: 39967 | C33: 5435 | L33: =SUM(C33:J33)-K33 -> 5435 | M33: =M32+L33 -> 5456.64 | O33: =C33 -> 5435 | P33: =IF(S33>R33+T32,S33-(R33+T32)) -> FALSE | Q33: =Q32+O33-P33 -> 5456.64 | R33: =SUM(D33:J33) -> 0 | S33: =K33 -> 0 | T33: =IF(S33>T32+R33,0,(T32+R33)-S33) -> 0 | U33: =S33-P33 -> 0
A34: =A33+1 -> 25 | B34: 39975 | C34: 2400 | L34: =SUM(C34:J34)-K34 -> 2400 | M34: =M33+L34 -> 7856.64 | O34: =C34 -> 2400 | P34: =IF(S34>R34+T33,S34-(R34+T33)) -> FALSE | Q34: =Q33+O34-P34 -> 7856.64 | R34: =SUM(D34:J34) -> 0 | S34: =K34 -> 0 | T34: =IF(S34>T33+R34,0,(T33+R34)-S34) -> 0 | U34: =S34-P34 -> 0
A35: =A34+1 -> 26 | B35: 39996 | H35: 3.2 | I35: 20 | L35: =SUM(C35:J35)-K35 -> 23.2 | M35: =M34+L35 -> 7879.84 | O35: =C35 -> 0 | P35: =IF(S35>R35+T34,S35-(R35+T34)) -> FALSE | Q35: =Q34+O35-P35 -> 7856.64 | R35: =SUM(D35:J35) -> 23.2 | S35: =K35 -> 0 | T35: =IF(S35>T34+R35,0,(T34+R35)-S35) -> 23.2 | U35: =S35-P35 -> 0
A36: =A35+1 -> 27 | B36: 40000 | K36: 7860 | L36: =SUM(C36:J36)-K36 -> -7860 | M36: =M35+L36 -> 19.839999999999236 | O36: =C36 -> 0 | P36: =IF(S36>R36+T35,S36-(R36+T35)) -> 7836.8 | Q36: =Q35+O36-P36 -> 19.839999999999236 | R36: =SUM(D36:J36) -> 0 | S36: =K36 -> 7860 | T36: =IF(S36>T35+R36,0,(T35+R36)-S36) -> 0 | U36: =S36-P36 -> 23.199999999999818
A37: =A36+1 -> 28 | B37: 39997 | C37: 1000 | L37: =SUM(C37:J37)-K37 -> 1000 | M37: =M36+L37 -> 1019.84 | O37: =C37 -> 1000 | P37: =IF(S37>R37+T36,S37-(R37+T36)) -> FALSE | Q37: =Q36+O37-P37 -> 1019.84 | R37: =SUM(D37:J37) -> 0 | S37: =K37 -> 0 | T37: =IF(S37>T36+R37,0,(T36+R37)-S37) -> 0 | U37: =S37-P37 -> 0
A38: =A37+1 -> 29 | B38: 39996 | C38: 5000 | L38: =SUM(C38:J38)-K38 -> 5000 | M38: =M37+L38 -> 6019.84 | O38: =C38 -> 5000 | P38: =IF(S38>R38+T37,S38-(R38+T37)) -> FALSE | Q38: =Q37+O38-P38 -> 6019.84 | R38: =SUM(D38:J38) -> 0 | S38: =K38 -> 0 | T38: =IF(S38>T37+R38,0,(T37+R38)-S38) -> 0 | U38: =S38-P38 -> 0
A39: =A38+1 -> 30 | B39: 39821 | H39: 3.2 | I39: 20 | L39: =SUM(C39:J39)-K39 -> 23.2 | M39: =M38+L39 -> 6043.04 | O39: =C39 -> 0 | P39: =IF(S39>R39+T38,S39-(R39+T38)) -> FALSE | Q39: =Q38+O39-P39 -> 6019.84 | R39: =SUM(D39:J39) -> 23.2 | S39: =K39 -> 0 | T39: =IF(S39>T38+R39,0,(T38+R39)-S39) -> 23.2 | U39: =S39-P39 -> 0
A40: =A39+1 -> 31 | B40: 40031 | C40: 16941 | K40: 6000 | L40: =SUM(C40:J40)-K40 -> 10941 | M40: =M39+L40 -> 16984.04 | O40: =C40 -> 16941 | P40: =IF(S40>R40+T39,S40-(R40+T39)) -> 5976.8 | Q40: =Q39+O40-P40 -> 16984.04 | R40: =SUM(D40:J40) -> 0 | S40: =K40 -> 6000 | T40: =IF(S40>T39+R40,0,(T39+R40)-S40) -> 0 | U40: =S40-P40 -> 23.199999999999818
A41: =A40+1 -> 32 | B41: 40040 | D41: 221.16 | L41: =SUM(C41:J41)-K41 -> 221.16 | M41: =M40+L41 -> 17205.2 | O41: =C41 -> 0 | P41: =IF(S41>R41+T40,S41-(R41+T40)) -> FALSE | Q41: =Q40+O41-P41 -> 16984.04 | R41: =SUM(D41:J41) -> 221.16 | S41: =K41 -> 0 | T41: =IF(S41>T40+R41,0,(T40+R41)-S41) -> 221.16 | U41: =S41-P41 -> 0
A42: =A41+1 -> 33 | B42: 40042 | C42: 1450 | L42: =SUM(C42:J42)-K42 -> 1450 | M42: =M41+L42 -> 18655.2 | O42: =C42 -> 1450 | P42: =IF(S42>R42+T41,S42-(R42+T41)) -> FALSE | Q42: =Q41+O42-P42 -> 18434.04 | R42: =SUM(D42:J42) -> 0 | S42: =K42 -> 0 | T42: =IF(S42>T41+R42,0,(T41+R42)-S42) -> 221.16 | U42: =S42-P42 -> 0
A43: =A42+1 -> 34 | B43: 40047 | C43: 26000 | L43: =SUM(C43:J43)-K43 -> 26000 | M43: =M42+L43 -> 44655.199999999997 | O43: =C43 -> 26000 | P43: =IF(S43>R43+T42,S43-(R43+T42)) -> FALSE | Q43: =Q42+O43-P43 -> 44434.04 | R43: =SUM(D43:J43) -> 0 | S43: =K43 -> 0 | T43: =IF(S43>T42+R43,0,(T42+R43)-S43) -> 221.16 | U43: =S43-P43 -> 0
A44: =A43+1 -> 35 | B44: 40053 | C44: 790 | L44: =SUM(C44:J44)-K44 -> 790 | M44: =M43+L44 -> 45445.2 | O44: =C44 -> 790 | P44: =IF(S44>R44+T43,S44-(R44+T43)) -> FALSE | Q44: =Q43+O44-P44 -> 45224.04 | R44: =SUM(D44:J44) -> 0 | S44: =K44 -> 0 | T44: =IF(S44>T43+R44,0,(T43+R44)-S44) -> 221.16 | U44: =S44-P44 -> 0
A45: =A44+1 -> 36 | B45: 40057 | H45: 3.2 | I45: 20 | L45: =SUM(C45:J45)-K45 -> 23.2 | M45: =M44+L45 -> 45468.4 | O45: =C45 -> 0 | P45: =IF(S45>R45+T44,S45-(R45+T44)) -> FALSE | Q45: =Q44+O45-P45 -> 45224.04 | R45: =SUM(D45:J45) -> 23.2 | S45: =K45 -> 0 | T45: =IF(S45>T44+R45,0,(T44+R45)-S45) -> 244.36 | U45: =S45-P45 -> 0
A46: =A45+1 -> 37 | B46: 40061 | K46: 17210 | L46: =SUM(C46:J46)-K46 -> -17210 | M46: =M45+L46 -> 28258.400000000001 | O46: =C46 -> 0 | P46: =IF(S46>R46+T45,S46-(R46+T45)) -> 16965.64 | Q46: =Q45+O46-P46 -> 28258.400000000001 | R46: =SUM(D46:J46) -> 0 | S46: =K46 -> 17210 | T46: =IF(S46>T45+R46,0,(T45+R46)-S46) -> 0 | U46: =S46-P46 -> 244.36000000000058
A47: =A46+1 -> 38 | B47: 40062 | C47: 4485 | L47: =SUM(C47:J47)-K47 -> 4485 | M47: =M46+L47 -> 32743.4 | O47: =C47 -> 4485 | P47: =IF(S47>R47+T46,S47-(R47+T46)) -> FALSE | Q47: =Q46+O47-P47 -> 32743.4 | R47: =SUM(D47:J47) -> 0 | S47: =K47 -> 0 | T47: =IF(S47>T46+R47,0,(T46+R47)-S47) -> 0 | U47: =S47-P47 -> 0
A48: =A47+1 -> 39 | B48: 40082 | F48: 500 | H48: 80 | L48: =SUM(C48:J48)-K48 -> 580 | M48: =M47+L48 -> 33323.4 | O48: =C48 -> 0 | P48: =IF(S48>R48+T47,S48-(R48+T47)) -> FALSE | Q48: =Q47+O48-P48 -> 32743.4 | R48: =SUM(D48:J48) -> 580 | S48: =K48 -> 0 | T48: =IF(S48>T47+R48,0,(T47+R48)-S48) -> 580 | U48: =S48-P48 -> 0
A49: =A48+1 -> 40 | B49: 40087 | H49: 3.2 | I49: 20 | L49: =SUM(C49:J49)-K49 -> 23.2 | M49: =M48+L49 -> 33346.6 | O49: =C49 -> 0 | P49: =IF(S49>R49+T48,S49-(R49+T48)) -> FALSE | Q49: =Q48+O49-P49 -> 32743.4 | R49: =SUM(D49:J49) -> 23.2 | S49: =K49 -> 0 | T49: =IF(S49>T48+R49,0,(T48+R49)-S49) -> 603.2 | U49: =S49-P49 -> 0
A50: =A49+1 -> 41 | B50: 40075 | C50: 6393 | L50: =SUM(C50:J50)-K50 -> 6393 | M50: =M49+L50 -> 39739.599999999999 | O50: =C50 -> 6393 | P50: =IF(S50>R50+T49,S50-(R50+T49)) -> FALSE | Q50: =Q49+O50-P50 -> 39136.400000000001 | R50: =SUM(D50:J50) -> 0 | S50: =K50 -> 0 | T50: =IF(S50>T49+R50,0,(T49+R50)-S50) -> 603.2 | U50: =S50-P50 -> 0
A51: =A50+1 -> 42 | B51: 40088 | K51: 32744 | L51: =SUM(C51:J51)-K51 -> -32744 | M51: =M50+L51 -> 6995.5999999999913 | O51: =C51 -> 0 | P51: =IF(S51>R51+T50,S51-(R51+T50)) -> 32140.799999999999 | Q51: =Q50+O51-P51 -> 6995.6 | R51: =SUM(D51:J51) -> 0 | S51: =K51 -> 32744 | T51: =IF(S51>T50+R51,0,(T50+R51)-S51) -> 0 | U51: =S51-P51 -> 603.20000000000073
A52: =A51+1 -> 43 | B52: 40093 | C52: 4872 | L52: =SUM(C52:J52)-K52 -> 4872 | M52: =M51+L52 -> 11867.6 | O52: =C52 -> 4872 | P52: =IF(S52>R52+T51,S52-(R52+T51)) -> FALSE | Q52: =Q51+O52-P52 -> 11867.6 | R52: =SUM(D52:J52) -> 0 | S52: =K52 -> 0 | T52: =IF(S52>T51+R52,0,(T51+R52)-S52) -> 0 | U52: =S52-P52 -> 0
A53: =A52+1 -> 44 | B53: 40117 | H53: 3.2 | I53: 20 | L53: =SUM(C53:J53)-K53 -> 23.2 | M53: =M52+L53 -> 11890.8 | O53: =C53 -> 0 | P53: =IF(S53>R53+T52,S53-(R53+T52)) -> FALSE | Q53: =Q52+O53-P53 -> 11867.6 | R53: =SUM(D53:J53) -> 23.2 | S53: =K53 -> 0 | T53: =IF(S53>T52+R53,0,(T52+R53)-S53) -> 23.2 | U53: =S53-P53 -> 0
A54: =A53+1 -> 45 | B54: 40122 | K54: 11870 | L54: =SUM(C54:J54)-K54 -> -11870 | M54: =M53+L54 -> 20.799999999991996 | O54: =C54 -> 0 | P54: =IF(S54>R54+T53,S54-(R54+T53)) -> 11846.8 | Q54: =Q53+O54-P54 -> 20.80000000000291 | R54: =SUM(D54:J54) -> 0 | S54: =K54 -> 11870 | T54: =IF(S54>T53+R54,0,(T53+R54)-S54) -> 0 | U54: =S54-P54 -> 23.200000000000728
A55: =A54+1 -> 46 | B55: 40128 | H55: 48 | I55: 300 | L55: =SUM(C55:J55)-K55 -> 348 | M55: =M54+L55 -> 368.799999999992 | O55: =C55 -> 0 | P55: =IF(S55>R55+T54,S55-(R55+T54)) -> FALSE | Q55: =Q54+O55-P55 -> 20.80000000000291 | R55: =SUM(D55:J55) -> 348 | S55: =K55 -> 0 | T55: =IF(S55>T54+R55,0,(T54+R55)-S55) -> 348 | U55: =S55-P55 -> 0
A56: =A55+1 -> 47 | B56: 40155 | H56: 3.2 | I56: 20 | L56: =SUM(C56:J56)-K56 -> 23.2 | M56: =M55+L56 -> 391.99999999999199 | O56: =C56 -> 0 | P56: =IF(S56>R56+T55,S56-(R56+T55)) -> FALSE | Q56: =Q55+O56-P56 -> 20.80000000000291 | R56: =SUM(D56:J56) -> 23.2 | S56: =K56 -> 0 | T56: =IF(S56>T55+R56,0,(T55+R56)-S56) -> 371.2 | U56: =S56-P56 -> 0
A57: =A56+1 -> 48 | B57: 40162 | E57: 600 | H57: 96 | L57: =SUM(C57:J57)-K57 -> 696 | M57: =M56+L57 -> 1087.999999999992 | O57: =C57 -> 0 | P57: =IF(S57>R57+T56,S57-(R57+T56)) -> FALSE | Q57: =Q56+O57-P57 -> 20.80000000000291 | R57: =SUM(D57:J57) -> 696 | S57: =K57 -> 0 | T57: =IF(S57>T56+R57,0,(T56+R57)-S57) -> 1067.2 | U57: =S57-P57 -> 0
A58: =A57+1 -> 49 | B58: 40176 | K58: 1100 | L58: =SUM(C58:J58)-K58 -> -1100 | M58: =M57+L58 -> -12.000000000007958 | O58: =C58 -> 0 | P58: =IF(S58>R58+T57,S58-(R58+T57)) -> 32.8 | Q58: =Q57+O58-P58 -> -11.999999999997044 | R58: =SUM(D58:J58) -> 0 | S58: =K58 -> 1100 | T58: =IF(S58>T57+R58,0,(T57+R58)-S58) -> 0 | U58: =S58-P58 -> 1067.2
A59: =A58+1 -> 50 | B59: 40178 | H59: 3.2 | I59: 20 | L59: =SUM(C59:J59)-K59 -> 23.2 | M59: =M58+L59 -> 11.199999999992041 | O59: =C59 -> 0 | P59: =IF(S59>R59+T58,S59-(R59+T58)) -> FALSE | Q59: =Q58+O59-P59 -> -11.999999999997044 | R59: =SUM(D59:J59) -> 23.2 | S59: =K59 -> 0 | T59: =IF(S59>T58+R59,0,(T58+R59)-S59) -> 23.2 | U59: =S59-P59 -> 0
A60: =A59+1 -> 51 | B60: 40210 | H60: 3.2 | I60: 20 | L60: =SUM(C60:J60)-K60 -> 23.2 | M60: =M59+L60 -> 34.399999999992041 | O60: =C60 -> 0 | P60: =IF(S60>R60+T59,S60-(R60+T59)) -> FALSE | Q60: =Q59+O60-P60 -> -11.999999999997044 | R60: =SUM(D60:J60) -> 23.2 | S60: =K60 -> 0 | T60: =IF(S60>T59+R60,0,(T59+R60)-S60) -> 46.4 | U60: =S60-P60 -> 0
A61: =A60+1 -> 52 | B61: 40218 | E61: -1200 | H61: -192 | I61: -12 | L61: =SUM(C61:J61)-K61 -> -1404 | M61: =M60+L61 -> -1369.6000000000079 | O61: =C61 -> 0 | P61: =IF(S61>R61+T60,S61-(R61+T60)) -> 1357.6 | Q61: =Q60+O61-P61 -> -1369.6 | R61: =SUM(D61:J61) -> -1404 | S61: =K61 -> 0 | T61: =IF(S61>T60+R61,0,(T60+R61)-S61) -> 0 | U61: =S61-P61 -> -1357.6
A62: =A61+1 -> 53 | B62: 40239 | H62: 3.2 | I62: 20 | L62: =SUM(C62:J62)-K62 -> 23.2 | M62: =M61+L62 -> -1346.4000000000078 | O62: =C62 -> 0 | P62: =IF(S62>R62+T61,S62-(R62+T61)) -> FALSE | Q62: =Q61+O62-P62 -> -1369.6 | R62: =SUM(D62:J62) -> 23.2 | S62: =K62 -> 0 | T62: =IF(S62>T61+R62,0,(T61+R62)-S62) -> 23.2 | U62: =S62-P62 -> 0
A63: =A62+1 -> 54 | B63: 40261 | C63: 3587 | L63: =SUM(C63:J63)-K63 -> 3587 | M63: =M62+L63 -> 2240.5999999999922 | O63: =C63 -> 3587 | P63: =IF(S63>R63+T62,S63-(R63+T62)) -> FALSE | Q63: =Q62+O63-P63 -> 2217.4 | R63: =SUM(D63:J63) -> 0 | S63: =K63 -> 0 | T63: =IF(S63>T62+R63,0,(T62+R63)-S63) -> 23.2 | U63: =S63-P63 -> 0
A64: =A63+1 -> 55 | B64: 40273 | C64: 2600 | H64: 3.2 | I64: 20 | L64: =SUM(C64:J64)-K64 -> 2623.2 | M64: =M63+L64 -> 4863.799999999992 | O64: =C64 -> 2600 | P64: =IF(S64>R64+T63,S64-(R64+T63)) -> FALSE | Q64: =Q63+O64-P64 -> 4817.4 | R64: =SUM(D64:J64) -> 23.2 | S64: =K64 -> 0 | T64: =IF(S64>T63+R64,0,(T63+R64)-S64) -> 46.4 | U64: =S64-P64 -> 0
A65: =A64+1 -> 56 | B65: 40301 | C65: 1275 | H65: 3.2 | I65: 20 | L65: =SUM(C65:J65)-K65 -> 1298.2 | M65: =M64+L65 -> 6161.9999999999918 | O65: =C65 -> 1275 | P65: =IF(S65>R65+T64,S65-(R65+T64)) -> FALSE | Q65: =Q64+O65-P65 -> 6092.4 | R65: =SUM(D65:J65) -> 23.2 | S65: =K65 -> 0 | T65: =IF(S65>T64+R65,0,(T64+R65)-S65) -> 69.6 | U65: =S65-P65 -> 0
A66: =A65+1 -> 57 | B66: 40303 | K66: 4870 | L66: =SUM(C66:J66)-K66 -> -4870 | M66: =M65+L66 -> 1291.9999999999918 | O66: =C66 -> 0 | P66: =IF(S66>R66+T65,S66-(R66+T65)) -> 4800.4 | Q66: =Q65+O66-P66 -> 1292 | R66: =SUM(D66:J66) -> 0 | S66: =K66 -> 4870 | T66: =IF(S66>T65+R66,0,(T65+R66)-S66) -> 0 | U66: =S66-P66 -> 69.600000000000364
A67: =A66+1 -> 58 | B67: 40298 | C67: 5484 | L67: =SUM(C67:J67)-K67 -> 5484 | M67: =M66+L67 -> 6775.9999999999918 | O67: =C67 -> 5484 | P67: =IF(S67>R67+T66,S67-(R67+T66)) -> FALSE | Q67: =Q66+O67-P67 -> 6776 | R67: =SUM(D67:J67) -> 0 | S67: =K67 -> 0 | T67: =IF(S67>T66+R67,0,(T66+R67)-S67) -> 0 | U67: =S67-P67 -> 0
A68: =A67+1 -> 59 | B68: 40318 | C68: 2500 | L68: =SUM(C68:J68)-K68 -> 2500 | M68: =M67+L68 -> 9275.9999999999927 | O68: =C68 -> 2500 | P68: =IF(S68>R68+T67,S68-(R68+T67)) -> FALSE | Q68: =Q67+O68-P68 -> 9276 | R68: =SUM(D68:J68) -> 0 | S68: =K68 -> 0 | T68: =IF(S68>T67+R68,0,(T67+R68)-S68) -> 0 | U68: =S68-P68 -> 0
A69: =A68+1 -> 60 | B69: 40332 | C69: 1200 | H69: 3.2 | I69: 20 | K69: 0 | L69: =SUM(C69:J69)-K69 -> 1223.2 | M69: =M68+L69 -> 10499.2 | O69: =C69 -> 1200 | P69: =IF(S69>R69+T68,S69-(R69+T68)) -> FALSE | Q69: =Q68+O69-P69 -> 10476 | R69: =SUM(D69:J69) -> 23.2 | S69: =K69 -> 0 | T69: =IF(S69>T68+R69,0,(T68+R69)-S69) -> 23.2 | U69: =S69-P69 -> 0
A70: =A69+1 -> 61 | B70: 40333 | C70: 125 | K70: 6800 | L70: =SUM(C70:J70)-K70 -> -6675 | M70: =M69+L70 -> 3824.1999999999935 | O70: =C70 -> 125 | P70: =IF(S70>R70+T69,S70-(R70+T69)) -> 6776.8 | Q70: =Q69+O70-P70 -> 3824.2 | R70: =SUM(D70:J70) -> 0 | S70: =K70 -> 6800 | T70: =IF(S70>T69+R70,0,(T69+R70)-S70) -> 0 | U70: =S70-P70 -> 23.199999999999818
A71: =A70+1 -> 62 | B71: 40334 | C71: 7210 | L71: =SUM(C71:J71)-K71 -> 7210 | M71: =M70+L71 -> 11034.2 | O71: =C71 -> 7210 | P71: =IF(S71>R71+T70,S71-(R71+T70)) -> FALSE | Q71: =Q70+O71-P71 -> 11034.2 | R71: =SUM(D71:J71) -> 0 | S71: =K71 -> 0 | T71: =IF(S71>T70+R71,0,(T70+R71)-S71) -> 0 | U71: =S71-P71 -> 0
A72: =A71+1 -> 63 | B72: 40350 | C72: 1000 | L72: =SUM(C72:J72)-K72 -> 1000 | M72: =M71+L72 -> 12034.2 | O72: =C72 -> 1000 | P72: =IF(S72>R72+T71,S72-(R72+T71)) -> FALSE | Q72: =Q71+O72-P72 -> 12034.2 | R72: =SUM(D72:J72) -> 0 | S72: =K72 -> 0 | T72: =IF(S72>T71+R72,0,(T71+R72)-S72) -> 0 | U72: =S72-P72 -> 0
A73: =A72+1 -> 64 | B73: 40359 | C73: 4710 | L73: =SUM(C73:J73)-K73 -> 4710 | M73: =M72+L73 -> 16744.2 | O73: =C73 -> 4710 | P73: =IF(S73>R73+T72,S73-(R73+T72)) -> FALSE | Q73: =Q72+O73-P73 -> 16744.2 | R73: =SUM(D73:J73) -> 0 | S73: =K73 -> 0 | T73: =IF(S73>T72+R73,0,(T72+R73)-S73) -> 0 | U73: =S73-P73 -> 0
A74: =A73+1 -> 65 | B74: 40366 | K74: 11040 | L74: =SUM(C74:J74)-K74 -> -11040 | M74: =M73+L74 -> 5704.1999999999935 | O74: =C74 -> 0 | P74: =IF(S74>R74+T73,S74-(R74+T73)) -> 11040 | Q74: =Q73+O74-P74 -> 5704.2 | R74: =SUM(D74:J74) -> 0 | S74: =K74 -> 11040 | T74: =IF(S74>T73+R74,0,(T73+R74)-S74) -> 0 | U74: =S74-P74 -> 0
A75: =A74+1 -> 66 | B75: 40377 | C75: 1570 | L75: =SUM(C75:J75)-K75 -> 1570 | M75: =M74+L75 -> 7274.1999999999935 | O75: =C75 -> 1570 | P75: =IF(S75>R75+T74,S75-(R75+T74)) -> FALSE | Q75: =Q74+O75-P75 -> 7274.2 | R75: =SUM(D75:J75) -> 0 | S75: =K75 -> 0 | T75: =IF(S75>T74+R75,0,(T74+R75)-S75) -> 0 | U75: =S75-P75 -> 0
A76: =A75+1 -> 67 | B76: 40389 | H76: 3.2 | I76: 20 | L76: =SUM(C76:J76)-K76 -> 23.2 | M76: =M75+L76 -> 7297.3999999999933 | O76: =C76 -> 0 | P76: =IF(S76>R76+T75,S76-(R76+T75)) -> FALSE | Q76: =Q75+O76-P76 -> 7274.2 | R76: =SUM(D76:J76) -> 23.2 | S76: =K76 -> 0 | T76: =IF(S76>T75+R76,0,(T75+R76)-S76) -> 23.2 | U76: =S76-P76 -> 0
A77: =A76+1 -> 68 | B77: 40393 | K77: 5710 | L77: =SUM(C77:J77)-K77 -> -5710 | M77: =M76+L77 -> 1587.3999999999933 | O77: =C77 -> 0 | P77: =IF(S77>R77+T76,S77-(R77+T76)) -> 5686.8 | Q77: =Q76+O77-P77 -> 1587.4 | R77: =SUM(D77:J77) -> 0 | S77: =K77 -> 5710 | T77: =IF(S77>T76+R77,0,(T76+R77)-S77) -> 0 | U77: =S77-P77 -> 23.199999999999818
A78: =A77+1 -> 69 | B78: 40397 | C78: =4368+6464 -> 10832 | L78: =SUM(C78:J78)-K78 -> 10832 | M78: =M77+L78 -> 12419.4 | O78: =C78 -> 10832 | P78: =IF(S78>R78+T77,S78-(R78+T77)) -> FALSE | Q78: =Q77+O78-P78 -> 12419.4 | R78: =SUM(D78:J78) -> 0 | S78: =K78 -> 0 | T78: =IF(S78>T77+R78,0,(T77+R78)-S78) -> 0 | U78: =S78-P78 -> 0
A79: =A78+1 -> 70 | B79: 40401 | C79: 3540 | L79: =SUM(C79:J79)-K79 -> 3540 | M79: =M78+L79 -> 15959.4 | O79: =C79 -> 3540 | P79: =IF(S79>R79+T78,S79-(R79+T78)) -> FALSE | Q79: =Q78+O79-P79 -> 15959.4 | R79: =SUM(D79:J79) -> 0 | S79: =K79 -> 0 | T79: =IF(S79>T78+R79,0,(T78+R79)-S79) -> 0 | U79: =S79-P79 -> 0
A80: =A79+1 -> 71 | B80: 40422 | H80: 3.2 | I80: 20 | L80: =SUM(C80:J80)-K80 -> 23.2 | M80: =M79+L80 -> 15982.6 | O80: =C80 -> 0 | P80: =IF(S80>R80+T79,S80-(R80+T79)) -> FALSE | Q80: =Q79+O80-P80 -> 15959.4 | R80: =SUM(D80:J80) -> 23.2 | S80: =K80 -> 0 | T80: =IF(S80>T79+R80,0,(T79+R80)-S80) -> 23.2 | U80: =S80-P80 -> 0
A81: =A80+1 -> 72 | B81: 40424 | K81: 12420 | L81: =SUM(C81:J81)-K81 -> -12420 | M81: =M80+L81 -> 3562.5999999999949 | O81: =C81 -> 0 | P81: =IF(S81>R81+T80,S81-(R81+T80)) -> 12396.8 | Q81: =Q80+O81-P81 -> 3562.6000000000058 | R81: =SUM(D81:J81) -> 0 | S81: =K81 -> 12420 | T81: =IF(S81>T80+R81,0,(T80+R81)-S81) -> 0 | U81: =S81-P81 -> 23.200000000000728
A82: =A81+1 -> 73 | B82: 40445 | F82: 500 | H82: 80 | L82: =SUM(C82:J82)-K82 -> 580 | M82: =M81+L82 -> 4142.5999999999949 | O82: =C82 -> 0 | P82: =IF(S82>R82+T81,S82-(R82+T81)) -> FALSE | Q82: =Q81+O82-P82 -> 3562.6000000000058 | R82: =SUM(D82:J82) -> 580 | S82: =K82 -> 0 | T82: =IF(S82>T81+R82,0,(T81+R82)-S82) -> 580 | U82: =S82-P82 -> 0
A83: =A82+1 -> 74 | B83: 40452 | H83: 3.2 | I83: 20 | L83: =SUM(C83:J83)-K83 -> 23.2 | M83: =M82+L83 -> 4165.7999999999947 | O83: =C83 -> 0 | P83: =IF(S83>R83+T82,S83-(R83+T82)) -> FALSE | Q83: =Q82+O83-P83 -> 3562.6000000000058 | R83: =SUM(D83:J83) -> 23.2 | S83: =K83 -> 0 | T83: =IF(S83>T82+R83,0,(T82+R83)-S83) -> 603.2 | U83: =S83-P83 -> 0
A84: =A83+1 -> 75 | B84: 40457 | K84: 3570 | L84: =SUM(C84:J84)-K84 -> -3570 | M84: =M83+L84 -> 595.79999999999472 | O84: =C84 -> 0 | P84: =IF(S84>R84+T83,S84-(R84+T83)) -> 2966.8 | Q84: =Q83+O84-P84 -> 595.80000000000564 | R84: =SUM(D84:J84) -> 0 | S84: =K84 -> 3570 | T84: =IF(S84>T83+R84,0,(T83+R84)-S84) -> 0 | U84: =S84-P84 -> 603.2
A85: =A84+1 -> 76 | B85: 40480 | C85: 2354 | L85: =SUM(C85:J85)-K85 -> 2354 | M85: =M84+L85 -> 2949.7999999999947 | O85: =C85 -> 2354 | P85: =IF(S85>R85+T84,S85-(R85+T84)) -> FALSE | Q85: =Q84+O85-P85 -> 2949.8000000000056 | R85: =SUM(D85:J85) -> 0 | S85: =K85 -> 0 | T85: =IF(S85>T84+R85,0,(T84+R85)-S85) -> 0 | U85: =S85-P85 -> 0
A86: =A85+1 -> 77 | B86: 40483 | H86: 3.2 | I86: 20 | L86: =SUM(C86:J86)-K86 -> 23.2 | M86: =M85+L86 -> 2972.9999999999945 | O86: =C86 -> 0 | P86: =IF(S86>R86+T85,S86-(R86+T85)) -> FALSE | Q86: =Q85+O86-P86 -> 2949.8000000000056 | R86: =SUM(D86:J86) -> 23.2 | S86: =K86 -> 0 | T86: =IF(S86>T85+R86,0,(T85+R86)-S86) -> 23.2 | U86: =S86-P86 -> 0
A87: =A86+1 -> 78 | B87: 40487 | C87: 70500 | L87: =SUM(C87:J87)-K87 -> 70500 | M87: =M86+L87 -> 73473 | O87: =C87 -> 70500 | P87: =IF(S87>R87+T86,S87-(R87+T86)) -> FALSE | Q87: =Q86+O87-P87 -> 73449.8 | R87: =SUM(D87:J87) -> 0 | S87: =K87 -> 0 | T87: =IF(S87>T86+R87,0,(T86+R87)-S87) -> 23.2 | U87: =S87-P87 -> 0
A88: =A87+1 -> 79 | B88: 40497 | E88: 600 | H88: 96 | L88: =SUM(C88:J88)-K88 -> 696 | M88: =M87+L88 -> 74169 | O88: =C88 -> 0 | P88: =IF(S88>R88+T87,S88-(R88+T87)) -> FALSE | Q88: =Q87+O88-P88 -> 73449.8 | R88: =SUM(D88:J88) -> 696 | S88: =K88 -> 0 | T88: =IF(S88>T87+R88,0,(T87+R88)-S88) -> 719.2 | U88: =S88-P88 -> 0
A89: =A88+1 -> 80 | B89: 40513 | H89: 3.2 | I89: 20 | L89: =SUM(C89:J89)-K89 -> 23.2 | M89: =M88+L89 -> 74192.2 | O89: =C89 -> 0 | P89: =IF(S89>R89+T88,S89-(R89+T88)) -> FALSE | Q89: =Q88+O89-P89 -> 73449.8 | R89: =SUM(D89:J89) -> 23.2 | S89: =K89 -> 0 | T89: =IF(S89>T88+R89,0,(T88+R89)-S89) -> 742.4 | U89: =S89-P89 -> 0
A90: =A89+1 -> 81 | B90: 40516 | K90: 74200 | L90: =SUM(C90:J90)-K90 -> -74200 | M90: =M89+L90 -> -7.8000000000029104 | O90: =C90 -> 0 | P90: =IF(S90>R90+T89,S90-(R90+T89)) -> 73457.600000000006 | Q90: =Q89+O90-P90 -> -7.8000000000029104 | R90: =SUM(D90:J90) -> 0 | S90: =K90 -> 74200 | T90: =IF(S90>T89+R90,0,(T89+R90)-S90) -> 0 | U90: =S90-P90 -> 742.39999999999418
A91: =A90+1 -> 82 | B91: 40519 | C91: 6740 | L91: =SUM(C91:J91)-K91 -> 6740 | M91: =M90+L91 -> 6732.2 | O91: =C91 -> 6740 | P91: =IF(S91>R91+T90,S91-(R91+T90)) -> FALSE | Q91: =Q90+O91-P91 -> 6732.2 | R91: =SUM(D91:J91) -> 0 | S91: =K91 -> 0 | T91: =IF(S91>T90+R91,0,(T90+R91)-S91) -> 0 | U91: =S91-P91 -> 0
A92: =A91+1 -> 83 | B92: 40539 | C92: 110000 | L92: =SUM(C92:J92)-K92 -> 110000 | M92: =M91+L92 -> 116732.2 | O92: =C92 -> 110000 | P92: =IF(S92>R92+T91,S92-(R92+T91)) -> FALSE | Q92: =Q91+O92-P92 -> 116732.2 | R92: =SUM(D92:J92) -> 0 | S92: =K92 -> 0 | T92: =IF(S92>T91+R92,0,(T91+R92)-S92) -> 0 | U92: =S92-P92 -> 0
A93: =A92+1 -> 84 | B93: 40544 | C93: 4093 | L93: =SUM(C93:J93)-K93 -> 4093 | M93: =M92+L93 -> 120825.2 | O93: =C93 -> 4093 | P93: =IF(S93>R93+T92,S93-(R93+T92)) -> FALSE | Q93: =Q92+O93-P93 -> 120825.2 | R93: =SUM(D93:J93) -> 0 | S93: =K93 -> 0 | T93: =IF(S93>T92+R93,0,(T92+R93)-S93) -> 0 | U93: =S93-P93 -> 0
A94: =A93+1 -> 85 | B94: 40547 | C94: 25000 | H94: 3.2 | I94: 20 | L94: =SUM(C94:J94)-K94 -> 25023.200000000001 | M94: =M93+L94 -> 145848.4 | O94: =C94 -> 25000 | P94: =IF(S94>R94+T93,S94-(R94+T93)) -> FALSE | Q94: =Q93+O94-P94 -> 145825.2 | R94: =SUM(D94:J94) -> 23.2 | S94: =K94 -> 0 | T94: =IF(S94>T93+R94,0,(T93+R94)-S94) -> 23.2 | U94: =S94-P94 -> 0
A95: =A94+1 -> 86 | B95: 40558 | D95: 335.49 | E95: 1000 | H95: 160 | L95: =SUM(C95:J95)-K95 -> 1495.49 | M95: =M94+L95 -> 147343.89 | O95: =C95 -> 0 | P95: =IF(S95>R95+T94,S95-(R95+T94)) -> FALSE | Q95: =Q94+O95-P95 -> 145825.2 | R95: =SUM(D95:J95) -> 1495.49 | S95: =K95 -> 0 | T95: =IF(S95>T94+R95,0,(T94+R95)-S95) -> 1518.69 | U95: =S95-P95 -> 0
A96: =A95+1 -> 87 | B96: 40575 | H96: 3.2 | I96: 20 | L96: =SUM(C96:J96)-K96 -> 23.2 | M96: =M95+L96 -> 147367.09 | O96: =C96 -> 0 | P96: =IF(S96>R96+T95,S96-(R96+T95)) -> FALSE | Q96: =Q95+O96-P96 -> 145825.2 | R96: =SUM(D96:J96) -> 23.2 | S96: =K96 -> 0 | T96: =IF(S96>T95+R96,0,(T95+R96)-S96) -> 1541.89 | U96: =S96-P96 -> 0
A97: =A96+1 -> 88 | B97: 40589 | D97: 7672.14 | E97: 1000 | H97: 160 | L97: =SUM(C97:J97)-K97 -> 8832.14 | M97: =M96+L97 -> 156199.23 | O97: =C97 -> 0 | P97: =IF(S97>R97+T96,S97-(R97+T96)) -> FALSE | Q97: =Q96+O97-P97 -> 145825.2 | R97: =SUM(D97:J97) -> 8832.14 | S97: =K97 -> 0 | T97: =IF(S97>T96+R97,0,(T96+R97)-S97) -> 10374.03 | U97: =S97-P97 -> 0
A98: =A97+1 -> 89 | B98: 40603 | H98: 3.2 | I98: 20 | L98: =SUM(C98:J98)-K98 -> 23.2 | M98: =M97+L98 -> 156222.43 | O98: =C98 -> 0 | P98: =IF(S98>R98+T97,S98-(R98+T97)) -> FALSE | Q98: =Q97+O98-P98 -> 145825.2 | R98: =SUM(D98:J98) -> 23.2 | S98: =K98 -> 0 | T98: =IF(S98>T97+R98,0,(T97+R98)-S98) -> 10397.23 | U98: =S98-P98 -> 0
A99: =A98+1 -> 90 | B99: 40617 | D99: 4423.36 | E99: 2115.1 | H99: =338.42+160 -> 498.42 | J99: 1000 | L99: =SUM(C99:J99)-K99 -> 8036.88 | M99: =M98+L99 -> 164259.31 | O99: =C99 -> 0 | P99: =IF(S99>R99+T98,S99-(R99+T98)) -> FALSE | Q99: =Q98+O99-P99 -> 145825.2 | R99: =SUM(D99:J99) -> 8036.88 | S99: =K99 -> 0 | T99: =IF(S99>T98+R99,0,(T98+R99)-S99) -> 18434.11 | U99: =S99-P99 -> 0
A100: =A99+1 -> 91 | B100: 40634 | H100: 3.2 | I100: 20 | L100: =SUM(C100:J100)-K100 -> 23.2 | M100: =M99+L100 -> 164282.51 | O100: =C100 -> 0 | P100: =IF(S100>R100+T99,S100-(R100+T99)) -> FALSE | Q100: =Q99+O100-P100 -> 145825.2 | R100: =SUM(D100:J100) -> 23.2 | S100: =K100 -> 0 | T100: =IF(S100>T99+R100,0,(T99+R100)-S100) -> 18457.31 | U100: =S100-P100 -> 0
A101: =A100+1 -> 92 | B101: 40648 | D101: 4897.3 | E101: 3596.4 | H101: =575.42+160 -> 735.42 | J101: 1000 | L101: =SUM(C101:J101)-K101 -> 10229.12 | M101: =M100+L101 -> 174511.63 | O101: =C101 -> 0 | P101: =IF(S101>R101+T100,S101-(R101+T100)) -> FALSE | Q101: =Q100+O101-P101 -> 145825.2 | R101: =SUM(D101:J101) -> 10229.12 | S101: =K101 -> 0 | T101: =IF(S101>T100+R101,0,(T100+R101)-S101) -> 28686.43 | U101: =S101-P101 -> 0
A102: =A101+1 -> 93 | B102: 40665 | H102: 3.2 | I102: 20 | L102: =SUM(C102:J102)-K102 -> 23.2 | M102: =M101+L102 -> 174534.83 | O102: =C102 -> 0 | P102: =IF(S102>R102+T101,S102-(R102+T101)) -> FALSE | Q102: =Q101+O102-P102 -> 145825.2 | R102: =SUM(D102:J102) -> 23.2 | S102: =K102 -> 0 | T102: =IF(S102>T101+R102,0,(T101+R102)-S102) -> 28709.63 | U102: =S102-P102 -> 0
A103: =A102+1 -> 94 | B103: 40679 | D103: 4739.32 | E103: 5263.2 | H103: 1002.11 | J103: 1000 | L103: =SUM(C103:J103)-K103 -> 12004.63 | M103: =M102+L103 -> 186539.46 | O103: =C103 -> 0 | P103: =IF(S103>R103+T102,S103-(R103+T102)) -> FALSE | Q103: =Q102+O103-P103 -> 145825.2 | R103: =SUM(D103:J103) -> 12004.63 | S103: =K103 -> 0 | T103: =IF(S103>T102+R103,0,(T102+R103)-S103) -> 40714.26 | U103: =S103-P103 -> 0
A104: =A103+1 -> 95 | B104: 40695 | H104: 3.2 | I104: 20 | L104: =SUM(C104:J104)-K104 -> 23.2 | M104: =M103+L104 -> 186562.66 | O104: =C104 -> 0 | P104: =IF(S104>R104+T103,S104-(R104+T103)) -> FALSE | Q104: =Q103+O104-P104 -> 145825.2 | R104: =SUM(D104:J104) -> 23.2 | S104: =K104 -> 0 | T104: =IF(S104>T103+R104,0,(T103+R104)-S104) -> 40737.46 | U104: =S104-P104 -> 0
A105: =A104+1 -> 96 | B105: 40709 | D105: 4897.3 | E105: 7075.4 | H105: =1132.06+160 -> 1292.06 | J105: 1000 | L105: =SUM(C105:J105)-K105 -> 14264.76 | M105: =M104+L105 -> 200827.42 | O105: =C105 -> 0 | P105: =IF(S105>R105+T104,S105-(R105+T104)) -> FALSE | Q105: =Q104+O105-P105 -> 145825.2 | R105: =SUM(D105:J105) -> 14264.76 | S105: =K105 -> 0 | T105: =IF(S105>T104+R105,0,(T104+R105)-S105) -> 55002.22 | U105: =S105-P105 -> 0
A106: =A105+1 -> 97 | B106: 40726 | H106: 3.2 | I106: 20 | L106: =SUM(C106:J106)-K106 -> 23.2 | M106: =M105+L106 -> 200850.62 | O106: =C106 -> 0 | P106: =IF(S106>R106+T105,S106-(R106+T105)) -> FALSE | Q106: =Q105+O106-P106 -> 145825.2 | R106: =SUM(D106:J106) -> 23.2 | S106: =K106 -> 0 | T106: =IF(S106>T105+R106,0,(T105+R106)-S106) -> 55025.42 | U106: =S106-P106 -> 0
A107: =A106+1 -> 98 | B107: 40739 | D107: 4739.32 | E107: 9083.2 | H107: =1453.31+160 -> 1613.31 | J107: 1000 | L107: =SUM(C107:J107)-K107 -> 16435.83 | M107: =M106+L107 -> 217286.45 | O107: =C107 -> 0 | P107: =IF(S107>R107+T106,S107-(R107+T106)) -> FALSE | Q107: =Q106+O107-P107 -> 145825.2 | R107: =SUM(D107:J107) -> 16435.83 | S107: =K107 -> 0 | T107: =IF(S107>T106+R107,0,(T106+R107)-S107) -> 71461.25 | U107: =S107-P107 -> 0
A108: =A107+1 -> 99 | B108: 41152 | K108: =5611 -> 5611 | L108: =SUM(C108:J108)-K108 -> -5611 | M108: =M107+L108 -> 211675.45 | O108: =C108 -> 0 | P108: =IF(S108>R108+T107,S108-(R108+T107)) -> FALSE | Q108: =Q107+O108-P108 -> 145825.2 | R108: =SUM(D108:J108) -> 0 | S108: =K108 -> 5611 | T108: =IF(S108>T107+R108,0,(T107+R108)-S108) -> 65850.25 | U108: =S108-P108 -> 5611
U109: =SUM(U10:U108) -> 9838.1999999999898
A110: Total | C110: =SUM(C10:C109) -> 575675 | D110: =SUM(D10:D109) -> 31925.39 | E110: =SUM(E10:E109) -> 30333.3 | F110: =SUM(F10:F109) -> 1500 | G110: =SUM(G10:G109) -> 0 | H110: =SUM(H10:H109) -> 5924.41 | I110: =SUM(I10:I109) -> 1005.35 | J110: =SUM(J10:J109) -> 5000 | K110: =SUM(K10:K109) -> 439688 | L110: =SUM(L10:L109) -> 211675.45
A112: Total | C112: =SUM(C10:C108) -> 575675 | D112: =SUM(D10:D108) -> 31925.39 | E112: =SUM(E10:E108) -> 30333.3 | F112: =SUM(F10:F108) -> 1500 | G112: =SUM(G10:G108) -> 0 | H112: =SUM(H10:H108) -> 5924.41 | I112: =SUM(I10:I108) -> 1005.35 | J112: =SUM(J10:J108) -> 5000 | K112: =SUM(K10:K108) -> 439688 | L112: =SUM(L10:L41) -> 17205.2
D114: =SUM(D112:J112) -> 75688.45 | E114: =T108 -> 65850.25 | F114: =D114-E114 -> 9838.2000000000116
A120: Certified and verified that all the entries contained in this statement of account are true copies of the entries contained in ordinary books of the bank maintained and prepared in ordinary course of business and the said books are still in the custody of the bank. These entries have been certified after verification from the original ledger/books of the bank.
A125: If you feel any difficulty in computation of mark-up and/or principal, you may contact directly through e-mail at nasirlaw@yahoo.com. Skype is nnbutt2000.
K130: Back