CL1: PR-02A
Q2: Employer's Name: | W2: Shangai Oil Mills Limited | CJ2: (For Normal Scheme)
W4: Registration No.: | AC4: T | AD4: S | AE4: A | AF4: --- | AG4: 4 | AH4: 4 | AI4: 5 | AJ4: 4 | AK4: 3 | AW4: Sub Code: | BA4: C | BB4: A | BC4: --- | BD4: 3 | BE4: 4 | BF4: 6 | BL4: Month: | BO4: 0 | BP4: 1 | BR4: Year: | BT4: 2 | BU4: 0 | BV4: 0 | BW4: 5
A6: S. No. | B6: Insured Persons' Registration Numbers | O6: National Identity Card Numbers | AW6: Name of the Insured Person with Father's Name | BI6: Sex | BJ6: Date of Birth | BR6: Date of Entry into insurable Employment | BZ6: Date of Exit (if applicable) | CH6: No. of day for which salary paid | CI6: Amount of wages paid | CJ6: Employer's Contribution | CK6: Insured Person's Contribution | CL6: Total Contribution
O7: Old | AB7: New (Nadra)
AQ9: Family Code | BI9: M/F | BJ9: Day | BL9: Month | BN9: Year | BR9: Day | BT9: Month | BV9: Year | BZ9: Day | CB9: Month | CD9: Year
A10: 1 | B10: 4 | C10: 2 | D10: 0 | E10: --- | F10: O | G10: D | H10: --- | I10: 3 | J10: 0 | K10: 2 | L10: 4 | M10: 2 | N10: 0 | O10: 4 | P10: 9 | Q10: 9 | R10: --- | S10: 7 | T10: 6 | U10: --- | V10: 4 | W10: 3 | X10: 3 | Y10: 9 | Z10: 1 | AA10: 1 | AG10: --- | AO10: --- | AW10: Muhammad Najam Shiraz | BI10: M | BJ10: 3 | BK10: 1 | BL10: 0 | BM10: 3 | BN10: 1 | BO10: 9 | BP10: 7 | BQ10: 0 | BR10: 1 | BS10: 0 | BT10: 1 | BU10: 1 | BV10: 1 | BW10: 9 | BX10: 9 | BY10: 9 | CH10: 26 | CI10: =IF(CH10=26,3000,3000/26*CH10) -> 3000 | CJ10: =IF(CI10=3000,150,CI10*5%) -> 150 | CK10: =IF(CJ10=0,0,20) -> 20 | CL10: =CK10+CJ10 -> 170
AW11: Sultan Rahi Hashmi
A12: =A10+1 -> 2 | E12: --- | H12: --- | R12: --- | U12: --- | AG12: --- | AO12: ---
A14: =A12+1 -> 3 | E14: --- | H14: --- | R14: --- | U14: --- | AG14: --- | AO14: ---
A16: =A14+1 -> 4 | E16: --- | H16: --- | R16: --- | U16: --- | AG16: --- | AO16: ---
A18: =A16+1 -> 5 | E18: --- | H18: --- | R18: --- | U18: --- | AG18: --- | AO18: ---
A20: =A18+1 -> 6 | E20: --- | H20: --- | R20: --- | U20: --- | AG20: --- | AO20: ---
A22: =A20+1 -> 7 | E22: --- | H22: --- | R22: --- | U22: --- | AG22: --- | AO22: ---
A24: =A22+1 -> 8 | E24: --- | H24: --- | R24: --- | U24: --- | AG24: --- | AO24: ---
A26: =A24+1 -> 9 | E26: --- | H26: --- | R26: --- | U26: --- | AG26: --- | AO26: ---
A28: =A26+1 -> 10 | E28: --- | H28: --- | R28: --- | U28: --- | AG28: --- | AO28: ---
C32: Employer's Contribution | L32: =SUM(CJ10:CJ29) -> 150 | R32: Employees' Contribution | AA32: =SUM(CK10:CK29) -> 20 | AG32: Total | AJ32: =SUM(CL10:CL29) -> 170
AX34: Signature of Employer with Seal
A35: Form composed by: | H35: Nasir Nazir Butt, MA (Political Science), MBA (Finance), & LL. B.
H36: Mobile Phone No.: | O36: 0333-4076420
A38: Back