A1: Cause List - Litigation
A2: Nasir Law Associates (Jurists' House)
A3: Nasir Nazir Butt (Advocate)
A4: Phone Nos. 0333-4076420, 0321-4624078
A5: ÏLast updatedÐ
A6: =TODAY() -> 40252
A7: S. No. | B7: Date | C7: Client/ Company | D7: Title of Case | G7: Subject Matter/Claim | H7: Case/Suit No. | I7: Court or Forum | J7: Judge | K7: Proceedings | L7: Adjournment
E8: Vs.
A9: 1 | B9: 39282 | C9: Aamir Ijaz Khokhar | D9: Afsa Khokhar, Mst. | E9: Vs. | F9: Aamir Ijaz Khokhar | G9: Dower | I9: Family | J9: Mr. Muhammad Akram Nawab Sandhu | K9: Written Statement
A10: =A9+1 -> 2 | B10: 39287 | C10: Mian Muhammad Tariq | D10: Mian Muhammad Tariq & etc. | E10: Vs. | F10: Public at Large & etc. | G10: Declaration | H10: 176/1 of 2007 | I10: Civil | J10: Mr. Muhammad Sher Abbas Awan/Mr. Amjad Ali Bajwa | K10: Evidence | L10: Decided on 18-09-2007
A11: =A10+1 -> 3 | B11: 39287 | C11: Nasir Nazir Butt | D11: Nasir Nazir Butt | E11: Vs. | F11: Proprietor, Al-Mubeen Watch Co., Lahore | G11: Damages | I11: Civil | J11: Mr. Haider Ali Arif | K11: Evidence
A12: =A11+1 -> 4 | B12: 39289 | C12: Zahid Ikram | D12: Zahid Ikram | E12: Vs. | F12: Zia Ullah Bhatti & etc. | G12: Declaration | I12: Civil | J12: Mr. Amjad Ali Bajwa | K12: Service of process yet to be issued
A13: =A12+1 -> 5 | B13: 39290 | C13: Aamir Ijaz Khokhar | D13: Afsa Khokhar, Mst. | E13: Vs. | F13: Aamir Ijaz Khokhar | G13: Maintenance | I13: Family | J13: Mr. Imran Nazir | K13: Written Statement
A14: =A13+1 -> 6 | B14: 39338 | C14: Haji Muhammad Hanif | D14: Haji Muhammad Hanif | E14: Vs. | F14: LDA & etc. | G14: Execution | I14: Civil | J14: Mr. Muhammad Sher Abbas Awan | K14: Jurisdiction yet to be decided

B2: Go to: