A1: The Punjab Gazette
A2: PUBLISHED BY AUTHORITY
A4: LAHORE MONDAY JUNE 30, 2008
A6: OFFICE OF THE DISTRICT OFFICER (REVENUE), LAHORE
C8: No. HRC/VT/2656
C9: Dated: 28-06-2008
A11: NOTIFICATION
A13: In exercise of the powers conferred upon me by under Section 27-A of the Stamp act, 1899, as amended, the revised Valuation Table showing assessment of land for computation of ad-valorem Stamp Duty in urban areas and localities of City District Government
C16: (Zulfiqar Ahmad Ghumman)
C17: District Officer (Revenue)/ Collector, City District Government, Lahore
A18: (4041)
A20: Valuation Table (City District Government, Lahore)
A21: with effect from July 01, 2008
A22: Last updated
A23: =TODAY() -> 40363
A25: Aziz Bhatti Town, Lahore
A26: S. No. | B26: Name of Locality | C26: Rate Per Marla Residential | D26: Rate Per Marla Commercial
A27: 1 | B27: Allama Iqbal Road | C27: 200000 | D27: 500000
A28: =A27+1 -> 2 | B28: Arif Abad (Near Beadon Road) | C28: 60000 | D28: 100000
A29: =A28+1 -> 3 | B29: Arazi Sehajpal | C29: 50000 | D29: 100000
A30: =A29+1 -> 4 | B30: Arazi Sehajpal (Phase-VIII) | C30: 100000 | D30: 600000
A31: =A30+1 -> 5 | B31: Bridge Colony | C31: 200000 | D31: 350000
A32: =A31+1 -> 6 | B32: Beadon Road (R. A. Bazar to Bhatta Chowk) | C32: 100000 | D32: 300000
A33: =A32+1 -> 7 | B33: Beadon Road (Bhatta Chowk to Office Elite Force) | C33: 50000 | D33: 150000
A34: =A33+1 -> 8 | B34: Bahar Shah Road | C34: 75000 | D34: 150000
A35: =A34+1 -> 9 | B35: C. M. A. Colony | C35: 200000 | D35: 350000
A36: =A35+1 -> 10 | B36: Cantonment Roads | C36: 200000 | D36: 350000
A37: =A36+1 -> 11 | B37: Canal Bank Road Dharampura Bridge (Both Sides) upto Jallo | C37: 200000 | D37: 300000
A38: =A37+1 -> 12 | B38: Chandian | C38: 50000 | D38: 150000
A39: =A38+1 -> 13 | B39: Dheer Pindi | C39: 50000 | D39: 150000
A40: =A39+1 -> 14 | B40: Fateh Garh & Adjoining Areas | C40: 75000 | D40: 100000
A41: =A40+1 -> 15 | B41: Defence Road (Bhatta Chowk to Chungi Mehfooz Pura) | C41: 0 | D41: 600000
A42: =A41+1 -> 16 | B42: Ghazi Abad / Kumharpura | C42: 60000 | D42: 200000
A43: =A42+1 -> 17 | B43: Gurumanget (L. C. B.) | C43: 175000 | D43: 450000
A44: =A43+1 -> 18 | B44: Gohawa & Adjoining Areas | C44: 60000 | D44: 125000
A45: =A44+1 -> 19 | B45: Gulistan Colony (Dharampura) | C45: 100000 | D45: 200000
A46: =A45+1 -> 20 | B46: Gunj | C46: 150000 | D46: 300000
A47: =A46+1 -> 21 | B47: Harbanspura | C47: 50000 | D47: 100000
A48: =A47+1 -> 22 | B48: Harbanspura Road (Joray Pull to Barbanspura Bridge) | C48: 75000 | D48: 350000
A49: =A48+1 -> 23 | B49: Infantry Road | C49: 200000 | D49: 350000
A50: =A49+1 -> 24 | B50: Juggian Alfa | C50: 60000 | D50: 125000
A51: =A50+1 -> 25 | B51: Kohar & Adjoining Abadies | C51: 60000 | D51: 200000
A52: =A51+1 -> 26 | B52: Kotli Pir Abdul Rahman | C52: 100000 | D52: 150000
A53: =A52+1 -> 27 | B53: Lal Kurti Sadar | C53: 125000 | D53: 250000
A54: =A53+1 -> 28 | B54: Lidhar & Adjoining Areas (LCB) | C54: 60000 | D54: 125000
A55: =A54+1 -> 29 | B55: Mustafa Abad (Dharampura) Main Bazar | C55: 0 | D55: 300000
A56: =A55+1 -> 30 | B56: Mustafa Abad | C56: 125000 | D56: 250000
A57: =A56+1 -> 31 | B57: Mian Meer | C57: 150000 | D57: 300000
A58: =A57+1 -> 32 | B58: Mugharpura | C58: 125000 | D58: 250000
A59: =A58+1 -> 33 | B59: Malik Pur | C59: 75000 | D59: 200000
A60: =A59+1 -> 34 | B60: Malik Pur (Housing Societies) | C60: 125000 | D60: 300000
A61: =A60+1 -> 35 | B61: Nizam Abad Harbanspura | C61: 75000 | D61: 200000
A62: =A61+1 -> 36 | B62: Nadir Abad (Sehajpal) | C62: 50000 | D62: 100000
A63: =A62+1 -> 37 | B63: Nishat Colony (LCB) | C63: 125000 | D63: 250000
A64: =A63+1 -> 38 | B64: New Canal Park Canal Point (Harbanspura) | C64: 100000 | D64: 200000
A65: =A64+1 -> 39 | B65: Officer Colony Ghazi Abad | C65: 200000 | D65: 350000
A66: =A65+1 -> 40 | B66: Park View Housing Society/DHA | C66: 150000 | D66: 400000
A67: =A66+1 -> 41 | B67: Rasheed Pura | C67: 60000 | D67: 150000
A68: =A67+1 -> 42 | B68: Sadar Bazar to Chungi Mahfooz | C68: 200000 | D68: 350000
A69: =A68+1 -> 43 | B69: Sadar Bazar | C69: 150000 | D69: 450000
A70: =A69+1 -> 44 | B70: Saint John Park | C70: 150000 | D70: 250000
A71: =A70+1 -> 45 | B71: Sahu Wari | C71: 125000 | D71: 250000
A72: =A71+1 -> 46 | B72: Sahjpal & Adjoining Areas | C72: 60000 | D72: 125000
A73: =A72+1 -> 47 | B73: Shiv Pura | C73: 50000 | D73: 150000
A74: =A73+1 -> 48 | B74: Shalimar Link Road Canal to PS Mughalpura Main | C74: 0 | D74: Main 400,000 Off: 250,000
A75: =A74+1 -> 49 | B75: Taj Pura | C75: 60000 | D75: 125000
A76: =A75+1 -> 50 | B76: Taj Bagh Housing Scheme | C76: 100000 | D76: 200000
A77: =A76+1 -> 51 | B77: Chung Khurd (LCB) | C77: 100000 | D77: 250000
A80: Data Gunj Bakhsh Town, Lahore
A81: S. No. | B81: Name of Locality | C81: Rate Per Marla Residential | D81: Rate Per Marla Commercial
A82: 1 | B82: Anarkali (New) | C82: 0 | D82: 1500000
A83: =A82+1 -> 2 | B83: Afzal Road Sanda | C83: 150000 | D83: 350000
A84: =A83+1 -> 3 | B84: Alfazal Road Sanda | C84: 150000 | D84: 350000
A85: =A84+1 -> 4 | B85: Abdali Road | C85: 150000 | D85: 500000
A86: =A85+1 -> 5 | B86: Abbott Road | C86: 0 | D86: 900000
A87: =A86+1 -> 6 | B87: Abdul Kareem Road (Qila Gujjar Singh) | C87: 250000 | D87: 600000
A88: =A87+1 -> 7 | B88: Anarkali (Old) | C88: 200000 | D88: 500000
A89: =A88+1 -> 8 | B89: Ashrafia Colony Shadman | C89: 200000 | D89: 450000
A90: =A89+1 -> 9 | B90: Ansari Road | C90: 150000 | D90: 300000
A91: =A90+1 -> 10 | B91: Aabkari Road | C91: 0 | D91: 700000
A92: =A91+1 -> 11 | B92: Ameer/Amir Road (Bilal Ganj) | C92: 150000 | D92: 500000
A93: =A92+1 -> 12 | B93: Aibak Road | C93: 0 | D93: 550000
A94: =A93+1 -> 13 | B94: Bird Wood Road | C94: 0 | D94: 400000
A95: =A94+1 -> 14 | B95: Bank Square | C95: 0 | D95: 1300000
A96: =A95+1 -> 15 | B96: Bull Road | C96: 0 | D96: 500000
A97: =A96+1 -> 16 | B97: Beaden Road | C97: 0 | D97: 1500000
A98: =A97+1 -> 17 | B98: Beaden Road (Streets) | C98: 300000 | D98: 500000
A99: =A98+1 -> 18 | B99: Bilal Gunj & Adjoining Abadies | C99: 150000 | D99: 400000
A100: =A99+1 -> 19 | B100: Bagh Munshi Ladha | C100: 150000 | D100: 350000
A101: =A100+1 -> 20 | B101: Begum Road | C101: 200000 | D101: 400000
A102: =A101+1 -> 21 | B102: Bagh Gul Begum | C102: 200000 | D102: 350000
A103: =A102+1 -> 22 | B103: Bilal Ganj (Kabari Market) | C103: 0 | D103: 500000
A104: =A103+1 -> 23 | B104: Bund Road Sagian to Toll Plaza | C104: 150000 | D104: 350000
A105: =A104+1 -> 24 | B105: Bahawalpur Road | C105: 200000 | D105: 600000
A106: =A105+1 -> 25 | B106: Bund Paar (Western Side) | C106: 50000 | D106: 200000
A107: =A106+1 -> 26 | B107: Circular Road | C107: 0 | D107: 1000000
A108: =A107+1 -> 27 | B108: Chamber Lane Road | C108: 0 | D108: 600000
A109: =A108+1 -> 28 | B109: Chohan Park | C109: 0 | D109: 400000
A110: =A109+1 -> 29 | B110: Court Street | C110: 0 | D110: 450000
A111: =A110+1 -> 30 | B111: Court Road | C111: 250000 | D111: 700000
A112: =A111+1 -> 31 | B112: Chak Jia Musa | C112: 175000 | D112: 400000
A113: =A112+1 -> 32 | B113: Cooper Road | C113: 0 | D113: 900000
A114: =A113+1 -> 33 | B114: Canal Bank Road Both Sides falling in DGBT | C114: 300000 | D114: 600000
A115: =A114+1 -> 34 | B115: Chowk Choburgi | C115: 0 | D115: 600000
A116: =A115+1 -> 35 | B116: Captain Jamal Road | C116: 200000 | D116: 500000
A117: =A116+1 -> 36 | B117: Church Road | C117: 0 | D117: 450000
A118: =A117+1 -> 37 | B118: Chatter Jee Road | C118: 0 | D118: 600000
A119: =A118+1 -> 38 | B119: Choburgi Park | C119: 150000 | D119: 400000
A120: =A119+1 -> 39 | B120: Choburgi Park (New) | C120: 150000 | D120: 400000
A121: =A120+1 -> 40 | B121: Dhoop Sarhi | C121: 125000 | D121: 400000
A122: =A121+1 -> 41 | B122: Dil Muhammad Road | C122: 300000 | D122: 600000
A123: =A122+1 -> 42 | B123: Dhoobi Mandi | C123: 150000 | D123: 400000
A124: =A123+1 -> 43 | B124: Danpur Lane | C124: 300000 | D124: 600000
A125: =A124+1 -> 44 | B125: Dilkusha Road | C125: 150000 | D125: 300000
A126: =A125+1 -> 45 | B126: Dave Samaj Road | C126: 150000 | D126: 400000
A127: =A126+1 -> 46 | B127: Dhani Ram Road | C127: 350000 | D127: 1000000
A128: =A127+1 -> 47 | B128: Data Gunj Bukhsh Road | C128: 200000 | D128: 400000
A129: =A128+1 -> 48 | B129: Davis Road | C129: 0 | D129: 1000000
A130: =A129+1 -> 49 | B130: Davrend Road | C130: 200000 | D130: 600000
A131: =A130+1 -> 50 | B131: Davis Road Streets | C131: 200000 | D131: 400000
A132: =A131+1 -> 51 | B132: Edward Road | C132: 0 | D132: 600000
A133: =A132+1 -> 52 | B133: Egerton Road Front | C133: 0 | D133: 1500000
A134: =A133+1 -> 53 | B134: Egerton Road Back | C134: 0 | D134: 1000000
A135: =A134+1 -> 54 | B135: Empress Road Front | C135: 0 | D135: 1500000
A136: =A135+1 -> 55 | B136: Empress Road Back | C136: 350000 | D136: 1200000
A137: =A136+1 -> 56 | B137: Fane Road | C137: 0 | D137: 500000
A138: =A137+1 -> 57 | B138: Farid Kot Streets | C138: 200000 | D138: 600000
A139: =A138+1 -> 58 | B139: Farid Kot Road | C139: 0 | D139: 600000
A140: =A139+1 -> 59 | B140: Fleming Road | C140: 250000 | D140: 600000
A141: =A140+1 -> 60 | B141: Firdous Park | C141: 150000 | D141: 350000
A142: =A141+1 -> 61 | B142: Ferozepur Road (Mozang Chungi to Shama Chowk) | C142: 0 | D142: 1000000
A143: =A142+1 -> 62 | B143: Ferozepur Road (Shama Chowk to Canal Bank) | C143: 0 | D143: 1000000
A144: =A143+1 -> 63 | B144: Ferozepur Road (Kacha) | C144: 200000 | D144: 500000
A145: =A144+1 -> 64 | B145: Fazlia Colony | C145: 200000 | D145: 500000
A146: =A145+1 -> 65 | B146: Fateh Sher Road | C146: 200000 | D146: 600000
A147: =A146+1 -> 66 | B147: Gawalmandi | C147: 200000 | D147: 500000
A148: =A147+1 -> 67 | B148: Gunpat Road | C148: 250000 | D148: 800000
A149: =A148+1 -> 68 | B149: Gunja Kalan & Adjoining Areas | C149: 150000 | D149: 350000
A150: =A149+1 -> 69 | B150: Gunja Kalan (Western Side) | C150: 50000 | D150: 200000
A151: =A150+1 -> 70 | B151: Gillani Park Near Bilal Gunj | C151: 150000 | D151: 400000
A152: =A151+1 -> 71 | B152: Golf Road | C152: 0 | D152: 600000
A153: =A152+1 -> 72 | B153: Golding Road | C153: 250000 | D153: 450000
A154: =A153+1 -> 73 | B154: Gulshan-e-Ravi | C154: 200000 | D154: 600000
A155: =A154+1 -> 74 | B155: Hospital Road | C155: 0 | D155: 500000
A156: =A155+1 -> 75 | B156: Hall Road | C156: 0 | D156: 1800000
A157: =A156+1 -> 76 | B157: Habib Gunj | C157: 150000 | D157: 400000
A158: =A157+1 -> 77 | B158: Islamia Park (Poonch Road) | C158: 150000 | D158: 350000
A159: =A158+1 -> 78 | B159: Islam Gunj (Near Bilal Ganj) | C159: 150000 | D159: 400000
A160: =A159+1 -> 79 | B160: Islampura | C160: 150000 | D160: 500000
A161: =A160+1 -> 80 | B161: Ittefaq Colony Sanda | C161: 150000 | D161: 350000
A162: =A161+1 -> 81 | B162: Ichhra & Adjoining Abadies | C162: 200000 | D162: 600000
A163: =A162+1 -> 82 | B163: Ibrahim Road | C163: 150000 | D163: 500000
A164: =A163+1 -> 83 | B164: Joy Shah | C164: 150000 | D164: 350000
A165: =A164+1 -> 84 | B165: Jail Road | C165: 0 | D165: 150000
A166: =A165+1 -> 85 | B166: Jail Road | C166: 300000 | D166: 800000
A167: =A166+1 -> 86 | B167: Katchery Road | C167: 300000 | D167: 700000
A168: =A167+1 -> 87 | B168: Kamal Gunj Near Bilal Ganj | C168: 150000 | D168: 400000
A169: =A168+1 -> 88 | B169: Kashmir Road Front | C169: 0 | D169: 1200000
A170: =A169+1 -> 89 | B170: Kashmir Road Back | C170: 0 | D170: 800000
A171: =A170+1 -> 90 | B171: Karim Park | C171: 150000 | D171: 350000
A172: =A171+1 -> 91 | B172: Kasur Pura | C172: 150000 | D172: 350000
A173: =A172+1 -> 92 | B173: Lower Mall | C173: 300000 | D173: 700000
A174: =A173+1 -> 93 | B174: Lytton Road | C174: 250000 | D174: 800000
A175: =A174+1 -> 94 | B175: Lake Road | C175: 250000 | D175: 600000
A176: =A175+1 -> 95 | B176: Lahore Road | C176: 200000 | D176: 500000
A177: =A176+1 -> 96 | B177: Landa Bazar | C177: 0 | D177: 800000
A178: =A177+1 -> 97 | B178: Landa Bazar and Adjoining Abadies | C178: 200000 | D178: 800000
A179: =A178+1 -> 98 | B179: Lawrance Road | C179: 250000 | D179: 600000
A180: =A179+1 -> 99 | B180: Multan Chowk (Chowk Choburji to Chowk Yateem Khana) | C180: 300000 | D180: 600000
A181: =A180+1 -> 100 | B181: McLeod Road | C181: 0 | D181: 1000000
A182: =A181+1 -> 101 | B182: Mali Pura | C182: 150000 | D182: 350000
A183: =A182+1 -> 102 | B183: Mission Road | C183: 300000 | D183: 800000
A184: =A183+1 -> 103 | B184: Mozang Road | C184: 300000 | D184: 600000
A185: =A184+1 -> 104 | B185: McLegon Road | C185: 0 | D185: 500000
A186: =A185+1 -> 105 | B186: Mella Ram Road (Bhati Gate) | C186: 250000 | D186: 500000
A187: =A186+1 -> 106 | B187: Murlidhar Road | C187: 200000 | D187: 500000
A188: =A187+1 -> 107 | B188: Montgomery Road | C188: 0 | D188: 1500000
A189: =A188+1 -> 108 | B189: Masson Road | C189: 400000 | D189: 600000
A190: =A189+1 -> 109 | B190: Main Mozang | C190: 200000 | D190: 600000
A191: =A190+1 -> 110 | B191: Mozang New | C191: 200000 | D191: 600000
A192: =A191+1 -> 111 | B192: Muhammadi Park | C192: 1500000 | D192: 3500000
A193: =A192+1 -> 112 | B193: Manzoor Park and Adjoining Abadies | C193: 150000 | D193: 350000
A194: =A193+1 -> 113 | B194: Main Bund Road (Both Sides) | C194: 0 | D194: 500000
A195: =A194+1 -> 114 | B195: Mohallah Dar-ul-Shakooh (Landa Bazar) | C195: 300000 | D195: 800000
A196: =A195+1 -> 115 | B196: Mall Road (PMG Chowk to Canal) | C196: 0 | D196: 2000000
A197: =A196+1 -> 116 | B197: Naulakha & Adjoining Abadies | C197: 200000 | D197: 600000
A198: =A197+1 -> 117 | B198: Nishter Road (Both Sides) | C198: 0 | D198: 2000000
A199: =A198+1 -> 118 | B199: Nabha Road | C199: 0 | D199: 800000
A200: =A199+1 -> 119 | B200: Naiper Road | C200: 0 | D200: 450000
A201: =A200+1 -> 120 | B201: Nisbat Road | C201: 0 | D201: 600000
A202: =A201+1 -> 121 | B202: Neela Gumbad | C202: 0 | D202: 1000000
A203: =A202+1 -> 122 | B203: Naulakha Bazar | C203: 0 | D203: 800000
A204: =A203+1 -> 123 | B204: National Park/Town Sanda | C204: 150000 | D204: 400000
A205: =A204+1 -> 124 | B205: Nicholson Road | C205: 300000 | D205: 800000
A206: =A205+1 -> 125 | B206: Nicholson Road Street | C206: 200000 | D206: 500000
A207: =A206+1 -> 126 | B207: Nadeem Park Sanda | C207: 150000 | D207: 400000
A208: =A207+1 -> 127 | B208: Naseer-ud-Din Road | C208: 200000 | D208: 500000
A209: =A208+1 -> 128 | B209: Nawan Kot | C209: 175000 | D209: 500000
A210: =A209+1 -> 129 | B210: Outfall Road | C210: 150000 | D210: 500000
A211: =A210+1 -> 130 | B211: Patiala Ground | C211: 300000 | D211: 900000
A212: =A211+1 -> 131 | B212: Paisa Akhbar | C212: 0 | D212: 500000
A213: =A212+1 -> 132 | B213: Parem Nagar Mauza Raj Garh | C213: 150000 | D213: 400000
A214: =A213+1 -> 133 | B214: Punch Road Chuburji to Ganda Nala | C214: 200000 | D214: 600000
A215: =A214+1 -> 134 | B215: Punj Mahal Road (Shish Mahal) | C215: 300000 | D215: 500000
A216: =A215+1 -> 135 | B216: Qila Hakeeman | C216: 150000 | D216: 350000
A217: =A216+1 -> 136 | B217: Queen's Road | C217: 300000 | D217: 1200000
A218: =A217+1 -> 137 | B218: Qila Gujjar Singh & Adjoining Abadies | C218: 200000 | D218: 600000
A219: =A218+1 -> 138 | B219: Qazalbash Road | C219: 0 | D219: 600000
A220: =A219+1 -> 139 | B220: Qadar Colony Sanda | C220: 150000 | D220: 350000
A221: =A220+1 -> 140 | B221: Rajgarh Road | C221: 200000 | D221: 500000
A222: =A221+1 -> 141 | B222: Ravi Road (Katcha) | C222: 150000 | D222: 400000
A223: =A222+1 -> 142 | B223: Rajgarh (Old Rifle Range) | C223: 150000 | D223: 400000
A224: =A223+1 -> 143 | B224: Rajgarh & Adjoining Abadies | C224: 150000 | D224: 400000
A225: =A224+1 -> 144 | B225: Rajgarh Road | C225: 300000 | D225: 500000
A226: =A225+1 -> 145 | B226: Ravi Colony | C226: 200000 | D226: 500000
A227: =A226+1 -> 146 | B227: Ratan Chand Road | C227: 250000 | D227: 500000
A228: =A227+1 -> 147 | B228: Railway Road | C228: 250000 | D228: 600000
A229: =A228+1 -> 148 | B229: Race Course Road | C229: 0 | D229: 800000
A230: =A229+1 -> 149 | B230: Royal Park | C230: 0 | D230: 600000
A231: =A230+1 -> 150 | B231: Rewaz Garden | C231: 250000 | D231: 600000
A232: =A231+1 -> 151 | B232: Robert Road | C232: 250000 | D232: 400000
A233: =A232+1 -> 152 | B233: Ravi Road | C233: 0 | D233: 800000
A234: =A233+1 -> 153 | B234: Rehman (Streets) | C234: 300000 | D234: 1000000
A235: =A234+1 -> 154 | B235: Rettigun Road | C235: 150000 | D235: 400000
A236: =A235+1 -> 155 | B236: Rajgarh Main Bazar | C236: 0 | D236: 500000
A237: =A236+1 -> 156 | B237: Saadi Park (Mozang) | C237: 150000 | D237: 400000
A238: =A237+1 -> 157 | B238: Sanat Nagar | C238: 150000 | D238: 350000
A239: =A238+1 -> 158 | B239: Sanda Khurd & Adjoining Abadies | C239: 150000 | D239: 350000
A240: =A239+1 -> 159 | B240: Sanda Road | C240: 0 | D240: 500000
A241: =A240+1 -> 160 | B241: Sanda Khurd/Kalan (Western Side Across Bund) | C241: 50000 | D241: 200000
A242: =A241+1 -> 161 | B242: Sanda Kalan & Adjoining Abadies | C242: 150000 | D242: 350000
A243: =A242+1 -> 162 | B243: Shera Kot | C243: 150000 | D243: 400000
A244: =A243+1 -> 163 | B244: Shera Kot Western Side Across Bund | C244: 50000 | D244: 200000
A245: =A244+1 -> 164 | B245: Shadman | C245: 300000 | D245: 1000000
A246: =A245+1 -> 165 | B246: Shafique Abad | C246: 150000 | D246: 350000
A247: =A246+1 -> 166 | B247: Shishmahal Mouza | C247: 150000 | D247: 350000
A248: =A247+1 -> 167 | B248: Shishmahal Road | C248: 200000 | D248: 500000
A249: =A248+1 -> 168 | B249: Shah Jamal & Adjoining Abadies | C249: 200000 | D249: 600000
A250: =A249+1 -> 169 | B250: Saray Sultan | C250: 200000 | D250: 500000
A251: =A250+1 -> 170 | B251: Shamas Qadri GOR Patiala House & Adjoining Abadies | C251: 200000 | D251: 400000
A252: =A251+1 -> 171 | B252: Turner Road | C252: 0 | D252: 500000
A253: =A252+1 -> 172 | B253: Temple Road | C253: 300000 | D253: 600000
A254: =A253+1 -> 173 | B254: Tagoor Park | C254: 250000 | D254: 600000
A255: =A254+1 -> 174 | B255: Thorton Road | C255: 0 | D255: 400000
A256: =A255+1 -> 175 | B256: Urdu Bazar | C256: 500000 | D256: 1000000
A257: =A256+1 -> 176 | B257: Usman Gunj (Bilal Gunj) | C257: 150000 | D257: 400000
A258: =A257+1 -> 177 | B258: Waris Road | C258: 300000 | D258: 800000
A259: =A258+1 -> 178 | B259: Zaildar Park & Adjoining Abadies | C259: 250000 | D259: 600000
A262: Rates of Cultivable Land falling in Data Gunj Bakhsh Town, Lahore
A263: S. No. | B263: Name of Locality | C263: Rate Per Acre for External Part of River (Out Side the Embankment) | D263: Rate Per Acre for External Part of River (Inside the Embankment)
A264: 1 | B264: Babu Sabu | C264: 800000 | D264: 600000
A265: =A264+1 -> 2 | B265: Sanda Kalan | C265: 800000 | D265: 600000
A266: =A265+1 -> 3 | B266: Sanda Khurd | C266: 800000 | D266: 600000
A267: =A266+1 -> 4 | B267: Shera Kot | C267: 800000 | D267: 600000
A268: =A267+1 -> 5 | B268: Shera Kot
A271: Gulberg Town, Lahore
A272: S. No. | B272: Name of Locality | C272: Rate Per Marla Residential | D272: Rate Per Marla Commercial
A273: 1 | B273: Aitchison College Road / Sundar Das Road | C273: 0 | D273: 400000
A274: =A273+1 -> 2 | B274: Achant Gharh | C274: 200000 | D274: 400000
A275: =A274+1 -> 3 | B275: Egerton Road Front | C275: 0 | D275: 1500000
A276: =A275+1 -> 4 | B276: Egerton Road Off | C276: 0 | D276: 1000000
A277: =A276+1 -> 5 | B277: Allama Iqbal Road | C277: 200000 | D277: 500000
A278: =A277+1 -> 6 | B278: Empress Road Front | C278: 350000 | D278: 1500000
A279: =A278+1 -> 7 | B279: Empress Road Off | C279: 350000 | D279: 1200000
A280: =A279+1 -> 8 | B280: Aziz Avenue Gulberg | C280: 0 | D280: 400000
A281: =A280+1 -> 9 | B281: Bahar Colony (Kot Lakhpat) | C281: 100000 | D281: 500000
A282: =A281+1 -> 10 | B282: Basti Saiden Shah | C282: 200000 | D282: 500000
A283: =A282+1 -> 11 | B283: Bibi Pak Daman (Ghan Shahu) | C283: 150000 | D283: 450000
A284: =A283+1 -> 12 | B284: Bhabra (Abadi) | C284: 200000 | D284: 500000
A285: =A284+1 -> 13 | B285: Canal Bank Road Both Side situated in Gulberg Town | C285: 300000 | D285: 600000
A286: =A285+1 -> 14 | B286: Canal Park (Gulberg) | C286: 200000 | D286: 450000
A287: =A286+1 -> 15 | B287: Canal Bank Road Both Side Ichhra Bridge to Doctors Hospital | C287: 300000 | D287: 700000
A288: =A287+1 -> 16 | B288: Ferozepur Road (Shama to Kahna Chowk) Both sides situated in Gulberg Town | C288: 0 | D288: 1000000
A289: =A288+1 -> 17 | B289: Dars Road | C289: 100000 | D289: 300000
A290: =A289+1 -> 18 | B290: Dars Bary Mian | C290: 100000 | D290: 300000
A291: =A290+1 -> 19 | B291: Davis Road | C291: 0 | D291: 1000000
A292: =A291+1 -> 20 | B292: Faisal Town | C292: 300000 | D292: 600000
A293: =A292+1 -> 21 | B293: Faisal Town Main Boulevard | C293: 0 | D293: 700000
A294: =A293+1 -> 22 | B294: Fruit Market Kot-Lakhpat | C294: 0 | D294: 600000
A295: =A294+1 -> 23 | B295: Ferozepur Road (Kalma Chowk to Kot-Lakhpat Phattak) | C295: 350000 | D295: 800000
A296: =A295+1 -> 24 | B296: Garden Town Civic Center | C296: 0 | D296: 1000000
A297: =A296+1 -> 25 | B297: Garden Town Blocks | C297: 200000 | D297: 800000
A298: =A297+1 -> 26 | B298: Garden Town Main Boulevard (Kalma Chowk to Y Junction) | C298: 200000 | D298: 800000
A299: =A298+1 -> 27 | B299: Garden Town (Barket Market) | C299: 0 | D299: 1000000
A300: =A299+1 -> 28 | B300: Garden Town (Khalid Market) | C300: 0 | D300: 800000
A301: =A300+1 -> 29 | B301: Government Employees' Cooperative Housing Society (Model Town Link Road) | C301: 200000 | D301: 600000
A302: =A301+1 -> 30 | B302: Gulberg M. M. Alam Road | C302: 200000 | D302: 600000
A303: =A302+1 -> 31 | B303: Gulberg Main Boulevard | C303: 500000 | D303: 1500000
A304: =A303+1 -> 32 | B304: Gulberg I-II-III-IV-V | C304: 300000 | D304: 1000000
A305: =A304+1 -> 33 | B305: Gulberg Roads | C305: 100000 | D305: 1000000
A306: =A305+1 -> 34 | B306: Gulberg Stadium Road | C306: 300000 | D306: 1000000
A307: =A306+1 -> 35 | B307: Gulberg Liberty Market | C307: 0 | D307: 2000000
A308: =A307+1 -> 36 | B308: Gulberg Main Market | C308: 0 | D308: 1200000
A309: =A308+1 -> 37 | B309: Gulberg Firdous Market | C309: 0 | D309: 1000000
A310: =A309+1 -> 38 | B310: Gulberg Zahoor Elahi Road | C310: 300000 | D310: 1000000
A311: =A310+1 -> 39 | B311: Gopal Nagar | C311: 150000 | D311: 500000
A312: =A311+1 -> 40 | B312: Ghalib Market (Gulberg) | C312: 0 | D312: 1000000
A313: =A312+1 -> 41 | B313: Gandhi Park (Gulberg) | C313: 200000 | D313: 700000
A314: =A313+1 -> 42 | B314: Gurumanget | C314: 125000 | D314: 400000
A315: =A314+1 -> 43 | B315: Gurumanget Road | C315: 0 | D315: 700000
A316: =A315+1 -> 44 | B316: Gulberg Industrial Area | C316: 0 | D316: 400000
A317: =A316+1 -> 45 | B317: Gari Shahu | C317: 200000 | D317: 500000
A318: =A317+1 -> 46 | B318: G. T. Road falling in Gulberg Town | C318: 200000 | D318: 400000
A319: =A318+1 -> 47 | B319: Habib Ullah Road | C319: 200000 | D319: 400000
A320: =A319+1 -> 48 | B320: Jail Road | C320: 0 | D320: 1500000
A321: =A320+1 -> 49 | B321: Kot-Lakhpat Industrial Area | C321: 0 | D321: 350000
A322: =A321+1 -> 50 | B322: Kot-Lakhpat | C322: 150000 | D322: 300000
A323: =A322+1 -> 51 | B323: Liqat Abad Main Bazar | C323: 0 | D323: 300000
A324: =A323+1 -> 52 | B324: Liqat Abad | C324: 100000 | D324: 200000
A325: =A324+1 -> 53 | B325: Maulana Shaukat Ali Road | C325: 0 | D325: 600000
A326: =A325+1 -> 54 | B326: Mian Mir | C326: 200000 | D326: 500000
A327: =A326+1 -> 55 | B327: Muhammad Nagar | C327: 200000 | D327: 500000
A328: =A327+1 -> 56 | B328: Mumtaz Street Ghari Shahu | C328: 200000 | D328: 500000
A329: =A328+1 -> 57 | B329: Makkah Colony (Gulberg) | C329: 150000 | D329: 450000
A330: =A329+1 -> 58 | B330: Model Town Link Road | C330: 0 | D330: 1500000
A331: =A330+1 -> 59 | B331: Model Town Old | C331: 200000 | D331: 600000
A332: =A331+1 -> 60 | B332: Model Town Extension | C332: 150000 | D332: 500000
A333: =A332+1 -> 61 | B333: Model Town Extension LDA Flats | C333: 150000 | D333: 400000
A334: =A333+1 -> 62 | B334: Mughalpura Road | C334: 150000 | D334: 300000
A335: =A334+1 -> 63 | B335: Niclson Road | C335: 300000 | D335: 800000
A336: =A335+1 -> 64 | B336: Nabi Pura (Gulberg) | C336: 100000 | D336: 500000
A337: =A336+1 -> 65 | B337: Nawaz Sharif Colony (Near Model Town Courts) | C337: 100000 | D337: 300000
A338: =A337+1 -> 66 | B338: Pindi Rajputan | C338: 150000 | D338: 300000
A339: =A338+1 -> 67 | B339: PECO Road (Phatak to Akbar Chowk) | C339: 0 | D339: 500000
A340: =A339+1 -> 68 | B340: Qila Gujjar Singh | C340: 200000 | D340: 500000
A341: =A340+1 -> 69 | B341: Qazilbash Road | C341: 0 | D341: 400000
A342: =A341+1 -> 70 | B342: Scotch Corner | C342: 200000 | D342: 500000
A343: =A342+1 -> 71 | B343: Sahowari | C343: 125000 | D343: 250000
A344: =A343+1 -> 72 | B344: Shabbir Usmani Road from Y Junction to Moulana Shaukat Ali Road | C344: 0 | D344: 600000
A345: =A344+1 -> 73 | B345: They Zaildaran Gulberg | C345: 200000 | D345: 700000
A346: =A345+1 -> 74 | B346: Upper Mall Scheme | C346: 300000 | D346: 800000
A347: =A346+1 -> 75 | B347: Upper Mall Road | C347: 300000 | D347: 800000
A348: =A347+1 -> 76 | B348: Wazir Ali Road | C348: 0 | D348: 500000
A349: =A348+1 -> 77 | B349: Zafar Ali Road | C349: 400000 | D349: 1000000
A350: =A349+1 -> 78 | B350: Zaman Park | C350: 250000 | D350: 600000
A351: =A350+1 -> 79 | B351: Zaildar Park (Ichhra) | C351: 200000 | D351: 600000
A354: Allama Iqbal Town, Lahore
A355: S. No. | B355: Name of Locality | C355: Rate Per Marla Residential | D355: Rate Per Marla Commercial
A356: 1 | B356: Ajhodia Pur | C356: 125000 | D356: 300000
A357: =A356+1 -> 2 | B357: Awan Town | C357: 125000 | D357: 300000
A358: =A357+1 -> 3 | B358: Abid Garden | C358: 100000 | D358: 300000
A359: =A358+1 -> 4 | B359: Abadi Moosla/Mouza Moosla | C359: 50000 | D359: 150000
A360: =A359+1 -> 5 | B360: Azam Garden | C360: 125000 | D360: 250000
A361: =A360+1 -> 6 | B361: Ali Park Niaz Baig | C361: 125000 | D361: 250000
A362: =A361+1 -> 7 | B362: Al-Hamad Park Niaz Baig | C362: 125000 | D362: 250000
A363: =A362+1 -> 8 | B363: Aitcheson College Cooperative Housing Society | C363: 125000 | D363: 250000
A364: =A363+1 -> 9 | B364: Ahmed Nagar (Kachi Kothi) | C364: 125000 | D364: 250000
A365: =A364+1 -> 10 | B365: Adjoining Canal Bank any Society Mouza Shahpur Khanpur | C365: 150000 | D365: 300000
A366: =A365+1 -> 11 | B366: Adjoining Canal Bank any Society Mouza Kanjran | C366: 150000 | D366: 400000
A367: =A366+1 -> 12 | B367: Agriculture Cooperative Housing Society | C367: 125000 | D367: 250000
A368: =A367+1 -> 13 | B368: Ali Raza Abad | C368: 125000 | D368: 250000
A369: =A368+1 -> 14 | B369: Al-Hajaj Cooperative Housing Society | C369: 125000 | D369: 250000
A370: =A369+1 -> 15 | B370: Ahmad Housing Scheme (Niaz Baig) | C370: 100000 | D370: 200000
A371: =A370+1 -> 16 | B371: Amar Kot | C371: 25000 | D371: 50000
A372: =A371+1 -> 17 | B372: Badar Pura | C372: 125000 | D372: 250000
A373: =A372+1 -> 18 | B373: Bakar Mandi | C373: 200000 | D373: 400000
A374: =A373+1 -> 19 | B374: Bola Garhi | C374: 125000 | D374: 250000
A375: =A374+1 -> 20 | B375: Campus View Town | C375: 125000 | D375: 300000
A376: =A375+1 -> 21 | B376: Canal View | C376: 200000 | D376: 400000
A377: =A376+1 -> 22 | B377: Chak Mozang | C377: 150000 | D377: 400000
A378: =A377+1 -> 23 | B378: Canal View Housing Society | C378: 200000 | D378: 400000
A379: =A378+1 -> 24 | B379: Canal Bank Road Two Sides Campus to Thokhar | C379: 200000 | D379: 400000
A380: =A379+1 -> 25 | B380: Chung Punjgrian | C380: 100000 | D380: 200000
A381: =A380+1 -> 26 | B381: All Societies of Chung Panjgrian | C381: 150000 | D381: 250000
A382: =A381+1 -> 27 | B382: Canal Breeze Housing Society | C382: 125000 | D382: 200000
A383: =A382+1 -> 28 | B383: Doctors' Society | C383: 150000 | D383: 300000
A384: =A383+1 -> 29 | B384: Dina Nath Amar Kot | C384: 50000 | D384: 100000
A385: =A384+1 -> 30 | B385: Dholan Wal | C385: 150000 | D385: 250000
A386: =A385+1 -> 31 | B386: Dhana Singh Wala | C386: 125000 | D386: 300000
A387: =A386+1 -> 32 | B387: Dooban Pura Abadi | C387: 100000 | D387: 200000
A388: =A387+1 -> 33 | B388: Ehbab Colony | C388: 50000 | D388: 100000
A389: =A388+1 -> 34 | B389: EME Housing Society | C389: 200000 | D389: 400000
A390: =A389+1 -> 35 | B390: Education Town | C390: 100000 | D390: 200000
A391: =A390+1 -> 36 | B391: Gosha-e-Ahbab Phase-I-II | C391: 75000 | D391: 250000
A392: =A391+1 -> 37 | B392: Green Forts Phase-I-II | C392: 200000 | D392: 300000
A393: =A392+1 -> 38 | B393: Ghulam Gouswala | C393: 50000 | D393: 100000
A394: =A393+1 -> 39 | B394: Ghulam Gouswala any Society/Town | C394: 100000 | D394: 200000
A395: =A394+1 -> 40 | B395: Hanjar Wal | C395: 100000 | D395: 200000
A396: =A395+1 -> 41 | B396: Hameed Park Chak Mozang | C396: 150000 | D396: 400000
A397: =A396+1 -> 42 | B397: Hassan Town | C397: 125000 | D397: 300000
A398: =A397+1 -> 43 | B398: Jalal Park (Niaz Baig) | C398: 100000 | D398: 200000
A399: =A398+1 -> 44 | B399: Jubilee Town | C399: 50000 | D399: 150000
A400: =A399+1 -> 45 | B400: Jogeen Pura | C400: 125000 | D400: 300000
A401: =A400+1 -> 46 | B401: Jhugian Shahab Din | C401: 150000 | D401: 350000
A402: =A401+1 -> 47 | B402: Johar Town | C402: 200000 | D402: 500000
A403: =A402+1 -> 48 | B403: Judicial Town | C403: 100000 | D403: 300000
A404: =A403+1 -> 49 | B404: Jhugian Nagra | C404: 75000 | D404: 250000
A405: =A404+1 -> 50 | B405: Kot Muhammadi | C405: 125000 | D405: 250000
A406: =A405+1 -> 51 | B406: Kot Kamboh | C406: 125000 | D406: 250000
A407: =A406+1 -> 52 | B407: Khadeeja Park | C407: 75000 | D407: 200000
A408: =A407+1 -> 53 | B408: Katar Bund Road | C408: 100000 | D408: 200000
A409: =A408+1 -> 54 | B409: Khamba | C409: 50000 | D409: 150000
A410: =A409+1 -> 55 | B410: All Societies in Khamba | C410: 75000 | D410: 200000
A411: =A410+1 -> 56 | B411: Kanjran | C411: 150000 | D411: 250000
A412: =A411+1 -> 57 | B412: Khaliq Abad | C412: 150000 | D412: 250000
A413: =A412+1 -> 58 | B413: Kibria Town | C413: 50000 | D413: 150000
A414: =A413+1 -> 59 | B414: Lalazar Market | C414: 0 | D414: 300000
A415: =A414+1 -> 60 | B415: Lalazar Colony/Judicial Cooperative Housing Society | C415: 100000 | D415: 200000
A416: =A415+1 -> 61 | B416: LDA Avenue-I | C416: 100000 | D416: 200000
A417: =A416+1 -> 62 | B417: Muhammad Sultan Abad | C417: 125000 | D417: 300000
A418: =A417+1 -> 63 | B418: Moulana Shoukat Ali Road | C418: 0 | D418: 600000
A419: =A418+1 -> 64 | B419: Mairaj Park (Dholanwal) | C419: 200000 | D419: 300000
A420: =A419+1 -> 65 | B420: Manzoor Park & Adjacent Areas | C420: 150000 | D420: 300000
A421: =A420+1 -> 66 | B421: Marraka | C421: 60000 | D421: 120000
A422: =A421+1 -> 67 | B422: Muridwal | C422: 125000 | D422: 250000
A423: =A422+1 -> 68 | B423: Main Bazar Chung | C423: 0 | D423: 250000
A424: =A423+1 -> 69 | B424: Manga Raiwind Road (Jurisdiction of AIT) | C424: 100000 | D424: 150000
A425: =A424+1 -> 70 | B425: Mohlanwal | C425: 30000 | D425: 100000
A426: =A425+1 -> 71 | B426: Mustafa Town Niaz Baig | C426: 125000 | D426: 250000
A427: =A426+1 -> 72 | B427: Multan Road falling in Allama Iqbal Town | C427: 0 | D427: 300000
A428: =A427+1 -> 73 | B428: Mansoora | C428: 125000 | D428: 250000
A429: =A428+1 -> 74 | B429: Maraghzar Colony | C429: 100000 | D429: 250000
A430: =A429+1 -> 75 | B430: Main Raiwind Road | C430: 200000 | D430: 350000
A431: =A430+1 -> 76 | B431: Myra Garh Flates Ali Raza Abad and Ahmad Nagar | C431: 150000 | D431: 300000
A432: =A431+1 -> 77 | B432: Muhafiz Town | C432: 100000 | D432: 200000
A433: =A432+1 -> 78 | B433: Mateen Avenue | C433: 125000 | D433: 250000
A434: =A433+1 -> 79 | B434: Mahdi Pura | C434: 25000 | D434: 50000
A435: =A434+1 -> 80 | B435: Niaz Baig | C435: 80000 | D435: 200000
A436: =A435+1 -> 81 | B436: Nawab Town (Rakh Khamba) | C436: 125000 | D436: 250000
A437: =A436+1 -> 82 | B437: Nasir Ganj | C437: 25000 | D437: 50000
A438: =A437+1 -> 83 | B438: NESPAK Housing Scheme | C438: 100000 | D438: 150000
A439: =A438+1 -> 84 | B439: PECO Colony Niaz Baig | C439: 100000 | D439: 200000
A440: =A439+1 -> 85 | B440: PCISR Housing Society Phase-I | C440: 200000 | D440: 400000
A441: =A440+1 -> 86 | B441: PCISR Housing Society Phase-II | C441: 150000 | D441: 300000
A442: =A441+1 -> 87 | B442: PIA Housing Society | C442: 200000 | D442: 400000
A443: =A442+1 -> 88 | B443: PECO Road (Phatak to Ganda Nala) | C443: 0 | D443: 500000
A444: =A443+1 -> 89 | B444: PECO Road (Ganda Nala to Akbar Chowk) | C444: 0 | D444: 500000
A445: =A444+1 -> 90 | B445: Paji | C445: 12500 | D445: 25000
A446: =A445+1 -> 91 | B446: Rana Town | C446: 75000 | D446: 200000
A447: =A446+1 -> 92 | B447: Rasulpura Niaz Baig | C447: 100000 | D447: 200000
A448: =A447+1 -> 93 | B448: Rajput Housing Scheme | C448: 100000 | D448: 200000
A449: =A448+1 -> 94 | B449: Rakh Khamba Mouza | C449: 65000 | D449: 150000
A450: =A449+1 -> 95 | B450: All Housing Societies & Town in Mouza Rakh Khama | C450: 100000 | D450: 250000
A451: =A450+1 -> 96 | B451: Rail Town | C451: 100000 | D451: 200000
A452: =A451+1 -> 97 | B452: Raiwind Road Main (Thokhar Nawaz Sharif Chowk to Avenue) | C452: 0 | D452: 350000
A453: =A452+1 -> 98 | B453: Raiwind Inside Town Committee | C453: 50000 | D453: 150000
A454: =A453+1 -> 99 | B454: Raiwind Main Bazar | C454: 0 | D454: 400000
A455: =A454+1 -> 100 | B455: Raiwind Main Bazar Adjoining Markets | C455: 0 | D455: 350000
A456: =A455+1 -> 101 | B456: Main Raiwind (Inside Phatak to Outside Phatak) | C456: 80000 | D456: 300000
A457: =A456+1 -> 102 | B457: Main Raiwind (Chowk Avenue-I to Outside Phatak Raiwind) | C457: 0 | D457: 200000
A458: =A457+1 -> 103 | B458: Revenue Employees' Coopearative Housing Society | C458: 125000 | D458: 250000
A459: =A458+1 -> 104 | B459: Sabzazar Scheme | C459: 150000 | D459: 400000
A460: =A459+1 -> 105 | B460: Saidpur | C460: 150000 | D460: 300000
A461: =A460+1 -> 106 | B461: Saidpur (Iqbal Town Side) | C461: 150000 | D461: 300000
A462: =A461+1 -> 107 | B462: Sattu Katla | C462: 125000 | D462: 350000
A463: =A462+1 -> 108 | B463: Shah Sharif/Kalan More | C463: 100000 | D463: 500000
A464: =A463+1 -> 109 | B464: State Enterprises Housing Society | C464: 125000 | D464: 300000
A465: =A464+1 -> 110 | B465: Samsani Road | C465: 150000 | D465: 300000
A466: =A465+1 -> 111 | B466: Sultan Town | C466: 150000 | D466: 300000
A467: =A466+1 -> 112 | B467: Sultanpura | C467: 50000 | D467: 100000
A468: =A467+1 -> 113 | B468: Super Market (Thokar to Ginning Market) | C468: 0 | D468: 400000
A469: =A468+1 -> 114 | B469: Sher Shah Town | C469: 25000 | D469: 50000
A470: =A469+1 -> 115 | B470: Shahpur Khanpur | C470: 60000 | D470: 100000
A471: =A470+1 -> 116 | B471: Sunflower Housing Scheme | C471: 125000 | D471: 300000
A472: =A471+1 -> 117 | B472: Shoukat Khanum Hospital (Khayyaban Jinnah) to Raiwind Road | C472: 200000 | D472: 500000
A473: =A472+1 -> 118 | B473: Thokhar to Shoukat Khanum Hospital | C473: 200000 | D473: 500000
A474: =A473+1 -> 119 | B474: Tanveer Park | C474: 150000 | D474: 400000
A475: =A474+1 -> 120 | B475: Touheed Park | C475: 150000 | D475: 400000
A476: =A475+1 -> 121 | B476: Thokhar to Manga Mandi Multan Road | C476: 0 | D476: 300000
A477: =A476+1 -> 122 | B477: TECH Society | C477: 200000 | D477: 400000
A478: =A477+1 -> 123 | B478: Township | C478: 125000 | D478: 300000
A479: =A478+1 -> 124 | B479: Township (Bismillah Chowk to Bumb Disposal B-II Township) | C479: 125000 | D479: 300000
A480: =A479+1 -> 125 | B480: Township (Al-Kareem Chowk to Chandni Chowk) | C480: 125000 | D480: 300000
A481: =A480+1 -> 126 | B481: Township (Block No. 14 Lal School Near Masjid Ghousia, Masjid AhleHadith Road Township) | C481: 125000 | D481: 300000
A482: =A481+1 -> 127 | B482: Township (Bagrian Road Rahmat Hospital to Bagrian) | C482: 125000 | D482: 300000
A483: =A482+1 -> 128 | B483: Township (Bagrian Road to Bhola Chowk, Block No. C-II, 3, 4, 5) | C483: 125000 | D483: 300000
A484: =A483+1 -> 129 | B484: Township College Road | C484: 0 | D484: 500000
A485: =A484+1 -> 130 | B485: Township C-I, C-II Road between Butt Chowk to Qadri Chowk and Around Choras Tanki to Outside College Road | C485: 125000 | D485: 300000
A486: =A485+1 -> 131 | B486: Township (Centre Road Ghanda Nala Near Doctor Nisar Tent Wala 7-8 Crossing Al-Madina Road to 11-12 Block Rafi Chowk | C486: 125000 | D486: 300000
A487: =A486+1 -> 132 | B487: Township, Centre Road between Ghanda Nala Block 2 and 3 Township | C487: 125000 | D487: 300000
A488: =A487+1 -> 133 | B488: Township, D-I, D-II, Industrial Nala Both Sides Township | C488: 0 | D488: 300000
A489: =A488+1 -> 134 | B489: Township, Darussalam Road, B-II, Township | C489: 125000 | D489: 300000
A490: =A489+1 -> 135 | B490: Township, DPS School, Main Gate upto Church, Township | C490: 125000 | D490: 300000
A491: =A490+1 -> 136 | B491: Townsip, Depot Chowk to Mirza M. Mirza Road Azmat Chowk, Township | C491: 125000 | D491: 300000
A492: =A491+1 -> 137 | B492: Township, Farooqi Chowk to Anti Shah Chowk Imam Bargah Abu Bakar Road, Township | C492: 125000 | D492: 300000
A493: =A492+1 -> 138 | B493: Township, Haider Road to Petrol Pump Wali Road, Anmol Cinema, Township | C493: 125000 | D493: 300000
A494: =A493+1 -> 139 | B494: Township, Hassan Basra Road Main Chowk, Township | C494: 125000 | D494: 300000
A495: =A494+1 -> 140 | B495: Township Industrial | C495: 0 | D495: 300000
A496: =A495+1 -> 141 | B496: Township, Imam Bargah D-I to Ground Block D-I, I, Township | C496: 125000 | D496: 300000
A497: =A496+1 -> 142 | B497: Township, Kashmir Road Backside 10 Block behind 2 Kanal Wali Kothi Road, Township | C497: 125000 | D497: 300000
A498: =A497+1 -> 143 | B498: Township, Khokhar Chowk to Ganda Nala, Township | C498: 125000 | D498: 300000
A499: =A498+1 -> 144 | B499: Township, Lakar Stop to Sunday Bazar, Township | C499: 125000 | D499: 300000
A500: =A499+1 -> 145 | B500: Township, Madina Road, Madina Chowk to Barkat Chowk, Township | C500: 0 | D500: 400000
A501: =A500+1 -> 146 | B501: Township, Madina Road to Ashraf Clinic, 13 Block Masjid to All Road, Township | C501: 0 | D501: 400000
A502: =A501+1 -> 147 | B502: Township, Madina Masjid to Bohar Wala Chowk Rehri Wala, Thela Road to Ganda Nala, Township | C502: 0 | D502: 400000
A503: =A502+1 -> 148 | B503: Township, Madina Masjid, Madina Bazar, Sooha Bazar, Township | C503: 0 | D503: 400000
A504: =A503+1 -> 149 | B504: Township, Ghousia Masjid to 13 Block to College Road, Township | C504: 125000 | D504: 300000
A505: =A504+1 -> 150 | B505: Township, Main Chowk to Pipe Stop (Tahir-ul-Qadri Chowk), Township | C505: 125000 | D505: 300000
A506: =A505+1 -> 151 | B506: Township, Masjid Stop Market to Milad Chowk, Township | C506: 125000 | D506: 300000
A507: =A506+1 -> 152 | B507: Township, Muhammadi Market No. 5, D-II, Township | C507: 125000 | D507: 300000
A508: =A507+1 -> 153 | B508: Township, Nursary Stop, Al-Kareem Chowk, Haider Road, Township | C508: 125000 | D508: 300000
A509: =A508+1 -> 154 | B509: Township, Nursary Stop to Hamdard Chowk, Township | C509: 125000 | D509: 300000
A510: =A509+1 -> 155 | B510: Township, Old PS Masjid Touheed to Gandari Chowk, Township | C510: 125000 | D510: 300000
A511: =A510+1 -> 156 | B511: Township, Pipe Chowk Stop (Tahir-ul-Qadri Chowk to Sadiq Chowk, Township | C511: 125000 | D511: 300000
A512: =A511+1 -> 157 | B512: Township, Rana Road to Tahir-ul-Qadri Masjid, Township | C512: 125000 | D512: 300000
A513: =A512+1 -> 158 | B513: Township, Sadiq Chowk to Aslam Chowk (Beside Nala), Towhship | C513: 125000 | D513: 300000
A514: =A513+1 -> 159 | B514: Township, Somi Centre upto Back Door of DPS School, Towhsnip | C514: 125000 | D514: 300000
A515: =A514+1 -> 160 | B515: Township, Shan Video Main Gate, DPS School Anmol Cinema Road, Township | C515: 125000 | D515: 300000
A516: =A515+1 -> 161 | B516: Township, Umar Chowk to Keer Kalan Block D-I, Township | C516: 125000 | D516: 300000
A517: =A516+1 -> 162 | B517: Umar Garden | C517: 150000 | D517: 300000
A518: =A517+1 -> 163 | B518: Valensia Town | C518: 150000 | D518: 300000
A519: =A518+1 -> 164 | B519: Waris Colony Niaz Baig | C519: 150000 | D519: 300000
A520: =A519+1 -> 165 | B520: West Wood Colony | C520: 150000 | D520: 300000
A521: =A520+1 -> 166 | B521: WAPDA Town | C521: 200000 | D521: 400000
A524: Rates of Cultivable Land falling in Iqbal Town, Lahore
A525: S. No. | B525: Name of Locality | C525: Rate Per Acre Agricultural Land | D525: Rate Per Acre Flooded Land
A526: 1 | B526: Mohlan Wal | C526: 800000 | D526: 0
A527: =A526+1 -> 2 | B527: Niaz Baig | C527: 800000 | D527: 600000
A530: Nishter Town, Lahore
A531: S. No. | B531: Name of Locality | C531: Rate Per Marla Residential | D531: Rate Per Marla Commercial
A532: 1 | B532: Amar Sidhu & Adjoining Areas | C532: 100000 | D532: 250000
A533: =A532+1 -> 2 | B533: Araian to Kahna (Jia Bagga Road) | C533: 25000 | D533: 50000
A534: =A533+1 -> 3 | B534: Abpara Scheme (Ammer Pura) Backward | C534: 70000 | D534: 150000
A535: =A534+1 -> 4 | B535: Audit & Accounts Society | C535: 100000 | D535: 250000
A536: =A535+1 -> 5 | B536: Ahbab Housing Society (Chandrai) | C536: 100000 | D536: 250000
A537: =A536+1 -> 6 | B537: Anmol Housing Society | C537: 100000 | D537: 250000
A538: =A537+1 -> 7 | B538: Accounts Group Society | C538: 100000 | D538: 250000
A539: =A538+1 -> 8 | B539: Al-Falah Town (Chandrai) | C539: 100000 | D539: 250000
A540: =A539+1 -> 9 | B540: Awan Brothers' Society | C540: 100000 | D540: 250000
A541: =A540+1 -> 10 | B541: Abdullah Town | C541: 100000 | D541: 250000
A542: =A541+1 -> 11 | B542: Arif Town | C542: 100000 | D542: 250000
A543: =A542+1 -> 12 | B543: Asif Town | C543: 100000 | D543: 250000
A544: =A543+1 -> 13 | B544: Azhar Town | C544: 100000 | D544: 250000
A545: =A544+1 -> 14 | B545: Ameer Pura & Adjoining Areas | C545: 50000 | D545: 100000
A546: =A545+1 -> 15 | B546: Ameer Pura (All Housing Societies) | C546: 100000 | D546: 250000
A547: =A546+1 -> 16 | B547: Attari Saroba & Adjoining Areas | C547: 80000 | D547: 150000
A548: =A547+1 -> 17 | B548: Bedian Road (R. A. Bazar to Bhatta Chowk) | C548: 100000 | D548: 300000
A549: =A548+1 -> 18 | B549: Bahar Colony | C549: 90000 | D549: 250000
A550: =A549+1 -> 19 | B550: Bedian Road (Ahead Bhatta Chowk to Elite Center) | C550: 50000 | D550: 150000
A551: =A550+1 -> 20 | B551: Bilal Town (Bhobtian) | C551: 40000 | D551: 100000
A552: =A551+1 -> 21 | B552: BPS Society | C552: 90000 | D552: 200000
A553: =A552+1 -> 22 | B553: Bapar (Walton Board) | C553: 40000 | D553: 80000
A554: =A553+1 -> 23 | B554: Bhoptian & Adjoining Areas | C554: 30000 | D554: 80000
A555: =A554+1 -> 24 | B555: Bagrian Dharam Chand | C555: 40000 | D555: 80000
A556: =A555+1 -> 25 | B556: Bakhshish Pura (Manawala) | C556: 50000 | D556: 100000
A557: =A556+1 -> 26 | B557: Balhar (Out of Cantt. Limits) | C557: 40000 | D557: 80000
A558: =A557+1 -> 27 | B558: Chohng Khud | C558: 90000 | D558: 250000
A559: =A558+1 -> 28 | B559: Ghohng Khurd (PSF Area Walton Road) | C559: 80000 | D559: 250000
A560: =A559+1 -> 29 | B560: Cavalry Ground Old & Extension | C560: 250000 | D560: 1100000
A561: =A560+1 -> 30 | B561: Chandrai & Adjoining Areas | C561: 90000 | D561: 250000
A562: =A561+1 -> 31 | B562: Charar & Adjoining Areas | C562: 150000 | D562: 250000
A563: =A562+1 -> 32 | B563: Central Park | C563: 50000 | D563: 100000
A564: =A563+1 -> 33 | B564: Defence Road (Kacha to Bhobtian) | C564: 50000 | D564: 150000
A565: =A564+1 -> 34 | B565: Defence Blocks Y & Z (Phase III) | C565: 300000 | D565: 1500000
A566: =A565+1 -> 35 | B566: Defence Phase - I | C566: 300000 | D566: 700000
A567: =A566+1 -> 36 | B567: Defence Phase - II | C567: 250000 | D567: 700000
A568: =A567+1 -> 37 | B568: Defence Phase - III | C568: 250000 | D568: 700000
A569: =A568+1 -> 38 | B569: Defence Phase - IV | C569: 200000 | D569: 700000
A570: =A569+1 -> 39 | B570: Defence Phase - V | C570: 100000 | D570: 500000
A571: =A570+1 -> 40 | B571: Defence Phase - I, Sector K | C571: 300000 | D571: 700000
A572: =A571+1 -> 41 | B572: Defence Garden | C572: 100000 | D572: 250000
A573: =A572+1 -> 42 | B573: Dulu Khurd & Adjoining Areas | C573: 80000 | D573: 200000
A574: =A573+1 -> 43 | B574: Dulu Kalan & Adjoining Areas | C574: 60000 | D574: 200000
A575: =A574+1 -> 44 | B575: Dev. Khurd Kalan & Adjoining Areas | C575: 80000 | D575: 200000
A576: =A575+1 -> 45 | B576: Dubai Town | C576: 40000 | D576: 80000
A577: =A576+1 -> 46 | B577: Eden Cottage Adjacent Defence | C577: 300000 | D577: 350000
A578: =A577+1 -> 47 | B578: EIPM Society | C578: 70000 | D578: 100000
A579: =A578+1 -> 48 | B579: Farooq Colony Amar Sidhu | C579: 100000 | D579: 250000
A580: =A579+1 -> 49 | B580: Ferozepur Road Kot Lakhpat to Kahna | C580: 0 | D580: 450000
A581: =A580+1 -> 50 | B581: Ferozepur Road Kot Lakhpat to Gilvehra | C581: 0 | D581: 150000
A582: =A581+1 -> 51 | B582: Ferozepur Road Bridge to Amar Sadhu Nala) | C582: 350000 | D582: 800000
A583: =A582+1 -> 52 | B583: Ghazi Road Amar Sadhu | C583: 0 | D583: 350000
A584: =A583+1 -> 53 | B584: Green Town | C584: 150000 | D584: 300000
A585: =A584+1 -> 54 | B585: Green Acre Housing Scheme Raiwind Road | C585: 50000 | D585: 100000
A586: =A585+1 -> 55 | B586: Gulshan-e-Munir Scheme | C586: 50000 | D586: 100000
A587: =A586+1 -> 56 | B587: Guru Manget (WCB) | C587: 175000 | D587: 400000
A588: =A587+1 -> 57 | B588: Galaxo Town | C588: 60000 | D588: 130000
A589: =A588+1 -> 58 | B589: Green Cap Scheme (Gajomata) | C589: 50000 | D589: 100000
A590: =A589+1 -> 59 | B590: Gajomata & Adjoining Areas | C590: 60000 | D590: 125000
A591: =A590+1 -> 60 | B591: Gulshan Colony Amar Sadhu | C591: 100000 | D591: 250000
A592: =A591+1 -> 61 | B592: Ghousia Colony Koray | C592: 100000 | D592: 200000
A593: =A592+1 -> 62 | B593: Hayat Town | C593: 60000 | D593: 125000
A594: =A593+1 -> 63 | B594: HBFC Society | C594: 60000 | D594: 125000
A595: =A594+1 -> 64 | B595: Hamza Town (Dulu Khurd) | C595: 80000 | D595: 150000
A596: =A595+1 -> 65 | B596: Harpalkey | C596: 40000 | D596: 70000
A597: =A596+1 -> 66 | B597: Hussain Global Society | C597: 80000 | D597: 150000
A598: =A597+1 -> 67 | B598: Iqbal Park & New Iqbal Park (WCB) | C598: 125000 | D598: 350000
A599: =A598+1 -> 68 | B599: IEPM Society | C599: 80000 | D599: 150000
A600: =A599+1 -> 69 | B600: Irrigation Cooperative Housing Society (Chandrai) | C600: 50000 | D600: 100000
A601: =A600+1 -> 70 | B601: Irrigation Cooperative Housing Society (Tihayat) | C601: 50000 | D601: 100000
A602: =A601+1 -> 71 | B602: ISRM Cooperative Housing Society | C602: 50000 | D602: 100000
A603: =A602+1 -> 72 | B603: Jathol (WCB) | C603: 40000 | D603: 80000
A604: =A603+1 -> 73 | B604: Jedah Town | C604: 60000 | D604: 125000
A605: =A604+1 -> 74 | B605: Jail Road Kacha toward Chungi | C605: 80000 | D605: 250000
A606: =A605+1 -> 75 | B606: Jalalpura | C606: 40000 | D606: 100000
A607: =A606+1 -> 76 | B607: Koray & Adjoining Areas (WCB) | C607: 100000 | D607: 200000
A608: =A607+1 -> 77 | B608: Kamahan | C608: 50000 | D608: 100000
A609: =A608+1 -> 78 | B609: Keer Khurd Adjoining Abadies | C609: 80000 | D609: 175000
A610: =A609+1 -> 79 | B610: Keer Kalan & Adjoining Areas | C610: 80000 | D610: 175000
A611: =A610+1 -> 80 | B611: Khalid Town | C611: 80000 | D611: 175000
A612: =A611+1 -> 81 | B612: Khaliq Nagar (Dullu Khurd) | C612: 80000 | D612: 200000
A613: =A612+1 -> 82 | B613: Khayaban-e-Karim | C613: 80000 | D613: 175000
A614: =A613+1 -> 83 | B614: Kamahan (Amer Sidhu Kamahan Attari Saroba Road) | C614: 0 | D614: 150000
A615: =A614+1 -> 84 | B615: Kachha | C615: 30000 | D615: 50000
A616: =A615+1 -> 85 | B616: Kachha Road (Kahna to Railway Line) | C616: 100000 | D616: 200000
A617: =A616+1 -> 86 | B617: Kahna | C617: 30000 | D617: 50000
A618: =A617+1 -> 87 | B618: Kahna Kohna | C618: 30000 | D618: 50000
A619: =A618+1 -> 88 | B619: Kahna Nau | C619: 30000 | D619: 50000
A620: =A619+1 -> 89 | B620: Kot Lakhpat | C620: 150000 | D620: 300000
A621: =A620+1 -> 90 | B621: Kot Lakhpat Industrial Area | C621: 0 | D621: 350000
A622: =A621+1 -> 91 | B622: K. E. Medical College Cooperative | C622: 100000 | D622: 150000
A623: =A622+1 -> 92 | B623: Lake City Holding Housing Society | C623: 100000 | D623: 200000
A624: =A623+1 -> 93 | B624: Liaqatabad | C624: 100000 | D624: 200000
A625: =A624+1 -> 94 | B625: Liaqatabad Main Bazar | C625: 0 | D625: 300000
A626: =A625+1 -> 95 | B626: Lidhar & Adjoining Areas (WCB) | C626: 60000 | D626: 125000
A627: =A626+1 -> 96 | B627: Main Boulevard Defence (Khayaban-e-Jinnah) | C627: 0 | D627: 1500000
A628: =A627+1 -> 97 | B628: Main Railway Road | C628: 200000 | D628: 350000
A629: =A628+1 -> 98 | B629: Main Boulevard Defence (Khayaban-e-Iqbal) | C629: 0 | D629: 1100000
A630: =A629+1 -> 99 | B630: Maulana Shokat Ali Road | C630: 0 | D630: 600000
A631: =A630+1 -> 100 | B631: Madina Colony (Koray) | C631: 100000 | D631: 300000
A632: =A631+1 -> 101 | B632: Military Accounts Housing Society | C632: 100000 | D632: 200000
A633: =A632+1 -> 102 | B633: Millat Town | C633: 100000 | D633: 150000
A634: =A633+1 -> 103 | B634: Mustafa Town | C634: 100000 | D634: 150000
A635: =A634+1 -> 104 | B635: Mashkoor Town | C635: 100000 | D635: 150000
A636: =A635+1 -> 105 | B636: Madina Town | C636: 100000 | D636: 150000
A637: =A636+1 -> 106 | B637: M/s. Industrial Cooperative Housing Society | C637: 100000 | D637: 150000
A638: =A637+1 -> 107 | B638: Nishat Colony (WCB) | C638: 100000 | D638: 200000
A639: =A638+1 -> 108 | B639: Niaz Town | C639: 100000 | D639: 150000
A640: =A639+1 -> 109 | B640: Nasheman Park | C640: 100000 | D640: 150000
A641: =A640+1 -> 110 | B641: Nasheman-e-Iqbal Cooperative Housing Society | C641: 150000 | D641: 300000
A642: =A641+1 -> 111 | B642: Noor Town | C642: 100000 | D642: 150000
A643: =A642+1 -> 112 | B643: Nisther Colony | C643: 100000 | D643: 150000
A644: =A643+1 -> 113 | B644: Nangar | C644: 25000 | D644: 50000
A645: =A644+1 -> 114 | B645: NIFC Society | C645: 100000 | D645: 150000
A646: =A645+1 -> 115 | B646: Nobahar Housing Society | C646: 80000 | D646: 125000
A647: =A646+1 -> 116 | B647: Nawaz Sharif Colony Near Model Town Post | C647: 100000 | D647: 300000
A648: =A647+1 -> 117 | B648: Officers' Colony (Cavalry Ground) | C648: 0 | D648: 250000
A649: =A648+1 -> 118 | B649: Overhead Bridge to Chowk Cavalry Ground | C649: 0 | D649: 1100000
A650: =A649+1 -> 119 | B650: Overseas Workers' Housing Society | C650: 50000 | D650: 125000
A651: =A650+1 -> 120 | B651: Punjab Cooperative Housing Society (WCB) | C651: 150000 | D651: 300000
A652: =A651+1 -> 121 | B652: Punjab Cooperative Housing Society Kamahan | C652: 80000 | D652: 125000
A653: =A652+1 -> 122 | B653: Public Health Society | C653: 50000 | D653: 100000
A654: =A653+1 -> 123 | B654: PCSIR Society | C654: 150000 | D654: 250000
A655: =A654+1 -> 124 | B655: PEC Housing Society | C655: 100000 | D655: 200000
A656: =A655+1 -> 125 | B656: Qadri Colony Koray | C656: 100000 | D656: 200000
A657: =A656+1 -> 126 | B657: Quaid-e-Azam Industrial Estate | C657: 0 | D657: 350000
A658: =A657+1 -> 127 | B658: R. A. Bazar (WCB) | C658: 0 | D658: 250000
A659: =A658+1 -> 128 | B659: Rifle Range Road (WCB) | C659: 200000 | D659: 300000
A660: =A659+1 -> 129 | B660: Roran Wala | C660: 30000 | D660: 50000
A661: =A660+1 -> 130 | B661: Super Town New Super Town (Koray) | C661: 125000 | D661: 375000
A662: =A661+1 -> 131 | B662: Shah Taj Colony (Koray) | C662: 125000 | D662: 250000
A663: =A662+1 -> 132 | B663: Sitara Colony Amar Sidhu | C663: 100000 | D663: 225000
A664: =A663+1 -> 133 | B664: Sargodha Housing Society | C664: 50000 | D664: 100000
A665: =A664+1 -> 134 | B665: Sardar Town | C665: 40000 | D665: 80000
A666: =A665+1 -> 135 | B666: Shahanshah Town (Bhobtian) | C666: 40000 | D666: 80000
A667: =A666+1 -> 136 | B667: Shalimar Town Gajjumatta | C667: 60000 | D667: 125000
A668: =A667+1 -> 137 | B668: Saadat Cooperative Housing Society | C668: 80000 | D668: 125000
A669: =A668+1 -> 138 | B669: Saroba Garden | C669: 80000 | D669: 150000
A670: =A669+1 -> 139 | B670: Shama Town | C670: 80000 | D670: 150000
A671: =A670+1 -> 140 | B671: Sadhokey | C671: 80000 | D671: 150000
A672: =A671+1 -> 141 | B672: Sui Norther Housing (Phase-I) | C672: 100000 | D672: 200000
A673: =A672+1 -> 142 | B673: State Life Housing Scheme (Harpalke) | C673: 100000 | D673: 200000
A674: =A673+1 -> 143 | B674: Township | C674: 125000 | D674: 300000
A675: =A674+1 -> 144 | B675: T & T Town | C675: 40000 | D675: 100000
A676: =A675+1 -> 145 | B676: TIPM Society | C676: 40000 | D676: 80000
A677: =A676+1 -> 146 | B677: Tibba Mashmula Kacha | C677: 40000 | D677: 80000
A678: =A677+1 -> 147 | B678: Thatta Khurd | C678: 40000 | D678: 80000
A679: =A678+1 -> 148 | B679: Venus Housing Society | C679: 80000 | D679: 125000
A680: =A679+1 -> 149 | B680: Walton Road Main | C680: 0 | D680: 500000
A681: =A680+1 -> 150 | B681: Waheed Brothers | C681: 80000 | D681: 150000
A682: =A681+1 -> 151 | B682: Youhana Abad | C682: 80000 | D682: 150000
A683: =A682+1 -> 152 | B683: Zahoor Town | C683: 80000 | D683: 150000
A684: =A683+1 -> 153 | B684: Zaman Colony (Koray) | C684: 120000 | D684: 240000
A687: Ravi Town, Lahore
A688: S. No. | B688: Name of Locality | C688: Rate Per Marla Residential | D688: Rate Per Marla Commercial
A689: A Ward
A690: 1 | B690: Shahi Mohalla | C690: 200000 | D690: 500000
A691: =A690+1 -> 2 | B691: Taxali | C691: 200000 | D691: 500000
A692: =A691+1 -> 3 | B692: Fort Road | C692: 200000 | D692: 500000
A693: B Ward
A694: =A692+1 -> 4 | B694: Bhatti Gate | C694: 200000 | D694: 500000
A695: =A694+1 -> 5 | B695: Mori Gate | C695: 200000 | D695: 500000
A696: C Ward
A697: =A695+1 -> 6 | B697: Langay Mandi | C697: 200000 | D697: 500000
A698: =A697+1 -> 7 | B698: City Cinema Road | C698: 200000 | D698: 500000
A699: =A698+1 -> 8 | B699: Pani Wala Talab | C699: 200000 | D699: 500000
A700: =A699+1 -> 9 | B700: Gumti Bazar | C700: 200000 | D700: 700000
A701: =A700+1 -> 10 | B701: Chatta Bazaar | C701: 200000 | D701: 700000
A702: =A701+1 -> 11 | B702: Moti Bazar | C702: 200000 | D702: 700000
A703: D Ward
A704: =A702+1 -> 12 | B704: Lohari Gate | C704: 200000 | D704: 500000
A705: =A704+1 -> 13 | B705: Lohari Mandi | C705: 200000 | D705: 500000
A706: =A705+1 -> 14 | B706: Rang Mahal (Back Side) | C706: 200000 | D706: 500000
A707: E Ward
A708: =A706+1 -> 15 | B708: Sooha Bazar | C708: 0 | D708: 2200000
A709: =A708+1 -> 16 | B709: Shahalam Gate | C709: 0 | D709: 2200000
A710: =A709+1 -> 17 | B710: Rang Mahal (Main) | C710: 0 | D710: 2200000
A711: F Ward
A712: =A710+1 -> 18 | B712: Kasera Bazar | C712: 300000 | D712: 900000
A713: =A712+1 -> 19 | B713: Kinari Bazar | C713: 300000 | D713: 900000
A714: =A713+1 -> 20 | B714: Dabi/Kashmiri Bazar | C714: 300000 | D714: 900000
A715: =A714+1 -> 21 | B715: Choona Mandi | C715: 300000 | D715: 900000
A716: =A715+1 -> 22 | B716: Mohallah Kakay Zaiyan | C716: 300000 | D716: 900000
A717: G Ward
A718: =A716+1 -> 23 | B718: Azam Cloth Market | C718: 0 | D718: 1800000
A719: =A718+1 -> 24 | B719: Yakki Gate | C719: 250000 | D719: 500000
A720: =A719+1 -> 25 | B720: Delhi Gate | C720: 250000 | D720: 500000
A721: =A720+1 -> 26 | B721: Sheranwala (Lions') Gate | C721: 250000 | D721: 500000
A722: =A721+1 -> 27 | B722: Pakistan Cloth Market | C722: 250000 | D722: 500000
A723: H Ward
A724: =A722+1 -> 28 | B724: Aabkari Mandi | C724: 250000 | D724: 1300000
A725: =A724+1 -> 29 | B725: Chohata Mufti Baqir | C725: 250000 | D725: 500000
A726: =A725+1 -> 30 | B726: Loon Mandi | C726: 250000 | D726: 500000
A727: =A726+1 -> 31 | B727: Gurr Mandi | C727: 250000 | D727: 500000
A728: =A727+1 -> 32 | B728: Adda Truck (Cicular Road) | C728: 350000 | D728: 1000000
A729: I Ward
A730: =A728+1 -> 33 | B730: Mochi Gate | C730: 300000 | D730: 500000
A731: =A730+1 -> 34 | B731: Pipple Vehra (Plastic Market) | C731: 300000 | D731: 500000
A732: =A731+1 -> 35 | B732: Shahalam Market (Backside) | C732: 0 | D732: 900000
A733: =A732+1 -> 36 | B733: Shoe Market | C733: 0 | D733: 900000
A734: =A733+1 -> 37 | B734: Alamgir Market | C734: 0 | D734: 900000
A735: =A734+1 -> 38 | B735: Bagami Bagh (Bus Stand) | C735: 0 | D735: 1000000
A736: =A735+1 -> 39 | B736: Aziz Road | C736: 200000 | D736: 400000
A737: =A736+1 -> 40 | B737: Akram Road | C737: 150000 | D737: 300000
A738: =A737+1 -> 41 | B738: Aslam Colony | C738: 150000 | D738: 300000
A739: =A738+1 -> 42 | B739: Akram Colony | C739: 150000 | D739: 300000
A740: =A739+1 -> 43 | B740: Al-Fateh Colony | C740: 150000 | D740: 300000
A741: =A740+1 -> 44 | B741: Altaf Park | C741: 150000 | D741: 300000
A742: =A741+1 -> 45 | B742: Azam Park | C742: 150000 | D742: 300000
A743: =A742+1 -> 46 | B743: Afzal Colony | C743: 150000 | D743: 300000
A744: =A743+1 -> 47 | B744: Ashraf Park | C744: 150000 | D744: 300000
A745: =A744+1 -> 48 | B745: Ahmad Park | C745: 150000 | D745: 300000
A746: =A745+1 -> 49 | B746: Ameen Park (Bela Basti Ram) | C746: 150000 | D746: 300000
A747: =A746+1 -> 50 | B747: Abdullah Park | C747: 150000 | D747: 300000
A748: =A747+1 -> 51 | B748: Abdul Qayyum Road (Bela Basti Ram) | C748: 0 | D748: 500000
A749: =A748+1 -> 52 | B749: Abdul Sattar Road (Bela Basti Ram) | C749: 0 | D749: 500000
A750: =A749+1 -> 53 | B750: Badami Bagh PECO Road | C750: 0 | D750: 1000000
A751: =A750+1 -> 54 | B751: Baghanwala | C751: 150000 | D751: 300000
A752: =A751+1 -> 55 | B752: Bela Basti Ram | C752: 150000 | D752: 300000
A753: =A752+1 -> 56 | B753: Bela Basti Ram (Western Side) | C753: 50000 | D753: 200000
A754: =A753+1 -> 57 | B754: Badar Colony | C754: 150000 | D754: 300000
A755: =A754+1 -> 58 | B755: Bhutto Colony | C755: 150000 | D755: 300000
A756: =A755+1 -> 59 | B756: Bund Road Ravi Bridge to Bassi More (Both Sides) | C756: 0 | D756: 350000
A757: =A756+1 -> 60 | B757: Bangali Park/Bagh | C757: 150000 | D757: 300000
A758: =A757+1 -> 61 | B758: Begum Kot | C758: 150000 | D758: 300000
A759: =A758+1 -> 62 | B759: Bhaman Mouza | C759: 100000 | D759: 300000
A760: =A759+1 -> 63 | B760: Bhaman (Western Side) | C760: 50000 | D760: 200000
A761: =A760+1 -> 64 | B761: Chiragh Park | C761: 150000 | D761: 300000
A762: =A761+1 -> 65 | B762: Chaudhary Park | C762: 150000 | D762: 300000
A763: =A762+1 -> 66 | B763: Chohan Colony | C763: 150000 | D763: 300000
A764: =A763+1 -> 67 | B764: Circular Road | C764: 0 | D764: 1000000
A765: =A764+1 -> 68 | B765: Clifton Colony/Park | C765: 150000 | D765: 300000
A766: =A765+1 -> 69 | B766: Data Nagar | C766: 150000 | D766: 300000
A767: =A766+1 -> 70 | B767: Elahi Park | C767: 150000 | D767: 300000
A768: =A767+1 -> 71 | B768: Elahi Bukhsh Park | C768: 150000 | D768: 300000
A769: =A768+1 -> 72 | B769: Eisa Nagar | C769: 150000 | D769: 300000
A770: =A769+1 -> 73 | B770: Fazal Park | C770: 150000 | D770: 300000
A771: =A770+1 -> 74 | B771: Fruit Market Badami Bagh | C771: 0 | D771: 1000000
A772: =A771+1 -> 75 | B772: Faisal Park | C772: 150000 | D772: 300000
A773: =A772+1 -> 76 | B773: Fateh Puri | C773: 150000 | D773: 300000
A774: =A773+1 -> 77 | B774: Feroze Colony, Bela Basti Ram | C774: 150000 | D774: 300000
A775: =A774+1 -> 78 | B775: Farrukh Abad | C775: 150000 | D775: 300000
A776: =A775+1 -> 79 | B776: Farooq Gunj | C776: 150000 | D776: 400000
A777: =A776+1 -> 80 | B777: Ghulam Hussain Park | C777: 150000 | D777: 300000
A778: =A777+1 -> 81 | B778: G. T. Road Ravi Bridge to Imamia Colony | C778: 200000 | D778: 400000
A779: =A778+1 -> 82 | B779: Gulistan Town | C779: 150000 | D779: 300000
A780: =A779+1 -> 83 | B780: Grain Market (Badami Bagh) | C780: 0 | D780: 1000000
A781: =A780+1 -> 84 | B781: Hanif Park | C781: 150000 | D781: 300000
A782: =A781+1 -> 85 | B782: Her-Naraom Pura | C782: 150000 | D782: 300000
A783: =A782+1 -> 86 | B783: Hussain Park | C783: 150000 | D783: 300000
A784: =A783+1 -> 87 | B784: Hamad Colony | C784: 150000 | D784: 300000
A785: =A784+1 -> 88 | B785: Ittefaq Colony, Kot Shahab Din | C785: 150000 | D785: 300000
A786: =A785+1 -> 89 | B786: Industrial Area Badami Bagh | C786: 0 | D786: 1000000
A787: =A786+1 -> 90 | B787: Imam Bukhsh Park | C787: 150000 | D787: 300000
A788: =A787+1 -> 91 | B788: Iqbal Park | C788: 150000 | D788: 300000
A789: =A788+1 -> 92 | B789: Jia Musa | C789: 150000 | D789: 300000
A790: =A789+1 -> 93 | B790: Javed Park | C790: 150000 | D790: 300000
A791: =A790+1 -> 94 | B791: Jehangir Park | C791: 150000 | D791: 300000
A792: =A791+1 -> 95 | B792: Jia Musa (Western Side) | C792: 50000 | D792: 200000
A793: =A792+1 -> 96 | B793: Kot Begum | C793: 150000 | D793: 300000
A794: =A793+1 -> 97 | B794: Khokhar Road | C794: 0 | D794: 450000
A795: =A794+1 -> 98 | B795: Kachho Pura | C795: 150000 | D795: 300000
A796: =A795+1 -> 99 | B796: Kala Khatai Road Across the Railawy Line | C796: 150000 | D796: 300000
A797: =A796+1 -> 100 | B797: Kot Mohibbue | C797: 150000 | D797: 300000
A798: =A797+1 -> 101 | B798: Khalid Park | C798: 150000 | D798: 300000
A799: =A798+1 -> 102 | B799: Khokhar | C799: 100000 | D799: 200000
A800: =A799+1 -> 103 | B800: Khurshid Park | C800: 150000 | D800: 300000
A801: =A800+1 -> 104 | B801: Lalazar Colony | C801: 150000 | D801: 300000
A802: =A801+1 -> 105 | B802: Misri Shah | C802: 200000 | D802: 400000
A803: =A802+1 -> 106 | B803: Muhammad Park | C803: 150000 | D803: 300000
A804: =A803+1 -> 107 | B804: Mehr Sooba Park | C804: 150000 | D804: 300000
A805: =A804+1 -> 108 | B805: Mouza Jhugian | C805: 150000 | D805: 300000
A806: =A805+1 -> 109 | B806: Mouza Nain Sukh | C806: 100000 | D806: 250000
A807: =A806+1 -> 110 | B807: Mouza Bhamma | C807: 150000 | D807: 250000
A808: =A807+1 -> 111 | B808: Mehar Park | C808: 150000 | D808: 300000
A809: =A808+1 -> 112 | B809: Nain Sukh (Abadi Deh) | C809: 100000 | D809: 250000
A810: =A809+1 -> 113 | B810: Nawab Colony | C810: 150000 | D810: 300000
A811: =A810+1 -> 114 | B811: Noor Road (Bela Basti Ram) | C811: 0 | D811: 500000
A812: =A811+1 -> 115 | B812: Niaz Pura | C812: 150000 | D812: 300000
A813: =A812+1 -> 116 | B813: Nabi Bukhsh Park | C813: 150000 | D813: 300000
A814: =A813+1 -> 117 | B814: Naseem Park | C814: 150000 | D814: 300000
A815: =A814+1 -> 118 | B815: New Malik Park | C815: 150000 | D815: 300000
A816: =A815+1 -> 119 | B816: Pak Bharat Nagar | C816: 200000 | D816: 400000
A817: =A816+1 -> 120 | B817: Qila Lachman Singh and Adjacent Abadis | C817: 200000 | D817: 400000
A818: =A817+1 -> 121 | B818: Qaiser Town (Shahdara) | C818: 80000 | D818: 300000
A819: =A818+1 -> 122 | B819: Qamar Park | C819: 150000 | D819: 300000
A820: =A819+1 -> 123 | B820: Qaddafi Colony | C820: 150000 | D820: 300000
A821: =A820+1 -> 124 | B821: Ravi Park | C821: 200000 | D821: 400000
A822: =A821+1 -> 125 | B822: Ram Kishan Wala | C822: 150000 | D822: 300000
A823: =A822+1 -> 126 | B823: Ravi Road | C823: 0 | D823: 700000
A824: =A823+1 -> 127 | B824: Rahim Road | C824: 0 | D824: 500000
A825: =A824+1 -> 128 | B825: Saddique/Saddiquia Colony | C825: 150000 | D825: 300000
A826: =A825+1 -> 129 | B826: Sabzi Market Badami Bagh | C826: 0 | D826: 1000000
A827: =A826+1 -> 130 | B827: Sheikhupura Road | C827: 200000 | D827: 400000
A828: =A827+1 -> 131 | B828: Shahdara Adjoining Abadies Ferozewala | C828: 80000 | D828: 300000
A829: =A828+1 -> 132 | B829: Saeed Park | C829: 150000 | D829: 300000
A830: =A829+1 -> 133 | B830: Shahdara Town | C830: 80000 | D830: 300000
A831: =A830+1 -> 134 | B831: Suggian | C831: 150000 | D831: 300000
A832: =A831+1 -> 135 | B832: Suggian Road (Toll Plaza to Nain Sukh Chowk) | C832: 300000 | D832: 300000
A833: =A832+1 -> 136 | B833: Sajjad Park | C833: 150000 | D833: 300000
A834: =A833+1 -> 137 | B834: Sheikh Colony | C834: 150000 | D834: 300000
A835: =A834+1 -> 138 | B835: Shaheen Park | C835: 150000 | D835: 300000
A836: =A835+1 -> 139 | B836: Siraj Din Park | C836: 150000 | D836: 300000
A837: =A836+1 -> 140 | B837: Sharif Park | C837: 150000 | D837: 300000
A838: =A837+1 -> 141 | B838: Siddiq Gunj | C838: 200000 | D838: 400000
A839: =A838+1 -> 142 | B839: Sooter Mandi | C839: 300000 | D839: 800000
A840: =A839+1 -> 143 | B840: Syed Mitha Bazar | C840: 300000 | D840: 800000
A841: =A840+1 -> 144 | B841: Rahim Park | C841: 200000 | D841: 400000
A842: =A841+1 -> 145 | B842: Rahim Road | C842: 0 | D842: 500000
A843: =A842+1 -> 146 | B843: Rustam Colony | C843: 150000 | D843: 300000
A844: =A843+1 -> 147 | B844: Taj Bagh Park | C844: 150000 | D844: 300000
A845: =A844+1 -> 148 | B845: Taj Park | C845: 150000 | D845: 300000
A846: =A845+1 -> 149 | B846: Timber Market | C846: 0 | D846: 800000
A847: =A846+1 -> 150 | B847: Tibba Azam Shah | C847: 150000 | D847: 300000
A848: =A847+1 -> 151 | B848: Tilak Nagar | C848: 150000 | D848: 300000
A849: =A848+1 -> 152 | B849: Truck Stand | C849: 0 | D849: 1000000
A850: =A849+1 -> 153 | B850: Tar Garh | C850: 80000 | D850: 300000
A851: =A850+1 -> 154 | B851: Teezab Ehata | C851: 150000 | D851: 300000
A852: =A851+1 -> 155 | B852: Touheed Park | C852: 150000 | D852: 300000
A853: =A852+1 -> 156 | B853: Wandala Road (Shahdara) | C853: 150000 | D853: 400000
A854: =A853+1 -> 157 | B854: Yahya Colony | C854: 150000 | D854: 300000
A855: =A854+1 -> 158 | B855: Yasrab Colony | C855: 150000 | D855: 300000
A856: =A855+1 -> 159 | B856: Zafar Park | C856: 150000 | D856: 300000
A859: Rates of Cultivable Land falling in Ravi Town, Lahore
A860: S. No. | B860: Name of Locality | C860: Rate Per Acre for External Part of River (Outside the Embankment) | D860: Rate Per Acre for External Part of River (Inside the Embankment)
A861: 1 | B861: Begum Kot | C861: 500000 | D861: 300000
A862: =A861+1 -> 2 | B862: Bhaman | C862: 500000 | D862: 300000
A863: =A862+1 -> 3 | B863: Jhugian | C863: 500000 | D863: 300000
A864: =A863+1 -> 4 | B864: Khokhar | C864: 500000 | D864: 300000
A865: =A864+1 -> 5 | B865: Kala Khatai | C865: 600000 | D865: 400000
A866: =A865+1 -> 6 | B866: Nain Sukh | C866: 700000 | D866: 500000
A867: =A866+1 -> 7 | B867: Saggian Kalan Noor | C867: 500000 | D867: 300000
A868: =A867+1 -> 8 | B868: Shahdara | C868: 600000 | D868: 400000
A871: Samnabad Town, Lahore
A872: S. No. | B872: Name of Locality | C872: Rate Per Marla Residential | D872: Rate Per Marla Commercial
A873: 1 | B873: Araiyn Nagar (Samanabad/Ichhra) | C873: 200000 | D873: 500000
A874: =A873+1 -> 2 | B874: Al-Mumtaz Road | C874: 175000 | D874: 400000
A875: =A874+1 -> 3 | B875: Ali Park Ichhra | C875: 200000 | D875: 600000
A876: =A875+1 -> 4 | B876: Ali Park (Samnabad) | C876: 200000 | D876: 600000
A877: =A876+1 -> 5 | B877: Allama Iqbal Town (Commercial Zone, Moon Market) | C877: 0 | D877: 800000
A878: =A877+1 -> 6 | B878: Allama Iqbal Town (All Blocks) | C878: 200000 | D878: 800000
A879: =A878+1 -> 7 | B879: Al-Hamad Colony Ichhra | C879: 200000 | D879: 500000
A880: =A879+1 -> 8 | B880: Abadi Shah Farid Abad | C880: 200000 | D880: 500000
A881: =A880+1 -> 9 | B881: Al-Putgeen Road (Ichhra) | C881: 200000 | D881: 600000
A882: =A881+1 -> 10 | B882: Bank Colony (Samanabad) | C882: 200000 | D882: 500000
A883: =A882+1 -> 11 | B883: Bhaikhaywal & Adjoining Abadies | C883: 200000 | D883: 500000
A884: =A883+1 -> 12 | B884: Bustami Road | C884: 200000 | D884: 500000
A885: =A884+1 -> 13 | B885: Babu Sabu Abadi & Adjoining Abadies | C885: 150000 | D885: 400000
A886: =A885+1 -> 14 | B886: Babu Sabu (Western) | C886: 50000 | D886: 150000
A887: =A886+1 -> 15 | B887: Bagh Gul Begum | C887: 200000 | D887: 500000
A888: =A887+1 -> 16 | B888: Badarpura (Iqbal Town) | C888: 150000 | D888: 400000
A889: =A888+1 -> 17 | B889: Canal Bank Road falling in Samanabad Town | C889: 300000 | D889: 500000
A890: =A889+1 -> 18 | B890: Chaudhary Colony | C890: 150000 | D890: 500000
A891: =A890+1 -> 19 | B891: Ghazali Road Chowk Chaudhary Colony to 3rd Goal Chakar | C891: 200000 | D891: 600000
A892: =A891+1 -> 20 | B892: Clifton Colony (Ichhra) | C892: 200000 | D892: 500000
A893: =A892+1 -> 21 | B893: Christian Colony (Ichhra) | C893: 200000 | D893: 500000
A894: =A893+1 -> 22 | B894: Commercial Zone Gulshan Ravi Moon Market | C894: 0 | D894: 700000
A895: =A894+1 -> 23 | B895: Chamro Pur (Western Side) | C895: 50000 | D895: 150000
A896: =A895+1 -> 24 | B896: Chaburji Park | C896: 150000 | D896: 400000
A897: =A896+1 -> 25 | B897: New Chaburji Park | C897: 150000 | D897: 400000
A898: =A897+1 -> 26 | B898: Dohatta Colony (Ichhra) | C898: 200000 | D898: 600000
A899: =A898+1 -> 27 | B899: Fateh Sher Road | C899: 200000 | D899: 600000
A900: =A899+1 -> 28 | B900: Ferozepur Road (Mozang Chungi to Shama Chowk) | C900: 0 | D900: 1000000
A901: =A900+1 -> 29 | B901: Ferozepur Road (Shama to Kalma Chowk) | C901: 0 | D901: 1000000
A902: =A901+1 -> 30 | B902: Fruit and Vegitable Mandi, Iqbal Town | C902: 0 | D902: 700000
A903: =A902+1 -> 31 | B903: Farooq-e-Azam Park (Ichhra) | C903: 200000 | D903: 600000
A904: =A903+1 -> 32 | B904: Ghulam Nabi Colony Samnabad/Ichhra | C904: 200000 | D904: 600000
A905: =A904+1 -> 33 | B905: Ghousia Park Ichhra | C905: 200000 | D905: 600000
A906: =A905+1 -> 34 | B906: Gulshan-e-Ravi (All Blocks) | C906: 175000 | D906: 500000
A907: =A906+1 -> 35 | B907: Gulshan-e-Ravi Main Boulevard Road upto Bund Road | C907: 300000 | D907: 600000
A908: =A907+1 -> 36 | B908: Gulshan-e-Ravi Ganda Nala Bund Road (Nonarian Bridge) | C908: 0 | D908: 600000
A909: =A908+1 -> 37 | B909: Hussain Street (Ichhra) | C909: 200000 | D909: 600000
A910: =A909+1 -> 38 | B910: Ichhra Adjoining Abadies | C910: 200000 | D910: 600000
A911: =A910+1 -> 39 | B911: Ichhra Main Bazar | C911: 0 | D911: 800000
A912: =A911+1 -> 40 | B912: Ichhra Road Ichhra | C912: 0 | D912: 800000
A913: =A912+1 -> 41 | B913: Ittehad Colony Samnabad | C913: 200000 | D913: 600000
A914: =A913+1 -> 42 | B914: Ittefaq Town & Extension | C914: 200000 | D914: 800000
A915: =A914+1 -> 43 | B915: Ittehad Colony Multan Road | C915: 175000 | D915: 550000
A916: =A915+1 -> 44 | B916: Inder Nagar (Samnabad) | C916: 200000 | D916: 500000
A917: =A916+1 -> 45 | B917: Islamia Park | C917: 150000 | D917: 350000
A918: =A917+1 -> 46 | B918: Ilyas Colony | C918: 200000 | D918: 500000
A919: =A918+1 -> 47 | B919: Janak Nagar | C919: 200000 | D919: 500000
A920: =A919+1 -> 48 | B920: Jinnah Colony (Samnabad) | C920: 200000 | D920: 500000
A921: =A920+1 -> 49 | B921: Jafaria Colony | C921: 150000 | D921: 350000
A922: =A921+1 -> 50 | B922: Karnal Pura (Ichhra) | C922: 200000 | D922: 500000
A923: =A922+1 -> 51 | B923: Kamobh Colony Ichhra | C923: 200000 | D923: 500000
A924: =A923+1 -> 52 | B924: Karmabad Ichhra | C924: 200000 | D924: 500000
A925: =A924+1 -> 53 | B925: Kacha Ferozepur Road (Adjoining Abadies) | C925: 200000 | D925: 500000
A926: =A925+1 -> 54 | B926: Khuda Bakhsh Road | C926: 200000 | D926: 600000
A927: =A926+1 -> 55 | B927: Muhajirabad (Nawankot) | C927: 150000 | D927: 400000
A928: =A927+1 -> 56 | B928: Muhammad Pura Ichhra | C928: 200000 | D928: 500000
A929: =A928+1 -> 57 | B929: Muslim Colony Samnabad | C929: 200000 | D929: 500000
A930: =A929+1 -> 58 | B930: Millat Road Samnabad | C930: 200000 | D930: 500000
A931: =A930+1 -> 59 | B931: Millat Park | C931: 200000 | D931: 500000
A932: =A931+1 -> 60 | B932: Multan Road Chowk Choburgi to Multan Chungi | C932: 300000 | D932: 500000
A933: =A932+1 -> 61 | B933: Muqaddas Park Nawan Kot | C933: 175000 | D933: 550000
A934: =A933+1 -> 62 | B934: Main Bund Road falling in Samnabad Town | C934: 0 | D934: 500000
A935: =A934+1 -> 63 | B935: Main Bund Road Motorway Chowk to Yateem Khana | C935: 0 | D935: 500000
A936: =A935+1 -> 64 | B936: Muslim Town New & Old & Adjoining Abadies | C936: 300000 | D936: 500000
A937: =A936+1 -> 65 | B937: Main Road Scheme More to Baikhaywal More (Iqbal Town Main Boulevard) | C937: 0 | D937: 1000000
A938: =A937+1 -> 66 | B938: New Samnabad Mouza Mozang and New Mozang | C938: 200000 | D938: 500000
A939: =A938+1 -> 67 | B939: Nawab Pura (Ichhra) | C939: 200000 | D939: 500000
A940: =A939+1 -> 68 | B940: Najaf Colony (Iqbal Town) | C940: 150000 | D940: 400000
A941: =A940+1 -> 69 | B941: Nadeem Shaheed Road (Samnabad) | C941: 200000 | D941: 500000
A942: =A941+1 -> 70 | B942: New Shalimar Town/Colony | C942: 175000 | D942: 550000
A943: =A942+1 -> 71 | B943: Nawan Kot (Adjoining Abadies) | C943: 175000 | D943: 550000
A944: =A943+1 -> 72 | B944: Nonarian | C944: 175000 | D944: 500000
A945: =A944+1 -> 73 | B945: Norarian (Western Side) | C945: 50000 | D945: 150000
A946: =A945+1 -> 74 | B946: Pakki Thathi & Adjoining Abadies | C946: 175000 | D946: 550000
A947: =A946+1 -> 75 | B947: Peer Ghazi Road to Chowk Baba Azam | C947: 200000 | D947: 500000
A948: =A947+1 -> 76 | B948: Poonch Road falling Samnabad Town | C948: 150000 | D948: 350000
A949: =A948+1 -> 77 | B949: Prem Nagar | C949: 150000 | D949: 400000
A950: =A949+1 -> 78 | B950: Rustam Park ( Nawan Kot) | C950: 175000 | D950: 500000
A951: =A950+1 -> 79 | B951: Rasool Park (Samnabad/Ichhra) | C951: 200000 | D951: 500000
A952: =A951+1 -> 80 | B952: Rehmanpura (Ichhra) | C952: 200000 | D952: 500000
A953: =A952+1 -> 81 | B953: Rehmanpura Quarters | C953: 200000 | D953: 500000
A954: =A953+1 -> 82 | B954: Rabbani Road (Samnabad) | C954: 200000 | D954: 500000
A955: =A954+1 -> 83 | B955: Sodiwal & Adjoining Abadies | C955: 175000 | D955: 500000
A956: =A955+1 -> 84 | B956: Sodiwal and its Quarters | C956: 175000 | D956: 500000
A957: =A956+1 -> 85 | B957: Samnabad Main Road Chowk Samnabad to Kubra Masjid | C957: 300000 | D957: 500000
A958: =A957+1 -> 86 | B958: Samnabad (N Block) & Adjoining Abadies | C958: 200000 | D958: 500000
A959: =A958+1 -> 87 | B959: Shah Kamal | C959: 200000 | D959: 500000
A960: =A959+1 -> 88 | B960: Sharif Park (Ichhra) | C960: 200000 | D960: 500000
A961: =A960+1 -> 89 | B961: Shah Farid Abad | C961: 200000 | D961: 500000
A962: =A961+1 -> 90 | B962: Shalimar Road Naunarian (Chappar Stop to Nala | C962: 175000 | D962: 500000
A963: =A962+1 -> 91 | B963: Sham Nagar | C963: 150000 | D963: 400000
A964: =A963+1 -> 92 | B964: Shama Road upto Ferozepur Road | C964: 200000 | D964: 600000
A965: =A964+1 -> 93 | B965: Sanda Western Side | C965: 50000 | D965: 200000
A966: =A965+1 -> 94 | B966: Sanda Kalan/Khurd | C966: 50000 | D966: 200000
A967: =A966+1 -> 95 | B967: Shera Kot & Adjoining Abadies | C967: 150000 | D967: 400000
A968: =A967+1 -> 96 | B968: Shera Kot Western Side | C968: 50000 | D968: 150000
A969: =A968+1 -> 97 | B969: Shera Kot 60 Feet Road | C969: 200000 | D969: 500000
A970: =A969+1 -> 98 | B970: Tariq Colony (Sodiwal) | C970: 175000 | D970: 500000
A971: =A970+1 -> 99 | B971: Touheed Park | C971: 175000 | D971: 500000
A972: =A971+1 -> 100 | B972: Urdu Nagar | C972: 175000 | D972: 500000
A973: =A972+1 -> 101 | B973: Union Park Ichhra | C973: 200000 | D973: 500000
A974: =A973+1 -> 102 | B974: Wahdat Road Muslim Town More to Chungi Multan Road | C974: 300000 | D974: 600000
A975: =A974+1 -> 103 | B975: Zaildar Road | C975: 200000 | D975: 500000
A978: Rates of Cultivable Land falling in Samnabad Town, Lahore
A979: S. No. | B979: Name of Locality | C979: Rate Per Acre for External Part of River (Outside the Embankment) | D979: Rate Per Acre for External Part of River (Inside the Embankment)
A980: 1 | B980: Babu Sabu | C980: 800000 | D980: 600000
A981: =A980+1 -> 2 | B981: Sanda Kalan | C981: 800000 | D981: 600000
A982: =A981+1 -> 3 | B982: Sanda Khurd | C982: 800000 | D982: 600000
A983: =A982+1 -> 4 | B983: Shera Kot | C983: 800000 | D983: 600000
A984: =A983+1 -> 5 | B984: Nonarian | C984: 800000 | D984: 600000
A985: =A984+1 -> 6 | B985: Bhadru | C985: 800000 | D985: 600000
A986: =A985+1 -> 7 | B986: Chamrupur | C986: 800000 | D986: 600000
A989: Shalimar Town, Lahore
A990: S. No. | B990: Name of Locality | C990: Rate Per Marla Residential | D990: Rate Per Marla Commercial
A991: 1 | B991: Angoori Bagh Scheme | C991: 150000 | D991: 250000
A992: =A991+1 -> 2 | B992: Achant Garh | C992: 200000 | D992: 400000
A993: =A992+1 -> 3 | B993: Aamir Road (Shad Bagh) | C993: 0 | D993: 500000
A994: =A993+1 -> 4 | B994: Aziz Road | C994: 200000 | D994: 450000
A995: =A994+1 -> 5 | B995: Akram Road (Chah Miran) | C995: 150000 | D995: 400000
A996: =A995+1 -> 6 | B996: Akbar Road/Mouza Naulakha | C996: 0 | D996: 400000
A997: =A996+1 -> 7 | B997: Boghewal | C997: 75000 | D997: 150000
A998: =A997+1 -> 8 | B998: Baghbanpura New | C998: 100000 | D998: 200000
A999: =A998+1 -> 9 | B999: Baghbanpura | C999: 150000 | D999: 300000
A1000: =A999+1 -> 10 | B1000: Bilal Park | C1000: 150000 | D1000: 300000
A1001: =A1000+1 -> 11 | B1001: Begum Pura | C1001: 150000 | D1001: 300000
A1002: =A1001+1 -> 12 | B1002: Baghat Pura | C1002: 150000 | D1002: 300000
A1003: =A1002+1 -> 13 | B1003: Bela Basti Ram & Adjoining Abadies | C1003: 150000 | D1003: 300000
A1004: =A1003+1 -> 14 | B1004: Bela Basti Ram Inside Rive Bed | C1004: 50000 | D1004: 100000
A1005: =A1004+1 -> 15 | B1005: Bund Road situated at Mauza Kot Khawaja Saeed & Baghbanpura | C1005: 0 | D1005: 500000
A1006: =A1005+1 -> 16 | B1006: Baghanwala & Adjoining Areas | C1006: 150000 | D1006: 300000
A1007: =A1006+1 -> 17 | B1007: Chah Miran (Miran di Khooi) & Adjoining Areas | C1007: 200000 | D1007: 400000
A1008: =A1007+1 -> 18 | B1008: Chah Miran Road | C1008: 200000 | D1008: 500000
A1009: =A1008+1 -> 19 | B1009: Chamra Mandi | C1009: 200000 | D1009: 300000
A1010: =A1009+1 -> 20 | B1010: Faiz Bagh | C1010: 200000 | D1010: 400000
A1011: =A1010+1 -> 21 | B1011: G. T. Road situated in Shalimar Town | C1011: 200000 | D1011: 500000
A1012: =A1011+1 -> 22 | B1012: G. T. Road (Domorial Pull to Schazo Laboratory) | C1012: 200000 | D1012: 500000
A1013: =A1012+1 -> 23 | B1013: G. T. Road (Schazo Laboratory to Pakistan Mint) | C1013: 200000 | D1013: 400000
A1014: =A1013+1 -> 24 | B1014: Gunj | C1014: 150000 | D1014: 300000
A1015: =A1014+1 -> 25 | B1015: Ghoray Shah Road | C1015: 0 | D1015: 350000
A1016: =A1015+1 -> 26 | B1016: Haq Nawaz Road | C1016: 0 | D1016: 400000
A1017: =A1016+1 -> 27 | B1017: Kotli Pir Abdul Rahman | C1017: 100000 | D1017: 150000
A1018: =A1017+1 -> 28 | B1018: Kot Khawaja Saeed & Adjoining Areas | C1018: 100000 | D1018: 300000
A1019: =A1018+1 -> 29 | B1019: Kot Khawaja Saeed (Western Side) | C1019: 50000 | D1019: 100000
A1020: =A1019+1 -> 30 | B1020: Kachu Pura | C1020: 150000 | D1020: 350000
A1021: =A1020+1 -> 31 | B1021: Muhammadi Mohallah (Mouza Chah Miran) | C1021: 200000 | D1021: 400000
A1022: =A1021+1 -> 32 | B1022: Mujahid Abad | C1022: 150000 | D1022: 300000
A1023: =A1022+1 -> 33 | B1023: Makhan Pura | C1023: 150000 | D1023: 300000
A1024: =A1023+1 -> 34 | B1024: New Shad Bagh | C1024: 150000 | D1024: 350000
A1025: =A1024+1 -> 35 | B1025: Naulakha & Adjoining Areas | C1025: 200000 | D1025: 400000
A1026: =A1025+1 -> 36 | B1026: New Wassan Pura & Scheme No. 2 | C1026: 150000 | D1026: 350000
A1027: =A1026+1 -> 37 | B1027: Pak Bharat Nagar | C1027: 200000 | D1027: 400000
A1028: =A1027+1 -> 38 | B1028: Singh Pura | C1028: 150000 | D1028: 300000
A1029: =A1028+1 -> 39 | B1029: Shahowari | C1029: 125000 | D1029: 250000
A1030: =A1029+1 -> 40 | B1030: Shalimar Town Baghbanpura | C1030: 100000 | D1030: 200000
A1031: =A1030+1 -> 41 | B1031: Shalimar Link Road (P. S. Baghbanpura to Shalimar Chowk) | C1031: 0 | D1031: Front 400,000 Read 250,000
A1032: =A1031+1 -> 42 | B1032: Saleem Park (Chah Miran) | C1032: 200000 | D1032: 400000
A1033: =A1032+1 -> 43 | B1033: Shad Bagh | C1033: 150000 | D1033: 350000
A1034: =A1033+1 -> 44 | B1034: Shad Bagh Road | C1034: 200000 | D1034: 400000
A1035: =A1034+1 -> 45 | B1035: Sher Shah Road | C1035: 200000 | D1035: 400000
A1036: =A1035+1 -> 46 | B1036: Sultanpura | C1036: 150000 | D1036: 300000
A1037: =A1036+1 -> 47 | B1037: Sultanpura Road | C1037: 0 | D1037: 350000
A1038: =A1037+1 -> 48 | B1038: Sawami Nagar Naulakha | C1038: 150000 | D1038: 300000
A1039: =A1038+1 -> 49 | B1039: Tezab Ahata | C1039: 150000 | D1039: 300000
A1040: =A1039+1 -> 50 | B1040: Tezab Ahata Road | C1040: 0 | D1040: 350000
A1041: =A1040+1 -> 51 | B1041: Umer Din Road Mauza Bela Basti Ram | C1041: 0 | D1041: 350000
A1042: =A1041+1 -> 52 | B1042: Wassanpura | C1042: 150000 | D1042: 350000
A1045: Wahga Town, Lahore
A1046: S. No. | B1046: Name of Locality | C1046: Rate Per Marla Residential | D1046: Rate Per Marla Commercial
A1047: 1 | B1047: Ahmad Town in Mouza Shadi Pura | C1047: 35000 | D1047: 100000
A1048: =A1047+1 -> 2 | B1048: Devi Pura | C1048: 75000 | D1048: 150000
A1049: =A1048+1 -> 3 | B1049: Darogha Wala | C1049: 75000 | D1049: 150000
A1050: =A1049+1 -> 4 | B1050: Darogha Wala Chowk to Bassi More (Bund Road) | C1050: 75000 | D1050: 350000
A1051: =A1050+1 -> 5 | B1051: Gulshan-e-Shalimar Scheme | C1051: 80000 | D1051: 200000
A1052: =A1051+1 -> 6 | B1052: G. T. Road falling in Wahga Town | C1052: 0 | D1052: 300000
A1053: =A1052+1 -> 7 | B1053: Lidhar | C1053: 60000 | D1053: 125000
A1054: =A1053+1 -> 8 | B1054: Lakho Dair | C1054: 40000 | D1054: 100000
A1055: =A1054+1 -> 9 | B1055: Manawan | C1055: 70000 | D1055: 200000
A1056: =A1055+1 -> 10 | B1056: Mahmood Booti | C1056: 75000 | D1056: 150000
A1057: =A1056+1 -> 11 | B1057: Momanpura | C1057: 60000 | D1057: 150000
A1058: =A1057+1 -> 12 | B1058: Madsoodan Pura | C1058: 75000 | D1058: 150000
A1059: =A1058+1 -> 13 | B1059: New Shalimar Housing Scheme | C1059: 100000 | D1059: 150000
A1060: =A1059+1 -> 14 | B1060: Sultan Mahmood Road | C1060: 100000 | D1060: 200000
A1061: =A1060+1 -> 15 | B1061: Salamat Pura | C1061: 75000 | D1061: 150000
A1062: =A1061+1 -> 16 | B1062: Shadi Pura | C1062: 35000 | D1062: 100000
A1063: =A1062+1 -> 17 | B1063: Qila Khazana | C1063: 50000 | D1063: 150000
A1064: =A1063+1 -> 18 | B1064: Kotli Ghasi | C1064: 50000 | D1064: 100000
A1066: Note:--- Error & omission excepted. Let us know if you find any mistake in Valuation Table.
A1068: Tuesday July 01, 2008
A1070: Reproduced by: M/s. Nasir Law Associates (Jurists' House)
A1071: for the convenience of general public.
A1072: Contact: 0333-4076420 & 0321-4624078
A1074: Back