A1: The Punjab Gazette
A2: PUBLISHED BY AUTHORITY
A4: LAHORE SATURDAY JUNE 28, 2013
A6: OFFICE OF THE DISTRICT COLLECTOR, LAHORE
C8: No. HRC/3935
C9: Dated: 27-06-2013
A11: NOTIFICATION
A13: In exercise of the powers conferred upon me under Section 27-A of the Stamp Act, 1899 as amended, I, Naseem Sadiq, Disctrict Collector, Lahore, do hereby notify the urban valuation table showing assessment of land falling in each locality for computation of ad-valorem Stamp Duty in urban areas of District Lahore. These rates shall be applicable as specified in the schedule herewith. The Notification shall be operative with effect from 01.07.2013.
C16: (NASEEM SADIQ)
C17: District Collector
C18: Lahore
A19: (01)
A21: Valuation Table (City District Government, Lahore)
A22: with effect from July 01, 2013
A23: Last updated
A24: =TODAY() -> 41580
A26: Aziz Bhatti Town, Lahore
A27: S. No. | B27: Name of Locality | C27: Rate Per Marla Residential | D27: Rate Per Marla Commercial
A28: 1 | B28: Al-Faisal Town | C28: 150000 | D28: 375000
A29: =A28+1 -> 2 | B29: Allama Iqbal Road | C29: 310000 | D29: 730000
A30: =A29+1 -> 3 | B30: Ameer-ud-Din Park | C30: 166000 | D30: 325000
A31: =A30+1 -> 4 | B31: Amir Town | C31: 166000 | D31: 325000
A32: =A31+1 -> 5 | B32: Arazi Sehjpaal (Excluding DHA) | C32: 90000 | D32: 155000
A33: =A32+1 -> 6 | B33: Arif Abad (Near Beadon Road) | C33: 80000 | D33: 175000
A34: =A33+1 -> 7 | B34: Bahar Shah Road | C34: 150000 | D34: 310000
A35: =A34+1 -> 8 | B35: Baidian Road, Bhatta Chowk to Office Elite Town | C35: 75000 | D35: 250000
A36: =A35+1 -> 9 | B36: Bedian Road R. A. Bazar to Bhatta Chowk | C36: 170000 | D36: 440000
A37: =A36+1 -> 10 | B37: Bridge Colony | C37: 360000 | D37: 680000
A38: =A37+1 -> 11 | B38: CMA Colony | C38: 300000 | D38: 680000
A39: =A38+1 -> 12 | B39: Canal Bank Road Dharampura Bridge (Both Sides) | C39: 340000 | D39: 500000
A40: =A39+1 -> 13 | B40: Canal Park & New Canal | C40: 175000 | D40: 340000
A41: =A40+1 -> 14 | B41: Cantonment Roads | C41: 415000 | D41: 690000
A42: =A41+1 -> 15 | B42: Chandian | C42: 85000 | D42: 240000
A43: =A42+1 -> 16 | B43: Chung Khurd (LCB) | C43: 170000 | D43: 800000
A44: =A43+1 -> 17 | B44: Devi Pura (UC 43) | C44: 110000 | D44: 215000
A45: =A44+1 -> 18 | B45: Defence Road (Bhatta Chowk to Chungi Mehfooz Pura) | C45: 480000 | D45: 940000
A46: =A45+1 -> 19 | B46: Fateh Garh & Adjoining Areas | C46: 150000 | D46: 225000
A47: =A46+1 -> 20 | B47: Ghazi Abad / Kumharpura | C47: 105000 | D47: 350000
A48: =A47+1 -> 21 | B48: Gohawa & Adjoining Areas | C48: 100000 | D48: 225000
A49: =A48+1 -> 22 | B49: Gul Dasht Town | C49: 215000 | D49: 300000
A50: =A49+1 -> 23 | B50: Gulistan Colony | C50: 170000 | D50: 320000
A51: =A50+1 -> 24 | B51: Gunj | C51: 225000 | D51: 40000
A52: =A51+1 -> 25 | B52: Guru Maangat (LCB) | C52: 250000 | D52: 625000
A53: =A52+1 -> 26 | B53: Herbenspura | C53: 100000 | D53: 220000
A54: =A53+1 -> 27 | B54: Infantry Road | C54: 277000 | D54: 450000
A55: =A54+1 -> 28 | B55: Jhuggian Alfa | C55: 100000 | D55: 190000
A56: =A55+1 -> 29 | B56: Joray Bridge to Harbansepura Bridge | C56: 140000 | D56: 550000
A57: =A56+1 -> 30 | B57: Kohaar & Adjoining Areas | C57: 111000 | D57: 335000
A58: =A57+1 -> 31 | B58: Kotli Pir Abdul Rahman | C58: 165000 | D58: 280000
A59: =A58+1 -> 32 | B59: Lidhar & Adjoining Areas | C59: 135000 | D59: 240000
A60: =A59+1 -> 33 | B60: Malik Pur | C60: 110000 | D60: 290000
A61: =A60+1 -> 34 | B61: Mian Meer | C61: 240000 | D61: 480000
A62: =A61+1 -> 35 | B62: Mugharpura | C62: 220000 | D62: 375000
A63: =A62+1 -> 36 | B63: Mustafa Abad | C63: 220000 | D63: 375000
A64: =A63+1 -> 37 | B64: Mustafa Abad (Dharampura) Main Bazar | C64: 0 | D64: 450000
A65: =A64+1 -> 38 | B65: Nadir Abad (Sehajpal) | C65: 140000 | D65: 285000
A66: =A65+1 -> 39 | B66: Nizam Abad Harbanspura | C66: 135000 | D66: 310000
A67: =A66+1 -> 40 | B67: Noor Pur Kambohan (Mustafaabad) | C67: 245000 | D67: 385000
A68: =A67+1 -> 41 | B68: Officer Colony Ghazi Abad Road | C68: 310000 | D68: 560000
A69: =A68+1 -> 42 | B69: Rasheed Pura | C69: 165000 | D69: 400000
A70: =A69+1 -> 43 | B70: Sadar Bazar | C70: 250000 | D70: 625000
A71: =A70+1 -> 44 | B71: Sadar Bazar to Chungi Mahfoozpura | C71: 310000 | D71: 500000
A72: =A71+1 -> 45 | B72: Sahowari | C72: 210000 | D72: 365000
A73: =A72+1 -> 46 | B73: Saint John Park | C73: 270000 | D73: 690000
A74: =A73+1 -> 47 | B74: Salli Town | C74: 200000 | D74: 325000
A75: =A74+1 -> 48 | B75: Sehjpal & Adjoining Areas | C75: 140000 | D75: 275000
A76: =A75+1 -> 49 | B76: Shalimar Link Road Canal to PS Mughalpura Main | C76: 430000 | D76: 620000
A77: =A76+1 -> 50 | B77: Shiv Pura | C77: 110000 | D77: 275000
A78: =A77+1 -> 51 | B78: Taj Bagh Housing Scheme | C78: 165000 | D78: 325000
A79: =A78+1 -> 52 | B79: Taj Pura | C79: 125000 | D79: 250000
A80: =A79+1 -> 53 | B80: Taj Pura Housing Scheme | C80: 245000 | D80: 440000
A83: Data Gunj Bakhsh Town, Lahore
A84: S. No. | B84: Name of Locality | C84: Rate Per Marla Residential | D84: Rate Per Marla Commercial
A85: 1 | B85: Aabkari Road | C85: 0 | D85: 970000
A86: =A85+1 -> 2 | B86: Abbott Road | C86: 0 | D86: 1235000
A87: =A86+1 -> 3 | B87: Abdali Road | C87: 215000 | D87: 680000
A88: =A87+1 -> 4 | B88: Abdul Kareem Road (Qila Gujjar Singh) | C88: 310000 | D88: 860000
A89: =A88+1 -> 5 | B89: Afzal Road Sanda (Revenue Estate Nawan Kot) | C89: 215000 | D89: 510000
A90: =A89+1 -> 6 | B90: Aibak Road | C90: 0 | D90: 835000
A91: =A90+1 -> 7 | B91: Al-Fazal Park Sanda (Revenue Estate Nawan Kot) | C91: 215000 | D91: 510000
A92: =A91+1 -> 8 | B92: Ameer/Amir Road (Bilal Ganj) | C92: 215000 | D92: 680000
A93: =A92+1 -> 9 | B93: Anarkali (New) | C93: 0 | D93: 1880000
A94: =A93+1 -> 10 | B94: Anarkali (Old) | C94: 300000 | D94: 835000
A95: =A94+1 -> 11 | B95: Ansari Road | C95: 215000 | D95: 450000
A96: =A95+1 -> 12 | B96: Ashrafia Colony Shadman | C96: 300000 | D96: 620000
A97: =A96+1 -> 13 | B97: Bagh Gul Begum | C97: 245000 | D97: 510000
A98: =A97+1 -> 14 | B98: Bagh Munshi Ladha | C98: 200000 | D98: 480000
A99: =A98+1 -> 15 | B99: Bahawalpur Road | C99: 245000 | D99: 780000
A100: =A99+1 -> 16 | B100: Bank Square | C100: 0 | D100: 1880000
A101: =A100+1 -> 17 | B101: Beadon Road | C101: 0 | D101: 1880000
A102: =A101+1 -> 18 | B102: Beadon Road (Streets) | C102: 480000 | D102: 670000
A103: =A102+1 -> 19 | B103: Begum Road | C103: 245000 | D103: 565000
A104: =A103+1 -> 20 | B104: Bilal Ganj & Adjoining Abadies | C104: 245000 | D104: 620000
A105: =A104+1 -> 21 | B105: Bilal Ganj (Kabari Market) | C105: 0 | D105: 670000
A106: =A105+1 -> 22 | B106: Bird Wood Road | C106: 0 | D106: 565000
A107: =A106+1 -> 23 | B107: Bull Road | C107: 0 | D107: 670000
A108: =A107+1 -> 24 | B108: Bund Paar (Western Side) | C108: 75000 | D108: 270000
A109: =A108+1 -> 25 | B109: Bund Road Sagian to Tol Plaza | C109: 200000 | D109: 485000
A110: =A109+1 -> 26 | B110: Canal Bank Road Both Sides falling in DGBT | C110: 450000 | D110: 840000
A111: =A110+1 -> 27 | B111: Captain Jamal Road | C111: 250000 | D111: 670000
A112: =A111+1 -> 28 | B112: Chak Jia Musa | C112: 245000 | D112: 540000
A113: =A112+1 -> 29 | B113: Chak Jia Musa Bund Par | C113: 90000 | D113: 280000
A114: =A113+1 -> 30 | B114: Chak kot Begum Bund Par | C114: 90000 | D114: 280000
A115: =A114+1 -> 31 | B115: Chamberlane Road | C115: 0 | D115: 780000
A116: =A115+1 -> 32 | B116: Chatter Jee Road | C116: 0 | D116: 835000
A117: =A116+1 -> 33 | B117: Chohan Park | C117: 200000 | D117: 510000
A118: =A117+1 -> 34 | B118: Chohan Park Road | C118: 0 | D118: 510000
A119: =A118+1 -> 35 | B119: Chuburji Chowk | C119: 0 | D119: 970000
A120: =A119+1 -> 36 | B120: Chuburji Park | C120: 220000 | D120: 540000
A121: =A120+1 -> 37 | B121: Chuburji Park (New) | C121: 220000 | D121: 540000
A122: =A121+1 -> 38 | B122: Church Road | C122: 0 | D122: 620000
A123: =A122+1 -> 39 | B123: Circular Road | C123: 0 | D123: 1400000
A124: =A123+1 -> 40 | B124: Cooper Road | C124: 0 | D124: 1235000
A125: =A124+1 -> 41 | B125: Court Road | C125: 300000 | D125: 890000
A126: =A125+1 -> 42 | B126: Court Street | C126: 0 | D126: 620000
A127: =A126+1 -> 43 | B127: Dahni Ram Road | C127: 510000 | D127: 1670000
A128: =A127+1 -> 44 | B128: Danpur Lane | C128: 350000 | D128: 780000
A129: =A128+1 -> 45 | B129: Data Gunj Bukhsh Road | C129: 295000 | D129: 620000
A130: =A129+1 -> 46 | B130: Davis Road | C130: 0 | D130: 1500000
A131: =A130+1 -> 47 | B131: Davis Road Backside | C131: 0 | D131: 1350000
A132: =A131+1 -> 48 | B132: Davis Road Streets | C132: 280000 | D132: 620000
A133: =A132+1 -> 49 | B133: Davrend Road | C133: 310000 | D133: 835000
A134: =A133+1 -> 50 | B134: Devesmaj Road | C134: 200000 | D134: 540000
A135: =A134+1 -> 51 | B135: Dhoop Sari | C135: 190000 | D135: 540000
A136: =A135+1 -> 52 | B136: Dil Muhammad Road | C136: 380000 | D136: 780000
A137: =A136+1 -> 53 | B137: Dil Kusha Road | C137: 215000 | D137: 450000
A138: =A137+1 -> 54 | B138: Dhobi Mandi | C138: 215000 | D138: 565000
A139: =A138+1 -> 55 | B139: Egerton Road Back | C139: 0 | D139: 1360000
A140: =A139+1 -> 56 | B140: Egerton Road Front | C140: 0 | D140: 2050000
A141: =A140+1 -> 57 | B141: Edward Road | C141: 540000 | D141: 835000
A142: =A141+1 -> 58 | B142: Empress Road Back | C142: 510000 | D142: 1560000
A143: =A142+1 -> 59 | B143: Empress Road Front | C143: 510000 | D143: 2050000
A144: =A143+1 -> 60 | B144: Fane Road | C144: 0 | D144: 680000
A145: =A144+1 -> 61 | B145: Farid Kot Road | C145: 540000 | D145: 810000
A146: =A145+1 -> 62 | B146: Farid Kot Streets | C146: 275000 | D146: 620000
A147: =A146+1 -> 63 | B147: Fateh Sher Road | C147: 275000 | D147: 780000
A148: =A147+1 -> 64 | B148: Fazlia Colony | C148: 275000 | D148: 680000
A149: =A148+1 -> 65 | B149: Ferozepur Road (Kacha) | C149: 275000 | D149: 680000
A150: =A149+1 -> 66 | B150: Ferozepur Road (Mozang Chungi to Shama Chowk) | C150: 0 | D150: 1480000
A151: =A150+1 -> 67 | B151: Ferozepur Road (Shama Chowk to Canal Bank) | C151: 0 | D151: 1480000
A152: =A151+1 -> 68 | B152: Firdous Park | C152: 215000 | D152: 510000
A153: =A152+1 -> 69 | B153: Fleming Road | C153: 345000 | D153: 810000
A154: =A153+1 -> 70 | B154: Ghanpat Road | C154: 305000 | D154: 1075000
A155: =A154+1 -> 71 | B155: Gillani Park Near Bilal Gunj | C155: 215000 | D155: 565000
A156: =A155+1 -> 72 | B156: Golding Road | C156: 350000 | D156: 620000
A157: =A156+1 -> 73 | B157: Golf Road | C157: 0 | D157: 780000
A158: =A157+1 -> 74 | B158: Gowal Mandi | C158: 265000 | D158: 780000
A159: =A158+1 -> 75 | B159: Gulshan-e-Ravi | C159: 295000 | D159: 680000
A160: =A159+1 -> 76 | B160: Gunja Kala & Adjoining Abadies | C160: 200000 | D160: 485000
A161: =A160+1 -> 77 | B161: Gunja Kalan (Western Side) | C161: 65000 | D161: 250000
A162: =A161+1 -> 78 | B162: Habib Gunj | C162: 200000 | D162: 540000
A163: =A162+1 -> 79 | B163: Hall Road | C163: 850000 | D163: 2200000
A164: =A163+1 -> 80 | B164: Hospital Road | C164: 0 | D164: 680000
A165: =A164+1 -> 81 | B165: Hussain Street (Ichhra) | C165: 0 | D165: 750000
A166: =A165+1 -> 82 | B166: Ibrahim Road | C166: 215000 | D166: 570000
A167: =A166+1 -> 83 | B167: Ichhra & Adjoining Abadies | C167: 300000 | D167: 780000
A168: =A167+1 -> 84 | B168: Islam Ganj (near Bilal Ganj) | C168: 200000 | D168: 540000
A169: =A168+1 -> 85 | B169: Islam Ganj (Poonch Road) | C169: 215000 | D169: 510000
A170: =A169+1 -> 86 | B170: Islam Pura | C170: 215000 | D170: 670000
A171: =A170+1 -> 87 | B171: Ittefaq Colony Sanda | C171: 215000 | D171: 510000
A172: =A171+1 -> 88 | B172: Jail Road | C172: 0 | D172: 1935000
A173: =A172+1 -> 89 | B173: Jail Road (Kacha) | C173: 460000 | D173: 1130000
A174: =A173+1 -> 90 | B174: Jail Road Adjoing Abadies | C174: 380000 | D174: 910000
A175: =A174+1 -> 91 | B175: Jia Musa falling in DGB Town | C175: 215000 | D175: 410000
A176: =A175+1 -> 92 | B176: Joy Shah | C176: 200000 | D176: 485000
A177: =A176+1 -> 93 | B177: Kachery Road | C177: 400000 | D177: 915000
A178: =A177+1 -> 94 | B178: Kamal Ganj near Bilal Ganj | C178: 200000 | D178: 540000
A179: =A178+1 -> 95 | B179: Karim Park | C179: 200000 | D179: 485000
A180: =A179+1 -> 96 | B180: Kashmir Road Back | C180: 0 | D180: 1130000
A181: =A180+1 -> 97 | B181: Kashmir Road Front | C181: 0 | D181: 1560000
A182: =A181+1 -> 98 | B182: Kasur Pura | C182: 200000 | D182: 485000
A183: =A182+1 -> 99 | B183: Lahore Road | C183: 280000 | D183: 670000
A184: =A183+1 -> 100 | B184: Lake Road | C184: 370000 | D184: 835000
A185: =A184+1 -> 101 | B185: Landa Bazar | C185: 0 | D185: 1130000
A186: =A185+1 -> 102 | B186: Landa Bazar and Adjoining Abadies | C186: 300000 | D186: 1130000
A187: =A186+1 -> 103 | B187: Lawrence Road | C187: 375000 | D187: 835000
A188: =A187+1 -> 104 | B188: Lower Mall | C188: 400000 | D188: 870000
A189: =A188+1 -> 105 | B189: Lytton Road | C189: 375000 | D189: 1130000
A190: =A189+1 -> 106 | B190: Maclagon Road | C190: 0 | D190: 810000
A191: =A190+1 -> 107 | B191: McLeod Road | C191: 0 | D191: 1450000
A192: =A191+1 -> 108 | B192: Main Bund Road (Both Sides) | C192: 0 | D192: 725000
A193: =A192+1 -> 109 | B193: Mozang | C193: 270000 | D193: 835000
A194: =A193+1 -> 110 | B194: Mali Pura | C194: 270000 | D194: 485000
A195: =A194+1 -> 111 | B195: Mall Road (PMG Chowk to Canal) | C195: 0 | D195: 2680000
A196: =A195+1 -> 112 | B196: Manzoor Park and Adjoining Abadies | C196: 200000 | D196: 485000
A197: =A196+1 -> 113 | B197: Masson Road | C197: 480000 | D197: 835000
A198: =A197+1 -> 114 | B198: Mella Ram Road (Bhati Gate) | C198: 350000 | D198: 725000
A199: =A198+1 -> 115 | B199: Misson Road | C199: 400000 | D199: 1130000
A200: =A199+1 -> 116 | B200: Mohallah Dar-ul-Shakooh (Landa Bazar) | C200: 0 | D200: 1775000
A201: =A200+1 -> 117 | B201: Montogomery Road | C201: 0 | D201: 1775000
A202: =A201+1 -> 118 | B202: Mozang New | C202: 270000 | D202: 835000
A203: =A202+1 -> 119 | B203: Mozang Road | C203: 370000 | D203: 835000
A204: =A203+1 -> 120 | B204: Muhammadi Park | C204: 200000 | D204: 485000
A205: =A204+1 -> 121 | B205: Multan Road (Chowk Chuburgi to Yateem Khana) | C205: 375000 | D205: 725000
A206: =A205+1 -> 122 | B206: Mullidhar Road | C206: 270000 | D206: 725000
A207: =A206+1 -> 123 | B207: Nabha Road | C207: 0 | D207: 1075000
A208: =A207+1 -> 124 | B208: Nadeem Park Sanda | C208: 200000 | D208: 540000
A209: =A208+1 -> 125 | B209: Napier Road | C209: 0 | D209: 620000
A210: =A209+1 -> 126 | B210: Naseer-ud-Din Road | C210: 270000 | D210: 670000
A211: =A210+1 -> 127 | B211: National Park/Town Sanda | C211: 200000 | D211: 620000
A212: =A211+1 -> 128 | B212: Naulakha & Adjoining Abadies | C212: 270000 | D212: 835000
A213: =A212+1 -> 129 | B213: Naulakha Bazar | C213: 0 | D213: 1130000
A214: =A213+1 -> 130 | B214: Nawan Kot | C214: 250000 | D214: 570000
A215: =A214+1 -> 131 | B215: Nichlson Road | C215: 430000 | D215: 1130000
A216: =A215+1 -> 132 | B216: Nichlson Road Street | C216: 270000 | D216: 725000
A217: =A216+1 -> 133 | B217: Nila Gumbad | C217: 0 | D217: 1450000
A218: =A217+1 -> 134 | B218: Nisbat Road | C218: 0 | D218: 835000
A219: =A218+1 -> 135 | B219: Nishter Road (Both Sides) | C219: 0 | D219: 2415000
A220: =A219+1 -> 136 | B220: Outfall Road | C220: 200000 | D220: 670000
A221: =A220+1 -> 137 | B221: Paisa Akhbar Anarkali | C221: 0 | D221: 725000
A222: =A221+1 -> 138 | B222: Panj Mahal Road (Shish Mahal) | C222: 400000 | D222: 725000
A223: =A222+1 -> 139 | B223: Parem Nagar Mauza Raj Garh | C223: 200000 | D223: 540000
A224: =A223+1 -> 140 | B224: Patiala Ground | C224: 430000 | D224: 1180000
A225: =A224+1 -> 141 | B225: Punch Road Chuburji to Ganda Nala | C225: 250000 | D225: 725000
A226: =A225+1 -> 142 | B226: Qadir Colony Sanda | C226: 215000 | D226: 485000
A227: =A226+1 -> 143 | B227: Qazalbash Road | C227: 0 | D227: 830000
A228: =A227+1 -> 144 | B228: Qila Gujjar Singh & Adjoining Abadies | C228: 295000 | D228: 860000
A229: =A228+1 -> 145 | B229: Qila Hakeeman | C229: 200000 | D229: 485000
A230: =A229+1 -> 146 | B230: Queen's Road | C230: 430000 | D230: 1610000
A231: =A230+1 -> 147 | B231: Race Course Road | C231: 0 | D231: 1130000
A232: =A231+1 -> 148 | B232: Railway Road | C232: 400000 | D232: 835000
A233: =A232+1 -> 149 | B233: Raj Garh & Adjoining Abadies | C233: 215000 | D233: 620000
A234: =A233+1 -> 150 | B234: Rajgarh Road (Old Raifal Range) | C234: 215000 | D234: 620000
A235: =A234+1 -> 151 | B235: Raj Garh Road | C235: 300000 | D235: 725000
A236: =A235+1 -> 152 | B236: Rajgarh Main Bazar | C236: 0 | D236: 725000
A237: =A236+1 -> 153 | B237: Ratan Chand Road | C237: 380000 | D237: 725000
A238: =A237+1 -> 154 | B238: Rati Gun Road | C238: 250000 | D238: 620000
A239: =A238+1 -> 155 | B239: Ravi Colony | C239: 270000 | D239: 670000
A240: =A239+1 -> 156 | B240: Ravi Road | C240: 0 | D240: 1075000
A241: =A240+1 -> 157 | B241: Ravi Road (Kacha) | C241: 215000 | D241: 620000
A242: =A241+1 -> 158 | B242: Rehman (Streets) | C242: 430000 | D242: 1290000
A243: =A242+1 -> 159 | B243: Rewaz Garden | C243: 380000 | D243: 835000
A244: =A243+1 -> 160 | B244: Rebert Road | C244: 350000 | D244: 620000
A245: =A244+1 -> 161 | B245: Royal Park | C245: 0 | D245: 830000
A246: =A245+1 -> 162 | B246: Saadi Park (Mozang) | C246: 250000 | D246: 620000
A247: =A246+1 -> 163 | B247: Sanda Kalan & Adjoining Abadies | C247: 215000 | D247: 570000
A248: =A247+1 -> 164 | B248: Sanda Khurd & Adjoining Abadies | C248: 215000 | D248: 430000
A249: =A248+1 -> 165 | B249: Sanda Khurd / Kalan (Western Side Across Bund) | C249: 80000 | D249: 295000
A250: =A249+1 -> 166 | B250: Sanda Road | C250: 0 | D250: 725000
A251: =A250+1 -> 167 | B251: Sanat Nagar | C251: 215000 | D251: 485000
A252: =A251+1 -> 168 | B252: Saray Sultan | C252: 270000 | D252: 620000
A253: =A252+1 -> 169 | B253: Shadman | C253: 430000 | D253: 1290000
A254: =A253+1 -> 170 | B254: Shafique Abad | C254: 215000 | D254: 485000
A255: =A254+1 -> 171 | B255: Shah Jamal & Adjoining Abadies | C255: 328000 | D255: 835000
A256: =A255+1 -> 172 | B256: Sham Nagar | C256: 215000 | D256: 620000
A257: =A256+1 -> 173 | B257: Shamas Nagar | C257: 215000 | D257: 540000
A258: =A257+1 -> 174 | B258: Shamas Qadri GOR GOR Patiala House & Adjoining Abadies | C258: 270000 | D258: 620000
A259: =A258+1 -> 175 | B259: Sheesh Mahal (Mouza) | C259: 200000 | D259: 485000
A260: =A259+1 -> 176 | B260: Shishmahal Road | C260: 280000 | D260: 725000
A261: =A260+1 -> 177 | B261: Shera Kot | C261: 215000 | D261: 540000
A262: =A261+1 -> 178 | B262: Shera Kot Western Side Across Bund | C262: 80000 | D262: 270000
A263: =A262+1 -> 179 | B263: Tegoor Park | C263: 350000 | D263: 835000
A264: =A263+1 -> 180 | B264: Temple Road | C264: 450000 | D264: 835000
A265: =A264+1 -> 181 | B265: Thorton Road | C265: 0 | D265: 620000
A266: =A265+1 -> 182 | B266: Turner Road | C266: 0 | D266: 725000
A267: =A266+1 -> 183 | B267: Urdu Bazar | C267: 700000 | D267: 1340000
A268: =A267+1 -> 184 | B268: Usman Gunj (Bilal Gunj) | C268: 215000 | D268: 540000
A269: =A268+1 -> 185 | B269: Waris Road | C269: 450000 | D269: 1130000
A270: =A269+1 -> 186 | B270: Zaildar Park & Adjoining Abadies | C270: 350000 | D270: 835000
A273: Rates of Cultivable Land falling in Data Gunj Bakhsh Town, Lahore
A274: S. No. | B274: Name of Locality | C274: Rate Per Acre for External Part of River (Out Side the Embankment) | D274: Rate Per Acre for External Part of River (Inside the Embankment)
A275: 1 | B275: Babu Sabu | C275: 1330000 | D275: 925000
A276: =A275+1 -> 2 | B276: Sanda Kalan | C276: 1330000 | D276: 925000
A277: =A276+1 -> 3 | B277: Sanda Khurd | C277: 1330000 | D277: 925000
A278: =A277+1 -> 4 | B278: Shera Kot | C278: 1330000 | D278: 925000
A283: Gulberg Town, Lahore
A284: S. No. | B284: Name of Locality | C284: Rate Per Marla Residential | D284: Rate Per Marla Commercial
A285: 1 | B285: Aitchison College Road / Sundar Das Road | C285: 200000 | D285: 400000
A286: =A285+1 -> 2 | B286: Achant Gharh | C286: 200000 | D286: 400000
A287: =A286+1 -> 3 | B287: Egerton Road Front | C287: 200000 | D287: 400000
A288: =A287+1 -> 4 | B288: Egerton Road Off | C288: 0 | D288: 1500000
A289: =A288+1 -> 5 | B289: Allama Iqbal Road | C289: 0 | D289: 1000000
A290: =A289+1 -> 6 | B290: Empress Road Front | C290: 200000 | D290: 500000
A291: =A290+1 -> 7 | B291: Empress Road Off | C291: 350000 | D291: 1500000
A292: =A291+1 -> 8 | B292: Aziz Avenue Gulberg | C292: 350000 | D292: 1200000
A293: =A292+1 -> 9 | B293: Bahar Colony (Kot Lakhpat) | C293: 0 | D293: 400000
A294: =A293+1 -> 10 | B294: Basti Saiden Shah | C294: 100000 | D294: 500000
A295: =A294+1 -> 11 | B295: Bibi Pak Daman (Ghan Shahu) | C295: 200000 | D295: 500000
A296: =A295+1 -> 12 | B296: Bhabra (Abadi) | C296: 150000 | D296: 450000
A297: =A296+1 -> 13 | B297: Canal Bank Road Both Side situated in Gulberg Town | C297: 200000 | D297: 500000
A298: =A297+1 -> 14 | B298: Canal Park (Gulberg) | C298: 300000 | D298: 600000
A299: =A298+1 -> 15 | B299: Canal Bank Road Both Side Ichhra Bridge to Doctors Hospital | C299: 200000 | D299: 450000
A300: =A299+1 -> 16 | B300: Ferozepur Road (Shama to Kahna Chowk) Both sides situated in Gulberg Town | C300: 300000 | D300: 700000
A301: =A300+1 -> 17 | B301: Dars Road | C301: 0 | D301: 1000000
A302: =A301+1 -> 18 | B302: Dars Bary Mian | C302: 100000 | D302: 300000
A303: =A302+1 -> 19 | B303: Davis Road | C303: 100000 | D303: 300000
A304: =A303+1 -> 20 | B304: Faisal Town | C304: 0 | D304: 1000000
A305: =A304+1 -> 21 | B305: Faisal Town Main Boulevard | C305: 300000 | D305: 600000
A306: =A305+1 -> 22 | B306: Fruit Market Kot-Lakhpat | C306: 0 | D306: 700000
A307: =A306+1 -> 23 | B307: Ferozepur Road (Kalma Chowk to Kot-Lakhpat Phattak) | C307: 0 | D307: 600000
A308: =A307+1 -> 24 | B308: Garden Town Civic Center | C308: 350000 | D308: 800000
A309: =A308+1 -> 25 | B309: Garden Town Blocks | C309: 0 | D309: 1000000
A310: =A309+1 -> 26 | B310: Garden Town Main Boulevard (Kalma Chowk to Y Junction) | C310: 200000 | D310: 800000
A311: =A310+1 -> 27 | B311: Garden Town (Barket Market) | C311: 200000 | D311: 800000
A312: =A311+1 -> 28 | B312: Garden Town (Khalid Market) | C312: 0 | D312: 1000000
A313: =A312+1 -> 29 | B313: Government Employees' Cooperative Housing Society (Model Town Link Road) | C313: 0 | D313: 800000
A314: =A313+1 -> 30 | B314: Gulberg M. M. Alam Road | C314: 200000 | D314: 600000
A315: =A314+1 -> 31 | B315: Gulberg Main Boulevard | C315: 200000 | D315: 600000
A316: =A315+1 -> 32 | B316: Gulberg I-II-III-IV-V | C316: 500000 | D316: 1500000
A317: =A316+1 -> 33 | B317: Gulberg Roads | C317: 300000 | D317: 1000000
A318: =A317+1 -> 34 | B318: Gulberg Stadium Road | C318: 100000 | D318: 1000000
A319: =A318+1 -> 35 | B319: Gulberg Liberty Market | C319: 300000 | D319: 1000000
A320: =A319+1 -> 36 | B320: Gulberg Main Market | C320: 0 | D320: 2000000
A321: =A320+1 -> 37 | B321: Gulberg Firdous Market | C321: 0 | D321: 1200000
A322: =A321+1 -> 38 | B322: Gulberg Zahoor Elahi Road | C322: 0 | D322: 1000000
A323: =A322+1 -> 39 | B323: Gopal Nagar | C323: 300000 | D323: 1000000
A324: =A323+1 -> 40 | B324: Ghalib Market (Gulberg) | C324: 150000 | D324: 500000
A325: =A324+1 -> 41 | B325: Gandhi Park (Gulberg) | C325: 0 | D325: 1000000
A326: =A325+1 -> 42 | B326: Gurumanget | C326: 200000 | D326: 700000
A327: =A326+1 -> 43 | B327: Gurumanget Road | C327: 125000 | D327: 400000
A328: =A327+1 -> 44 | B328: Gulberg Industrial Area | C328: 0 | D328: 700000
A329: =A328+1 -> 45 | B329: Ghari Shahu | C329: 0 | D329: 400000
A330: =A329+1 -> 46 | B330: G. T. Road falling in Gulberg Town | C330: 200000 | D330: 500000
A331: =A330+1 -> 47 | B331: Habib Ullah Road | C331: 200000 | D331: 400000
A332: =A331+1 -> 48 | B332: Jail Road | C332: 200000 | D332: 400000
A333: =A332+1 -> 49 | B333: Kot-Lakhpat Industrial Area | C333: 0 | D333: 1500000
A334: =A333+1 -> 50 | B334: Kot-Lakhpat | C334: 0 | D334: 350000
A335: =A334+1 -> 51 | B335: Liqat Abad Main Bazar | C335: 150000 | D335: 300000
A336: =A335+1 -> 52 | B336: Liqat Abad | C336: 0 | D336: 300000
A337: =A336+1 -> 53 | B337: Maulana Shaukat Ali Road | C337: 100000 | D337: 200000
A338: =A337+1 -> 54 | B338: Mian Mir | C338: 0 | D338: 600000
A339: =A338+1 -> 55 | B339: Muhammad Nagar | C339: 200000 | D339: 500000
A340: =A339+1 -> 56 | B340: Mumtaz Street Ghari Shahu | C340: 200000 | D340: 500000
A341: =A340+1 -> 57 | B341: Makkah Colony (Gulberg) | C341: 200000 | D341: 500000
A342: =A341+1 -> 58 | B342: Model Town Link Road | C342: 150000 | D342: 450000
A343: =A342+1 -> 59 | B343: Model Town Old | C343: 0 | D343: 1500000
A344: =A343+1 -> 60 | B344: Model Town Extension | C344: 200000 | D344: 600000
A345: =A344+1 -> 61 | B345: Model Town Extension LDA Flats | C345: 150000 | D345: 500000
A346: =A345+1 -> 62 | B346: Mughalpura Road | C346: 150000 | D346: 400000
A347: =A346+1 -> 63 | B347: Niclson Road | C347: 150000 | D347: 300000
A348: =A347+1 -> 64 | B348: Nabi Pura (Gulberg) | C348: 300000 | D348: 800000
A349: =A348+1 -> 65 | B349: Nawaz Sharif Colony (Near Model Town Courts) | C349: 100000 | D349: 500000
A350: =A349+1 -> 66 | B350: Pindi Rajputan | C350: 100000 | D350: 300000
A351: =A350+1 -> 67 | B351: PECO Road (Phatak to Akbar Chowk) | C351: 150000 | D351: 300000
A352: =A351+1 -> 68 | B352: Qila Gujjar Singh | C352: 0 | D352: 500000
A353: =A352+1 -> 69 | B353: Qazilbash Road | C353: 200000 | D353: 500000
A354: =A353+1 -> 70 | B354: Scotch Corner | C354: 0 | D354: 400000
A355: =A354+1 -> 71 | B355: Sahowari | C355: 200000 | D355: 500000
A356: =A355+1 -> 72 | B356: Shabbir Usmani Road from Y Junction to Moulana Shaukat Ali Road | C356: 125000 | D356: 250000
A357: =A356+1 -> 73 | B357: They Zaildaran Gulberg | C357: 0 | D357: 600000
A358: =A357+1 -> 74 | B358: Upper Mall Scheme | C358: 200000 | D358: 700000
A359: =A358+1 -> 75 | B359: Upper Mall Road | C359: 300000 | D359: 800000
A360: =A359+1 -> 76 | B360: Wazir Ali Road | C360: 300000 | D360: 800000
A361: =A360+1 -> 77 | B361: Zafar Ali Road | C361: 0 | D361: 500000
A362: =A361+1 -> 78 | B362: Zaman Park | C362: 400000 | D362: 1000000
A363: =A362+1 -> 79 | B363: Zaildar Park (Ichhra) | C363: 250000 | D363: 600000
C364: 200000 | D364: 600000
A366: Allama Iqbal Town, Lahore
A367: S. No. | B367: Name of Locality | C367: Rate Per Marla Residential | D367: Rate Per Marla Commercial
A368: 1 | B368: Abadalian co-operative Society | C368: 250000 | D368: 475000
A369: =A368+1 -> 2 | B369: Abadi Moosla/Mouza Moosla | C369: 90000 | D369: 210000
A370: =A369+1 -> 3 | B370: Abid Garden Abadi Musala | C370: 160000 | D370: 365000
A371: =A370+1 -> 4 | B371: Adjoining Canal Bank All Societies Mouza Kanjran | C371: 260000 | D371: 560000
A372: =A371+1 -> 5 | B372: Adjoining Canal Bank All Societies in Shahpur Khanpur | C372: 215000 | D372: 500000
A373: =A372+1 -> 6 | B373: Agriculture Cooperative Housing Society | C373: 190000 | D373: 370000
A374: =A373+1 -> 7 | B374: Habib Colony | C374: 90000 | D374: 155000
A375: =A374+1 -> 8 | B375: Ahmad Housing Scheme (Niaz Baig) | C375: 160000 | D375: 310000
A376: =A375+1 -> 9 | B376: Ahmad Nagar Katchi Kothi | C376: 190000 | D376: 325000
A377: =A376+1 -> 10 | B377: Aitcheson College Cooperative Housing Society | C377: 190000 | D377: 325000
A378: =A377+1 -> 11 | B378: Ajhodia Pur | C378: 200000 | D378: 435000
A379: =A378+1 -> 12 | B379: Adjoining All Societies & Towns in Ajodiapur | C379: 250000 | D379: 500000
A380: =A379+1 -> 13 | B380: Al-Hajjaj Co-operative Society | C380: 190000 | D380: 325000
A381: =A380+1 -> 14 | B381: Al-Hamad Park Niaz Baig | C381: 190000 | D381: 325000
A382: =A381+1 -> 15 | B382: Ali Park Niaz Baig | C382: 190000 | D382: 325000
A383: =A382+1 -> 16 | B383: Ali Raza Abad | C383: 190000 | D383: 325000
A384: =A383+1 -> 17 | B384: All Societies & Town in Rakh Khamba | C384: 150000 | D384: 325000
A385: =A384+1 -> 18 | B385: All Societies & Town in Amar Kot | C385: 250000 | D385: 360000
A386: =A385+1 -> 19 | B386: All Societies & Town in Mouza Juilana | C386: 120000 | D386: 415000
A387: =A386+1 -> 20 | B387: All Societies & Town in Mouza Khamba | C387: 120000 | D387: 310000
A388: =A387+1 -> 21 | B388: All Towns & Societies in Mohlanwal | C388: 120000 | D388: 250000
A389: =A388+1 -> 22 | B389: Amar Kot | C389: 55000 | D389: 100000
A390: =A389+1 -> 23 | B390: Awan Town | C390: 200000 | D390: 435000
A391: =A390+1 -> 24 | B391: Awiasia Co-operative Housing Society | C391: 160000 | D391: 365000
A392: =A391+1 -> 25 | B392: Azam Garden | C392: 190000 | D392: 365000
A393: =A392+1 -> 26 | B393: Badar Pura | C393: 190000 | D393: 230000
A394: =A393+1 -> 27 | B394: Bahria Town | C394: 130000 | D394: 500000
A395: =A394+1 -> 28 | B395: Bakar Mandi | C395: 280000 | D395: 550000
A396: =A395+1 -> 29 | B396: Bhaigil All Societies | C396: 130000 | D396: 500000
A397: =A396+1 -> 30 | B397: Bhula Gari | C397: 190000 | D397: 330000
A398: =A397+1 -> 31 | B398: BOR Society | C398: 250000 | D398: 500000
A399: =A398+1 -> 32 | B399: Bund Road Motorway Chowk to Chowk Yateem Khana | C399: 0 | D399: 780000
A400: =A399+1 -> 33 | B400: Campus View Town | C400: 190000 | D400: 425000
A401: =A400+1 -> 34 | B401: Canal Bank Road Two Sides Campus to Thokhar | C401: 280000 | D401: 780000
A402: =A401+1 -> 35 | B402: Canal Breeze Housing Society | C402: 190000 | D402: 310000
A403: =A402+1 -> 36 | B403: Canal Burg Society | C403: 250000 | D403: 550000
A404: =A403+1 -> 37 | B404: Canal View | C404: 280000 | D404: 550000
A405: =A404+1 -> 38 | B405: Canal View Society | C405: 280000 | D405: 620000
A406: =A405+1 -> 39 | B406: Chak Mozang | C406: 210000 | D406: 550000
A407: =A406+1 -> 40 | B407: Chak Mozang All Societies | C407: 210000 | D407: 550000
A408: =A407+1 -> 41 | B408: Chung Punjgrian | C408: 150000 | D408: 280000
A409: =A408+1 -> 42 | B409: Chung Punjgrian All Societies | C409: 210000 | D409: 365000
A410: =A409+1 -> 43 | B410: Deena Nath Amar Kot | C410: 75000 | D410: 150000
A411: =A410+1 -> 44 | B411: Dhana Singh Wala | C411: 200000 | D411: 435000
A412: =A411+1 -> 45 | B412: Dhana Singh Wala all Societies | C412: 200000 | D412: 4352000
A413: =A412+1 -> 46 | B413: Dholanwal | C413: 215000 | D413: 325000
A414: =A413+1 -> 47 | B414: Doctors' Society | C414: 250000 | D414: 425000
A415: =A414+1 -> 48 | B415: Dubanpura Abadi | C415: 150000 | D415: 280000
A416: =A415+1 -> 49 | B416: Education Town | C416: 160000 | D416: 280000
A417: =A416+1 -> 50 | B417: EME Housing Society | C417: 270000 | D417: 550000
A418: =A417+1 -> 51 | B418: Engineering University Co-Operative Housing Society Limited | C418: 130000 | D418: 250000
A419: =A418+1 -> 52 | B419: Engineers Co-Operative Society Limited | C419: 160000 | D419: 250000
A420: =A419+1 -> 53 | B420: G. C. P. Co-Operative Society Limited | C420: 250000 | D420: 550000
A421: =A420+1 -> 54 | B421: Gbulam Ghose Wala | C421: 75000 | D421: 150000
A422: =A421+1 -> 55 | B422: Ghulam Ghous Wala any Societies and Towns | C422: 150000 | D422: 280000
A423: =A422+1 -> 56 | B423: Gopay Rai | C423: 90000 | D423: 245000
A424: =A423+1 -> 57 | B424: Gosha-e-Ahbab Phase-I-II | C424: 130000 | D424: 365000
A425: =A424+1 -> 58 | B425: Gosha-e-Ahbab Phase-III | C425: 130000 | D425: 310000
A426: =A425+1 -> 59 | B426: Govt. Officers' Co-Operative Housing Society Limited | C426: 130000 | D426: 365000
A427: =A426+1 -> 60 | B427: Green Forts Phase-I-II | C427: 210000 | D427: 435000
A428: =A427+1 -> 61 | B428: Green Forts Phase-III | C428: 190000 | D428: 370000
A429: =A428+1 -> 62 | B429: Hameed Park Chak Mozang | C429: 210000 | D429: 550000
A430: =A429+1 -> 63 | B430: Hanjar Wal | C430: 150000 | D430: 260000
A431: =A430+1 -> 64 | B431: Hanjar Wal all Societies and Towns | C431: 150000 | D431: 260000
A432: =A431+1 -> 65 | B432: Hassan Town | C432: 190000 | D432: 420000
A433: =A432+1 -> 66 | B433: I.E.P.M. (Institute Employees' Pakistan) | C433: 250000 | D433: 480000
A434: =A433+1 -> 67 | B434: Iqbal Avenue | C434: 250000 | D434: 480000
A435: =A434+1 -> 68 | B435: Jalal Park Niaz Baig | C435: 160000 | D435: 310000
A436: =A435+1 -> 69 | B436: Jhugian Nagara | C436: 125000 | D436: 360000
A437: =A436+1 -> 70 | B437: Jhugian Shahab Din | C437: 210000 | D437: 435000
A438: =A437+1 -> 71 | B438: Jubeely Town | C438: 110000 | D438: 260000
A439: =A438+1 -> 72 | B439: Jogeen Pura | C439: 190000 | D439: 415000
A440: =A439+1 -> 73 | B440: Johar Town | C440: 270000 | D440: 650000
A441: =A440+1 -> 74 | B441: Johar Town Main Roads | C441: 310000 | D441: 710000
A442: =A441+1 -> 75 | B442: Judicial Colony | C442: 150000 | D442: 450000
A443: =A442+1 -> 76 | B443: Kake Zaee | C443: 150000 | D443: 310000
A444: =A443+1 -> 77 | B444: Kanjra | C444: 190000 | D444: 365000
A445: =A444+1 -> 78 | B445: Katar Bund Road | C445: 150000 | D445: 310000
A446: =A445+1 -> 79 | B446: Khadija Park | C446: 125000 | D446: 310000
A447: =A446+1 -> 80 | B447: Khaliq Abad | C447: 190000 | D447: 310000
A448: =A447+1 -> 81 | B448: Khamba | C448: 90000 | D448: 210000
A449: =A448+1 -> 82 | B449: Kharak | C449: 150000 | D449: 310000
A450: =A449+1 -> 83 | B450: Kibiria Town | C450: 86000 | D450: 210000
A451: =A450+1 -> 84 | B451: Kot Kambho | C451: 190000 | D451: 370000
A452: =A451+1 -> 85 | B452: Kot Mohammadi | C452: 190000 | D452: 330000
A453: =A452+1 -> 86 | B453: Lalazar Colony and Judicial Co-Operative Society | C453: 120000 | D453: 250000
A454: =A453+1 -> 87 | B454: Lalazar Market | C454: 0 | D454: 450000
A455: =A454+1 -> 88 | B455: LDA Avenue-I | C455: 135000 | D455: 265000
A456: =A455+1 -> 89 | B456: LDA Employees' Co-Operative Society Limited | C456: 125000 | D456: 245000
A457: =A456+1 -> 90 | B457: Main Bazar Chung | C457: 0 | D457: 395000
A458: =A457+1 -> 91 | B458: Maira Ghar Flats Ali Razaabad & Ahmad Nagar | C458: 210000 | D458: 390000
A459: =A458+1 -> 92 | B459: Mansoora | C459: 184000 | D459: 330000
A460: =A459+1 -> 93 | B460: Manzoor Park along-with Colonies | C460: 184000 | D460: 365000
A461: =A460+1 -> 94 | B461: Maraka | C461: 85000 | D461: 190000
A462: =A461+1 -> 95 | B462: Margazar Colony | C462: 150000 | D462: 350000
A463: =A462+1 -> 96 | B463: Mateen Avenue | C463: 150000 | D463: 310000
A464: =A463+1 -> 97 | B464: Mehndipur | C464: 40000 | D464: 75000
A465: =A464+1 -> 98 | B465: Miraj Park (Dholanwal) | C465: 270000 | D465: 430000
A466: =A465+1 -> 99 | B466: Mohafiz Town | C466: 150000 | D466: 270000
A467: =A466+1 -> 100 | B467: Mohlanwal | C467: 65000 | D467: 125000
A468: =A467+1 -> 101 | B468: Molana Shaukat Ali Road | C468: 0 | D468: 930000
A469: =A468+1 -> 102 | B469: Muhammad Sultanabad | C469: 190000 | D469: 430000
A470: =A469+1 -> 103 | B470: Multan Road Chungi To Thokhar | C470: 365000 | D470: 730000
A471: =A470+1 -> 104 | B471: Multan Road Thokhar to Manga Mandi | C471: 0 | D471: 430000
A472: =A471+1 -> 105 | B472: Mureedwal | C472: 150000 | D472: 430000
A473: =A472+1 -> 106 | B473: Mustafa Town (Niaz Baig) Jurisdiction in Iqbal Town | C473: 185000 | D473: 365000
A474: =A473+1 -> 107 | B474: Nasir Abad | C474: 38000 | D474: 75000
A475: =A474+1 -> 108 | B475: Nawab Town (Rakh Khamba) | C475: 185000 | D475: 340000
A476: =A475+1 -> 109 | B476: NESPAK Housing Scheme | C476: 185000 | D476: 250000
A477: =A476+1 -> 110 | B477: NFC Employees' co-Opearative Society Limited | C477: 145000 | D477: 310000
A478: =A477+1 -> 111 | B478: Niaz Baig | C478: 120000 | D478: 270000
A479: =A478+1 -> 112 | B479: Niaz Baig all Societies | C479: 150000 | D479: 310000
A480: =A479+1 -> 113 | B480: Nishaman Iqbal Society | C480: 245000 | D480: 495000
A481: =A480+1 -> 114 | B481: Overseas Society | C481: 245000 | D481: 495000
A482: =A481+1 -> 115 | B482: Pakistan Election Commission Employees' Co-Operative | C482: 120000 | D482: 250000
A483: =A482+1 -> 116 | B483: Pakistan Expatriates Co-Operative Society (Valencia Town) | C483: 210000 | D483: 430000
A484: =A483+1 -> 117 | B484: Pakistan Rajput Society | C484: 245000 | D484: 365000
A485: =A484+1 -> 118 | B485: Pakistan Technocrate Co-Operative Society | C485: 185000 | D485: 430000
A486: =A485+1 -> 119 | B486: Pakki Thathi & adjoining Abadies West Side | C486: 250000 | D486: 735000
A487: =A486+1 -> 120 | B487: PASCO Employees' Soceity | C487: 120000 | D487: 310000
A488: =A487+1 -> 121 | B488: PCSIR Society Phase-I | C488: 260000 | D488: 560000
A489: =A488+1 -> 122 | B489: PCSIR Society Phase-II & III | C489: 210000 | D489: 430000
A490: =A489+1 -> 123 | B490: PECCO Road Phatak to Ganda Nala | C490: 0 | D490: 750000
A491: =A490+1 -> 124 | B491: PECO Colony Niaz Baig | C491: 150000 | D491: 270000
A492: =A491+1 -> 125 | B492: PIA Housing Society | C492: 245000 | D492: 560000
A493: =A492+1 -> 126 | B493: Punjab Govt. Co-Operative Society Limited | C493: 190000 | D493: 310000
A494: =A493+1 -> 127 | B494: Punjab University Town | C494: 150000 | D494: 310000
A495: =A494+1 -> 128 | B495: Rail Town | C495: 150000 | D495: 270000
A496: =A495+1 -> 129 | B496: Railway Road Raiwind | C496: 260000 | D496: 450000
A497: =A496+1 -> 130 | B497: Raiwind Main Bazar | C497: 0 | D497: 495000
A498: =A497+1 -> 131 | B498: Raiwind (Inside Town Committee) | C498: 75000 | D498: 210000
A499: =A498+1 -> 132 | B499: Raiwind Kasur Road | C499: 120000 | D499: 400000
A500: =A499+1 -> 133 | B500: Raiwind Main Bazar Adjoining Markets | C500: 0 | D500: 500000
A501: =A500+1 -> 134 | B501: Raiwind Manga Road | C501: 120000 | D501: 190000
A502: =A501+1 -> 135 | B502: Raiwind outside Committee UC 148 to 149 | C502: 40000 | D502: 75000
A503: =A502+1 -> 136 | B503: Raiwind Road (Chowk Avenue to Phatak outside Raiwind) | C503: 360000 | D503: 400000
A504: =A503+1 -> 137 | B504: Raiwind Road Bhobatian to Raiwind | C504: 120000 | D504: 340000
A505: =A504+1 -> 138 | B505: Raiwind Road Main (Thokhar Chowk to Bhobatian) | C505: 150000 | D505: 365000
A506: =A505+1 -> 139 | B506: Raiwind Sundar Road | C506: 75000 | D506: 190000
A507: =A506+1 -> 140 | B507: Rajput Scheme | C507: 150000 | D507: 270000
A508: =A507+1 -> 141 | B508: Rakh Khamba | C508: 100000 | D508: 210000
A509: =A508+1 -> 142 | B509: Rana Town | C509: 120000 | D509: 270000
A510: =A509+1 -> 143 | B510: Rasool Pura Niaz Baig | C510: 150000 | D510: 270000
A511: =A510+1 -> 144 | B511: Revenue Employees' Co-Operative Society | C511: 190000 | D511: 340000
A512: =A511+1 -> 145 | B512: Sabzazar Scheme | C512: 250000 | D512: 560000
A513: =A512+1 -> 146 | B513: Saidpur | C513: 210000 | D513: 430000
A514: =A513+1 -> 147 | B514: Saidpur (Iqbal Town Side) | C514: 190000 | D514: 365000
A515: =A514+1 -> 148 | B515: Samanzar Soceity | C515: 250000 | D515: 620000
A516: =A515+1 -> 149 | B516: Samsani Road | C516: 210000 | D516: 365000
A517: =A516+1 -> 150 | B517: Sattokatla | C517: 190000 | D517: 495000
A518: =A517+1 -> 151 | B518: Shaday Wal | C518: 120000 | D518: 250000
A519: =A518+1 -> 152 | B519: Shah Sharif/Kalan More | C519: 145000 | D519: 620000
A520: =A519+1 -> 153 | B520: Shahpur Khanpur | C520: 120000 | D520: 250000
A521: =A520+1 -> 154 | B521: Khayaban Jannah to Raiwind Road both side | C521: 280000 | D521: 680000
A522: =A521+1 -> 155 | B522: Sher Shah Town | C522: 50000 | D522: 85000
A523: =A522+1 -> 156 | B523: State Enterprise Society | C523: 150000 | D523: 365000
A524: =A523+1 -> 157 | B524: Sui Northern Gas Pipeline Officers' Co-Operative Society Ltd. | C524: 120000 | D524: 250000
A525: =A524+1 -> 158 | B525: Sukh Chain Soceity | C525: 190000 | D525: 365000
A526: =A525+1 -> 159 | B526: Sultan Town | C526: 190000 | D526: 365000
A527: =A526+1 -> 160 | B527: Sultan Pura | C527: 90000 | D527: 150000
A528: =A527+1 -> 161 | B528: Sun Floor Scheme | C528: 190000 | D528: 430000
A529: =A528+1 -> 162 | B529: Sunny View Co-Operative Soceity | C529: 120000 | D529: 250000
A530: =A529+1 -> 163 | B530: Super Market (Thokhar and King Market) | C530: 0 | D530: 565000
A531: =A530+1 -> 164 | B531: Tanveer Park | C531: 210000 | D531: 560000
A532: =A531+1 -> 165 | B532: TECH Society | C532: 310000 | D532: 560000
A533: =A532+1 -> 166 | B533: Thokar to Shaukat Khanum | C533: 280000 | D533: 680000
A534: =A533+1 -> 167 | B534: Toheed Park | C534: 210000 | D534: 560000
A535: =A534+1 -> 168 | B535: Township Industrial Area (Quaid-e-Azam Town)_ | C535: 0 | D535: 430000
A536: =A535+1 -> 169 | B536: Township Scheme | C536: 180000 | D536: 420000
A537: =A536+1 -> 170 | B537: Tricon Developers (Pvt.) Limited (Ladke Newan) | C537: 270000 | D537: 560000
A538: =A537+1 -> 171 | B538: Umar Garden | C538: 210000 | D538: 430000
A539: =A538+1 -> 172 | B539: WAPDA Town | C539: 260000 | D539: 430000
A540: =A539+1 -> 173 | B540: Waris Colony Niaz Baig | C540: 210000 | D540: 430000
A541: =A540+1 -> 174 | B541: West Wood Colony | C541: 200000 | D541: 430000
A544: Rates of Cultivable Land falling in Iqbal Town, Lahore
A545: S. No. | B545: Name of Locality | C545: Rate Per Acre Agricultural Land | D545: Rate Per Acre Flooded Land
A546: 1 | B546: Mohlan Wal | C546: 960000 | D546: 0
A547: =A546+1 -> 2 | B547: Raiwind | C547: 1850000 | D547: 0
A548: =A547+1 -> 3 | B548: Niaz Baig | C548: 950000 | D548: 740000
A551: Shalimar Town, Lahore
A552: S. No. | B552: Name of Locality | C552: Rate Per Marla Residential | D552: Rate Per Marla Commercial
A553: 1 | B553: Aalia Town Mehmood Booti New | C553: 120000 | D553: 225000
A554: =A553+1 -> 2 | B554: Abdullah Park | C554: 200000 | D554: 375000
A555: =A554+1 -> 3 | B555: Achant Garh | C555: 200000 | D555: 550000
A556: =A555+1 -> 4 | B556: Afzaal Park | C556: 200000 | D556: 390000
A557: =A556+1 -> 5 | B557: Akbar Road | C557: 340000 | D557: 500000
A558: =A557+1 -> 6 | B558: Akram Road (Khoi Miran) | C558: 200000 | D558: 500000
A559: =A558+1 -> 7 | B559: Altaf Park Amir Road | C559: 200000 | D559: 300000
A560: =A559+1 -> 8 | B560: Amir Road Shad Bagh | C560: 475000 | D560: 690000
A561: =A560+1 -> 9 | B561: Angori Bagh | C561: 200000 | D561: 330000
A562: =A561+1 -> 10 | B562: Ashraf Park Amir Road | C562: 215000 | D562: 430000
A563: =A562+1 -> 11 | B563: Ashraf Park Wassan Pura | C563: 215000 | D563: 400000
A564: =A563+1 -> 12 | B564: Aziz Road | C564: 270000 | D564: 560000
A565: =A564+1 -> 13 | B565: Baghanwala and ajoining Areas | C565: 215000 | D565: 400000
A566: =A565+1 -> 14 | B566: Baghat Pura and adjoining Areas | C566: 215000 | D566: 400000
A567: =A566+1 -> 15 | B567: Baghbanpura Old | C567: 200000 | D567: 380000
A568: =A567+1 -> 16 | B568: Baghbanpura New Abadi | C568: 170000 | D568: 330000
A569: =A568+1 -> 17 | B569: Band Road following in Shalimar Town | C569: 670000 | D569: 670000
A570: =A569+1 -> 18 | B570: Begum Pura | C570: 200000 | D570: 380000
A571: =A570+1 -> 19 | B571: Bela Basti Ram (inside River Bed) | C571: 90000 | D571: 220000
A572: =A571+1 -> 20 | B572: Bela Basti Ram (Western Side) | C572: 90000 | D572: 260000
A573: =A572+1 -> 21 | B573: Bela Basti Ram and adjoining Areas | C573: 215000 | D573: 400000
A574: =A573+1 -> 22 | B574: Bharat Nagar (Park Nagar) | C574: 225000 | D574: 440000
A575: =A574+1 -> 23 | B575: Bhogiwal | C575: 120000 | D575: 200000
A576: =A575+1 -> 24 | B576: Bhogiwal Road | C576: 225000 | D576: 440000
A577: =A576+1 -> 25 | B577: Bilal Park | C577: 200000 | D577: 390000
A578: =A577+1 -> 26 | B578: Chah Miran Road | C578: 280000 | D578: 625000
A579: =A578+1 -> 27 | B579: Chamra Mandi | C579: 280000 | D579: 440000
A580: =A579+1 -> 28 | B580: Chiragh Park | C580: 215000 | D580: 400000
A581: =A580+1 -> 29 | B581: Choudhary Park | C581: 215000 | D581: 400000
A582: =A581+1 -> 30 | B582: Dars Road | C582: 250000 | D582: 500000
A583: =A582+1 -> 31 | B583: Elahi Baksh Park (Bela Basti Ram) | C583: 215000 | D583: 400000
A584: =A583+1 -> 32 | B584: Elahi Park (Khoi Miran) | C584: 215000 | D584: 400000
A585: =A584+1 -> 33 | B585: Esa Nagar | C585: 215000 | D585: 400000
A586: =A585+1 -> 34 | B586: Faiz Bagh | C586: 250000 | D586: 495000
A587: =A586+1 -> 35 | B587: Farooq Gunj | C587: 215000 | D587: 400000
A588: =A587+1 -> 36 | B588: Fazal Park Bela Basti Ram | C588: 215000 | D588: 400000
A589: =A588+1 -> 37 | B589: G. T. Road situated in Shalimar Town | C589: 270000 | D589: 640000
A590: =A589+1 -> 38 | B590: Gharay Shah Road | C590: 400000 | D590: 450000
A591: =A590+1 -> 39 | B591: Ghulam Hussain Park | C591: 215000 | D591: 410000
A592: =A591+1 -> 40 | B592: Ghujjar Pura China Scheme | C592: 250000 | D592: 510000
A593: =A592+1 -> 41 | B593: Gunj | C593: 225000 | D593: 400000
A594: =A593+1 -> 42 | B594: Haq Nawaz road | C594: 510000 | D594: 565000
A595: =A594+1 -> 43 | B595: Hussain Park | C595: 215000 | D595: 410000
A596: =A595+1 -> 44 | B596: Imam Buksh Park (Bela Basti Ram) | C596: 215000 | D596: 410000
A597: =A596+1 -> 45 | B597: Iqbal Park, Khoi Miran | C597: 215000 | D597: 410000
A598: =A597+1 -> 46 | B598: Kacchu Pura | C598: 215000 | D598: 410000
A599: =A598+1 -> 47 | B599: Khizar Abad New Baghbanpura | C599: 170000 | D599: 400000
A600: =A599+1 -> 48 | B600: Khoi Miran & adjoining Areas | C600: 270000 | D600: 560000
A601: =A600+1 -> 49 | B601: Khokhar Road | C601: 625000 | D601: 625000
A602: =A601+1 -> 50 | B602: Kot Khawaja Saeed & adjoining Areas | C602: 150000 | D602: 400000
A603: =A602+1 -> 51 | B603: Kot Khawaja Saeed (Western Side) | C603: 90000 | D603: 270000
A604: =A603+1 -> 52 | B604: Kotli Peer Abdul Rehman | C604: 160000 | D604: 275000
A605: =A604+1 -> 53 | B605: Main Bazar Mujahid Abad | C605: 270000 | D605: 510000
A606: =A605+1 -> 54 | B606: Main Bazar Shahwari | C606: 270000 | D606: 510000
A607: =A606+1 -> 55 | B607: Makhan Pura | C607: 200000 | D607: 400000
A608: =A607+1 -> 56 | B608: Mehr Suba Park | C608: 215000 | D608: 410000
A609: =A608+1 -> 57 | B609: Misri Shah | C609: 275000 | D609: 560000
A610: =A609+1 -> 58 | B610: Muhammadi Mohallah | C610: 250000 | D610: 510000
A611: =A610+1 -> 59 | B611: Muhammadi Park | C611: 215000 | D611: 410000
A612: =A611+1 -> 60 | B612: Mujahid Abad | C612: 215000 | D612: 400000
A613: =A612+1 -> 61 | B613: Nabi Baksh Park | C613: 215000 | D613: 410000
A614: =A613+1 -> 62 | B614: Naulakha & adjoining Areas | C614: 250000 | D614: 500000
A615: =A614+1 -> 63 | B615: New Malik Park | C615: 215000 | D615: 410000
A616: =A615+1 -> 64 | B616: New Shahad Bagh | C616: 215000 | D616: 410000
A617: =A616+1 -> 65 | B617: New Wasan Pura Scheme No. 2 | C617: 215000 | D617: 410000
A618: =A617+1 -> 66 | B618: Rahim Park Bela Basti Ram | C618: 260000 | D618: 520000
A619: =A618+1 -> 67 | B619: Ram Kishanwala | C619: 215000 | D619: 410000
A620: =A619+1 -> 68 | B620: Rashid Pura Baghbanpura | C620: 170000 | D620: 400000
A621: =A620+1 -> 69 | B621: Sahowari | C621: 210000 | D621: 360000
A622: =A621+1 -> 70 | B622: Saleem Park Kohi Miran | C622: 225000 | D622: 450000
A623: =A622+1 -> 71 | B623: Sawami Nagar | C623: 215000 | D623: 410000
A624: =A623+1 -> 72 | B624: Sehar Road | C624: 250000 | D624: 510000
A625: =A624+1 -> 73 | B625: Shad Bagh | C625: 215000 | D625: 450000
A626: =A625+1 -> 74 | B626: Shahbaz Road | C626: 235000 | D626: 510000
A627: =A626+1 -> 75 | B627: Shad Bagh Road | C627: 250000 | D627: 510000
A628: =A627+1 -> 76 | B628: Shaheen Park | C628: 215000 | D628: 410000
A629: =A628+1 -> 77 | B629: Shalimar Town Link Road (Rear) | C629: 270000 | D629: 270000
A630: =A629+1 -> 78 | B630: Shalimar Link Road (Front) | C630: 485000 | D630: 485000
A631: =A630+1 -> 79 | B631: Shalimar Town Baghbanpura | C631: 155000 | D631: 400000
A632: =A631+1 -> 80 | B632: Sher Shah Road | C632: 270000 | D632: 510000
A633: =A632+1 -> 81 | B633: Singh Pura | C633: 200000 | D633: 400000
A634: =A633+1 -> 82 | B634: Siraj Din Park | C634: 215000 | D634: 410000
A635: =A634+1 -> 83 | B635: Sultan Mehmood Road | C635: 250000 | D635: 510000
A636: =A635+1 -> 84 | B636: Sultan Pura | C636: 215000 | D636: 450000
A637: =A636+1 -> 85 | B637: Sultan Pura Road | C637: 450000 | D637: 450000
A638: =A637+1 -> 86 | B638: Taj Park/Taj Ghazi Park | C638: 215000 | D638: 410000
A639: =A638+1 -> 87 | B639: Taj Pura | C639: 225000 | D639: 400000
A640: =A639+1 -> 88 | B640: Tezab Ahata | C640: 215000 | D640: 410000
A641: =A640+1 -> 89 | B641: Tezab Ahata Road | C641: 450000 | D641: 450000
A642: =A641+1 -> 90 | B642: Tibba Azeem Shah | C642: 215000 | D642: 410000
A643: =A642+1 -> 91 | B643: Toheed Park | C643: 215000 | D643: 410000
A644: =A643+1 -> 92 | B644: Umer Din Road Mauza Bela Basti Ram | C644: 480000 | D644: 480000
A645: =A644+1 -> 93 | B645: Waitmen Road (New) | C645: 200000 | D645: 400000
A646: =A645+1 -> 94 | B646: Wassan Pura | C646: 215000 | D646: 450000
A647: =A646+1 -> 95 | B647: Yahya Colony | C647: 215000 | D647: 410000
A648: =A647+1 -> 96 | B648: Yasrib Colony Ram | C648: 215000 | D648: 410000
A649: =A648+1 -> 97 | B649: Zafar Park | C649: 215000 | D649: 410000
A652: Rates of Cultivable Land falling in Shalimar Town, Lahore
A653: S. No. | B653: Name of Locality | C653: Rate Per Acre
A654: 1 | B654: Baghbanpura Bund Par | C654: 3000000
A655: =A654+1 -> 2 | B655: Kot Khawaja Saeed Bund Par | C655: 3000000
A658: Ravi Town, Lahore
A659: S. No. | B659: Name of Locality | C659: Rate Per Marla Residential | D659: Rate Per Marla Commercial
A660: 1 | B660: Abdul Qayyum Road (Bela Basti Ram) | C660: 680000 | D660: 680000
A661: =A660+1 -> 2 | B661: Abdul Sattar Road (Bela Basti Ram) | C661: 680000 | D661: 680000
A662: =A661+1 -> 3 | B662: Afzal Colony (Bela Basti Ram) | C662: 215000 | D662: 420000
A663: =A662+1 -> 4 | B663: Ahmad Park (Bela Basti Ram) | C663: 215000 | D663: 420000
A664: =A663+1 -> 5 | B664: Akbari Mandi (H Ward) | C664: 380000 | D664: 1900000
A665: =A664+1 -> 6 | B665: Akram Colony (Baghanwala) | C665: 215000 | D665: 415000
A666: =A665+1 -> 7 | B666: Akram Road (Bela Basti Ram) | C666: 215000 | D666: 415000
A667: =A666+1 -> 8 | B667: Alamgir Market | C667: 1310000 | D667: 1310000
A668: =A667+1 -> 9 | B668: Al-Fateh Colony (Baghanwala) | C668: 215000 | D668: 415000
A669: =A668+1 -> 10 | B669: Altaf Park (Baghanwala) | C669: 215000 | D669: 415000
A670: =A669+1 -> 11 | B670: Amin Park (Bela Basti Ram) | C670: 215000 | D670: 415000
A671: =A670+1 -> 12 | B671: Amir Road Bagh/Bela | C671: 470000 | D671: 680000
A672: =A671+1 -> 13 | B672: Ashraf Park (Bela Basti Ram) | C672: 215000 | D672: 430000
A673: =A672+1 -> 14 | B673: Aslam Colony (Bela Basti Ram) | C673: 215000 | D673: 430000
A674: =A673+1 -> 15 | B674: Azam Cloth Market (G Ward) | C674: 2580000 | D674: 2580000
A675: =A674+1 -> 16 | B675: Azam Cloth Market (Bela Basti Ram) | C675: 215000 | D675: 430000
A676: =A675+1 -> 17 | B676: Aziz Colony (Shahdara) | C676: 215000 | D676: 410000
A677: =A676+1 -> 18 | B677: Aziz Road (Misri Shah) | C677: 270000 | D677: 565000
A678: =A677+1 -> 19 | B678: Badami Bagh Bus Stand | C678: 1420000 | D678: 1420000
A679: =A678+1 -> 20 | B679: Badami Bagh PECO Road | C679: 1420000 | D679: 1420000
A680: =A679+1 -> 21 | B680: Badami Bagh PECO Road (Off the Road) | C680: 860000 | D680: 860000
A681: =A680+1 -> 22 | B681: Badar Colony (Bela Basti Ram) | C681: 215000 | D681: 400000
A682: =A681+1 -> 23 | B682: Baghanwala (adjoining Abadies) | C682: 215000 | D682: 400000
A683: =A682+1 -> 24 | B683: Bangali Park/Bagh | C683: 215000 | D683: 400000
A684: =A683+1 -> 25 | B684: Baradari Road | C684: 225000 | D684: 440000
A685: =A684+1 -> 26 | B685: Begum Kot & Adjoining Abadies | C685: 215000 | D685: 400000
A686: =A685+1 -> 27 | B686: Bela Basti Ram (Adjoining Abadies) | C686: 215000 | D686: 400000
A687: =A686+1 -> 28 | B687: Bela Basti Ram (Western Side) | C687: 90000 | D687: 260000
A688: =A687+1 -> 29 | B688: B hamman Mauza | C688: 70000 | D688: 240000
A689: =A688+1 -> 30 | B689: Bhatti Gate (B Ward) | C689: 280000 | D689: 700000
A690: =A689+1 -> 31 | B690: Bhutto Colony (Shahdara) | C690: 215000 | D690: 400000
A691: =A690+1 -> 32 | B691: Bund Road Ravi Bridge to Bassi More (Both Sides) | C691: 520000 | D691: 520000
A692: =A691+1 -> 33 | B692: Chak Jia Musa falling in Ravi Town | C692: 250000 | D692: 400000
A693: =A692+1 -> 34 | B693: Chaman Colony | C693: 215000 | D693: 400000
A694: =A693+1 -> 35 | B694: Chatta Bazar (C Ward) | C694: 280000 | D694: 1000000
A695: =A694+1 -> 36 | B695: Chiragh Park (Baghanwala) | C695: 215000 | D695: 400000
A696: =A695+1 -> 37 | B696: Chohan Colony (Ram Kishan Wala) | C696: 215000 | D696: 400000
A697: =A696+1 -> 38 | B697: Choudhary Park/Colony | C697: 215000 | D697: 400000
A698: =A697+1 -> 39 | B698: Chouhatta Mufti Baqir (H Ward) | C698: 375000 | D698: 700000
A699: =A698+1 -> 40 | B699: Chuna Mandi (F Ward) | C699: 420000 | D699: 1300000
A700: =A699+1 -> 41 | B700: Circular Road | C700: 1420000 | D700: 1420000
A701: =A700+1 -> 42 | B701: City Cinema Road (C Ward) | C701: 285000 | D701: 700000
A702: =A701+1 -> 43 | B702: Dabi/Kashmir Bazar (F Ward) | C702: 420000 | D702: 1300000
A703: =A702+1 -> 44 | B703: Data Nagar | C703: 215000 | D703: 400000
A704: =A703+1 -> 45 | B704: Daulat Khan Raod (Shahdara) | C704: 270000 | D704: 650000
A705: =A704+1 -> 46 | B705: Dehli Gate (G Ward) | C705: 375000 | D705: 700000
A706: =A705+1 -> 47 | B706: Elahi Bukhsh Park (Bela Basti Ram) | C706: 215000 | D706: 400000
A707: =A706+1 -> 48 | B707: Elahi Park | C707: 215000 | D707: 400000
A708: =A707+1 -> 49 | B708: Esa Nagar | C708: 215000 | D708: 400000
A709: =A708+1 -> 50 | B709: Faisal Park (Shahdara) | C709: 215000 | D709: 400000
A710: =A709+1 -> 51 | B710: Farkhabad | C710: 215000 | D710: 400000
A711: =A710+1 -> 52 | B711: Farooq Gunj (Bela Basti Ram) | C711: 215000 | D711: 400000
A712: =A711+1 -> 53 | B712: Fateh Puri | C712: 215000 | D712: 400000
A713: =A712+1 -> 54 | B713: Fazal Park (Bela Basti Ram) | C713: 215000 | D713: 400000
A714: =A713+1 -> 55 | B714: Feroze Colony, Bela Basti Ram | C714: 215000 | D714: 400000
A715: =A714+1 -> 56 | B715: Fort Road (A Ward) | C715: 280000 | D715: 700000
A716: =A715+1 -> 57 | B716: Fruit Market Badami Bagh | C716: 1420000 | D716: 1420000
A717: =A716+1 -> 58 | B717: G. T. Road Ravi Bridge to Imamia Colony | C717: 590000 | D717: 590000
A718: =A717+1 -> 59 | B718: Ghulam Hussain Park | C718: 215000 | D718: 410000
A719: =A718+1 -> 60 | B719: Grain Market (Badami Bagh) | C719: 1420000 | D719: 1420000
A720: =A719+1 -> 61 | B720: Gulistan Town/Colony | C720: 215000 | D720: 410000
A721: =A720+1 -> 62 | B721: Gumati Bazar (C Ward) | C721: 285000 | D721: 1020000
A722: =A721+1 -> 63 | B722: Gurr Mandi (H Ward) | C722: 380000 | D722: 715000
A723: =A722+1 -> 64 | B723: Hamad Colony (Bela Basti Ram) | C723: 215000 | D723: 410000
A724: =A723+1 -> 65 | B724: Hanif Park (Bela Basti Ram) | C724: 215000 | D724: 410000
A725: =A724+1 -> 66 | B725: Her-Naraon Pura | C725: 215000 | D725: 410000
A726: =A725+1 -> 67 | B726: Hussain Park (Bela Basti Ram) | C726: 215000 | D726: 410000
A727: =A726+1 -> 68 | B727: Imam Bukhsh Park (Bela Basti Ram) | C727: 215000 | D727: 410000
A728: =A727+1 -> 69 | B728: Industrial Area Badami Bagh | C728: 1420000 | D728: 1420000
A729: =A728+1 -> 70 | B729: Iqbal Park | C729: 215000 | D729: 410000
A730: =A729+1 -> 71 | B730: Ittefaq Colony, Kot Shahab Din | C730: 215000 | D730: 410000
A731: =A730+1 -> 72 | B731: Jahangir Park (Bela Basti Ram) | C731: 215000 | D731: 410000
A732: =A731+1 -> 73 | B732: Jamail Park (Shahdara) | C732: 120000 | D732: 410000
A733: =A732+1 -> 74 | B733: Javed Park (Shahdara) | C733: 120000 | D733: 410000
A734: =A733+1 -> 75 | B734: Jia Musa | C734: 215000 | D734: 410000
A735: =A734+1 -> 76 | B735: Kala Khatai Road | C735: 215000 | D735: 410000
A736: =A735+1 -> 77 | B736: Kasera Bazar (F Ward) | C736: 420000 | D736: 1320000
A737: =A736+1 -> 78 | B737: Kashmir Park (Shahdara) | C737: 215000 | D737: 410000
A738: =A737+1 -> 79 | B738: Khalid Park (Bela Basti Ram) | C738: 215000 | D738: 410000
A739: =A738+1 -> 80 | B739: Khoi Meeran Mauza | C739: 270000 | D739: 560000
A740: =A739+1 -> 81 | B740: Khokhar Mauza | C740: 130000 | D740: 275000
A741: =A740+1 -> 82 | B741: Khokhar Road | C741: 620000 | D741: 620000
A742: =A741+1 -> 83 | B742: Khurshid Park (Ram Kishan Wala) | C742: 215000 | D742: 410000
A743: =A742+1 -> 84 | B743: Kinari Bazar (F Ward) | C743: 420000 | D743: 1315000
A744: =A743+1 -> 85 | B744: Kot Begum | C744: 215000 | D744: 410000
A745: =A744+1 -> 86 | B745: Kot Mohiboo (adjoining Abadies) | C745: 215000 | D745: 410000
A746: =A745+1 -> 87 | B746: Kot Shahab Din (Shahdara) | C746: 215000 | D746: 410000
A747: =A746+1 -> 88 | B747: Lajpat Nagar (Shahdara) | C747: 215000 | D747: 410000
A748: =A747+1 -> 89 | B748: Lajpat Road (Shahdara) | C748: 270000 | D748: 680000
A749: =A748+1 -> 90 | B749: Lalazar Colony (Shahdara) | C749: 215000 | D749: 410000
A750: =A749+1 -> 91 | B750: Langay Mandi (C Ward) | C750: 280000 | D750: 715000
A751: =A750+1 -> 92 | B751: Lohari Gate (D Ward) | C751: 280000 | D751: 715000
A752: =A751+1 -> 93 | B752: Lohari Mandi (D Ward) | C752: 280000 | D752: 715000
A753: =A752+1 -> 94 | B753: Loon Mandi (H Ward) | C753: 375000 | D753: 715000
A754: =A753+1 -> 95 | B754: Main Road Shahdara Town | C754: 225000 | D754: 450000
A755: =A754+1 -> 96 | B755: Mauza Jhuggian | C755: 70000 | D755: 90000
A756: =A755+1 -> 97 | B756: Mauza Nain Sukh | C756: 145000 | D756: 345000
A757: =A756+1 -> 98 | B757: Mehar Park (Baghanwala) | C757: 215000 | D757: 410000
A758: =A757+1 -> 99 | B758: Mehar Suba Park (Baghanwala) | C758: 215000 | D758: 410000
A759: =A758+1 -> 100 | B759: Misri Shah | C759: 275000 | D759: 560000
A760: =A759+1 -> 101 | B760: Mochi Gate | C760: 430000 | D760: 715000
A761: =A760+1 -> 102 | B761: Mohallah Kakay Zaiyan (F Ward) | C761: 420000 | D761: 1315000
A762: =A761+1 -> 103 | B762: Mori Gate (B Ward) | C762: 280000 | D762: 715000
A763: =A762+1 -> 104 | B763: Moti Bazar (C Ward) | C763: 285000 | D763: 1020000
A764: =A763+1 -> 105 | B764: Muhammadi Park | C764: 215000 | D764: 410000
A765: =A764+1 -> 106 | B765: Nabi Bukhsh Park (Bela Basti Ram) | C765: 215000 | D765: 410000
A766: =A765+1 -> 107 | B766: Naseem Park | C766: 215000 | D766: 410000
A767: =A766+1 -> 108 | B767: National Fan Colony (Shahdara) | C767: 215000 | D767: 410000
A768: =A767+1 -> 109 | B768: Naulakha Mauza falling in Ravi Town | C768: 250000 | D768: 500000
A769: =A768+1 -> 110 | B769: New Malik Park/Malik Park/Malik Bagh | C769: 215000 | D769: 410000
A770: =A769+1 -> 111 | B770: Niaz Pura | C770: 215000 | D770: 410000
A771: =A770+1 -> 112 | B771: Noor Road (Bela Basti Ram) | C771: 680000 | D771: 680000
A772: =A771+1 -> 113 | B772: Pakistan Cloth Market (G Ward) | C772: 1425000 | D772: 1425000
A773: =A772+1 -> 114 | B773: Paniwala Talab (C Ward) | C773: 280000 | D773: 715000
A774: =A773+1 -> 115 | B774: Pindi Das Road | C774: 270000 | D774: 785000
A775: =A774+1 -> 116 | B775: Pipple Whara (Plastic Market) | C775: 430000 | D775: 715000
A776: =A775+1 -> 117 | B776: Qaddafi Colony (Bela Basti Ram) | C776: 215000 | D776: 410000
A777: =A776+1 -> 118 | B777: Qaiser Town (Shahdara) | C777: 120000 | D777: 410000
A778: =A777+1 -> 119 | B778: Qamar Park (Ram Kishan Wala) | C778: 215000 | D778: 410000
A779: =A778+1 -> 120 | B779: Qila Lachman Singh and Adjacent Abadis | C779: 275000 | D779: 560000
A780: =A779+1 -> 121 | B780: Rahim Park (Bela Basti Ram) | C780: 260000 | D780: 520000
A781: =A780+1 -> 122 | B781: Rahim Road | C781: 680000 | D781: 680000
A782: =A781+1 -> 123 | B782: Ram Kishan Wala | C782: 215000 | D782: 410000
A783: =A782+1 -> 124 | B783: Rang Mahal Main (E Ward) | C783: 2950000 | D783: 2950000
A784: =A783+1 -> 125 | B784: Rang Mahal, Back Side (D Ward) | C784: 285000 | D784: 715000
A785: =A784+1 -> 126 | B785: Ravi Clifton Colony/Park (Shahdara) | C785: 215000 | D785: 410000
A786: =A785+1 -> 127 | B786: Ravi Park | C786: 275000 | D786: 560000
A787: =A786+1 -> 128 | B787: Ravi Road (Eastern Side) | C787: 1075000 | D787: 1075000
A788: =A787+1 -> 129 | B788: Rustam Colony (Bela Basti Ram) | C788: 215000 | D788: 410000
A789: =A788+1 -> 130 | B789: Saeed Park | C789: 215000 | D789: 410000
A790: =A789+1 -> 131 | B790: Saggian Kalanwar | C790: 120000 | D790: 250000
A791: =A790+1 -> 132 | B791: Saggian Road (Toll Plaza to Chowk Nain Sukh) | C791: 430000 | D791: 430000
A792: =A791+1 -> 133 | B792: Said Metha Bazar | C792: 430000 | D792: 1130000
A793: =A792+1 -> 134 | B793: Sajjad Park | C793: 215000 | D793: 410000
A794: =A793+1 -> 135 | B794: Shah Alam Gate (E Ward) | C794: 2950000 | D794: 2950000
A795: =A794+1 -> 136 | B795: Shah Alam Market (Back Side) | C795: 1310000 | D795: 1310000
A796: =A795+1 -> 137 | B796: Shahdara Town (adjoining Abadies) | C796: 120000 | D796: 400000
A797: =A796+1 -> 138 | B797: Shaheen Park (Bela Basti Ram) | C797: 215000 | D797: 400000
A798: =A797+1 -> 139 | B798: Shahi Mohallah (A Ward) | C798: 280000 | D798: 715000
A799: =A798+1 -> 140 | B799: Sharif Park (Bela Basti Ram) | C799: 215000 | D799: 410000
A800: =A799+1 -> 141 | B800: Sharkpur Road (Begum Kot Chowk to Saeed Chowk) | C800: 320000 | D800: 495000
A801: =A800+1 -> 142 | B801: Sheikh Colony (Bela Basti Ram) | C801: 215000 | D801: 410000
A802: =A801+1 -> 143 | B802: Sheikhupura Road | C802: 560000 | D802: 560000
A803: =A802+1 -> 144 | B803: Sher Shah Road (Bela Basti Ram) | C803: 225000 | D803: 450000
A804: =A803+1 -> 145 | B804: Sheranwala Gate (G Ward) | C804: 375000 | D804: 715000
A805: =A804+1 -> 146 | B805: Shoe Market | C805: 1310000 | D805: 1310000
A806: =A805+1 -> 147 | B806: Siddiq Gunj (Bela Basti Ram) | C806: 275000 | D806: 520000
A807: =A806+1 -> 148 | B807: Siddiqui/Saddiqui Colony (Bela Basti Ram) | C807: 215000 | D807: 400000
A808: =A807+1 -> 149 | B808: Siraj Din Park (Bela Basti Ram) | C808: 215000 | D808: 400000
A809: =A808+1 -> 150 | B809: Soha Bazar (E Ward) | C809: 2950000 | D809: 2950000
A810: =A809+1 -> 151 | B810: Sootar Mandi (D Ward) | C810: 285000 | D810: 715000
A811: =A810+1 -> 152 | B811: Subzi Market Badami Bagh | C811: 1420000 | D811: 1420000
A812: =A811+1 -> 153 | B812: Sui Gas Road | C812: 250000 | D812: 625000
A813: =A812+1 -> 154 | B813: Taj Ghazi Park (Bela Basti Ram) | C813: 215000 | D813: 410000
A814: =A813+1 -> 155 | B814: Taj Park (Bela Basti Ram) | C814: 215000 | D814: 410000
A815: =A814+1 -> 156 | B815: Targarh | C815: 120000 | D815: 410000
A816: =A815+1 -> 157 | B816: Taxali Gate (A Ward) | C816: 280000 | D816: 715000
A817: =A816+1 -> 158 | B817: Timber Market | C817: 1180000 | D817: 1180000
A818: =A817+1 -> 159 | B818: Toheed Park (Bela Basti Ram) | C818: 215000 | D818: 410000
A819: =A818+1 -> 160 | B819: Truck Stand | C819: 1355000 | D819: 1355000
A820: =A819+1 -> 161 | B820: Truck Stand, Circular Road (H Ward) | C820: 1355000 | D820: 1355000
A821: =A820+1 -> 162 | B821: Wandala Road (Shahdara) | C821: 215000 | D821: 430000
A822: =A821+1 -> 163 | B822: Wasanpura (UC 26) | C822: 215000 | D822: 500000
A823: =A822+1 -> 164 | B823: Yahya Colony (Bela Basti Ram) | C823: 215000 | D823: 410000
A824: =A823+1 -> 165 | B824: Yakki Gate (G Ward) | C824: 375000 | D824: 715000
A825: =A824+1 -> 166 | B825: Yasrab Colony (Ram Kishan Wala) | C825: 215000 | D825: 410000
A826: =A825+1 -> 167 | B826: Zafar Park | C826: 215000 | D826: 410000
A829: Rates of Cultivable Land falling in Ravi Town, Lahore
A830: S. No. | B830: Name of Locality | C830: Rate Per Acre for External Part of River (Outside the Embankment) | D830: Rate Per Acre for External Part of River (Inside the Embankment)
A831: 1 | B831: Begum Kot | C831: 2250000 | D831: 670000
A832: =A831+1 -> 2 | B832: Bhaman | C832: 1340000 | D832: 670000
A833: =A832+1 -> 3 | B833: Jhugian | C833: 1340000 | D833: 670000
A834: =A833+1 -> 4 | B834: Khokhar | C834: 1340000 | D834: 670000
A835: =A834+1 -> 5 | B835: Nain Sukh | C835: 2250000 | D835: 670000
A836: =A835+1 -> 6 | B836: Saggian Kalan Noor | C836: 2250000 | D836: 670000
A837: =A836+1 -> 7 | B837: Shahdara | C837: 2250000 | D837: 670000
A838: =A837+1 -> 8 | B838: Saggian Kalan Noor | D838: 670000
A839: =A838+1 -> 9 | B839: Shahdara | D839: 670000
A842: Samnabad Town, Lahore
A843: S. No. | B843: Name of Locality | C843: Rate Per Marla Residential | D843: Rate Per Marla Commercial
A844: 1 | B844: Abadi Shah Faridabad | C844: 260000 | D844: 645000
A845: =A844+1 -> 2 | B845: Al-Hamd Colony, Ichhra | C845: 260000 | D845: 645000
A846: =A845+1 -> 3 | B846: Ali Park (Ichhra) | C846: 200000 | D846: 750000
A847: =A846+1 -> 4 | B847: Ali Park (Samnabad) | C847: 260000 | D847: 750000
A848: =A847+1 -> 5 | B848: Allama Iqbal Town (Commercial Zone, Moon Market) | C848: 0 | D848: 1180000
A849: =A848+1 -> 6 | B849: Allama Iqbal Town (All Blocks) | C849: 280000 | D849: 1075000
A850: =A849+1 -> 7 | B850: Al-Mumtaz Road | C850: 260000 | D850: 565000
A851: =A850+1 -> 8 | B851: Al-Putgeen Road (Ichhra) | C851: 280000 | D851: 780000
A852: =A851+1 -> 9 | B852: Arain Nagar (Samnabad) | C852: 260000 | D852: 645000
A853: =A852+1 -> 10 | B853: Babu Sabu (Gharbi) | C853: 75000 | D853: 215000
A854: =A853+1 -> 11 | B854: Babu Sabu Abadi & Adjoining Abadies | C854: 215000 | D854: 540000
A855: =A854+1 -> 12 | B855: Badarpura (Iqbal Town) | C855: 225000 | D855: 565000
A856: =A855+1 -> 13 | B856: Bagh Gul Begum | C856: 250000 | D856: 510000
A857: =A856+1 -> 14 | B857: Bank Colony (Samnabad) | C857: 280000 | D857: 670000
A858: =A857+1 -> 15 | B858: Bastami Road | C858: 280000 | D858: 670000
A859: =A858+1 -> 16 | B859: Bhadru (Western Side) | C859: 65000 | D859: 215000
A860: =A859+1 -> 17 | B860: Bhekheywal and adjoining Abadi | C860: 280000 | D860: 670000
A861: =A860+1 -> 18 | B861: Canal Bank Road falling in Samanabd Town | C861: 460000 | D861: 835000
A862: =A861+1 -> 19 | B862: Chaburji Park | C862: 215000 | D862: 540000
A863: =A862+1 -> 20 | B863: Chaburji Park (New) | C863: 215000 | D863: 540000
A864: =A863+1 -> 21 | B864: Chamaru Pur (Western Side) | C864: 75000 | D864: 215000
A865: =A864+1 -> 22 | B865: Chaudhary Colony Samanabad/Ichhra | C865: 225000 | D865: 670000
A866: =A865+1 -> 23 | B866: Chouburji Chowk | C866: 0 | D866: 970000
A867: =A866+1 -> 24 | B867: Christian Colony (Ichhra) | C867: 260000 | D867: 645000
A868: =A867+1 -> 25 | B868: Clifton Colony (Ichhra) | C868: 260000 | D868: 645000
A869: =A868+1 -> 26 | B869: Commercial Zone Gulshan-e-Ravi (Moon Market) | C869: 620000 | D869: 940000
A870: =A869+1 -> 27 | B870: Dohata Colony (Ichhra) | C870: 260000 | D870: 750000
A871: =A870+1 -> 28 | B871: Farooq-e-Azam Park (Ichhra) | C871: 260000 | D871: 750000
A872: =A871+1 -> 29 | B872: Fateh Sher Road (Ichhra) | C872: 280000 | D872: 780000
A873: =A872+1 -> 30 | B873: Feroze Pur Road (Mozang Chungi to Canal Bridge) | C873: 0 | D873: 1480000
A874: =A873+1 -> 31 | B874: Fruit & Vegitable Mandi Iqbal Town | C874: 0 | D874: 1020000
A875: =A874+1 -> 32 | B875: Ghazali Park (Ichhra) | C875: 260000 | D875: 750000
A876: =A875+1 -> 33 | B876: Ghazali Road Chowk Chaudary Colony to 3rd | C876: 280000 | D876: 780000
A877: =A876+1 -> 34 | B877: Ghulam Colony (Samnabad) & adjoining Abadies | C877: 260000 | D877: 750000
A878: =A877+1 -> 35 | B878: Gulshan-e-Ravi (All Blocks) | C878: 300000 | D878: 680000
A879: =A878+1 -> 36 | B879: Gulshan-e-Ravi Main Boulevard Road upto Bund | C879: 455000 | D879: 810000
A880: =A879+1 -> 37 | B880: Hussain Streets Ichhra | C880: 260000 | D880: 750000
A881: =A880+1 -> 38 | B881: Ichhra Adjoining Abadies | C881: 260000 | D881: 750000
A882: =A881+1 -> 39 | B882: Ichhra Main Bazar | C882: 670000 | D882: 1075000
A883: =A882+1 -> 40 | B883: Ichhra Road Ichhra | C883: 300000 | D883: 1075000
A884: =A883+1 -> 41 | B884: Ilyas Colony | C884: 260000 | D884: 645000
A885: =A884+1 -> 42 | B885: Inder Nagar (Samnabad) | C885: 260000 | D885: 645000
A886: =A885+1 -> 43 | B886: Islamia Park | C886: 215000 | D886: 510000
A887: =A886+1 -> 44 | B887: Ittefaq Town & Extension (Iqbal Town) | C887: 280000 | D887: 1075000
A888: =A887+1 -> 45 | B888: Ittehad Colony (Multan Road) | C888: 260000 | D888: 750000
A889: =A888+1 -> 46 | B889: Ittehad Colony (Samnabad) | C889: 260000 | D889: 750000
A890: =A889+1 -> 47 | B890: Jaffria Colony | C890: 215000 | D890: 510000
A891: =A890+1 -> 48 | B891: Janka Nagar | C891: 260000 | D891: 645000
A892: =A891+1 -> 49 | B892: Jinnah Colony (Samanabad) | C892: 260000 | D892: 645000
A893: =A892+1 -> 50 | B893: Kacha Ferozepur Road (Adjoining Abadies) | C893: 280000 | D893: 660000
A894: =A893+1 -> 51 | B894: Kamboh Colony | C894: 260000 | D894: 645000
A895: =A894+1 -> 52 | B895: Karmabad Ichhra | C895: 260000 | D895: 645000
A896: =A895+1 -> 53 | B896: Karnal Pura, Ichhra | C896: 260000 | D896: 645000
A897: =A896+1 -> 54 | B897: Khuda Buksh Road | C897: 0 | D897: 725000
A898: =A897+1 -> 55 | B898: Link Wahdat Road falling in Samnabad Town | C898: 280000 | D898: 750000
A899: =A898+1 -> 56 | B899: Mahajar Abad (Nawankot) | C899: 215000 | D899: 540000
A900: =A899+1 -> 57 | B900: Main Bund Road | C900: 360000 | D900: 670000
A901: =A900+1 -> 58 | B901: Main Boulevard Urdu Nagar | C901: 510000 | D901: 970000
A902: =A901+1 -> 59 | B902: Main Bund Road Motorway Chowk to Yateem Khana | C902: 0 | D902: 780000
A903: =A902+1 -> 60 | B903: Main Road Scheme Mor to Bhekewal Mor | C903: 940000 | D903: 1350000
A904: =A903+1 -> 61 | B904: Millat Park | C904: 260000 | D904: 645000
A905: =A904+1 -> 62 | B905: Millat Road Samnabad | C905: 280000 | D905: 670000
A906: =A905+1 -> 63 | B906: Muhammad Pura, Ichhra | C906: 260000 | D906: 645000
A907: =A906+1 -> 64 | B907: Multan Road Chowk Chuburji to Multan Chungi | C907: 380000 | D907: 725000
A908: =A907+1 -> 65 | B908: Muqaddas Park Nawankot | C908: 250000 | D908: 645000
A909: =A908+1 -> 66 | B909: Muslim Colony, Samnabad | C909: 260000 | D909: 645000
A910: =A909+1 -> 67 | B910: Muslim Town New & Old & adjoining Abadies | C910: 430000 | D910: 670000
A911: =A910+1 -> 68 | B911: Nadeem Shaheed Road (Samnabad) | C911: 280000 | D911: 680000
A912: =A911+1 -> 69 | B912: Najaf Colony (Iqbal Town) | C912: 225000 | D912: 565000
A913: =A912+1 -> 70 | B913: Nawabpura, Ichhra | C913: 260000 | D913: 645000
A914: =A913+1 -> 71 | B914: Nawankot (adjoining Abadies) | C914: 250000 | D914: 645000
A915: =A914+1 -> 72 | B915: New Samnabad, Mozang, & New Mozang | C915: 280000 | D915: 670000
A916: =A915+1 -> 73 | B916: New Shalimar Town/Colony | C916: 250000 | D916: 680000
A917: =A916+1 -> 74 | B917: Nonarian (Western Side) | C917: 75000 | D917: 215000
A918: =A917+1 -> 75 | B918: Nonarian | C918: 250000 | D918: 645000
A919: =A918+1 -> 76 | B919: Nonarian Shalimar Road | C919: 0 | D919: 620000
A920: =A919+1 -> 77 | B920: Paki Thathi & adjoining Abadies | C920: 260000 | D920: 725000
A921: =A920+1 -> 78 | B921: Pir Ghazi Road to Chowk Baba Azam | C921: 260000 | D921: 645000
A922: =A921+1 -> 79 | B922: Poonch Road Choubrgi to Ghanda Nala | C922: 250000 | D922: 725000
A923: =A922+1 -> 80 | B923: Poonch Road falling in Samnabad Town | C923: 280000 | D923: 670000
A924: =A923+1 -> 81 | B924: Prem Nagar | C924: 200000 | D924: 540000
A925: =A924+1 -> 82 | B925: Rabani Road (Samanabad) | C925: 280000 | D925: 680000
A926: =A925+1 -> 83 | B926: Raj Garh (Old Rifle Range Road) | C926: 215000 | D926: 620000
A927: =A926+1 -> 84 | B927: Rasool Park Samanabad/Ichhra | C927: 250000 | D927: 645000
A928: =A927+1 -> 85 | B928: Rehman Pura (Ichhra) | C928: 300000 | D928: 670000
A929: =A928+1 -> 86 | B929: Rehman Pura Quarters | C929: 300000 | D929: 680000
A930: =A929+1 -> 87 | B930: Rustam Park (Nawan Kot) | C930: 250000 | D930: 645000
A931: =A930+1 -> 88 | B931: Samnabad (Block N) & adjoining Abadi | C931: 280000 | D931: 670000
A932: =A931+1 -> 89 | B932: Main Road Samanabad Chowk to Kubra Masjid | C932: 455000 | D932: 750000
A933: =A932+1 -> 90 | B933: Sanda Kalan & adjoining Abadies | C933: 215000 | D933: 540000
A934: =A933+1 -> 91 | B934: Sanda Kalan (Western Side) | C934: 75000 | D934: 270000
A935: =A934+1 -> 92 | B935: Sanda Khurd & adjoining Abadies | C935: 215000 | D935: 430000
A936: =A935+1 -> 93 | B936: Sanda Khurd (Western Side) | C936: 75000 | D936: 270000
A937: =A936+1 -> 94 | B937: Shah Farid Abad | C937: 260000 | D937: 645000
A938: =A937+1 -> 95 | B938: Shah Kamal | C938: 280000 | D938: 670000
A939: =A938+1 -> 96 | B939: Sham Nagar | C939: 215000 | D939: 565000
A940: =A939+1 -> 97 | B940: Shama Road upto Ferozepur Road | C940: 280000 | D940: 780000
A941: =A940+1 -> 98 | B941: Sharif Park (Ichhra) | C941: 260000 | D941: 645000
A942: =A941+1 -> 99 | B942: Shera Kot & adjoining Abadies | C942: 215000 | D942: 540000
A943: =A942+1 -> 100 | B943: Shera Kot 60 Feet Road | C943: 260000 | D943: 645000
A944: =A943+1 -> 101 | B944: Shera Kot (Western Side) | C944: 75000 | D944: 270000
A945: =A944+1 -> 102 | B945: Sodiwan & adjoining Abadies | C945: 250000 | D945: 645000
A946: =A945+1 -> 103 | B946: Sodiwal and its Quarters | C946: 250000 | D946: 645000
A947: =A946+1 -> 104 | B947: Tariq Colony Sodiwal | C947: 250000 | D947: 645000
A948: =A947+1 -> 105 | B948: Toheed Park | C948: 250000 | D948: 645000
A949: =A948+1 -> 106 | B949: Union Park Ichhra | C949: 260000 | D949: 645000
A950: =A949+1 -> 107 | B950: Unru Nagar | C950: 250000 | D950: 645000
A951: =A950+1 -> 108 | B951: Wahdat Road Bhekhewal more to Multan Chungi | C951: 390000 | D951: 1075000
A952: =A951+1 -> 109 | B952: Wahdat Road Muslim town More to Bhekhewal More | C952: 480000 | D952: 1450000
A953: =A952+1 -> 110 | B953: Zaildar Road | C953: 280000 | D953: 625000
A956: Rates of Cultivable Land falling in Samnabad Town, Lahore
A957: S. No. | B957: Name of Locality | C957: Rate Per Acre for External Part of River (Outside the Embankment) | D957: Rate Per Acre for External Part of River (Inside the Embankment)
A958: 1 | B958: Babu Sabu | C958: 1330000 | D958: 930000
A959: =A958+1 -> 2 | B959: Sanda Kalan | C959: 1330000 | D959: 930000
A960: =A959+1 -> 3 | B960: Sanda Khurd | C960: 1330000 | D960: 930000
A961: =A960+1 -> 4 | B961: Shera Kot | C961: 1330000 | D961: 930000
A962: =A961+1 -> 5 | B962: Nonarian | C962: 1330000 | D962: 930000
A963: =A962+1 -> 6 | B963: Bhadru | C963: 1330000 | D963: 930000
A964: =A963+1 -> 7 | B964: Chamrupur | C964: 1330000 | D964: 930000
A967: Nishter Town, Lahore
A968: S. No. | B968: Name of Locality | C968: Rate Per Marla Residential | D968: Rate Per Marla Commercial
A969: 1 | B969: A. M. Farms (Pvt.) Limited (Bagarian Dharam Chand) | C969: 80000 | D969: 175000
A970: =A969+1 -> 2 | B970: Aabara Scheme (Ameer Pura) | C970: 110000 | D970: 240000
A971: =A970+1 -> 3 | B971: Accounts Officers' Co-Operative Housing Society (Bagarian Dharam) | C971: 110000 | D971: 175000
A972: =A971+1 -> 4 | B972: Akhter State (Attari Saroba) | C972: 110000 | D972: 175000
A973: =A972+1 -> 5 | B973: Al-Ameen Co-Operative Housing Society (Lidher) | C973: 140000 | D973: 280000
A974: =A973+1 -> 6 | B974: Al-Falah Town (Chandrai) | C974: 140000 | D974: 340000
A975: =A974+1 -> 7 | B975: Ali View Garden (Keer Khurd) | C975: 170000 | D975: 310000
A976: =A975+1 -> 8 | B976: Al-Noor Town (Amer Sidhu) Walton/Cantonment Board | C976: 140000 | D976: 215000
A977: =A976+1 -> 9 | B977: Amar Sidhu & adjoining Abadies | C977: 140000 | D977: 400000
A978: =A977+1 -> 10 | B978: Ameer Pura & other Societies | C978: 130000 | D978: 340000
A979: =A978+1 -> 11 | B979: Anmol Co-Operative Society (Balhar & Dev Khurd/Kalan) | C979: 130000 | D979: 340000
A980: =A979+1 -> 12 | B980: Asif Town (Gajjumata) | C980: 130000 | D980: 310000
A981: =A980+1 -> 13 | B981: Atari Saroba & adjoining Abadies | C981: 115000 | D981: 215000
A982: =A981+1 -> 14 | B982: Audit & Accounts Co-Operative Society (Kachha Sadhoki) | C982: 110000 | D982: 135000
A983: =A982+1 -> 15 | B983: Aukaf Colony (Bagarian Dharam Chand) | C983: 110000 | D983: 225000
A984: =A983+1 -> 16 | B984: Awan Brothers Society | C984: 140000 | D984: 355000
A985: =A984+1 -> 17 | B985: Awan Colony (Bagarian Dharam Chand) | C985: 100000 | D985: 225000
A986: =A985+1 -> 18 | B986: Babul Mahair Town Christian (Lidher) | C986: 100000 | D986: 190000
A987: =A986+1 -> 19 | B987: Badian Road (Ahead Bhata Chcowk to Elite Centre) | C987: 125000 | D987: 240000
A988: =A987+1 -> 20 | B988: Badian Road (Aray Bazar to Bhata Chowk) | C988: 430000 | D988: 430000
A989: =A988+1 -> 21 | B989: Bagrian Dharam Chand | C989: 110000 | D989: 170000
A990: =A989+1 -> 22 | B990: Balhar | C990: 125000 | D990: 170000
A991: =A990+1 -> 23 | B991: Bankers' Co-Operative Society (Kamahan) | C991: 160000 | D991: 280000
A992: =A991+1 -> 24 | B992: Cavalry Ground Old & Extension | C992: 345000 | D992: 1450000
A993: =A992+1 -> 25 | B993: Chandrai | C993: 110000 | D993: 325000
A994: =A993+1 -> 26 | B994: Charrar & adjoining Abadies | C994: 200000 | D994: 340000
A995: =A994+1 -> 27 | B995: Chung Khurd | C995: 140000 | D995: 340000
A996: =A995+1 -> 28 | B996: Co-Operative Society LHC (Bagarian Dharam Chand) | C996: 75000 | D996: 125000
A997: =A996+1 -> 29 | B997: Defence Fort Scheme (Pvt.) Limited (Amer Sadhu) WCB | C997: 170000 | D997: 420000
A998: =A997+1 -> 30 | B998: Defence Garden | C998: 160000 | D998: 400000
A999: =A998+1 -> 31 | B999: Defence Phase VIII | C999: 135000 | D999: 620000
A1000: =A999+1 -> 32 | B1000: Defence Phase I, Section K | C1000: 400000 | D1000: 995000
A1001: =A1000+1 -> 33 | B1001: Defence Phase VI | C1001: 125000 | D1001: 465000
A1002: =A1001+1 -> 34 | B1002: Defence Phase VII | C1002: 110000 | D1002: 365000
A1003: =A1002+1 -> 35 | B1003: Defence Phase - I | C1003: 375000 | D1003: 995000
A1004: =A1003+1 -> 36 | B1004: Defence Phase - II | C1004: 320000 | D1004: 995000
A1005: =A1004+1 -> 37 | B1005: Defence Phase - III | C1005: 320000 | D1005: 995000
A1006: =A1005+1 -> 38 | B1006: Defence Phase - IV | C1006: 310000 | D1006: 995000
A1007: =A1006+1 -> 39 | B1007: Defence Phase - V | C1007: 145000 | D1007: 670000
A1008: =A1007+1 -> 40 | B1008: Defence Road (Bhobatian to Kachha Phatak) | C1008: 90000 | D1008: 215000
A1009: =A1008+1 -> 41 | B1009: Dev. Khurd Kalan | C1009: 110000 | D1009: 270000
A1010: =A1009+1 -> 42 | B1010: Deveolopers Groups Scheme (Korey) | C1010: 165000 | D1010: 390000
A1011: =A1010+1 -> 43 | B1011: DHA Blocks & Z of Phase - III | C1011: 430000 | D1011: 1940000
A1012: =A1011+1 -> 44 | B1012: DHA Phase - IX & XI | C1012: 65000 | D1012: 150000
A1013: =A1012+1 -> 45 | B1013: DHA Rahbar Sector (Balloki) | C1013: 100000 | D1013: 210000
A1014: =A1013+1 -> 46 | B1014: Dubai Town (Bhoptian) | C1014: 95000 | D1014: 130000
A1015: =A1014+1 -> 47 | B1015: Dulu Kalan | C1015: 90000 | D1015: 295000
A1016: =A1015+1 -> 48 | B1016: Dulu Khurd | C1016: 110000 | D1016: 280000
A1017: =A1016+1 -> 49 | B1017: Eden Cottage adjacent Defence | C1017: 350000 | D1017: 495000
A1018: =A1017+1 -> 50 | B1018: Eden Scheme (Dulu Khurd/Gajjumatta) | C1018: 110000 | D1018: 225000
A1019: =A1018+1 -> 51 | B1019: Eden Society (Bagrian Dharam Chand) | C1019: 110000 | D1019: 225000
A1020: =A1019+1 -> 52 | B1020: Eden Line Villa (Bhoptian) | C1020: 110000 | D1020: 225000
A1021: =A1020+1 -> 53 | B1021: Faisal Town (Gujumatta) | C1021: 110000 | D1021: 280000
A1022: =A1021+1 -> 54 | B1022: Farooq Colony (Korey/Amer Sadhu) WBC | C1022: 160000 | D1022: 275000
A1023: =A1022+1 -> 55 | B1023: Feroze Pur Road (Kahna to Gulvehra) | C1023: 225000 | D1023: 225000
A1024: =A1023+1 -> 56 | B1024: Feroze Pur Road (Kot Lakhpat to Gujumatta) | C1024: 670000 | D1024: 670000
A1025: =A1024+1 -> 57 | B1025: Feroze Pur Road Ganda Nala to Amer Sadhu | C1025: 450000 | D1025: 1020000
A1026: =A1025+1 -> 58 | B1026: Gajumatta & adjoining Abadies | C1026: 95000 | D1026: 190000
A1027: =A1026+1 -> 59 | B1027: Ghausia Colony (Korey) | C1027: 175000 | D1027: 300000
A1028: =A1027+1 -> 60 | B1028: Ghazi Road (Amer Sadhu) | C1028: 565000 | D1028: 565000
A1029: =A1028+1 -> 61 | B1029: Galaxo Town (Dulu Khurd & Kalan) | C1029: 95000 | D1029: 190000
A1030: =A1029+1 -> 62 | B1030: Golden Earth (Pvt.) Limited (Bagarian Dharam Chand) | C1030: 110000 | D1030: 210000
A1031: =A1030+1 -> 63 | B1031: Government Transport HQ Co-Operative Housing Society (Balher) | C1031: 85000 | D1031: 185000
A1032: =A1031+1 -> 64 | B1032: Green Acre Scheme (Ameer Pura) | C1032: 110000 | D1032: 215000
A1033: =A1032+1 -> 65 | B1033: Green Cap Scheme (Gajjumatta) | C1033: 95000 | D1033: 160000
A1034: =A1033+1 -> 66 | B1034: Green Town | C1034: 195000 | D1034: 375000
A1035: =A1034+1 -> 67 | B1035: Gulshan-e-Ahbab Phase II & Shadab Colony (Chandrai) | C1035: 145000 | D1035: 365000
A1036: =A1035+1 -> 68 | B1036: Gulshan-e-Awan Society (Nanger) | C1036: 80000 | D1036: 150000
A1037: =A1036+1 -> 69 | B1037: Gulshan-e-Munir Scheme (Gajjumatta) | C1037: 85000 | D1037: 150000
A1038: =A1037+1 -> 70 | B1038: Gulistan Colony (Amer Sadhu) | C1038: 145000 | D1038: 340000
A1039: =A1038+1 -> 71 | B1039: Guli Kot (Dulu Kalan & Khurd) | C1039: 80000 | D1039: 225000
A1040: =A1039+1 -> 72 | B1040: Gurrumangat (WCB) | C1040: 240000 | D1040: 565000
A1041: =A1040+1 -> 73 | B1041: HBFC Society (Kahaman/Leel) | C1041: 95000 | D1041: 190000
A1042: =A1041+1 -> 74 | B1042: Herpalkey | C1042: 65000 | D1042: 110000
A1043: =A1042+1 -> 75 | B1043: Humza Town (Dulu Khurd & Kalan) | C1043: 125000 | D1043: 215000
A1044: =A1043+1 -> 76 | B1044: E. I. P. M. Society | C1044: 120000 | D1044: 190000
A1045: =A1044+1 -> 77 | B1045: I. S. R. M. Co-Operative Society (Bhobatian) | C1045: 75000 | D1045: 125000
A1046: =A1045+1 -> 78 | B1046: Iqbal Park & New Iqbal Park (Korey) | C1046: 190000 | D1046: 450000
A1047: =A1046+1 -> 79 | B1047: Irrigation Co-Operative Society (Chandrai) | C1047: 100000 | D1047: 160000
A1048: =A1047+1 -> 80 | B1048: Islamic Research Co-Operative Society (Bhobatian) | C1048: 100000 | D1048: 195000
A1049: =A1048+1 -> 81 | B1049: Jadha Town (Dulu Khurd & Kalan) | C1049: 95000 | D1049: 175000
A1050: =A1049+1 -> 82 | B1050: Jail Road (Katch towards Chungi) | C1050: 120000 | D1050: 375000
A1051: =A1050+1 -> 83 | B1051: Jathol (WCB) | C1051: 85000 | D1051: 140000
A1052: =A1051+1 -> 84 | B1052: K. C. H. Co-Operative Society (Sadhoki) | C1052: 110000 | D1052: 225000
A1053: =A1052+1 -> 85 | B1053: K. E. Medical College Cooperative Society (Sadkoki/Halloki) | C1053: 90000 | D1053: 180000
A1054: =A1053+1 -> 86 | B1054: Kachha Road (Kahna Nau to Railway Phatak Kacha) | C1054: 75000 | D1054: 125000
A1055: =A1054+1 -> 87 | B1055: Kahna Nau (Inside Town Committee) | C1055: 50000 | D1055: 175000
A1056: =A1055+1 -> 88 | B1056: Kamahan | C1056: 90000 | D1056: 160000
A1057: =A1056+1 -> 89 | B1057: Kamahan Road both side (Attari Saroba & Amer Sadhu) | C1057: 225000 | D1057: 225000
A1058: =A1057+1 -> 90 | B1058: Keer Kalan | C1058: 120000 | D1058: 250000
A1059: =A1058+1 -> 91 | B1059: Keer Khurd | C1059: 140000 | D1059: 270000
A1060: =A1059+1 -> 92 | B1060: Khalid Town (Gajjumatta) | C1060: 140000 | D1060: 270000
A1061: =A1060+1 -> 93 | B1061: Khaliq Nagar (Dulu Khurd) | C1061: 120000 | D1061: 270000
A1062: =A1061+1 -> 94 | B1062: Khayaban-e-Amin (Dulu Kalan) | C1062: 140000 | D1062: 270000
A1063: =A1062+1 -> 95 | B1063: Khayaban-e-Amin Scheme (Halloki) | C1063: 60000 | D1063: 140000
A1064: =A1063+1 -> 96 | B1064: Koh-i-Noor Scheme (Amer Sadhu) WCB | C1064: 145000 | D1064: 390000
A1065: =A1064+1 -> 97 | B1065: Korey & adjoining Abadies | C1065: 150000 | D1065: 310000
A1066: =A1065+1 -> 98 | B1066: Kot Lakhpat (Industrial Area) | C1066: 565000 | D1066: 620000
A1067: =A1066+1 -> 99 | B1067: Kot Lakhpat (Jurisdiction (N. T.)) | C1067: 225000 | D1067: 450000
A1068: =A1067+1 -> 100 | B1068: Lake City Holding (Pvt.) Limited | C1068: 150000 | D1068: 260000
A1069: =A1068+1 -> 101 | B1069: Lidhar & adjoining Abadies (WCB) | C1069: 120000 | D1069: 240000
A1070: =A1069+1 -> 102 | B1070: M/s. Industrial Cooperative Housing Society | C1070: 140000 | D1070: 215000
A1071: =A1070+1 -> 103 | B1071: M/s. Lahore Garden (Elite) Co-Operative Society (Khana Nau) | C1071: 90000 | D1071: 175000
A1072: =A1071+1 -> 104 | B1072: M/s. Overseas Co-Operative Society (Bagarian Dharam Chand) | C1072: 100000 | D1072: 210000
A1073: =A1072+1 -> 105 | B1073: Madina Colony (Koray) | C1073: 145000 | D1073: 400000
A1074: =A1073+1 -> 106 | B1074: Madina Town/Madina Garden (Gajjumatta & Dulu Kalan) | C1074: 140000 | D1074: 210000
A1075: =A1074+1 -> 107 | B1075: Main Boulevard Defence Khayaban-e-Jinnah | C1075: 180000 | D1075: 1775000
A1076: =A1075+1 -> 108 | B1076: Main Boulevard Khabayan-e-Iqbal LDA | C1076: 150000 | D1076: 1450000
A1077: =A1076+1 -> 109 | B1077: Main Raiwind Road (Ali Raza Abad to Bhobatian) | C1077: 150000 | D1077: 365000
A1078: =A1077+1 -> 110 | B1078: Main Raiwind Road (Bhobatian to Paji) | C1078: 120000 | D1078: 250000
A1079: =A1078+1 -> 111 | B1079: Military Accounts Co-Operative Society (Bagrian) | C1079: 150000 | D1079: 270000
A1080: =A1079+1 -> 112 | B1080: Millat Tractor Employees' Co-Operative Society (Kachha) | C1080: 60000 | D1080: 120000
A1081: =A1080+1 -> 113 | B1081: NBP Officers' Co-Operative Society (Kamahan) | C1081: 140000 | D1081: 200000
A1082: =A1081+1 -> 114 | B1082: Nangar | C1082: 60000 | D1082: 110000
A1083: =A1082+1 -> 115 | B1083: National Industrial Finance Co-Operative Society | C1083: 140000 | D1083: 215000
A1084: =A1083+1 -> 116 | B1084: Nau Bahar Society | C1084: 120000 | D1084: 190000
A1085: =A1084+1 -> 117 | B1085: Naz Town (Sadhoki) | C1085: 135000 | D1085: 210000
A1086: =A1085+1 -> 118 | B1086: Neshaman Park/Town Colony | C1086: 140000 | D1086: 215000
A1087: =A1086+1 -> 119 | B1087: Nishat Colony (WCB) (Chung Khurd) | C1087: 160000 | D1087: 280000
A1088: =A1087+1 -> 120 | B1088: Nishter Colony | C1088: 140000 | D1088: 215000
A1089: =A1088+1 -> 121 | B1089: Officers' Colony Cavalary Ground | C1089: 340000 | D1089: 915000
A1090: =A1089+1 -> 122 | B1090: Officials' Co-Operative Society (Bagarian Dharam Chand) | C1090: 100000 | D1090: 200000
A1091: =A1090+1 -> 123 | B1091: Overhead Bridge to Chowk Cavalary Ground | C1091: 0 | D1091: 1720000
A1092: =A1091+1 -> 124 | B1092: Overseas Pakistanis Foundation Society (Ameer) | C1092: 140000 | D1092: 340000
A1093: =A1092+1 -> 125 | B1093: PCSIR (Staff) Co-Operative Society (Sadhoki/Bagarian) | C1093: 120000 | D1093: 250000
A1094: =A1093+1 -> 126 | B1094: Pak Arab Society (Chandari) | C1094: 170000 | D1094: 340000
A1095: =A1094+1 -> 127 | B1095: Pakistan Medical Co-Operative Society (Tarugill) | C1095: 90000 | D1095: 175000
A1096: =A1095+1 -> 128 | B1096: Pakistan Ranger Co-Operative Society (Sadhoki) | C1096: 110000 | D1096: 200000
A1097: =A1096+1 -> 129 | B1097: Phamanites Society(Kamahan Leel Kot Wadava & Jathol) | C1097: 105000 | D1097: 200000
A1098: =A1097+1 -> 130 | B1098: Phed Co-Operative Society (Bhobatian) | C1098: 90000 | D1098: 150000
A1099: =A1098+1 -> 131 | B1099: Punjab Co-Operative Society (Amer Sadhu & Kamahan) | C1099: 215000 | D1099: 430000
A1100: =A1099+1 -> 132 | B1100: Punjab Park (Phase I & III (Chajjumatta)) | C1100: 100000 | D1100: 200000
A1101: =A1100+1 -> 133 | B1101: Punjab Small Industry Co-Operative Society (Chung Khurd & Lidher) | C1101: 190000 | D1101: 390000
A1102: =A1101+1 -> 134 | B1102: Quaid-e-Azam Industrial Estate | C1102: 495000 | D1102: 495000
A1103: =A1102+1 -> 135 | B1103: R. A. Bazar & adjoining Abadies | C1103: 170000 | D1103: 340000
A1104: =A1103+1 -> 136 | B1104: Rehman Garden (Chung Khurd) | C1104: 170000 | D1104: 340000
A1105: =A1104+1 -> 137 | B1105: Roranwala | C1105: 50000 | D1105: 65000
A1106: =A1105+1 -> 138 | B1106: Saadat Co-Operative Society (Bagarian Dharanm Chand & adjoining Abadies) | C1106: 120000 | D1106: 190000
A1107: =A1106+1 -> 139 | B1107: Sadhokey | C1107: 120000 | D1107: 215000
A1108: =A1107+1 -> 140 | B1108: Sargodha Co-Operative Society (Bhobatian) | C1108: 120000 | D1108: 190000
A1109: =A1108+1 -> 141 | B1109: Saroba Garden (Attari Saroba) | C1109: 120000 | D1109: 215000
A1110: =A1109+1 -> 142 | B1110: Shah Taj Colony (Korey) | C1110: 190000 | D1110: 322000
A1111: =A1110+1 -> 143 | B1111: Shalimar Town (Gajjumatta) | C1111: 100000 | D1111: 190000
A1112: =A1111+1 -> 144 | B1112: Sharifabad Town (Gajjumatta) | C1112: 100000 | D1112: 210000
A1113: =A1112+1 -> 145 | B1113: Shaukat Town (Amer Sadhu) WCB | C1113: 170000 | D1113: 340000
A1114: =A1113+1 -> 146 | B1114: Sheraz Villas 9I & II) (Korey) | C1114: 170000 | D1114: 340000
A1115: =A1114+1 -> 147 | B1115: Sitara Colony (Amer Sadhu) | C1115: 150000 | D1115: 310000
A1116: =A1115+1 -> 148 | B1116: State Life (Herpalkay/De) | C1116: 145000 | D1116: 260000
A1117: =A1116+1 -> 149 | B1117: State Life Scheme (Kamahan) | C1117: 172000 | D1117: 340000
A1118: =A1117+1 -> 150 | B1118: Sui Northern Officers' Society (Kamahan) | C1118: 145000 | D1118: 280000
A1119: =A1118+1 -> 151 | B1119: Super Town & New Super Town (Korey) | C1119: 190000 | D1119: 485000
A1120: =A1119+1 -> 152 | B1120: Superior Court co-Operative Society (Ameer Pura) | C1120: 100000 | D1120: 215000
A1121: =A1120+1 -> 153 | B1121: T & T Employees' Co-Operative Scheme (Ameer Pura) | C1121: 75000 | D1121: 150000
A1122: =A1121+1 -> 154 | B1122: Tahait | C1122: 80000 | D1122: 110000
A1123: =A1122+1 -> 155 | B1123: Tariq Garden Scheme (Sadhoki) | C1123: 110000 | D1123: 200000
A1124: =A1123+1 -> 156 | B1124: Telecommunication co-Operative Society (Bhobatian) | C1124: 100000 | D1124: 200000
A1125: =A1124+1 -> 157 | B1125: The Co-Operative Engineering Town (Nangar) | C1125: 170000 | D1125: 340000
A1126: =A1125+1 -> 158 | B1126: TIPM Co-Operative Society (Sadhoki) | C1126: 90000 | D1126: 175000
A1127: =A1126+1 -> 159 | B1127: Township Scheme | C1127: 180000 | D1127: 420000
A1128: =A1127+1 -> 160 | B1128: UET Employees' Co-Operative Society (Sadhoki) | C1128: 100000 | D1128: 200000
A1129: =A1128+1 -> 161 | B1129: Venus Scheme (Attari Saroba & Chandrai) | C1129: 120000 | D1129: 190000
A1130: =A1129+1 -> 162 | B1130: Waheed Brothers' Colony (Attari Saroba) | C1130: 120000 | D1130: 215000
A1131: =A1130+1 -> 163 | B1131: Walton Road | C1131: 860000 | D1131: 860000
A1132: =A1131+1 -> 164 | B1132: Yasin Town (Amer Sadhu) WCB | C1132: 150000 | D1132: 280000
A1133: =A1132+1 -> 165 | B1133: Younhanabad | C1133: 110000 | D1133: 215000
A1134: =A1133+1 -> 166 | B1134: Yousaf Town (Attari Saroba) | C1134: 120000 | D1134: 200000
A1135: =A1134+1 -> 167 | B1135: Zahoor Town | C1135: 120000 | D1135: 200000
A1136: =A1135+1 -> 168 | B1136: Zam Zam Scheme (Pvt.) (Kachha) | C1136: 90000 | D1136: 175000
A1137: =A1136+1 -> 169 | B1137: Zaman Park (Korey) | C1137: 160000 | D1137: 320000
A1140: Wahga Town, Lahore
A1141: S. No. | B1141: Name of Locality | C1141: Rate Per Marla Residential | D1141: Rate Per Marla Commercial
A1142: 1 | B1142: Abdullah Garden | C1142: 95000 | D1142: 160000
A1143: =A1142+1 -> 2 | B1143: Ahmed Town Shadi Pura | C1143: 60000 | D1143: 135000
A1144: =A1143+1 -> 3 | B1144: Al-Karim Garden | C1144: 95000 | D1144: 150000
A1145: =A1144+1 -> 4 | B1145: Al-Ahmed Garden G. T. Road | C1145: 95000 | D1145: 160000
A1146: =A1145+1 -> 5 | B1146: AL-Ghani Garden G. T. Road | C1146: 80000 | D1146: 160000
A1147: =A1146+1 -> 6 | B1147: Ali Alam Garden | C1147: 95000 | D1147: 160000
A1148: =A1147+1 -> 7 | B1148: Al-Raheem Garden, Phase V | C1148: 95000 | D1148: 160000
A1149: =A1148+1 -> 8 | B1149: Al-Raheem Garden Phase I, II, & IV, G. T. Road | C1149: 95000 | D1149: 160000
A1150: =A1149+1 -> 9 | B1150: Ashrif Garden | C1150: 110000 | D1150: 160000
A1151: =A1150+1 -> 10 | B1151: Asid Garden | C1151: 85000 | D1151: 160000
A1152: =A1151+1 -> 11 | B1152: Aziz Garden | C1152: 80000 | D1152: 135000
A1153: =A1152+1 -> 12 | B1153: Canal Bank Scheme | C1153: 120000 | D1153: 225000
A1154: =A1153+1 -> 13 | B1154: Canal Point Salamat Pura | C1154: 160000 | D1154: 215000
A1155: =A1154+1 -> 14 | B1155: Canal View Houseing Scheme | C1155: 110000 | D1155: 190000
A1156: =A1155+1 -> 15 | B1156: Darogah Wala | C1156: 110000 | D1156: 215000
A1157: =A1156+1 -> 16 | B1157: Darogha Wala Chowk to Ring Road Mehmood Booti | C1157: 130000 | D1157: 445000
A1158: =A1157+1 -> 17 | B1158: Devi Pura (UC 38) | C1158: 110000 | D1158: 215000
A1159: =A1158+1 -> 18 | B1159: Garision Garden (Kotly Ghasi) | C1159: 135000 | D1159: 215000
A1160: =A1159+1 -> 19 | B1160: Gulshan Shalimar Scheme | C1160: 130000 | D1160: 270000
A1161: =A1160+1 -> 20 | B1161: Gulshan-e-Dawood | C1161: 80000 | D1161: 110000
A1162: =A1161+1 -> 21 | B1162: Gulshan-e-Haider | C1162: 135000 | D1162: 215000
A1163: =A1162+1 -> 22 | B1163: Gulshan-e-Yasin | C1163: 55000 | D1163: 90000
A1164: =A1163+1 -> 23 | B1164: Hanif Park | C1164: 135000 | D1164: 215000
A1165: =A1164+1 -> 24 | B1165: IBL Home, Jallo Town | C1165: 80000 | D1165: 135000
A1166: =A1165+1 -> 25 | B1166: Kotli Ghasi | C1166: 85000 | D1166: 140000
A1167: =A1166+1 -> 26 | B1167: Lahore Medical Houseing Scheme Phases | C1167: 135000 | D1167: 215000
A1168: =A1167+1 -> 27 | B1168: Lahore Ring Road falling Wahga Town | C1168: 215000 | D1168: 225000
A1169: =A1168+1 -> 28 | B1169: Lakhodair | C1169: 65000 | D1169: 150000
A1170: =A1169+1 -> 29 | B1170: Lidhar | C1170: 120000 | D1170: 240000
A1171: =A1170+1 -> 30 | B1171: Main G. T. Road from Sukh Nehar to Wara Sattar | C1171: 350000 | D1171: 485000
A1172: =A1171+1 -> 31 | B1172: Manawan | C1172: 95000 | D1172: 265000
A1173: =A1172+1 -> 32 | B1173: Madsudan Pura | C1173: 105000 | D1173: 215000
A1174: =A1173+1 -> 33 | B1174: Mehmood Booti | C1174: 105000 | D1174: 225000
A1175: =A1174+1 -> 34 | B1175: Moeez Town | C1175: 135000 | D1175: 215000
A1176: =A1175+1 -> 35 | B1176: Momen Pura | C1176: 120000 | D1176: 250000
A1177: =A1176+1 -> 36 | B1177: New Shalimar Scheme (Salamat Pura) | C1177: 160000 | D1177: 225000
A1178: =A1177+1 -> 37 | B1178: Qila Khazana | C1178: 85000 | D1178: 200000
A1179: =A1178+1 -> 38 | B1179: Rizwan Garden | C1179: 160000 | D1179: 240000
A1180: =A1179+1 -> 39 | B1180: Salamat Pura | C1180: 110000 | D1180: 215000
A1181: =A1180+1 -> 40 | B1181: Shadi Pura | C1181: 90000 | D1181: 215000
A1182: =A1181+1 -> 41 | B1182: Shalimar Town, Baghbanpura | C1182: 155000 | D1182: 400000
A1183: =A1182+1 -> 42 | B1183: Sharif Garden | C1183: 135000 | D1183: 240000
A1184: =A1183+1 -> 43 | B1184: Sultan Mahmood Road (Baghbanpura UC 37 & 38) | C1184: 160000 | D1184: 270000
A1185: =A1184+1 -> 44 | B1185: Tufail Garden | C1185: 90000 | D1185: 110000
A1186: =A1185+1 -> 45 | B1186: Wara Sattar to Jallo More (Canal BRB Bridge) | C1186: 240000 | D1186: 240000
A1189: Rates of Cultivable Land falling in Wahga Town, Lahore
A1190: S. No. | B1190: Name of Locality | C1190: Rate Per Acre
A1191: 1 | B1191: Lakho Dair | C1191: 2380000
A1192: =A1191+1 -> 2 | B1192: Mehmood Booti Bund Road (Both Side) | C1192: 2340000
A1193: =A1192+1 -> 3 | B1193: Moman Pura (Both Side) | C1193: 4080000
A1194: =A1193+1 -> 4 | B1194: Kotli Ghasi Bund Road (Both Side) | C1194: 4080000
A1195: =A1194+1 -> 5 | B1195: Lidhar | C1195: 3850000
A1196: =A1195+1 -> 6 | B1196: Baghbanpura | C1196: 3650000
A1198: Note:--- Error & omission excepted. Let us know if you find any mistake in Valuation Table.
A1200: Thursday July 01, 2010
A1202: Reproduced by: M/s. Nasir Law Associates (Jurists' House)
A1203: for the convenience of general public.
A1204: Contact: 042-35060468, 0333-4076420, 0312-4624078, & 0321-4624078
A1206: Back