A1: The Punjab Gazette
A2: PUBLISHED BY AUTHORITY
A4: LAHORE SATURDAY JUNE 30, 2012
A6: OFFICE OF THE DISTRICT COLLECTOR, LAHORE
C8: No. HRC/5194
C9: Dated: 30-06-2012
A11: NOTIFICATION
A13: In exercise of the powers conferred upon me by under Section 27-A of the Stamp Act, 1899, and as amended, I, Noor-ul-Amin Mengal, Disctrict Collector, Lahore, do hereby notify the urban valuation table showing assessment of land falling in each locality for computation of ad-valorem Stamp Duty in urban areas of District Lahore. These rates shall be applicable as specified in the schedule herewith. The Notification shall be operative with effect from 01.07.2012.
C16: (NOOR-UL-AMIN MENGAL)
C17: District Collector
C18: Lahore
A19: (01)
A21: Valuation Table (City District Government, Lahore)
A22: with effect from July 01, 2012
A23: Last updated
A24: =TODAY() -> 41147
A26: Aziz Bhatti Town, Lahore
A27: S. No. | B27: Name of Locality | C27: Rate Per Marla Residential | D27: Rate Per Marla Commercial
A28: 1 | B28: Al-Faisal Town | C28: 142000 | D28: 680000
A29: =A28+1 -> 2 | B29: Allama Iqbal Road | C29: 290000 | D29: 680000
A30: =A29+1 -> 3 | B30: Ameer-ud-Din Park | C30: 156000 | D30: 300000
A31: =A30+1 -> 4 | B31: Amir Town | C31: 156000 | D31: 300000
A32: =A31+1 -> 5 | B32: Arazi Sehjpaal (Excluding DHA) | C32: 80000 | D32: 145000
A33: =A32+1 -> 6 | B33: Arif Abad (Near Beadon Road) | C33: 75000 | D33: 160000
A34: =A33+1 -> 7 | B34: Bahar Shah Road | C34: 142000 | D34: 285000
A35: =A34+1 -> 8 | B35: Baidian Road, Bhatta Chowk to Office Elite Town | C35: 70000 | D35: 230000
A36: =A35+1 -> 9 | B36: Bedian Road R. A. Bazar to Bhatta Chowk | C36: 156000 | D36: 405000
A37: =A36+1 -> 10 | B37: Bridge Colony | C37: 340000 | D37: 630000
A38: =A37+1 -> 11 | B38: CMA Colony | C38: 278000 | D38: 630000
A39: =A38+1 -> 12 | B39: Canal Bank Road Dharampura Bridge (Both Sides) | C39: 315000 | D39: 470000
A40: =A39+1 -> 13 | B40: Cantonment Roads | C40: 385000 | D40: 640000
A41: =A40+1 -> 14 | B41: Chandian | C41: 79000 | D41: 225000
A42: =A41+1 -> 15 | B42: Chung Khurd (LCB) | C42: 158000 | D42: 685000
A43: =A42+1 -> 16 | B43: Defence Road (Bhatta Chowk to Chungi Mehfooz Pura) | C43: 447000 | D43: 870000
A44: =A43+1 -> 17 | B44: Fateh Garh & Adjoining Areas | C44: 139000 | D44: 210000
A45: =A44+1 -> 18 | B45: Ghazi Abad / Kumharpura | C45: 100000 | D45: 325000
A46: =A45+1 -> 19 | B46: Gohawa & Adjoining Areas | C46: 95000 | D46: 210000
A47: =A46+1 -> 20 | B47: Gul Dasht Town | C47: 200000 | D47: 280000
A48: =A47+1 -> 21 | B48: Gulistan Colony | C48: 158000 | D48: 300000
A49: =A48+1 -> 22 | B49: Gunj | C49: 210000 | D49: 370000
A50: =A49+1 -> 23 | B50: Guru Maangat (LCB) | C50: 230000 | D50: 580000
A51: =A50+1 -> 24 | B51: Herbenspura | C51: 93000 | D51: 105000
A52: =A51+1 -> 25 | B52: Infantry Road | C52: 263000 | D52: 420000
A53: =A52+1 -> 26 | B53: Jhuggian Alfa | C53: 90000 | D53: 175000
A54: =A53+1 -> 27 | B54: Joray Bridge to Harbansepura Bridge | C54: 127000 | D54: 510000
A55: =A54+1 -> 28 | B55: Kohaar & Adjoining Areas | C55: 100000 | D55: 310000
A56: =A55+1 -> 29 | B56: Kotli Pir Abdul Rahman | C56: 152000 | D56: 260000
A57: =A56+1 -> 30 | B57: Lidhar & Adjoining Areas | C57: 115000 | D57: 220000
A58: =A57+1 -> 31 | B58: Malik Pur | C58: 105000 | D58: 265000
A59: =A58+1 -> 32 | B59: Mian Meer | C59: 221000 | D59: 447000
A60: =A59+1 -> 33 | B60: Mugharpura | C60: 210000 | D60: 350000
A61: =A60+1 -> 34 | B61: Mustafa Abad | C61: 205000 | D61: 350000
A62: =A61+1 -> 35 | B62: Mustafa Abad (Dharampura) Main Bazar | C62: 0 | D62: 420000
A63: =A62+1 -> 36 | B63: Nadir Abad (Sehajpal) | C63: 132000 | D63: 265000
A64: =A63+1 -> 37 | B64: New Canal Park & Canal Park | C64: 163000 | D64: 315000
A65: =A64+1 -> 38 | B65: Nizam Abad Harbanspura | C65: 127000 | D65: 290000
A66: =A65+1 -> 39 | B66: Noor Pur Kambohan (Mustafaabad) | C66: 230000 | D66: 347000
A67: =A66+1 -> 40 | B67: Officer Colony Ghazi Abad Road | C67: 288000 | D67: 520000
A68: =A67+1 -> 41 | B68: Rasheed Pura | C68: 158000 | D68: 370000
A69: =A68+1 -> 42 | B69: Sadar Bazar | C69: 230000 | D69: 580000
A70: =A69+1 -> 43 | B70: Sadar Bazar to Chungi Mahfoozpura | C70: 288000 | D70: 465000
A71: =A70+1 -> 44 | B71: Sahowari | C71: 195000 | D71: 340000
A72: =A71+1 -> 45 | B72: Saint John Park | C72: 254000 | D72: 640000
A73: =A72+1 -> 46 | B73: Salli Town | C73: 184000 | D73: 300000
A74: =A73+1 -> 47 | B74: Sehjpal & Adjoining Areas | C74: 127000 | D74: 255000
A75: =A74+1 -> 48 | B75: Shalimar Link Road Canal to PS Mughalpura Main | C75: 405000 | D75: 578000
A76: =A75+1 -> 49 | B76: Shiv Pura | C76: 98000 | D76: 255000
A77: =A76+1 -> 50 | B77: Taj Bagh Housing Scheme | C77: 158000 | D77: 300000
A78: =A77+1 -> 51 | B78: Taj Pura | C78: 116000 | D78: 230000
A79: =A78+1 -> 52 | B79: Taj Pura Scheme | C79: 230000 | D79: 410000
A82: Data Gunj Bakhsh Town, Lahore
A83: S. No. | B83: Name of Locality | C83: Rate Per Marla Residential | D83: Rate Per Marla Commercial
A84: 1 | B84: Anarkali (New) | C84: 0 | D84: 1750000
A85: =A84+1 -> 2 | B85: Afzal Road Sanda (Revenue Estate Nawan Kot) | C85: 200000 | D85: 475000
A86: =A85+1 -> 3 | B86: Alfazal Road Sanda (Revenue Estate Nawan Kot) | C86: 200000 | D86: 475000
A87: =A86+1 -> 4 | B87: Abdali Road | C87: 200000 | D87: 630000
A88: =A87+1 -> 5 | B88: Abbott Road | C88: 0 | D88: 1150000
A89: =A88+1 -> 6 | B89: Abdul Kareem Road (Qila Gujjar Singh) | C89: 290000 | D89: 800000
A90: =A89+1 -> 7 | B90: Anarkali (Old) | C90: 290000 | D90: 775000
A91: =A90+1 -> 8 | B91: Ashrafia Colony Shadman | C91: 290000 | D91: 575000
A92: =A91+1 -> 9 | B92: Ansari Road | C92: 200000 | D92: 420000
A93: =A92+1 -> 10 | B93: Aabkari Road | C93: 0 | D93: 900000
A94: =A93+1 -> 11 | B94: Ameer/Amir Road (Bilal Ganj) | C94: 200000 | D94: 630000
A95: =A94+1 -> 12 | B95: Aibak Road | C95: 0 | D95: 775000
A96: =A95+1 -> 13 | B96: Bird Wood Road | C96: 0 | D96: 525000
A97: =A96+1 -> 14 | B97: Bank Square | C97: 0 | D97: 1750000
A98: =A97+1 -> 15 | B98: Bull Road | C98: 0 | D98: 625000
A99: =A98+1 -> 16 | B99: Beaden Road | C99: 0 | D99: 1750000
A100: =A99+1 -> 17 | B100: Beaden Road (Streets) | C100: 425000 | D100: 625000
A101: =A100+1 -> 18 | B101: Bilal Gunj & Adjoining Abadies | C101: 230000 | D101: 575000
A102: =A101+1 -> 19 | B102: Bagh Munshi Ladha | C102: 190000 | D102: 450000
A103: =A102+1 -> 20 | B103: Begum Road | C103: 230000 | D103: 525000
A104: =A103+1 -> 21 | B104: Bagh Gul Begum | C104: 230000 | D104: 475000
A105: =A104+1 -> 22 | B105: Bilal Ganj (Kabari Market) | C105: 0 | D105: 625000
A106: =A105+1 -> 23 | B106: Bund Road Sagian to Toll Plaza | C106: 190000 | D106: 450000
A107: =A106+1 -> 24 | B107: Bahawalpur Road | C107: 230000 | D107: 725000
A108: =A107+1 -> 25 | B108: Bund Paar (Western Side) | C108: 70000 | D108: 250000
A109: =A108+1 -> 26 | B109: Circular Road | C109: 0 | D109: 1300000
A110: =A109+1 -> 27 | B110: Chamber Lane Road | C110: 0 | D110: 725000
A111: =A110+1 -> 28 | B111: Chohan Park Road | D111: 475000
A112: =A111+1 -> 29 | B112: Chohan park | C112: 190000 | D112: 475000
A113: =A112+1 -> 30 | B113: Court Street | C113: 0 | D113: 575000
A114: =A113+1 -> 31 | B114: Court Road | C114: 290000 | D114: 825000
A115: =A114+1 -> 32 | B115: Chak Jia Musa | C115: 230000 | D115: 500000
A116: =A115+1 -> 33 | C116: 85000 | D116: 260000
A117: =A116+1 -> 34
A118: =A117+1 -> 35 | B118: Chak kot Begum Bund Par | C118: 0 | D118: 900000
A119: =A118+1 -> 36 | B119: Chak Jia Musa Bund Park | C119: 300000 | D119: 600000
A120: =A119+1 -> 37 | B120: Cooper Road | C120: 0 | D120: 1150000
A121: =A120+1 -> 38 | B121: Canal Bank Road Both Sides falling in DGBT | C121: 420000 | D121: 780000
A122: =A121+1 -> 39 | B122: Chowk Choburgi | C122: 0 | D122: 900000
A123: =A122+1 -> 40 | B123: Captain Jamal Road | C123: 230000 | D123: 620000
A124: =A123+1 -> 41 | B124: Church Road | C124: 150000 | D124: 575000
A125: =A124+1 -> 42 | B125: Chatter Jee Road | C125: 150000 | D125: 775000
A126: =A125+1 -> 43 | B126: Choburgi Park | C126: 200000 | D126: 500000
A127: =A126+1 -> 44 | B127: Choburgi Park (New) | C127: 300000 | D127: 600000
A128: =A127+1 -> 45 | B128: Dhoop Sarhi | C128: 180000 | D128: 500000
A129: =A128+1 -> 46 | B129: Dil Muhammad Road | C129: 3600000 | D129: 725000
A130: =A129+1 -> 47 | B130: Dhoobi Mandi | C130: 200000 | D130: 525000
A131: =A130+1 -> 48 | B131: Danpur Lane | C131: 330000 | D131: 725000
A132: =A131+1 -> 49 | B132: Dilkusha Road | C132: 200000 | D132: 420000
A133: =A132+1 -> 50 | B133: Dave Samaj Road | C133: 190000 | D133: 500000
A134: =A133+1 -> 51 | B134: Dhani Ram Road | C134: 475000 | D134: 1550000
A135: =A134+1 -> 52 | B135: Data Gunj Bukhsh Road | C135: 275000 | D135: 575000
A136: =A135+1 -> 53 | B136: Davis Road | D136: 1400000
A137: =A136+1 -> 54 | B137: Davrend Road | C137: 290000 | D137: 775000
A138: =A137+1 -> 55 | B138: Davis Road Streets | C138: 260000 | D138: 575000
A139: =A138+1 -> 56 | B139: Edward Road | C139: 500000 | D139: 775000
A140: =A139+1 -> 57 | B140: Egerton Road Front | C140: 0 | D140: 1900000
A141: =A140+1 -> 58 | B141: Egerton Road Back | D141: 1200000
A142: =A141+1 -> 59 | B142: Empress Road Front | C142: 475000 | D142: 1900000
A143: =A142+1 -> 60 | B143: Empress Road Back | C143: 475000 | D143: 1450000
A144: =A143+1 -> 61 | B144: Fane Road | C144: 0 | D144: 630000
A145: =A144+1 -> 62 | B145: Farid Kot Streets | C145: 260000 | D145: 575000
A146: =A145+1 -> 63 | B146: Farid Kot Road | C146: 260000 | D146: 575000
A147: =A146+1 -> 64 | B147: Fleming Road | C147: 320000 | D147: 7750000
A148: =A147+1 -> 65 | B148: Firdous Park | C148: 200000 | D148: 475000
A149: =A148+1 -> 66 | B149: Ferozepur Road (Mozang Chungi to Shama Chowk) | D149: 1360000
A150: =A149+1 -> 67 | B150: Ferozepur Road (Shama Chowk to Canal Bank) | D150: 1360000
A151: =A150+1 -> 68 | B151: Ferozepur Road (Kacha) | C151: 260000 | D151: 600000
A152: =A151+1 -> 69 | B152: Fazlia Colony | C152: 260000 | D152: 630000
A153: =A152+1 -> 70 | B153: Fateh Sher Road | C153: 260000 | D153: 775000
A154: =A153+1 -> 71 | B154: Gawalmandi | C154: 150000 | D154: 350000
A155: =A154+1 -> 72 | B155: Gunpat Road | C155: 50000 | D155: 200000
A156: =A155+1 -> 73 | C156: 290000 | D156: 1000000
A157: =A156+1 -> 74 | B157: Gunja Kalan (Western Side) | C157: 190000 | D157: 450000
A158: =A157+1 -> 75 | B158: Gillani Park Near Bilal Gunj | C158: 250000 | D158: 450000
A159: =A158+1 -> 76 | B159: Golf Road | D159: 725000
A160: =A159+1 -> 77 | B160: Golding Road | C160: 330000 | D160: 575000
A161: =A160+1 -> 78 | B161: Gulshan-e-Ravi | C161: 275000 | D161: 630000
A162: =A161+1 -> 79 | B162: Hospital Road | D162: 630000
A163: =A162+1 -> 80 | B163: Hall Road | C163: 600000 | D163: 2000000
A164: =A163+1 -> 81 | B164: Habib Gunj | C164: 190000 | D164: 500000
A165: =A164+1 -> 82 | B165: Hussain Street (Ichhra) | D165: 700000
A166: =A165+1 -> 83 | B166: Islamia Park (Poonch Road) | C166: 200000 | D166: 475000
A167: =A166+1 -> 84 | B167: Islam Gunj (Near Bilal Ganj) | C167: 190000 | D167: 500000
A168: =A167+1 -> 85 | B168: Islampura | C168: 200000 | D168: 625000
A169: =A168+1 -> 86 | B169: Ittefaq Colony Sanda | C169: 200000 | D169: 475000
A170: =A169+1 -> 87 | B170: Ichhra & Adjoining Abadies | C170: 275000 | D170: 725000
A171: =A170+1 -> 88 | B171: Ibrahim Road | C171: 200000 | D171: 625000
A172: =A171+1 -> 89 | B172: Jia Musa Falling in DGB Town Mission | C172: 200000 | D172: 380000
A173: =A172+1 -> 90 | B173: Joy Shah | C173: 190000 | D173: 450000
A174: =A173+1 -> 91 | B174: Jail Road | D174: 1800000
A175: =A174+1 -> 92 | B175: Jail Road | C175: 425000 | D175: 1050000
A176: =A175+1 -> 93 | B176: Jail Road Adjoing Abadies | C176: 350000 | D176: 850000
A177: =A176+1 -> 94 | B177: Katchery Road | C177: 375000 | D177: 850000
A178: =A177+1 -> 95 | B178: Kamal Gunj Near Bilal Ganj | C178: 190000 | D178: 500000
A179: =A178+1 -> 96 | B179: Kashmir Road Front | D179: 1450000
A180: =A179+1 -> 97 | B180: Kashmir Road Back | D180: 1050000
A181: =A180+1 -> 98 | B181: Karim Park | C181: 190000 | D181: 450000
A182: =A181+1 -> 99 | B182: Kasur Pura | C182: 190000 | D182: 450000
A183: =A182+1 -> 100 | B183: Lower Mall | C183: 375000 | D183: 900000
A184: =A183+1 -> 101 | B184: Lytton Road | C184: 350000 | D184: 1050000
A185: =A184+1 -> 102 | B185: Lake Road | C185: 340000 | D185: 775000
A186: =A185+1 -> 103 | B186: Lahore Road | C186: 260000 | D186: 625000
A187: =A186+1 -> 104 | B187: Landa Bazar | D187: 1050000
A188: =A187+1 -> 105 | B188: Landa Bazar and Adjoining Abadies | C188: 275000 | D188: 1050000
A189: =A188+1 -> 106 | B189: Lawrence Road | C189: 350000 | D189: 775000
A190: =A189+1 -> 107 | B190: Multan Chowk (Chowk Choburji to Chowk Yateem Khana) | C190: 350000 | D190: 675000
A191: =A190+1 -> 108 | B191: McLeod Road | D191: 1350000
A192: =A191+1 -> 109 | B192: Mali Pura | C192: 250000 | D192: 450000
A193: =A192+1 -> 110 | B193: Mission Road | C193: 375000 | D193: 1050000
A194: =A193+1 -> 111 | B194: Mozang Road | C194: 340000 | D194: 775000
A195: =A194+1 -> 112 | B195: McLegon Road | D195: 750000
A196: =A195+1 -> 113 | B196: Mella Ram Road (Bhati Gate) | C196: 325000 | D196: 675000
A197: =A196+1 -> 114 | B197: Murlidhar Road | C197: 250000 | D197: 675000
A198: =A197+1 -> 115 | B198: Montgomery Road | D198: 165000
A199: =A198+1 -> 116 | B199: Masson Road | C199: 450000 | D199: 775000
A200: =A199+1 -> 117 | B200: Main Mozang | C200: 250000 | D200: 775000
A201: =A200+1 -> 118 | B201: Mozang New | C201: 250000 | D201: 775000
A202: =A201+1 -> 119 | B202: Muhammadi Park | C202: 190000 | D202: 450000
A203: =A202+1 -> 120 | B203: Manzoor Park and Adjoining Abadies | C203: 190000 | D203: 450000
A204: =A203+1 -> 121 | B204: Main Bund Road (Both Sides) | C204: 0 | D204: 675000
A205: =A204+1 -> 122 | B205: Mohallah Dar-ul-Shakooh (Landa Bazar) | C205: 350000 | D205: 1050000
A206: =A205+1 -> 123 | B206: Mall Road (PMG Chowk to Canal) | C206: 0 | D206: 2500000
A207: =A206+1 -> 124 | B207: Naulakha & Adjoining Abadies | C207: 250000 | D207: 775000
A208: =A207+1 -> 125 | B208: Nishter Road (Both Sides) | C208: 0 | D208: 2250000
A209: =A208+1 -> 126 | B209: Nabha Road | C209: 0 | D209: 1000000
A210: =A209+1 -> 127 | B210: Naiper Road | C210: 0 | D210: 1000000
A211: =A210+1 -> 128 | B211: Nisbat Road | C211: 0 | D211: 775000
A212: =A211+1 -> 129 | B212: Nila Gunbad | D212: 1350000
A213: =A212+1 -> 130 | B213: Naulakah Bazar | D213: 1050000
A214: =A213+1 -> 131 | B214: Neela Gumbad | C214: 150000 | D214: 400000
A215: =A214+1 -> 132 | B215: Naulakha Bazar | C215: 300000 | D215: 800000
A216: =A215+1 -> 133 | B216: National Park/Town Sanda | C216: 200000 | D216: 500000
A217: =A216+1 -> 134 | B217: Nicholson Road | C217: 150000 | D217: 400000
A218: =A217+1 -> 135 | B218: Nicholson Road Street | C218: 200000 | D218: 500000
A219: =A218+1 -> 136 | B219: Nadeem Park Sanda | C219: 175000 | D219: 500000
A220: =A219+1 -> 137 | B220: Naseer-ud-Din Road | C220: 150000 | D220: 500000
A221: =A220+1 -> 138 | B221: Nawan Kot | C221: 300000 | D221: 900000
A222: =A221+1 -> 139 | B222: Outfall Road | C222: 0 | D222: 500000
A223: =A222+1 -> 140 | B223: Patiala Ground | C223: 150000 | D223: 400000
A224: =A223+1 -> 141 | B224: Paisa Akhbar | C224: 200000 | D224: 600000
A225: =A224+1 -> 142 | B225: Parem Nagar Mauza Raj Garh | C225: 300000 | D225: 500000
A226: =A225+1 -> 143 | B226: Punch Road Chuburji to Ganda Nala | C226: 150000 | D226: 350000
A227: =A226+1 -> 144 | B227: Punj Mahal Road (Shish Mahal) | C227: 300000 | D227: 1200000
A228: =A227+1 -> 145 | B228: Qila Hakeeman | C228: 200000 | D228: 600000
A229: =A228+1 -> 146 | B229: Queen's Road | C229: 0 | D229: 600000
A230: =A229+1 -> 147 | B230: Qila Gujjar Singh & Adjoining Abadies | C230: 150000 | D230: 350000
A231: =A230+1 -> 148 | B231: Qazalbash Road | C231: 200000 | D231: 500000
A232: =A231+1 -> 149 | B232: Qadar Colony Sanda | C232: 150000 | D232: 400000
A233: =A232+1 -> 150 | B233: Rajgarh Road | C233: 150000 | D233: 400000
A234: =A233+1 -> 151 | B234: Ravi Road (Katcha) | C234: 150000 | D234: 400000
A235: =A234+1 -> 152 | B235: Rajgarh (Old Rifle Range) | C235: 300000 | D235: 500000
A236: =A235+1 -> 153 | B236: Rajgarh & Adjoining Abadies | C236: 200000 | D236: 500000
A237: =A236+1 -> 154 | B237: Rajgarh Road | C237: 250000 | D237: 500000
A238: =A237+1 -> 155 | B238: Ravi Colony | C238: 250000 | D238: 600000
A239: =A238+1 -> 156 | B239: Ratan Chand Road | C239: 0 | D239: 800000
A240: =A239+1 -> 157 | B240: Railway Road | C240: 0 | D240: 600000
A241: =A240+1 -> 158 | B241: Race Course Road | C241: 250000 | D241: 600000
A242: =A241+1 -> 159 | B242: Royal Park | C242: 250000 | D242: 400000
A243: =A242+1 -> 160 | B243: Rewaz Garden | C243: 0 | D243: 800000
A244: =A243+1 -> 161 | B244: Robert Road | C244: 300000 | D244: 1000000
A245: =A244+1 -> 162 | B245: Ravi Road | C245: 150000 | D245: 400000
A246: =A245+1 -> 163 | B246: Rehman (Streets) | C246: 0 | D246: 500000
A247: =A246+1 -> 164 | B247: Rettigun Road | C247: 150000 | D247: 400000
A248: =A247+1 -> 165 | B248: Rajgarh Main Bazar | C248: 150000 | D248: 350000
A249: =A248+1 -> 166 | B249: Saadi Park (Mozang) | C249: 150000 | D249: 350000
A250: =A249+1 -> 167 | B250: Sanat Nagar | C250: 0 | D250: 500000
A251: =A250+1 -> 168 | B251: Sanda Khurd & Adjoining Abadies | C251: 50000 | D251: 200000
A252: =A251+1 -> 169 | B252: Sanda Road | C252: 150000 | D252: 350000
A253: =A252+1 -> 170 | B253: Sanda Khurd/Kalan (Western Side Across Bund) | C253: 150000 | D253: 400000
A254: =A253+1 -> 171 | B254: Sanda Kalan & Adjoining Abadies | C254: 50000 | D254: 200000
A255: =A254+1 -> 172 | B255: Shera Kot | C255: 300000 | D255: 1000000
A256: =A255+1 -> 173 | B256: Shera Kot Western Side Across Bund | C256: 150000 | D256: 350000
A257: =A256+1 -> 174 | B257: Shadman | C257: 150000 | D257: 350000
A258: =A257+1 -> 175 | B258: Shafique Abad | C258: 200000 | D258: 500000
A259: =A258+1 -> 176 | B259: Shishmahal Mouza | C259: 200000 | D259: 600000
A260: =A259+1 -> 177 | B260: Shishmahal Road | C260: 200000 | D260: 500000
A261: =A260+1 -> 178 | B261: Shah Jamal & Adjoining Abadies | C261: 200000 | D261: 400000
A262: =A261+1 -> 179 | B262: Saray Sultan | C262: 0 | D262: 500000
A263: =A262+1 -> 180 | B263: Shamas Qadri GOR Patiala House & Adjoining Abadies | C263: 300000 | D263: 600000
A264: =A263+1 -> 181 | B264: Turner Road | C264: 250000 | D264: 600000
A265: =A264+1 -> 182 | B265: Temple Road | C265: 0 | D265: 400000
A266: =A265+1 -> 183 | B266: Tagoor Park | C266: 500000 | D266: 1000000
A267: =A266+1 -> 184 | B267: Thorton Road | C267: 150000 | D267: 400000
A268: =A267+1 -> 185 | B268: Urdu Bazar | C268: 300000 | D268: 800000
A269: =A268+1 -> 186 | B269: Usman Gunj (Bilal Gunj) | C269: 250000 | D269: 600000
A272: Rates of Cultivable Land falling in Data Gunj Bakhsh Town, Lahore
A273: S. No. | B273: Name of Locality | C273: Rate Per Acre for External Part of River (Out Side the Embankment) | D273: Rate Per Acre for External Part of River (Inside the Embankment)
A274: 1 | B274: Babu Sabu | C274: 1250000 | D274: 875000
A275: =A274+1 -> 2 | B275: Sanda Kalan | C275: 1250000 | D275: 875000
A276: =A275+1 -> 3 | B276: Sanda Khurd | C276: 1250000 | D276: 875000
A277: =A276+1 -> 4 | B277: Shera Kot | C277: 1250000 | D277: 875000
A282: Gulberg Town, Lahore
A283: S. No. | B283: Name of Locality | C283: Rate Per Marla Residential | D283: Rate Per Marla Commercial
A284: 1 | B284: Aitchison College Road / Sundar Das Road | C284: 200000 | D284: 400000
A285: =A284+1 -> 2 | B285: Achant Gharh | C285: 200000 | D285: 400000
A286: =A285+1 -> 3 | B286: Egerton Road Front | C286: 200000 | D286: 400000
A287: =A286+1 -> 4 | B287: Egerton Road Off | C287: 0 | D287: 1500000
A288: =A287+1 -> 5 | B288: Allama Iqbal Road | C288: 0 | D288: 1000000
A289: =A288+1 -> 6 | B289: Empress Road Front | C289: 200000 | D289: 500000
A290: =A289+1 -> 7 | B290: Empress Road Off | C290: 350000 | D290: 1500000
A291: =A290+1 -> 8 | B291: Aziz Avenue Gulberg | C291: 350000 | D291: 1200000
A292: =A291+1 -> 9 | B292: Bahar Colony (Kot Lakhpat) | C292: 0 | D292: 400000
A293: =A292+1 -> 10 | B293: Basti Saiden Shah | C293: 100000 | D293: 500000
A294: =A293+1 -> 11 | B294: Bibi Pak Daman (Ghan Shahu) | C294: 200000 | D294: 500000
A295: =A294+1 -> 12 | B295: Bhabra (Abadi) | C295: 150000 | D295: 450000
A296: =A295+1 -> 13 | B296: Canal Bank Road Both Side situated in Gulberg Town | C296: 200000 | D296: 500000
A297: =A296+1 -> 14 | B297: Canal Park (Gulberg) | C297: 300000 | D297: 600000
A298: =A297+1 -> 15 | B298: Canal Bank Road Both Side Ichhra Bridge to Doctors Hospital | C298: 200000 | D298: 450000
A299: =A298+1 -> 16 | B299: Ferozepur Road (Shama to Kahna Chowk) Both sides situated in Gulberg Town | C299: 300000 | D299: 700000
A300: =A299+1 -> 17 | B300: Dars Road | C300: 0 | D300: 1000000
A301: =A300+1 -> 18 | B301: Dars Bary Mian | C301: 100000 | D301: 300000
A302: =A301+1 -> 19 | B302: Davis Road | C302: 100000 | D302: 300000
A303: =A302+1 -> 20 | B303: Faisal Town | C303: 0 | D303: 1000000
A304: =A303+1 -> 21 | B304: Faisal Town Main Boulevard | C304: 300000 | D304: 600000
A305: =A304+1 -> 22 | B305: Fruit Market Kot-Lakhpat | C305: 0 | D305: 700000
A306: =A305+1 -> 23 | B306: Ferozepur Road (Kalma Chowk to Kot-Lakhpat Phattak) | C306: 0 | D306: 600000
A307: =A306+1 -> 24 | B307: Garden Town Civic Center | C307: 350000 | D307: 800000
A308: =A307+1 -> 25 | B308: Garden Town Blocks | C308: 0 | D308: 1000000
A309: =A308+1 -> 26 | B309: Garden Town Main Boulevard (Kalma Chowk to Y Junction) | C309: 200000 | D309: 800000
A310: =A309+1 -> 27 | B310: Garden Town (Barket Market) | C310: 200000 | D310: 800000
A311: =A310+1 -> 28 | B311: Garden Town (Khalid Market) | C311: 0 | D311: 1000000
A312: =A311+1 -> 29 | B312: Government Employees' Cooperative Housing Society (Model Town Link Road) | C312: 0 | D312: 800000
A313: =A312+1 -> 30 | B313: Gulberg M. M. Alam Road | C313: 200000 | D313: 600000
A314: =A313+1 -> 31 | B314: Gulberg Main Boulevard | C314: 200000 | D314: 600000
A315: =A314+1 -> 32 | B315: Gulberg I-II-III-IV-V | C315: 500000 | D315: 1500000
A316: =A315+1 -> 33 | B316: Gulberg Roads | C316: 300000 | D316: 1000000
A317: =A316+1 -> 34 | B317: Gulberg Stadium Road | C317: 100000 | D317: 1000000
A318: =A317+1 -> 35 | B318: Gulberg Liberty Market | C318: 300000 | D318: 1000000
A319: =A318+1 -> 36 | B319: Gulberg Main Market | C319: 0 | D319: 2000000
A320: =A319+1 -> 37 | B320: Gulberg Firdous Market | C320: 0 | D320: 1200000
A321: =A320+1 -> 38 | B321: Gulberg Zahoor Elahi Road | C321: 0 | D321: 1000000
A322: =A321+1 -> 39 | B322: Gopal Nagar | C322: 300000 | D322: 1000000
A323: =A322+1 -> 40 | B323: Ghalib Market (Gulberg) | C323: 150000 | D323: 500000
A324: =A323+1 -> 41 | B324: Gandhi Park (Gulberg) | C324: 0 | D324: 1000000
A325: =A324+1 -> 42 | B325: Gurumanget | C325: 200000 | D325: 700000
A326: =A325+1 -> 43 | B326: Gurumanget Road | C326: 125000 | D326: 400000
A327: =A326+1 -> 44 | B327: Gulberg Industrial Area | C327: 0 | D327: 700000
A328: =A327+1 -> 45 | B328: Ghari Shahu | C328: 0 | D328: 400000
A329: =A328+1 -> 46 | B329: G. T. Road falling in Gulberg Town | C329: 200000 | D329: 500000
A330: =A329+1 -> 47 | B330: Habib Ullah Road | C330: 200000 | D330: 400000
A331: =A330+1 -> 48 | B331: Jail Road | C331: 200000 | D331: 400000
A332: =A331+1 -> 49 | B332: Kot-Lakhpat Industrial Area | C332: 0 | D332: 1500000
A333: =A332+1 -> 50 | B333: Kot-Lakhpat | C333: 0 | D333: 350000
A334: =A333+1 -> 51 | B334: Liqat Abad Main Bazar | C334: 150000 | D334: 300000
A335: =A334+1 -> 52 | B335: Liqat Abad | C335: 0 | D335: 300000
A336: =A335+1 -> 53 | B336: Maulana Shaukat Ali Road | C336: 100000 | D336: 200000
A337: =A336+1 -> 54 | B337: Mian Mir | C337: 0 | D337: 600000
A338: =A337+1 -> 55 | B338: Muhammad Nagar | C338: 200000 | D338: 500000
A339: =A338+1 -> 56 | B339: Mumtaz Street Ghari Shahu | C339: 200000 | D339: 500000
A340: =A339+1 -> 57 | B340: Makkah Colony (Gulberg) | C340: 200000 | D340: 500000
A341: =A340+1 -> 58 | B341: Model Town Link Road | C341: 150000 | D341: 450000
A342: =A341+1 -> 59 | B342: Model Town Old | C342: 0 | D342: 1500000
A343: =A342+1 -> 60 | B343: Model Town Extension | C343: 200000 | D343: 600000
A344: =A343+1 -> 61 | B344: Model Town Extension LDA Flats | C344: 150000 | D344: 500000
A345: =A344+1 -> 62 | B345: Mughalpura Road | C345: 150000 | D345: 400000
A346: =A345+1 -> 63 | B346: Niclson Road | C346: 150000 | D346: 300000
A347: =A346+1 -> 64 | B347: Nabi Pura (Gulberg) | C347: 300000 | D347: 800000
A348: =A347+1 -> 65 | B348: Nawaz Sharif Colony (Near Model Town Courts) | C348: 100000 | D348: 500000
A349: =A348+1 -> 66 | B349: Pindi Rajputan | C349: 100000 | D349: 300000
A350: =A349+1 -> 67 | B350: PECO Road (Phatak to Akbar Chowk) | C350: 150000 | D350: 300000
A351: =A350+1 -> 68 | B351: Qila Gujjar Singh | C351: 0 | D351: 500000
A352: =A351+1 -> 69 | B352: Qazilbash Road | C352: 200000 | D352: 500000
A353: =A352+1 -> 70 | B353: Scotch Corner | C353: 0 | D353: 400000
A354: =A353+1 -> 71 | B354: Sahowari | C354: 200000 | D354: 500000
A355: =A354+1 -> 72 | B355: Shabbir Usmani Road from Y Junction to Moulana Shaukat Ali Road | C355: 125000 | D355: 250000
A356: =A355+1 -> 73 | B356: They Zaildaran Gulberg | C356: 0 | D356: 600000
A357: =A356+1 -> 74 | B357: Upper Mall Scheme | C357: 200000 | D357: 700000
A358: =A357+1 -> 75 | B358: Upper Mall Road | C358: 300000 | D358: 800000
A359: =A358+1 -> 76 | B359: Wazir Ali Road | C359: 300000 | D359: 800000
A360: =A359+1 -> 77 | B360: Zafar Ali Road | C360: 0 | D360: 500000
A361: =A360+1 -> 78 | B361: Zaman Park | C361: 400000 | D361: 1000000
A362: =A361+1 -> 79 | B362: Zaildar Park (Ichhra) | C362: 250000 | D362: 600000
C363: 200000 | D363: 600000
A365: Allama Iqbal Town, Lahore
A366: S. No. | B366: Name of Locality | C366: Rate Per Marla Residential | D366: Rate Per Marla Commercial
A367: 1 | B367: Ajhodia Pur | C367: 125000 | D367: 300000
A368: =A367+1 -> 2 | B368: Awan Town | C368: 125000 | D368: 300000
A369: =A368+1 -> 3 | B369: Abid Garden | C369: 100000 | D369: 300000
A370: =A369+1 -> 4 | B370: Abadi Moosla/Mouza Moosla | C370: 50000 | D370: 150000
A371: =A370+1 -> 5 | B371: Azam Garden | C371: 125000 | D371: 250000
A372: =A371+1 -> 6 | B372: Ali Park Niaz Baig | C372: 125000 | D372: 250000
A373: =A372+1 -> 7 | B373: Al-Hamad Park Niaz Baig | C373: 125000 | D373: 250000
A374: =A373+1 -> 8 | B374: Aitcheson College Cooperative Housing Society | C374: 125000 | D374: 250000
A375: =A374+1 -> 9 | B375: Ahmed Nagar (Kachi Kothi) | C375: 125000 | D375: 250000
A376: =A375+1 -> 10 | B376: Adjoining Canal Bank any Society Mouza Shahpur Khanpur | C376: 150000 | D376: 300000
A377: =A376+1 -> 11 | B377: Adjoining Canal Bank any Society Mouza Kanjran | C377: 150000 | D377: 400000
A378: =A377+1 -> 12 | B378: Agriculture Cooperative Housing Society | C378: 125000 | D378: 250000
A379: =A378+1 -> 13 | B379: Ali Raza Abad | C379: 125000 | D379: 250000
A380: =A379+1 -> 14 | B380: Al-Hajaj Cooperative Housing Society | C380: 125000 | D380: 250000
A381: =A380+1 -> 15 | B381: Ahmad Housing Scheme (Niaz Baig) | C381: 100000 | D381: 200000
A382: =A381+1 -> 16 | B382: Amar Kot | C382: 25000 | D382: 50000
A383: =A382+1 -> 17 | B383: Badar Pura | C383: 125000 | D383: 250000
A384: =A383+1 -> 18 | B384: Bakar Mandi | C384: 200000 | D384: 400000
A385: =A384+1 -> 19 | B385: Bola Garhi | C385: 125000 | D385: 250000
A386: =A385+1 -> 20 | B386: Campus View Town | C386: 125000 | D386: 300000
A387: =A386+1 -> 21 | B387: Canal View | C387: 200000 | D387: 400000
A388: =A387+1 -> 22 | B388: Chak Mozang | C388: 150000 | D388: 400000
A389: =A388+1 -> 23 | B389: Canal View Housing Society | C389: 200000 | D389: 400000
A390: =A389+1 -> 24 | B390: Canal Bank Road Two Sides Campus to Thokhar | C390: 200000 | D390: 400000
A391: =A390+1 -> 25 | B391: Chung Punjgrian | C391: 100000 | D391: 200000
A392: =A391+1 -> 26 | B392: All Societies of Chung Panjgrian | C392: 150000 | D392: 250000
A393: =A392+1 -> 27 | B393: Canal Breeze Housing Society | C393: 125000 | D393: 200000
A394: =A393+1 -> 28 | B394: Doctors' Society | C394: 150000 | D394: 300000
A395: =A394+1 -> 29 | B395: Dina Nath Amar Kot | C395: 50000 | D395: 100000
A396: =A395+1 -> 30 | B396: Dholan Wal | C396: 150000 | D396: 250000
A397: =A396+1 -> 31 | B397: Dhana Singh Wala | C397: 125000 | D397: 300000
A398: =A397+1 -> 32 | B398: Dooban Pura Abadi | C398: 100000 | D398: 200000
A399: =A398+1 -> 33 | B399: Ehbab Colony | C399: 50000 | D399: 100000
A400: =A399+1 -> 34 | B400: EME Housing Society | C400: 200000 | D400: 400000
A401: =A400+1 -> 35 | B401: Education Town | C401: 100000 | D401: 200000
A402: =A401+1 -> 36 | B402: Gosha-e-Ahbab Phase-I-II | C402: 75000 | D402: 250000
A403: =A402+1 -> 37 | B403: Green Forts Phase-I-II | C403: 200000 | D403: 300000
A404: =A403+1 -> 38 | B404: Ghulam Gouswala | C404: 50000 | D404: 100000
A405: =A404+1 -> 39 | B405: Ghulam Gouswala any Society/Town | C405: 100000 | D405: 200000
A406: =A405+1 -> 40 | B406: Hanjar Wal | C406: 100000 | D406: 200000
A407: =A406+1 -> 41 | B407: Hameed Park Chak Mozang | C407: 150000 | D407: 400000
A408: =A407+1 -> 42 | B408: Hassan Town | C408: 125000 | D408: 300000
A409: =A408+1 -> 43 | B409: Jalal Park (Niaz Baig) | C409: 100000 | D409: 200000
A410: =A409+1 -> 44 | B410: Jubilee Town | C410: 50000 | D410: 150000
A411: =A410+1 -> 45 | B411: Jogeen Pura | C411: 125000 | D411: 300000
A412: =A411+1 -> 46 | B412: Jhugian Shahab Din | C412: 150000 | D412: 350000
A413: =A412+1 -> 47 | B413: Johar Town | C413: 200000 | D413: 500000
A414: =A413+1 -> 48 | B414: Judicial Town | C414: 100000 | D414: 300000
A415: =A414+1 -> 49 | B415: Jhugian Nagra | C415: 75000 | D415: 250000
A416: =A415+1 -> 50 | B416: Kot Muhammadi | C416: 125000 | D416: 250000
A417: =A416+1 -> 51 | B417: Kot Kamboh | C417: 125000 | D417: 250000
A418: =A417+1 -> 52 | B418: Khadeeja Park | C418: 75000 | D418: 200000
A419: =A418+1 -> 53 | B419: Katar Bund Road | C419: 100000 | D419: 200000
A420: =A419+1 -> 54 | B420: Khamba | C420: 50000 | D420: 150000
A421: =A420+1 -> 55 | B421: All Societies in Khamba | C421: 75000 | D421: 200000
A422: =A421+1 -> 56 | B422: Kanjran | C422: 150000 | D422: 250000
A423: =A422+1 -> 57 | B423: Khaliq Abad | C423: 150000 | D423: 250000
A424: =A423+1 -> 58 | B424: Kibria Town | C424: 50000 | D424: 150000
A425: =A424+1 -> 59 | B425: Lalazar Market | C425: 0 | D425: 300000
A426: =A425+1 -> 60 | B426: Lalazar Colony/Judicial Cooperative Housing Society | C426: 100000 | D426: 200000
A427: =A426+1 -> 61 | B427: LDA Avenue-I | C427: 100000 | D427: 200000
A428: =A427+1 -> 62 | B428: Muhammad Sultan Abad | C428: 125000 | D428: 300000
A429: =A428+1 -> 63 | B429: Moulana Shoukat Ali Road | C429: 0 | D429: 600000
A430: =A429+1 -> 64 | B430: Mairaj Park (Dholanwal) | C430: 200000 | D430: 300000
A431: =A430+1 -> 65 | B431: Manzoor Park & Adjacent Areas | C431: 150000 | D431: 300000
A432: =A431+1 -> 66 | B432: Marraka | C432: 60000 | D432: 120000
A433: =A432+1 -> 67 | B433: Muridwal | C433: 125000 | D433: 250000
A434: =A433+1 -> 68 | B434: Main Bazar Chung | C434: 0 | D434: 250000
A435: =A434+1 -> 69 | B435: Manga Raiwind Road (Jurisdiction of AIT) | C435: 100000 | D435: 150000
A436: =A435+1 -> 70 | B436: Mohlanwal | C436: 30000 | D436: 100000
A437: =A436+1 -> 71 | B437: Mustafa Town Niaz Baig | C437: 125000 | D437: 250000
A438: =A437+1 -> 72 | B438: Multan Road falling in Allama Iqbal Town | C438: 0 | D438: 300000
A439: =A438+1 -> 73 | B439: Mansoora | C439: 125000 | D439: 250000
A440: =A439+1 -> 74 | B440: Maraghzar Colony | C440: 100000 | D440: 250000
A441: =A440+1 -> 75 | B441: Main Raiwind Road | C441: 200000 | D441: 350000
A442: =A441+1 -> 76 | B442: Myra Garh Flates Ali Raza Abad and Ahmad Nagar | C442: 150000 | D442: 300000
A443: =A442+1 -> 77 | B443: Muhafiz Town | C443: 100000 | D443: 200000
A444: =A443+1 -> 78 | B444: Mateen Avenue | C444: 125000 | D444: 250000
A445: =A444+1 -> 79 | B445: Mahdi Pura | C445: 25000 | D445: 50000
A446: =A445+1 -> 80 | B446: Niaz Baig | C446: 80000 | D446: 200000
A447: =A446+1 -> 81 | B447: Nawab Town (Rakh Khamba) | C447: 125000 | D447: 250000
A448: =A447+1 -> 82 | B448: Nasir Ganj | C448: 25000 | D448: 50000
A449: =A448+1 -> 83 | B449: NESPAK Housing Scheme | C449: 100000 | D449: 150000
A450: =A449+1 -> 84 | B450: PECO Colony Niaz Baig | C450: 100000 | D450: 200000
A451: =A450+1 -> 85 | B451: PCISR Housing Society Phase-I | C451: 200000 | D451: 400000
A452: =A451+1 -> 86 | B452: PCISR Housing Society Phase-II | C452: 150000 | D452: 300000
A453: =A452+1 -> 87 | B453: PIA Housing Society | C453: 200000 | D453: 400000
A454: =A453+1 -> 88 | B454: PECO Road (Phatak to Ganda Nala) | C454: 0 | D454: 500000
A455: =A454+1 -> 89 | B455: PECO Road (Ganda Nala to Akbar Chowk) | C455: 0 | D455: 500000
A456: =A455+1 -> 90 | B456: Paji | C456: 12500 | D456: 25000
A457: =A456+1 -> 91 | B457: Rana Town | C457: 75000 | D457: 200000
A458: =A457+1 -> 92 | B458: Rasulpura Niaz Baig | C458: 100000 | D458: 200000
A459: =A458+1 -> 93 | B459: Rajput Housing Scheme | C459: 100000 | D459: 200000
A460: =A459+1 -> 94 | B460: Rakh Khamba Mouza | C460: 65000 | D460: 150000
A461: =A460+1 -> 95 | B461: All Housing Societies & Town in Mouza Rakh Khama | C461: 100000 | D461: 250000
A462: =A461+1 -> 96 | B462: Rail Town | C462: 100000 | D462: 200000
A463: =A462+1 -> 97 | B463: Raiwind Road Main (Thokhar Nawaz Sharif Chowk to Avenue) | C463: 0 | D463: 350000
A464: =A463+1 -> 98 | B464: Raiwind Inside Town Committee | C464: 50000 | D464: 150000
A465: =A464+1 -> 99 | B465: Raiwind Main Bazar | C465: 0 | D465: 400000
A466: =A465+1 -> 100 | B466: Raiwind Main Bazar Adjoining Markets | C466: 0 | D466: 350000
A467: =A466+1 -> 101 | B467: Main Raiwind (Inside Phatak to Outside Phatak) | C467: 80000 | D467: 300000
A468: =A467+1 -> 102 | B468: Main Raiwind (Chowk Avenue-I to Outside Phatak Raiwind) | C468: 0 | D468: 200000
A469: =A468+1 -> 103 | B469: Revenue Employees' Coopearative Housing Society | C469: 125000 | D469: 250000
A470: =A469+1 -> 104 | B470: Sabzazar Scheme | C470: 150000 | D470: 400000
A471: =A470+1 -> 105 | B471: Saidpur | C471: 150000 | D471: 300000
A472: =A471+1 -> 106 | B472: Saidpur (Iqbal Town Side) | C472: 150000 | D472: 300000
A473: =A472+1 -> 107 | B473: Sattu Katla | C473: 125000 | D473: 350000
A474: =A473+1 -> 108 | B474: Shah Sharif/Kalan More | C474: 100000 | D474: 500000
A475: =A474+1 -> 109 | B475: State Enterprises Housing Society | C475: 125000 | D475: 300000
A476: =A475+1 -> 110 | B476: Samsani Road | C476: 150000 | D476: 300000
A477: =A476+1 -> 111 | B477: Sultan Town | C477: 150000 | D477: 300000
A478: =A477+1 -> 112 | B478: Sultanpura | C478: 50000 | D478: 100000
A479: =A478+1 -> 113 | B479: Super Market (Thokar to Ginning Market) | C479: 0 | D479: 400000
A480: =A479+1 -> 114 | B480: Sher Shah Town | C480: 25000 | D480: 50000
A481: =A480+1 -> 115 | B481: Shahpur Khanpur | C481: 60000 | D481: 100000
A482: =A481+1 -> 116 | B482: Sunflower Housing Scheme | C482: 125000 | D482: 300000
A483: =A482+1 -> 117 | B483: Shoukat Khanum Hospital (Khayyaban Jinnah) to Raiwind Road | C483: 200000 | D483: 500000
A484: =A483+1 -> 118 | B484: Thokhar to Shoukat Khanum Hospital | C484: 200000 | D484: 500000
A485: =A484+1 -> 119 | B485: Tanveer Park | C485: 150000 | D485: 400000
A486: =A485+1 -> 120 | B486: Touheed Park | C486: 150000 | D486: 400000
A487: =A486+1 -> 121 | B487: Thokhar to Manga Mandi Multan Road | C487: 0 | D487: 300000
A488: =A487+1 -> 122 | B488: TECH Society | C488: 200000 | D488: 400000
A489: =A488+1 -> 123 | B489: Township | C489: 125000 | D489: 300000
A490: =A489+1 -> 124 | B490: Township (Bismillah Chowk to Bumb Disposal B-II Township) | C490: 125000 | D490: 300000
A491: =A490+1 -> 125 | B491: Township (Al-Kareem Chowk to Chandni Chowk) | C491: 125000 | D491: 300000
A492: =A491+1 -> 126 | B492: Township (Block No. 14 Lal School Near Masjid Ghousia, Masjid AhleHadith Road Township) | C492: 125000 | D492: 300000
A493: =A492+1 -> 127 | B493: Township (Bagrian Road Rahmat Hospital to Bagrian) | C493: 125000 | D493: 300000
A494: =A493+1 -> 128 | B494: Township (Bagrian Road to Bhola Chowk, Block No. C-II, 3, 4, 5) | C494: 125000 | D494: 300000
A495: =A494+1 -> 129 | B495: Township College Road | C495: 0 | D495: 500000
A496: =A495+1 -> 130 | B496: Township C-I, C-II Road between Butt Chowk to Qadri Chowk and Around Choras Tanki to Outside College Road | C496: 125000 | D496: 300000
A497: =A496+1 -> 131 | B497: Township (Centre Road Ghanda Nala Near Doctor Nisar Tent Wala 7-8 Crossing Al-Madina Road to 11-12 Block Rafi Chowk | C497: 125000 | D497: 300000
A498: =A497+1 -> 132 | B498: Township, Centre Road between Ghanda Nala Block 2 and 3 Township | C498: 125000 | D498: 300000
A499: =A498+1 -> 133 | B499: Township, D-I, D-II, Industrial Nala Both Sides Township | C499: 0 | D499: 300000
A500: =A499+1 -> 134 | B500: Township, Darussalam Road, B-II, Township | C500: 125000 | D500: 300000
A501: =A500+1 -> 135 | B501: Township, DPS School, Main Gate upto Church, Township | C501: 125000 | D501: 300000
A502: =A501+1 -> 136 | B502: Townsip, Depot Chowk to Mirza M. Mirza Road Azmat Chowk, Township | C502: 125000 | D502: 300000
A503: =A502+1 -> 137 | B503: Township, Farooqi Chowk to Anti Shah Chowk Imam Bargah Abu Bakar Road, Township | C503: 125000 | D503: 300000
A504: =A503+1 -> 138 | B504: Township, Haider Road to Petrol Pump Wali Road, Anmol Cinema, Township | C504: 125000 | D504: 300000
A505: =A504+1 -> 139 | B505: Township, Hassan Basra Road Main Chowk, Township | C505: 125000 | D505: 300000
A506: =A505+1 -> 140 | B506: Township Industrial | C506: 0 | D506: 300000
A507: =A506+1 -> 141 | B507: Township, Imam Bargah D-I to Ground Block D-I, I, Township | C507: 125000 | D507: 300000
A508: =A507+1 -> 142 | B508: Township, Kashmir Road Backside 10 Block behind 2 Kanal Wali Kothi Road, Township | C508: 125000 | D508: 300000
A509: =A508+1 -> 143 | B509: Township, Khokhar Chowk to Ganda Nala, Township | C509: 125000 | D509: 300000
A510: =A509+1 -> 144 | B510: Township, Lakar Stop to Sunday Bazar, Township | C510: 125000 | D510: 300000
A511: =A510+1 -> 145 | B511: Township, Madina Road, Madina Chowk to Barkat Chowk, Township | C511: 0 | D511: 400000
A512: =A511+1 -> 146 | B512: Township, Madina Road to Ashraf Clinic, 13 Block Masjid to All Road, Township | C512: 0 | D512: 400000
A513: =A512+1 -> 147 | B513: Township, Madina Masjid to Bohar Wala Chowk Rehri Wala, Thela Road to Ganda Nala, Township | C513: 0 | D513: 400000
A514: =A513+1 -> 148 | B514: Township, Madina Masjid, Madina Bazar, Sooha Bazar, Township | C514: 0 | D514: 400000
A515: =A514+1 -> 149 | B515: Township, Ghousia Masjid to 13 Block to College Road, Township | C515: 125000 | D515: 300000
A516: =A515+1 -> 150 | B516: Township, Main Chowk to Pipe Stop (Tahir-ul-Qadri Chowk), Township | C516: 125000 | D516: 300000
A517: =A516+1 -> 151 | B517: Township, Masjid Stop Market to Milad Chowk, Township | C517: 125000 | D517: 300000
A518: =A517+1 -> 152 | B518: Township, Muhammadi Market No. 5, D-II, Township | C518: 125000 | D518: 300000
A519: =A518+1 -> 153 | B519: Township, Nursary Stop, Al-Kareem Chowk, Haider Road, Township | C519: 125000 | D519: 300000
A520: =A519+1 -> 154 | B520: Township, Nursary Stop to Hamdard Chowk, Township | C520: 125000 | D520: 300000
A521: =A520+1 -> 155 | B521: Township, Old PS Masjid Touheed to Gandari Chowk, Township | C521: 125000 | D521: 300000
A522: =A521+1 -> 156 | B522: Township, Pipe Chowk Stop (Tahir-ul-Qadri Chowk to Sadiq Chowk, Township | C522: 125000 | D522: 300000
A523: =A522+1 -> 157 | B523: Township, Rana Road to Tahir-ul-Qadri Masjid, Township | C523: 125000 | D523: 300000
A524: =A523+1 -> 158 | B524: Township, Sadiq Chowk to Aslam Chowk (Beside Nala), Towhship | C524: 125000 | D524: 300000
A525: =A524+1 -> 159 | B525: Township, Somi Centre upto Back Door of DPS School, Towhsnip | C525: 125000 | D525: 300000
A526: =A525+1 -> 160 | B526: Township, Shan Video Main Gate, DPS School Anmol Cinema Road, Township | C526: 125000 | D526: 300000
A527: =A526+1 -> 161 | B527: Township, Umar Chowk to Keer Kalan Block D-I, Township | C527: 125000 | D527: 300000
A528: =A527+1 -> 162 | B528: Umar Garden | C528: 150000 | D528: 300000
A529: =A528+1 -> 163 | B529: Valensia Town | C529: 150000 | D529: 300000
A530: =A529+1 -> 164 | B530: Waris Colony Niaz Baig | C530: 150000 | D530: 300000
A531: =A530+1 -> 165 | B531: West Wood Colony | C531: 150000 | D531: 300000
A532: =A531+1 -> 166 | B532: WAPDA Town | C532: 200000 | D532: 400000
A535: Rates of Cultivable Land falling in Iqbal Town, Lahore
A536: S. No. | B536: Name of Locality | C536: Rate Per Acre Agricultural Land | D536: Rate Per Acre Flooded Land
A537: 1 | B537: Mohlan Wal | C537: 800000 | D537: 0
A538: =A537+1 -> 2 | B538: Niaz Baig | C538: 800000 | D538: 600000
A541: Nishter Town, Lahore
A542: S. No. | B542: Name of Locality | C542: Rate Per Marla Residential | D542: Rate Per Marla Commercial
A543: 1 | B543: Amar Sidhu & Adjoining Areas | C543: 100000 | D543: 250000
A544: =A543+1 -> 2 | B544: Araian to Kahna (Jia Bagga Road) | C544: 25000 | D544: 50000
A545: =A544+1 -> 3 | B545: Abpara Scheme (Ammer Pura) Backward | C545: 70000 | D545: 150000
A546: =A545+1 -> 4 | B546: Audit & Accounts Society | C546: 100000 | D546: 250000
A547: =A546+1 -> 5 | B547: Ahbab Housing Society (Chandrai) | C547: 100000 | D547: 250000
A548: =A547+1 -> 6 | B548: Anmol Housing Society | C548: 100000 | D548: 250000
A549: =A548+1 -> 7 | B549: Accounts Group Society | C549: 100000 | D549: 250000
A550: =A549+1 -> 8 | B550: Al-Falah Town (Chandrai) | C550: 100000 | D550: 250000
A551: =A550+1 -> 9 | B551: Awan Brothers' Society | C551: 100000 | D551: 250000
A552: =A551+1 -> 10 | B552: Abdullah Town | C552: 100000 | D552: 250000
A553: =A552+1 -> 11 | B553: Arif Town | C553: 100000 | D553: 250000
A554: =A553+1 -> 12 | B554: Asif Town | C554: 100000 | D554: 250000
A555: =A554+1 -> 13 | B555: Azhar Town | C555: 100000 | D555: 250000
A556: =A555+1 -> 14 | B556: Ameer Pura & Adjoining Areas | C556: 50000 | D556: 100000
A557: =A556+1 -> 15 | B557: Ameer Pura (All Housing Societies) | C557: 100000 | D557: 250000
A558: =A557+1 -> 16 | B558: Attari Saroba & Adjoining Areas | C558: 80000 | D558: 150000
A559: =A558+1 -> 17 | B559: Bedian Road (R. A. Bazar to Bhatta Chowk) | C559: 100000 | D559: 300000
A560: =A559+1 -> 18 | B560: Bahar Colony | C560: 90000 | D560: 250000
A561: =A560+1 -> 19 | B561: Bedian Road (Ahead Bhatta Chowk to Elite Center) | C561: 50000 | D561: 150000
A562: =A561+1 -> 20 | B562: Bilal Town (Bhobtian) | C562: 40000 | D562: 100000
A563: =A562+1 -> 21 | B563: BPS Society | C563: 90000 | D563: 200000
A564: =A563+1 -> 22 | B564: Bapar (Walton Board) | C564: 40000 | D564: 80000
A565: =A564+1 -> 23 | B565: Bhoptian & Adjoining Areas | C565: 30000 | D565: 80000
A566: =A565+1 -> 24 | B566: Bagrian Dharam Chand | C566: 40000 | D566: 80000
A567: =A566+1 -> 25 | B567: Bakhshish Pura (Manawala) | C567: 50000 | D567: 100000
A568: =A567+1 -> 26 | B568: Balhar (Out of Cantt. Limits) | C568: 40000 | D568: 80000
A569: =A568+1 -> 27 | B569: Chohng Khud | C569: 90000 | D569: 250000
A570: =A569+1 -> 28 | B570: Ghohng Khurd (PSF Area Walton Road) | C570: 80000 | D570: 250000
A571: =A570+1 -> 29 | B571: Cavalry Ground Old & Extension | C571: 250000 | D571: 1100000
A572: =A571+1 -> 30 | B572: Chandrai & Adjoining Areas | C572: 90000 | D572: 250000
A573: =A572+1 -> 31 | B573: Charar & Adjoining Areas | C573: 150000 | D573: 250000
A574: =A573+1 -> 32 | B574: Central Park | C574: 50000 | D574: 100000
A575: =A574+1 -> 33 | B575: Defence Road (Kacha to Bhobtian) | C575: 50000 | D575: 150000
A576: =A575+1 -> 34 | B576: Defence Blocks Y & Z (Phase III) | C576: 300000 | D576: 1500000
A577: =A576+1 -> 35 | B577: Defence Phase - I | C577: 300000 | D577: 700000
A578: =A577+1 -> 36 | B578: Defence Phase - II | C578: 250000 | D578: 700000
A579: =A578+1 -> 37 | B579: Defence Phase - III | C579: 250000 | D579: 700000
A580: =A579+1 -> 38 | B580: Defence Phase - IV | C580: 200000 | D580: 700000
A581: =A580+1 -> 39 | B581: Defence Phase - V | C581: 100000 | D581: 500000
A582: =A581+1 -> 40 | B582: Defence Phase - I, Sector K | C582: 300000 | D582: 700000
A583: =A582+1 -> 41 | B583: Defence Garden | C583: 100000 | D583: 250000
A584: =A583+1 -> 42 | B584: Dulu Khurd & Adjoining Areas | C584: 80000 | D584: 200000
A585: =A584+1 -> 43 | B585: Dulu Kalan & Adjoining Areas | C585: 60000 | D585: 200000
A586: =A585+1 -> 44 | B586: Dev. Khurd Kalan & Adjoining Areas | C586: 80000 | D586: 200000
A587: =A586+1 -> 45 | B587: Dubai Town | C587: 40000 | D587: 80000
A588: =A587+1 -> 46 | B588: Eden Cottage Adjacent Defence | C588: 300000 | D588: 350000
A589: =A588+1 -> 47 | B589: EIPM Society | C589: 70000 | D589: 100000
A590: =A589+1 -> 48 | B590: Farooq Colony Amar Sidhu | C590: 100000 | D590: 250000
A591: =A590+1 -> 49 | B591: Ferozepur Road Kot Lakhpat to Kahna | C591: 0 | D591: 450000
A592: =A591+1 -> 50 | B592: Ferozepur Road Kot Lakhpat to Gilvehra | C592: 0 | D592: 150000
A593: =A592+1 -> 51 | B593: Ferozepur Road Bridge to Amar Sadhu Nala) | C593: 350000 | D593: 800000
A594: =A593+1 -> 52 | B594: Ghazi Road Amar Sadhu | C594: 0 | D594: 350000
A595: =A594+1 -> 53 | B595: Green Town | C595: 150000 | D595: 300000
A596: =A595+1 -> 54 | B596: Green Acre Housing Scheme Raiwind Road | C596: 50000 | D596: 100000
A597: =A596+1 -> 55 | B597: Gulshan-e-Munir Scheme | C597: 50000 | D597: 100000
A598: =A597+1 -> 56 | B598: Guru Manget (WCB) | C598: 175000 | D598: 400000
A599: =A598+1 -> 57 | B599: Galaxo Town | C599: 60000 | D599: 130000
A600: =A599+1 -> 58 | B600: Green Cap Scheme (Gajomata) | C600: 50000 | D600: 100000
A601: =A600+1 -> 59 | B601: Gajomata & Adjoining Areas | C601: 60000 | D601: 125000
A602: =A601+1 -> 60 | B602: Gulshan Colony Amar Sadhu | C602: 100000 | D602: 250000
A603: =A602+1 -> 61 | B603: Ghousia Colony Koray | C603: 100000 | D603: 200000
A604: =A603+1 -> 62 | B604: Hayat Town | C604: 60000 | D604: 125000
A605: =A604+1 -> 63 | B605: HBFC Society | C605: 60000 | D605: 125000
A606: =A605+1 -> 64 | B606: Hamza Town (Dulu Khurd) | C606: 80000 | D606: 150000
A607: =A606+1 -> 65 | B607: Harpalkey | C607: 40000 | D607: 70000
A608: =A607+1 -> 66 | B608: Hussain Global Society | C608: 80000 | D608: 150000
A609: =A608+1 -> 67 | B609: Iqbal Park & New Iqbal Park (WCB) | C609: 125000 | D609: 350000
A610: =A609+1 -> 68 | B610: IEPM Society | C610: 80000 | D610: 150000
A611: =A610+1 -> 69 | B611: Irrigation Cooperative Housing Society (Chandrai) | C611: 50000 | D611: 100000
A612: =A611+1 -> 70 | B612: Irrigation Cooperative Housing Society (Tihayat) | C612: 50000 | D612: 100000
A613: =A612+1 -> 71 | B613: ISRM Cooperative Housing Society | C613: 50000 | D613: 100000
A614: =A613+1 -> 72 | B614: Jathol (WCB) | C614: 40000 | D614: 80000
A615: =A614+1 -> 73 | B615: Jedah Town | C615: 60000 | D615: 125000
A616: =A615+1 -> 74 | B616: Jail Road Kacha toward Chungi | C616: 80000 | D616: 250000
A617: =A616+1 -> 75 | B617: Jalalpura | C617: 40000 | D617: 100000
A618: =A617+1 -> 76 | B618: Koray & Adjoining Areas (WCB) | C618: 100000 | D618: 200000
A619: =A618+1 -> 77 | B619: Kamahan | C619: 50000 | D619: 100000
A620: =A619+1 -> 78 | B620: Keer Khurd Adjoining Abadies | C620: 80000 | D620: 175000
A621: =A620+1 -> 79 | B621: Keer Kalan & Adjoining Areas | C621: 80000 | D621: 175000
A622: =A621+1 -> 80 | B622: Khalid Town | C622: 80000 | D622: 175000
A623: =A622+1 -> 81 | B623: Khaliq Nagar (Dullu Khurd) | C623: 80000 | D623: 200000
A624: =A623+1 -> 82 | B624: Khayaban-e-Karim | C624: 80000 | D624: 175000
A625: =A624+1 -> 83 | B625: Kamahan (Amer Sidhu Kamahan Attari Saroba Road) | C625: 0 | D625: 150000
A626: =A625+1 -> 84 | B626: Kachha | C626: 30000 | D626: 50000
A627: =A626+1 -> 85 | B627: Kachha Road (Kahna to Railway Line) | C627: 100000 | D627: 200000
A628: =A627+1 -> 86 | B628: Kahna | C628: 30000 | D628: 50000
A629: =A628+1 -> 87 | B629: Kahna Kohna | C629: 30000 | D629: 50000
A630: =A629+1 -> 88 | B630: Kahna Nau | C630: 30000 | D630: 50000
A631: =A630+1 -> 89 | B631: Kot Lakhpat | C631: 150000 | D631: 300000
A632: =A631+1 -> 90 | B632: Kot Lakhpat Industrial Area | C632: 0 | D632: 350000
A633: =A632+1 -> 91 | B633: K. E. Medical College Cooperative | C633: 100000 | D633: 150000
A634: =A633+1 -> 92 | B634: Lake City Holding Housing Society | C634: 100000 | D634: 200000
A635: =A634+1 -> 93 | B635: Liaqatabad | C635: 100000 | D635: 200000
A636: =A635+1 -> 94 | B636: Liaqatabad Main Bazar | C636: 0 | D636: 300000
A637: =A636+1 -> 95 | B637: Lidhar & Adjoining Areas (WCB) | C637: 60000 | D637: 125000
A638: =A637+1 -> 96 | B638: Main Boulevard Defence (Khayaban-e-Jinnah) | C638: 0 | D638: 1500000
A639: =A638+1 -> 97 | B639: Main Railway Road | C639: 200000 | D639: 350000
A640: =A639+1 -> 98 | B640: Main Boulevard Defence (Khayaban-e-Iqbal) | C640: 0 | D640: 1100000
A641: =A640+1 -> 99 | B641: Maulana Shokat Ali Road | C641: 0 | D641: 600000
A642: =A641+1 -> 100 | B642: Madina Colony (Koray) | C642: 100000 | D642: 300000
A643: =A642+1 -> 101 | B643: Military Accounts Housing Society | C643: 100000 | D643: 200000
A644: =A643+1 -> 102 | B644: Millat Town | C644: 100000 | D644: 150000
A645: =A644+1 -> 103 | B645: Mustafa Town | C645: 100000 | D645: 150000
A646: =A645+1 -> 104 | B646: Mashkoor Town | C646: 100000 | D646: 150000
A647: =A646+1 -> 105 | B647: Madina Town | C647: 100000 | D647: 150000
A648: =A647+1 -> 106 | B648: M/s. Industrial Cooperative Housing Society | C648: 100000 | D648: 150000
A649: =A648+1 -> 107 | B649: Nishat Colony (WCB) | C649: 100000 | D649: 200000
A650: =A649+1 -> 108 | B650: Niaz Town | C650: 100000 | D650: 150000
A651: =A650+1 -> 109 | B651: Nasheman Park | C651: 100000 | D651: 150000
A652: =A651+1 -> 110 | B652: Nasheman-e-Iqbal Cooperative Housing Society | C652: 150000 | D652: 300000
A653: =A652+1 -> 111 | B653: Noor Town | C653: 100000 | D653: 150000
A654: =A653+1 -> 112 | B654: Nisther Colony | C654: 100000 | D654: 150000
A655: =A654+1 -> 113 | B655: Nangar | C655: 25000 | D655: 50000
A656: =A655+1 -> 114 | B656: NIFC Society | C656: 100000 | D656: 150000
A657: =A656+1 -> 115 | B657: Nobahar Housing Society | C657: 80000 | D657: 125000
A658: =A657+1 -> 116 | B658: Nawaz Sharif Colony Near Model Town Post | C658: 100000 | D658: 300000
A659: =A658+1 -> 117 | B659: Officers' Colony (Cavalry Ground) | C659: 0 | D659: 250000
A660: =A659+1 -> 118 | B660: Overhead Bridge to Chowk Cavalry Ground | C660: 0 | D660: 1100000
A661: =A660+1 -> 119 | B661: Overseas Workers' Housing Society | C661: 50000 | D661: 125000
A662: =A661+1 -> 120 | B662: Punjab Cooperative Housing Society (WCB) | C662: 150000 | D662: 300000
A663: =A662+1 -> 121 | B663: Punjab Cooperative Housing Society Kamahan | C663: 80000 | D663: 125000
A664: =A663+1 -> 122 | B664: Public Health Society | C664: 50000 | D664: 100000
A665: =A664+1 -> 123 | B665: PCSIR Society | C665: 150000 | D665: 250000
A666: =A665+1 -> 124 | B666: PEC Housing Society | C666: 100000 | D666: 200000
A667: =A666+1 -> 125 | B667: Qadri Colony Koray | C667: 100000 | D667: 200000
A668: =A667+1 -> 126 | B668: Quaid-e-Azam Industrial Estate | C668: 0 | D668: 350000
A669: =A668+1 -> 127 | B669: R. A. Bazar (WCB) | C669: 0 | D669: 250000
A670: =A669+1 -> 128 | B670: Rifle Range Road (WCB) | C670: 200000 | D670: 300000
A671: =A670+1 -> 129 | B671: Roran Wala | C671: 30000 | D671: 50000
A672: =A671+1 -> 130 | B672: Super Town New Super Town (Koray) | C672: 125000 | D672: 375000
A673: =A672+1 -> 131 | B673: Shah Taj Colony (Koray) | C673: 125000 | D673: 250000
A674: =A673+1 -> 132 | B674: Sitara Colony Amar Sidhu | C674: 100000 | D674: 225000
A675: =A674+1 -> 133 | B675: Sargodha Housing Society | C675: 50000 | D675: 100000
A676: =A675+1 -> 134 | B676: Sardar Town | C676: 40000 | D676: 80000
A677: =A676+1 -> 135 | B677: Shahanshah Town (Bhobtian) | C677: 40000 | D677: 80000
A678: =A677+1 -> 136 | B678: Shalimar Town Gajjumatta | C678: 60000 | D678: 125000
A679: =A678+1 -> 137 | B679: Saadat Cooperative Housing Society | C679: 80000 | D679: 125000
A680: =A679+1 -> 138 | B680: Saroba Garden | C680: 80000 | D680: 150000
A681: =A680+1 -> 139 | B681: Shama Town | C681: 80000 | D681: 150000
A682: =A681+1 -> 140 | B682: Sadhokey | C682: 80000 | D682: 150000
A683: =A682+1 -> 141 | B683: Sui Norther Housing (Phase-I) | C683: 100000 | D683: 200000
A684: =A683+1 -> 142 | B684: State Life Housing Scheme (Harpalke) | C684: 100000 | D684: 200000
A685: =A684+1 -> 143 | B685: Township | C685: 125000 | D685: 300000
A686: =A685+1 -> 144 | B686: T & T Town | C686: 40000 | D686: 100000
A687: =A686+1 -> 145 | B687: TIPM Society | C687: 40000 | D687: 80000
A688: =A687+1 -> 146 | B688: Tibba Mashmula Kacha | C688: 40000 | D688: 80000
A689: =A688+1 -> 147 | B689: Thatta Khurd | C689: 40000 | D689: 80000
A690: =A689+1 -> 148 | B690: Venus Housing Society | C690: 80000 | D690: 125000
A691: =A690+1 -> 149 | B691: Walton Road Main | C691: 0 | D691: 500000
A692: =A691+1 -> 150 | B692: Waheed Brothers | C692: 80000 | D692: 150000
A693: =A692+1 -> 151 | B693: Youhana Abad | C693: 80000 | D693: 150000
A694: =A693+1 -> 152 | B694: Zahoor Town | C694: 80000 | D694: 150000
A695: =A694+1 -> 153 | B695: Zaman Colony (Koray) | C695: 120000 | D695: 240000
A698: Ravi Town, Lahore
A699: S. No. | B699: Name of Locality | C699: Rate Per Marla Residential | D699: Rate Per Marla Commercial
A700: A Ward
A701: 1 | B701: Shahi Mohalla | C701: 200000 | D701: 500000
A702: =A701+1 -> 2 | B702: Taxali | C702: 200000 | D702: 500000
A703: =A702+1 -> 3 | B703: Fort Road | C703: 200000 | D703: 500000
A704: B Ward
A705: =A703+1 -> 4 | B705: Bhatti Gate | C705: 200000 | D705: 500000
A706: =A705+1 -> 5 | B706: Mori Gate | C706: 200000 | D706: 500000
A707: C Ward
A708: =A706+1 -> 6 | B708: Langay Mandi | C708: 200000 | D708: 500000
A709: =A708+1 -> 7 | B709: City Cinema Road | C709: 200000 | D709: 500000
A710: =A709+1 -> 8 | B710: Pani Wala Talab | C710: 200000 | D710: 500000
A711: =A710+1 -> 9 | B711: Gumti Bazar | C711: 200000 | D711: 700000
A712: =A711+1 -> 10 | B712: Chatta Bazaar | C712: 200000 | D712: 700000
A713: =A712+1 -> 11 | B713: Moti Bazar | C713: 200000 | D713: 700000
A714: D Ward
A715: =A713+1 -> 12 | B715: Lohari Gate | C715: 200000 | D715: 500000
A716: =A715+1 -> 13 | B716: Lohari Mandi | C716: 200000 | D716: 500000
A717: =A716+1 -> 14 | B717: Rang Mahal (Back Side) | C717: 200000 | D717: 500000
A718: E Ward
A719: =A717+1 -> 15 | B719: Sooha Bazar | C719: 0 | D719: 2200000
A720: =A719+1 -> 16 | B720: Shahalam Gate | C720: 0 | D720: 2200000
A721: =A720+1 -> 17 | B721: Rang Mahal (Main) | C721: 0 | D721: 2200000
A722: F Ward
A723: =A721+1 -> 18 | B723: Kasera Bazar | C723: 300000 | D723: 900000
A724: =A723+1 -> 19 | B724: Kinari Bazar | C724: 300000 | D724: 900000
A725: =A724+1 -> 20 | B725: Dabi/Kashmiri Bazar | C725: 300000 | D725: 900000
A726: =A725+1 -> 21 | B726: Choona Mandi | C726: 300000 | D726: 900000
A727: =A726+1 -> 22 | B727: Mohallah Kakay Zaiyan | C727: 300000 | D727: 900000
A728: G Ward
A729: =A727+1 -> 23 | B729: Azam Cloth Market | C729: 0 | D729: 1800000
A730: =A729+1 -> 24 | B730: Yakki Gate | C730: 250000 | D730: 500000
A731: =A730+1 -> 25 | B731: Delhi Gate | C731: 250000 | D731: 500000
A732: =A731+1 -> 26 | B732: Sheranwala (Lions') Gate | C732: 250000 | D732: 500000
A733: =A732+1 -> 27 | B733: Pakistan Cloth Market | C733: 250000 | D733: 500000
A734: H Ward
A735: =A733+1 -> 28 | B735: Aabkari Mandi | C735: 250000 | D735: 1300000
A736: =A735+1 -> 29 | B736: Chohata Mufti Baqir | C736: 250000 | D736: 500000
A737: =A736+1 -> 30 | B737: Loon Mandi | C737: 250000 | D737: 500000
A738: =A737+1 -> 31 | B738: Gurr Mandi | C738: 250000 | D738: 500000
A739: =A738+1 -> 32 | B739: Adda Truck (Cicular Road) | C739: 350000 | D739: 1000000
A740: I Ward
A741: =A739+1 -> 33 | B741: Mochi Gate | C741: 300000 | D741: 500000
A742: =A741+1 -> 34 | B742: Pipple Vehra (Plastic Market) | C742: 300000 | D742: 500000
A743: =A742+1 -> 35 | B743: Shahalam Market (Backside) | C743: 0 | D743: 900000
A744: =A743+1 -> 36 | B744: Shoe Market | C744: 0 | D744: 900000
A745: =A744+1 -> 37 | B745: Alamgir Market | C745: 0 | D745: 900000
A746: =A745+1 -> 38 | B746: Bagami Bagh (Bus Stand) | C746: 0 | D746: 1000000
A747: =A746+1 -> 39 | B747: Aziz Road | C747: 200000 | D747: 400000
A748: =A747+1 -> 40 | B748: Akram Road | C748: 150000 | D748: 300000
A749: =A748+1 -> 41 | B749: Aslam Colony | C749: 150000 | D749: 300000
A750: =A749+1 -> 42 | B750: Akram Colony | C750: 150000 | D750: 300000
A751: =A750+1 -> 43 | B751: Al-Fateh Colony | C751: 150000 | D751: 300000
A752: =A751+1 -> 44 | B752: Altaf Park | C752: 150000 | D752: 300000
A753: =A752+1 -> 45 | B753: Azam Park | C753: 150000 | D753: 300000
A754: =A753+1 -> 46 | B754: Afzal Colony | C754: 150000 | D754: 300000
A755: =A754+1 -> 47 | B755: Ashraf Park | C755: 150000 | D755: 300000
A756: =A755+1 -> 48 | B756: Ahmad Park | C756: 150000 | D756: 300000
A757: =A756+1 -> 49 | B757: Ameen Park (Bela Basti Ram) | C757: 150000 | D757: 300000
A758: =A757+1 -> 50 | B758: Abdullah Park | C758: 150000 | D758: 300000
A759: =A758+1 -> 51 | B759: Abdul Qayyum Road (Bela Basti Ram) | C759: 0 | D759: 500000
A760: =A759+1 -> 52 | B760: Abdul Sattar Road (Bela Basti Ram) | C760: 0 | D760: 500000
A761: =A760+1 -> 53 | B761: Badami Bagh PECO Road | C761: 0 | D761: 1000000
A762: =A761+1 -> 54 | B762: Baghanwala | C762: 150000 | D762: 300000
A763: =A762+1 -> 55 | B763: Bela Basti Ram | C763: 150000 | D763: 300000
A764: =A763+1 -> 56 | B764: Bela Basti Ram (Western Side) | C764: 50000 | D764: 200000
A765: =A764+1 -> 57 | B765: Badar Colony | C765: 150000 | D765: 300000
A766: =A765+1 -> 58 | B766: Bhutto Colony | C766: 150000 | D766: 300000
A767: =A766+1 -> 59 | B767: Bund Road Ravi Bridge to Bassi More (Both Sides) | C767: 0 | D767: 350000
A768: =A767+1 -> 60 | B768: Bangali Park/Bagh | C768: 150000 | D768: 300000
A769: =A768+1 -> 61 | B769: Begum Kot | C769: 150000 | D769: 300000
A770: =A769+1 -> 62 | B770: Bhaman Mouza | C770: 100000 | D770: 300000
A771: =A770+1 -> 63 | B771: Bhaman (Western Side) | C771: 50000 | D771: 200000
A772: =A771+1 -> 64 | B772: Chiragh Park | C772: 150000 | D772: 300000
A773: =A772+1 -> 65 | B773: Chaudhary Park | C773: 150000 | D773: 300000
A774: =A773+1 -> 66 | B774: Chohan Colony | C774: 150000 | D774: 300000
A775: =A774+1 -> 67 | B775: Circular Road | C775: 0 | D775: 1000000
A776: =A775+1 -> 68 | B776: Clifton Colony/Park | C776: 150000 | D776: 300000
A777: =A776+1 -> 69 | B777: Data Nagar | C777: 150000 | D777: 300000
A778: =A777+1 -> 70 | B778: Elahi Park | C778: 150000 | D778: 300000
A779: =A778+1 -> 71 | B779: Elahi Bukhsh Park | C779: 150000 | D779: 300000
A780: =A779+1 -> 72 | B780: Eisa Nagar | C780: 150000 | D780: 300000
A781: =A780+1 -> 73 | B781: Fazal Park | C781: 150000 | D781: 300000
A782: =A781+1 -> 74 | B782: Fruit Market Badami Bagh | C782: 0 | D782: 1000000
A783: =A782+1 -> 75 | B783: Faisal Park | C783: 150000 | D783: 300000
A784: =A783+1 -> 76 | B784: Fateh Puri | C784: 150000 | D784: 300000
A785: =A784+1 -> 77 | B785: Feroze Colony, Bela Basti Ram | C785: 150000 | D785: 300000
A786: =A785+1 -> 78 | B786: Farrukh Abad | C786: 150000 | D786: 300000
A787: =A786+1 -> 79 | B787: Farooq Gunj | C787: 150000 | D787: 400000
A788: =A787+1 -> 80 | B788: Ghulam Hussain Park | C788: 150000 | D788: 300000
A789: =A788+1 -> 81 | B789: G. T. Road Ravi Bridge to Imamia Colony | C789: 200000 | D789: 400000
A790: =A789+1 -> 82 | B790: Gulistan Town | C790: 150000 | D790: 300000
A791: =A790+1 -> 83 | B791: Grain Market (Badami Bagh) | C791: 0 | D791: 1000000
A792: =A791+1 -> 84 | B792: Hanif Park | C792: 150000 | D792: 300000
A793: =A792+1 -> 85 | B793: Her-Naraom Pura | C793: 150000 | D793: 300000
A794: =A793+1 -> 86 | B794: Hussain Park | C794: 150000 | D794: 300000
A795: =A794+1 -> 87 | B795: Hamad Colony | C795: 150000 | D795: 300000
A796: =A795+1 -> 88 | B796: Ittefaq Colony, Kot Shahab Din | C796: 150000 | D796: 300000
A797: =A796+1 -> 89 | B797: Industrial Area Badami Bagh | C797: 0 | D797: 1000000
A798: =A797+1 -> 90 | B798: Imam Bukhsh Park | C798: 150000 | D798: 300000
A799: =A798+1 -> 91 | B799: Iqbal Park | C799: 150000 | D799: 300000
A800: =A799+1 -> 92 | B800: Jia Musa | C800: 150000 | D800: 300000
A801: =A800+1 -> 93 | B801: Javed Park | C801: 150000 | D801: 300000
A802: =A801+1 -> 94 | B802: Jehangir Park | C802: 150000 | D802: 300000
A803: =A802+1 -> 95 | B803: Jia Musa (Western Side) | C803: 50000 | D803: 200000
A804: =A803+1 -> 96 | B804: Kot Begum | C804: 150000 | D804: 300000
A805: =A804+1 -> 97 | B805: Khokhar Road | C805: 0 | D805: 450000
A806: =A805+1 -> 98 | B806: Kachho Pura | C806: 150000 | D806: 300000
A807: =A806+1 -> 99 | B807: Kala Khatai Road Across the Railawy Line | C807: 150000 | D807: 300000
A808: =A807+1 -> 100 | B808: Kot Mohibbue | C808: 150000 | D808: 300000
A809: =A808+1 -> 101 | B809: Khalid Park | C809: 150000 | D809: 300000
A810: =A809+1 -> 102 | B810: Khokhar | C810: 100000 | D810: 200000
A811: =A810+1 -> 103 | B811: Khurshid Park | C811: 150000 | D811: 300000
A812: =A811+1 -> 104 | B812: Lalazar Colony | C812: 150000 | D812: 300000
A813: =A812+1 -> 105 | B813: Misri Shah | C813: 200000 | D813: 400000
A814: =A813+1 -> 106 | B814: Muhammad Park | C814: 150000 | D814: 300000
A815: =A814+1 -> 107 | B815: Mehr Sooba Park | C815: 150000 | D815: 300000
A816: =A815+1 -> 108 | B816: Mouza Jhugian | C816: 150000 | D816: 300000
A817: =A816+1 -> 109 | B817: Mouza Nain Sukh | C817: 100000 | D817: 250000
A818: =A817+1 -> 110 | B818: Mouza Bhamma | C818: 150000 | D818: 250000
A819: =A818+1 -> 111 | B819: Mehar Park | C819: 150000 | D819: 300000
A820: =A819+1 -> 112 | B820: Nain Sukh (Abadi Deh) | C820: 100000 | D820: 250000
A821: =A820+1 -> 113 | B821: Nawab Colony | C821: 150000 | D821: 300000
A822: =A821+1 -> 114 | B822: Noor Road (Bela Basti Ram) | C822: 0 | D822: 500000
A823: =A822+1 -> 115 | B823: Niaz Pura | C823: 150000 | D823: 300000
A824: =A823+1 -> 116 | B824: Nabi Bukhsh Park | C824: 150000 | D824: 300000
A825: =A824+1 -> 117 | B825: Naseem Park | C825: 150000 | D825: 300000
A826: =A825+1 -> 118 | B826: New Malik Park | C826: 150000 | D826: 300000
A827: =A826+1 -> 119 | B827: Pak Bharat Nagar | C827: 200000 | D827: 400000
A828: =A827+1 -> 120 | B828: Qila Lachman Singh and Adjacent Abadis | C828: 200000 | D828: 400000
A829: =A828+1 -> 121 | B829: Qaiser Town (Shahdara) | C829: 80000 | D829: 300000
A830: =A829+1 -> 122 | B830: Qamar Park | C830: 150000 | D830: 300000
A831: =A830+1 -> 123 | B831: Qaddafi Colony | C831: 150000 | D831: 300000
A832: =A831+1 -> 124 | B832: Ravi Park | C832: 200000 | D832: 400000
A833: =A832+1 -> 125 | B833: Ram Kishan Wala | C833: 150000 | D833: 300000
A834: =A833+1 -> 126 | B834: Ravi Road | C834: 0 | D834: 700000
A835: =A834+1 -> 127 | B835: Rahim Road | C835: 0 | D835: 500000
A836: =A835+1 -> 128 | B836: Saddique/Saddiquia Colony | C836: 150000 | D836: 300000
A837: =A836+1 -> 129 | B837: Sabzi Market Badami Bagh | C837: 0 | D837: 1000000
A838: =A837+1 -> 130 | B838: Sheikhupura Road | C838: 200000 | D838: 400000
A839: =A838+1 -> 131 | B839: Shahdara Adjoining Abadies Ferozewala | C839: 80000 | D839: 300000
A840: =A839+1 -> 132 | B840: Saeed Park | C840: 150000 | D840: 300000
A841: =A840+1 -> 133 | B841: Shahdara Town | C841: 80000 | D841: 300000
A842: =A841+1 -> 134 | B842: Suggian | C842: 150000 | D842: 300000
A843: =A842+1 -> 135 | B843: Suggian Road (Toll Plaza to Nain Sukh Chowk) | C843: 300000 | D843: 300000
A844: =A843+1 -> 136 | B844: Sajjad Park | C844: 150000 | D844: 300000
A845: =A844+1 -> 137 | B845: Sheikh Colony | C845: 150000 | D845: 300000
A846: =A845+1 -> 138 | B846: Shaheen Park | C846: 150000 | D846: 300000
A847: =A846+1 -> 139 | B847: Siraj Din Park | C847: 150000 | D847: 300000
A848: =A847+1 -> 140 | B848: Sharif Park | C848: 150000 | D848: 300000
A849: =A848+1 -> 141 | B849: Siddiq Gunj | C849: 200000 | D849: 400000
A850: =A849+1 -> 142 | B850: Sooter Mandi | C850: 300000 | D850: 800000
A851: =A850+1 -> 143 | B851: Syed Mitha Bazar | C851: 300000 | D851: 800000
A852: =A851+1 -> 144 | B852: Rahim Park | C852: 200000 | D852: 400000
A853: =A852+1 -> 145 | B853: Rahim Road | C853: 0 | D853: 500000
A854: =A853+1 -> 146 | B854: Rustam Colony | C854: 150000 | D854: 300000
A855: =A854+1 -> 147 | B855: Taj Bagh Park | C855: 150000 | D855: 300000
A856: =A855+1 -> 148 | B856: Taj Park | C856: 150000 | D856: 300000
A857: =A856+1 -> 149 | B857: Timber Market | C857: 0 | D857: 800000
A858: =A857+1 -> 150 | B858: Tibba Azam Shah | C858: 150000 | D858: 300000
A859: =A858+1 -> 151 | B859: Tilak Nagar | C859: 150000 | D859: 300000
A860: =A859+1 -> 152 | B860: Truck Stand | C860: 0 | D860: 1000000
A861: =A860+1 -> 153 | B861: Tar Garh | C861: 80000 | D861: 300000
A862: =A861+1 -> 154 | B862: Teezab Ehata | C862: 150000 | D862: 300000
A863: =A862+1 -> 155 | B863: Touheed Park | C863: 150000 | D863: 300000
A864: =A863+1 -> 156 | B864: Wandala Road (Shahdara) | C864: 150000 | D864: 400000
A865: =A864+1 -> 157 | B865: Yahya Colony | C865: 150000 | D865: 300000
A866: =A865+1 -> 158 | B866: Yasrab Colony | C866: 150000 | D866: 300000
A867: =A866+1 -> 159 | B867: Zafar Park | C867: 150000 | D867: 300000
A870: Rates of Cultivable Land falling in Ravi Town, Lahore
A871: S. No. | B871: Name of Locality | C871: Rate Per Acre for External Part of River (Outside the Embankment) | D871: Rate Per Acre for External Part of River (Inside the Embankment)
A872: 1 | B872: Begum Kot | C872: 500000 | D872: 300000
A873: =A872+1 -> 2 | B873: Bhaman | C873: 500000 | D873: 300000
A874: =A873+1 -> 3 | B874: Jhugian | C874: 500000 | D874: 300000
A875: =A874+1 -> 4 | B875: Khokhar | C875: 500000 | D875: 300000
A876: =A875+1 -> 5 | B876: Kala Khatai | C876: 600000 | D876: 400000
A877: =A876+1 -> 6 | B877: Nain Sukh | C877: 700000 | D877: 500000
A878: =A877+1 -> 7 | B878: Saggian Kalan Noor | C878: 500000 | D878: 300000
A879: =A878+1 -> 8 | B879: Shahdara | C879: 600000 | D879: 400000
A882: Samnabad Town, Lahore
A883: S. No. | B883: Name of Locality | C883: Rate Per Marla Residential | D883: Rate Per Marla Commercial
A884: 1 | B884: Araiyn Nagar (Samanabad/Ichhra) | C884: 200000 | D884: 500000
A885: =A884+1 -> 2 | B885: Al-Mumtaz Road | C885: 175000 | D885: 400000
A886: =A885+1 -> 3 | B886: Ali Park Ichhra | C886: 200000 | D886: 600000
A887: =A886+1 -> 4 | B887: Ali Park (Samnabad) | C887: 200000 | D887: 600000
A888: =A887+1 -> 5 | B888: Allama Iqbal Town (Commercial Zone, Moon Market) | C888: 0 | D888: 800000
A889: =A888+1 -> 6 | B889: Allama Iqbal Town (All Blocks) | C889: 200000 | D889: 800000
A890: =A889+1 -> 7 | B890: Al-Hamad Colony Ichhra | C890: 200000 | D890: 500000
A891: =A890+1 -> 8 | B891: Abadi Shah Farid Abad | C891: 200000 | D891: 500000
A892: =A891+1 -> 9 | B892: Al-Putgeen Road (Ichhra) | C892: 200000 | D892: 600000
A893: =A892+1 -> 10 | B893: Bank Colony (Samanabad) | C893: 200000 | D893: 500000
A894: =A893+1 -> 11 | B894: Bhaikhaywal & Adjoining Abadies | C894: 200000 | D894: 500000
A895: =A894+1 -> 12 | B895: Bustami Road | C895: 200000 | D895: 500000
A896: =A895+1 -> 13 | B896: Babu Sabu Abadi & Adjoining Abadies | C896: 150000 | D896: 400000
A897: =A896+1 -> 14 | B897: Babu Sabu (Western) | C897: 50000 | D897: 150000
A898: =A897+1 -> 15 | B898: Bagh Gul Begum | C898: 200000 | D898: 500000
A899: =A898+1 -> 16 | B899: Badarpura (Iqbal Town) | C899: 150000 | D899: 400000
A900: =A899+1 -> 17 | B900: Canal Bank Road falling in Samanabad Town | C900: 300000 | D900: 500000
A901: =A900+1 -> 18 | B901: Chaudhary Colony | C901: 150000 | D901: 500000
A902: =A901+1 -> 19 | B902: Ghazali Road Chowk Chaudhary Colony to 3rd Goal Chakar | C902: 200000 | D902: 600000
A903: =A902+1 -> 20 | B903: Clifton Colony (Ichhra) | C903: 200000 | D903: 500000
A904: =A903+1 -> 21 | B904: Christian Colony (Ichhra) | C904: 200000 | D904: 500000
A905: =A904+1 -> 22 | B905: Commercial Zone Gulshan Ravi Moon Market | C905: 0 | D905: 700000
A906: =A905+1 -> 23 | B906: Chamro Pur (Western Side) | C906: 50000 | D906: 150000
A907: =A906+1 -> 24 | B907: Chaburji Park | C907: 150000 | D907: 400000
A908: =A907+1 -> 25 | B908: New Chaburji Park | C908: 150000 | D908: 400000
A909: =A908+1 -> 26 | B909: Dohatta Colony (Ichhra) | C909: 200000 | D909: 600000
A910: =A909+1 -> 27 | B910: Fateh Sher Road | C910: 200000 | D910: 600000
A911: =A910+1 -> 28 | B911: Ferozepur Road (Mozang Chungi to Shama Chowk) | C911: 0 | D911: 1000000
A912: =A911+1 -> 29 | B912: Ferozepur Road (Shama to Kalma Chowk) | C912: 0 | D912: 1000000
A913: =A912+1 -> 30 | B913: Fruit and Vegitable Mandi, Iqbal Town | C913: 0 | D913: 700000
A914: =A913+1 -> 31 | B914: Farooq-e-Azam Park (Ichhra) | C914: 200000 | D914: 600000
A915: =A914+1 -> 32 | B915: Ghulam Nabi Colony Samnabad/Ichhra | C915: 200000 | D915: 600000
A916: =A915+1 -> 33 | B916: Ghousia Park Ichhra | C916: 200000 | D916: 600000
A917: =A916+1 -> 34 | B917: Gulshan-e-Ravi (All Blocks) | C917: 175000 | D917: 500000
A918: =A917+1 -> 35 | B918: Gulshan-e-Ravi Main Boulevard Road upto Bund Road | C918: 300000 | D918: 600000
A919: =A918+1 -> 36 | B919: Gulshan-e-Ravi Ganda Nala Bund Road (Nonarian Bridge) | C919: 0 | D919: 600000
A920: =A919+1 -> 37 | B920: Hussain Street (Ichhra) | C920: 200000 | D920: 600000
A921: =A920+1 -> 38 | B921: Ichhra Adjoining Abadies | C921: 200000 | D921: 600000
A922: =A921+1 -> 39 | B922: Ichhra Main Bazar | C922: 0 | D922: 800000
A923: =A922+1 -> 40 | B923: Ichhra Road Ichhra | C923: 0 | D923: 800000
A924: =A923+1 -> 41 | B924: Ittehad Colony Samnabad | C924: 200000 | D924: 600000
A925: =A924+1 -> 42 | B925: Ittefaq Town & Extension | C925: 200000 | D925: 800000
A926: =A925+1 -> 43 | B926: Ittehad Colony Multan Road | C926: 175000 | D926: 550000
A927: =A926+1 -> 44 | B927: Inder Nagar (Samnabad) | C927: 200000 | D927: 500000
A928: =A927+1 -> 45 | B928: Islamia Park | C928: 150000 | D928: 350000
A929: =A928+1 -> 46 | B929: Ilyas Colony | C929: 200000 | D929: 500000
A930: =A929+1 -> 47 | B930: Janak Nagar | C930: 200000 | D930: 500000
A931: =A930+1 -> 48 | B931: Jinnah Colony (Samnabad) | C931: 200000 | D931: 500000
A932: =A931+1 -> 49 | B932: Jafaria Colony | C932: 150000 | D932: 350000
A933: =A932+1 -> 50 | B933: Karnal Pura (Ichhra) | C933: 200000 | D933: 500000
A934: =A933+1 -> 51 | B934: Kamobh Colony Ichhra | C934: 200000 | D934: 500000
A935: =A934+1 -> 52 | B935: Karmabad Ichhra | C935: 200000 | D935: 500000
A936: =A935+1 -> 53 | B936: Kacha Ferozepur Road (Adjoining Abadies) | C936: 200000 | D936: 500000
A937: =A936+1 -> 54 | B937: Khuda Bakhsh Road | C937: 200000 | D937: 600000
A938: =A937+1 -> 55 | B938: Muhajirabad (Nawankot) | C938: 150000 | D938: 400000
A939: =A938+1 -> 56 | B939: Muhammad Pura Ichhra | C939: 200000 | D939: 500000
A940: =A939+1 -> 57 | B940: Muslim Colony Samnabad | C940: 200000 | D940: 500000
A941: =A940+1 -> 58 | B941: Millat Road Samnabad | C941: 200000 | D941: 500000
A942: =A941+1 -> 59 | B942: Millat Park | C942: 200000 | D942: 500000
A943: =A942+1 -> 60 | B943: Multan Road Chowk Choburgi to Multan Chungi | C943: 300000 | D943: 500000
A944: =A943+1 -> 61 | B944: Muqaddas Park Nawan Kot | C944: 175000 | D944: 550000
A945: =A944+1 -> 62 | B945: Main Bund Road falling in Samnabad Town | C945: 0 | D945: 500000
A946: =A945+1 -> 63 | B946: Main Bund Road Motorway Chowk to Yateem Khana | C946: 0 | D946: 500000
A947: =A946+1 -> 64 | B947: Muslim Town New & Old & Adjoining Abadies | C947: 300000 | D947: 500000
A948: =A947+1 -> 65 | B948: Main Road Scheme More to Baikhaywal More (Iqbal Town Main Boulevard) | C948: 0 | D948: 1000000
A949: =A948+1 -> 66 | B949: New Samnabad Mouza Mozang and New Mozang | C949: 200000 | D949: 500000
A950: =A949+1 -> 67 | B950: Nawab Pura (Ichhra) | C950: 200000 | D950: 500000
A951: =A950+1 -> 68 | B951: Najaf Colony (Iqbal Town) | C951: 150000 | D951: 400000
A952: =A951+1 -> 69 | B952: Nadeem Shaheed Road (Samnabad) | C952: 200000 | D952: 500000
A953: =A952+1 -> 70 | B953: New Shalimar Town/Colony | C953: 175000 | D953: 550000
A954: =A953+1 -> 71 | B954: Nawan Kot (Adjoining Abadies) | C954: 175000 | D954: 550000
A955: =A954+1 -> 72 | B955: Nonarian | C955: 175000 | D955: 500000
A956: =A955+1 -> 73 | B956: Norarian (Western Side) | C956: 50000 | D956: 150000
A957: =A956+1 -> 74 | B957: Pakki Thathi & Adjoining Abadies | C957: 175000 | D957: 550000
A958: =A957+1 -> 75 | B958: Peer Ghazi Road to Chowk Baba Azam | C958: 200000 | D958: 500000
A959: =A958+1 -> 76 | B959: Poonch Road falling Samnabad Town | C959: 150000 | D959: 350000
A960: =A959+1 -> 77 | B960: Prem Nagar | C960: 150000 | D960: 400000
A961: =A960+1 -> 78 | B961: Rustam Park ( Nawan Kot) | C961: 175000 | D961: 500000
A962: =A961+1 -> 79 | B962: Rasool Park (Samnabad/Ichhra) | C962: 200000 | D962: 500000
A963: =A962+1 -> 80 | B963: Rehmanpura (Ichhra) | C963: 200000 | D963: 500000
A964: =A963+1 -> 81 | B964: Rehmanpura Quarters | C964: 200000 | D964: 500000
A965: =A964+1 -> 82 | B965: Rabbani Road (Samnabad) | C965: 200000 | D965: 500000
A966: =A965+1 -> 83 | B966: Sodiwal & Adjoining Abadies | C966: 175000 | D966: 500000
A967: =A966+1 -> 84 | B967: Sodiwal and its Quarters | C967: 175000 | D967: 500000
A968: =A967+1 -> 85 | B968: Samnabad Main Road Chowk Samnabad to Kubra Masjid | C968: 300000 | D968: 500000
A969: =A968+1 -> 86 | B969: Samnabad (N Block) & Adjoining Abadies | C969: 200000 | D969: 500000
A970: =A969+1 -> 87 | B970: Shah Kamal | C970: 200000 | D970: 500000
A971: =A970+1 -> 88 | B971: Sharif Park (Ichhra) | C971: 200000 | D971: 500000
A972: =A971+1 -> 89 | B972: Shah Farid Abad | C972: 200000 | D972: 500000
A973: =A972+1 -> 90 | B973: Shalimar Road Naunarian (Chappar Stop to Nala | C973: 175000 | D973: 500000
A974: =A973+1 -> 91 | B974: Sham Nagar | C974: 150000 | D974: 400000
A975: =A974+1 -> 92 | B975: Shama Road upto Ferozepur Road | C975: 200000 | D975: 600000
A976: =A975+1 -> 93 | B976: Sanda Western Side | C976: 50000 | D976: 200000
A977: =A976+1 -> 94 | B977: Sanda Kalan/Khurd | C977: 50000 | D977: 200000
A978: =A977+1 -> 95 | B978: Shera Kot & Adjoining Abadies | C978: 150000 | D978: 400000
A979: =A978+1 -> 96 | B979: Shera Kot Western Side | C979: 50000 | D979: 150000
A980: =A979+1 -> 97 | B980: Shera Kot 60 Feet Road | C980: 200000 | D980: 500000
A981: =A980+1 -> 98 | B981: Tariq Colony (Sodiwal) | C981: 175000 | D981: 500000
A982: =A981+1 -> 99 | B982: Touheed Park | C982: 175000 | D982: 500000
A983: =A982+1 -> 100 | B983: Urdu Nagar | C983: 175000 | D983: 500000
A984: =A983+1 -> 101 | B984: Union Park Ichhra | C984: 200000 | D984: 500000
A985: =A984+1 -> 102 | B985: Wahdat Road Muslim Town More to Chungi Multan Road | C985: 300000 | D985: 600000
A986: =A985+1 -> 103 | B986: Zaildar Road | C986: 200000 | D986: 500000
A989: Rates of Cultivable Land falling in Samnabad Town, Lahore
A990: S. No. | B990: Name of Locality | C990: Rate Per Acre for External Part of River (Outside the Embankment) | D990: Rate Per Acre for External Part of River (Inside the Embankment)
A991: 1 | B991: Babu Sabu | C991: 800000 | D991: 600000
A992: =A991+1 -> 2 | B992: Sanda Kalan | C992: 800000 | D992: 600000
A993: =A992+1 -> 3 | B993: Sanda Khurd | C993: 800000 | D993: 600000
A994: =A993+1 -> 4 | B994: Shera Kot | C994: 800000 | D994: 600000
A995: =A994+1 -> 5 | B995: Nonarian | C995: 800000 | D995: 600000
A996: =A995+1 -> 6 | B996: Bhadru | C996: 800000 | D996: 600000
A997: =A996+1 -> 7 | B997: Chamrupur | C997: 800000 | D997: 600000
A1000: Shalimar Town, Lahore
A1001: S. No. | B1001: Name of Locality | C1001: Rate Per Marla Residential | D1001: Rate Per Marla Commercial
A1002: 1 | B1002: Abdullah Park | C1002: 170000 | D1002: 330000
A1003: =A1002+1 -> 2 | B1003: Achant Garh | C1003: 230000 | D1003: 450000
A1004: =A1003+1 -> 3 | B1004: Afzaal Park / Colony (Aamir Road) | C1004: 170000 | D1004: 350000
A1005: =A1004+1 -> 4 | B1005: Afzaal Park / Colony (Aamir Road) | C1005: 175000 | D1005: 330000
A1006: =A1005+1 -> 5 | B1006: Akbar Road | C1006: 300000 | D1006: 450000
A1007: =A1006+1 -> 6 | B1007: Akram Road (Chah Miran) | C1007: 170000 | D1007: 450000
A1008: =A1007+1 -> 7 | B1008: Altaf Park, Aamir Road | C1008: 175000 | D1008: 230000
A1009: =A1008+1 -> 8 | B1009: Aamir Road (Shad Bagh) | C1009: 400000 | D1009: 600000
A1010: =A1009+1 -> 9 | B1010: Anghori Bagh | C1010: 175000 | D1010: 275000
A1011: =A1010+1 -> 10 | B1011: Ashraf Park | C1011: 175000 | D1011: 330000
A1012: =A1011+1 -> 11 | B1012: Aziz Road | C1012: 225000 | D1012: 450000
A1013: =A1012+1 -> 12 | B1013: Baghanwala | C1013: 175000 | D1013: 330000
A1014: =A1013+1 -> 13 | B1014: Baghanwala & Adjoining Areas | C1014: 175000 | D1014: 330000
A1015: =A1014+1 -> 14 | B1015: Baghat Pura | C1015: 175000 | D1015: 350000
A1016: =A1015+1 -> 15 | B1016: Baghbanpura New | C1016: 130000 | D1016: 255000
A1017: =A1016+1 -> 16 | B1017: Baghbanpura Old | C1017: 175000 | D1017: 350000
A1018: =A1017+1 -> 17 | B1018: Band Road following in Shalamar Town | C1018: 600000 | D1018: 600000
A1019: =A1018+1 -> 18 | B1019: Begum Pura | C1019: 175000 | D1019: 350000
A1020: =A1019+1 -> 19 | B1020: Bela Basti Ram & Adjoining Areas | C1020: 175000 | D1020: 330000
A1021: =A1020+1 -> 20 | B1021: Bela Basti Ram (Inside Rive Bed) | C1021: 70000 | D1021: 125000
A1022: =A1021+1 -> 21 | B1022: Bela Basti Ram (Western Side) | C1022: 70000 | D1022: 220000
A1023: =A1022+1 -> 22 | B1023: Bharat Nagar (Pak Nagar) | C1023: 200000 | D1023: 400000
A1024: =A1023+1 -> 23 | B1024: Boghewal | C1024: 90000 | D1024: 175000
A1025: =A1024+1 -> 24 | B1025: Boghewal Road | C1025: 200000 | D1025: 400000
A1026: =A1025+1 -> 25 | B1026: Bilal Park | C1026: 175000 | D1026: 350000
A1027: =A1026+1 -> 26 | B1027: Chah Miran & Adjoining Areas | C1027: 225000 | D1027: 450000
A1028: =A1027+1 -> 27 | B1028: Chah Miran Road | C1028: 230000 | D1028: 560000
A1029: =A1028+1 -> 28 | B1029: Chamra Mandi | C1029: 225000 | D1029: 350000
A1030: =A1029+1 -> 29 | B1030: Chiragh Park | C1030: 175000 | D1030: 330000
A1031: =A1030+1 -> 30 | B1031: Chourdhary Park | C1031: 175000 | D1031: 330000
A1032: =A1031+1 -> 31 | B1032: Dars Road | C1032: 225000 | D1032: 450000
A1033: =A1032+1 -> 32 | B1033: Elahi Baksh Park | C1033: 175000 | D1033: 330000
A1034: =A1033+1 -> 33 | B1034: Elahi Park | C1034: 175000 | D1034: 330000
A1035: =A1034+1 -> 34 | B1035: Esa Nagar | C1035: 175000 | D1035: 330000
A1036: =A1035+1 -> 35 | B1036: Faiz Bagh | C1036: 225000 | D1036: 450000
A1037: =A1036+1 -> 36 | B1037: Farooq Ganj | C1037: 175000 | D1037: 450000
A1038: =A1037+1 -> 37 | B1038: Fazal Park | C1038: 175000 | D1038: 330000
A1039: =A1038+1 -> 38 | B1039: G. T. Road situated in Shalimar Town | C1039: 230000 | D1039: 560000
A1040: =A1039+1 -> 39 | B1040: Ghoray Shah Road | C1040: 350000 | D1040: 400000
A1041: =A1040+1 -> 40 | B1041: Ghulam Hussain Park | C1041: 175000 | D1041: 330000
A1042: =A1041+1 -> 41 | B1042: Gujjar Pura China Scheme | C1042: 225000 | D1042: 450000
A1043: =A1042+1 -> 42 | B1043: Gunj | C1043: 175000 | D1043: 350000
A1044: =A1043+1 -> 43 | B1044: Haq Nawaz Road | C1044: 450000 | D1044: 450000
A1045: =A1044+1 -> 44 | B1045: Hussain Park | C1045: 175000 | D1045: 330000
A1046: =A1045+1 -> 45 | B1046: Imam Bakhsh Park Road | C1046: 175000 | D1046: 330000
A1047: =A1046+1 -> 46 | B1047: Iqbal Park Aamir Road | C1047: 175000 | D1047: 330000
A1048: =A1047+1 -> 47 | B1048: Kacchu Pura | C1048: 175000 | D1048: 400000
A1049: =A1048+1 -> 48 | B1049: Khakar Road | C1049: 500000 | D1049: 500000
A1050: =A1049+1 -> 49 | B1050: Kot Khawaja Saeed & Adjoining Areas | C1050: 125000 | D1050: 330000
A1051: =A1050+1 -> 50 | B1051: Kot Khawaja Saeed (Western Side) | C1051: 70000 | D1051: 125000
A1052: =A1051+1 -> 51 | B1052: Kotli Pir Abdul Rehman | C1052: 125000 | D1052: 175000
A1053: =A1052+1 -> 52 | B1053: Main Bazar Mogahid Abad | C1053: 225000 | D1053: 450000
A1054: =A1053+1 -> 53
A1055: =A1054+1 -> 54
A1056: =A1055+1 -> 55
A1057: =A1056+1 -> 56
A1058: =A1057+1 -> 57
A1059: =A1058+1 -> 58
A1060: =A1059+1 -> 59
A1061: =A1060+1 -> 60
A1062: =A1061+1 -> 61 | B1062: Muhammadi Mohallah (Mouza Chah Miran) | C1062: 200000 | D1062: 400000
A1063: =A1062+1 -> 62 | B1063: Mujahid Abad | C1063: 150000 | D1063: 300000
A1064: =A1063+1 -> 63 | B1064: Makhan Pura | C1064: 150000 | D1064: 300000
A1065: =A1064+1 -> 64 | B1065: New Shad Bagh | C1065: 150000 | D1065: 350000
A1066: =A1065+1 -> 65 | B1066: Naulakha & Adjoining Areas | C1066: 200000 | D1066: 400000
A1067: =A1066+1 -> 66 | B1067: New Wassan Pura & Scheme No. 2 | C1067: 150000 | D1067: 350000
A1068: =A1067+1 -> 67 | B1068: Pak Bharat Nagar | C1068: 200000 | D1068: 400000
A1069: =A1068+1 -> 68 | B1069: Singh Pura | C1069: 150000 | D1069: 300000
A1070: =A1069+1 -> 69 | B1070: Shahowari | C1070: 125000 | D1070: 250000
A1071: =A1070+1 -> 70 | B1071: Shalimar Town Baghbanpura | C1071: 100000 | D1071: 200000
A1072: =A1071+1 -> 71 | B1072: Shalimar Link Road (P. S. Baghbanpura to Shalimar Chowk) | C1072: 0 | D1072: Front 400,000 Read 250,000
A1073: =A1072+1 -> 72 | B1073: Saleem Park (Chah Miran) | C1073: 200000 | D1073: 400000
A1074: =A1073+1 -> 73 | B1074: Shad Bagh | C1074: 150000 | D1074: 350000
A1075: =A1074+1 -> 74 | B1075: Shad Bagh Road | C1075: 200000 | D1075: 400000
A1076: =A1075+1 -> 75 | B1076: Sher Shah Road | C1076: 200000 | D1076: 400000
A1077: =A1076+1 -> 76 | B1077: Sultanpura | C1077: 150000 | D1077: 300000
A1078: =A1077+1 -> 77 | B1078: Sultanpura Road | C1078: 0 | D1078: 350000
A1079: =A1078+1 -> 78 | B1079: Sawami Nagar Naulakha | C1079: 150000 | D1079: 300000
A1080: =A1079+1 -> 79 | B1080: Tezab Ahata | C1080: 150000 | D1080: 300000
A1081: =A1080+1 -> 80 | B1081: Tezab Ahata Road | C1081: 0 | D1081: 350000
A1082: =A1081+1 -> 81 | B1082: Umer Din Road Mauza Bela Basti Ram | C1082: 0 | D1082: 350000
A1083: =A1082+1 -> 82 | B1083: Wassanpura | C1083: 150000 | D1083: 350000
A1086: Wahga Town, Lahore
A1087: S. No. | B1087: Name of Locality | C1087: Rate Per Marla Residential | D1087: Rate Per Marla Commercial
A1088: 1 | B1088: Ahmad Town Shadi Pura | C1088: 55000 | D1088: 125000
A1089: =A1088+1 -> 2 | B1089: Darogha Wala | C1089: 100000 | D1089: 200000
A1090: =A1089+1 -> 3 | B1090: Darogha Wala Chowk to Interchange Ring Road Mehmoiod Booti | C1090: 120000 | D1090: 415000
A1091: =A1090+1 -> 4 | B1091: Devi Pura | C1091: 100000 | D1091: 200000
A1092: =A1091+1 -> 5 | B1092: Gulshan-e-Shalimar Scheme | C1092: 120000 | D1092: 250000
A1093: =A1092+1 -> 6 | B1093: Kotli Ghasi | C1093: 80000 | D1093: 130000
A1094: =A1093+1 -> 7 | B1094: Lahore Ring Road falling Wahga Town | C1094: 200000 | D1094: 210000
A1095: =A1094+1 -> 8 | B1095: Lakho Dair | C1095: 60000 | D1095: 140000
A1096: =A1095+1 -> 9 | B1096: Lidhar | C1096: 115000 | D1096: 220000
A1097: =A1096+1 -> 10 | B1097: Mahmood Booti | C1097: 100000 | D1097: 210000
A1098: =A1097+1 -> 11 | B1098: Main GT Road from Sukh Nehar to Wara Sattar Inerchange | C1098: 360000 | D1098: 450000
A1099: =A1098+1 -> 12 | B1099: Manawan | C1099: 90000 | D1099: 245000
A1100: =A1099+1 -> 13 | B1100: Madsoodan Pura | C1100: 100000 | D1100: 200000
A1101: =A1100+1 -> 14 | B1101: Momanpura | C1101: 110000 | D1101: 235000
A1102: =A1101+1 -> 15 | B1102: New Shalimar Housing Scheme | C1102: 150000 | D1102: 210000
A1103: =A1102+1 -> 16 | B1103: Qila Khazana | C1103: 80000 | D1103: 190000
A1104: =A1103+1 -> 17 | B1104: Salamat Pura | C1104: 100000 | D1104: 200000
A1105: =A1104+1 -> 18 | B1105: Shadi Pura | C1105: 85000 | D1105: 200000
A1106: =A1105+1 -> 19 | B1106: Sultan Mahmood Road (Baghbanpura UC 37 & 38) | C1106: 150000 | D1106: 250000
A1107: =A1106+1 -> 20 | B1107: Wara Sattar Intercrange to Jallo More Canal BRB Bridge | C1107: 225000 | D1107: 225000
A1108: =A1107+1 -> 21 | B1108: Canal Point Salamat Pura | C1108: 150000 | D1108: 200000
A1109: =A1108+1 -> 22 | B1109: Gulshan-e-Yasin | C1109: 50000 | D1109: 80000
A1110: =A1109+1 -> 23 | B1110: Gulshan-e-Dowood | C1110: 75000 | D1110: 100000
A1111: =A1110+1 -> 24 | B1111: Sharif Garden | C1111: 125000 | D1111: 225000
A1112: =A1111+1 -> 25 | B1112: Canal Bank House Scheme | C1112: 110000 | D1112: 210000
A1113: =A1112+1 -> 26 | B1113: Gulshah-e-Haider | C1113: 125000 | D1113: 20000
A1114: =A1113+1 -> 27 | B1114: Hanif Park | C1114: 125000 | D1114: 200000
A1115: =A1114+1 -> 28 | B1115: Aziz Garden | C1115: 75000 | D1115: 125000
A1116: =A1115+1 -> 29 | B1116: IBL Home, Jallo Town | C1116: 75000 | D1116: 125000
A1117: =A1116+1 -> 30 | B1117: Asid Garden | C1117: 80000 | D1117: 150000
A1118: =A1117+1 -> 31 | B1118: Ashrif Garden | C1118: 100000 | D1118: 150000
A1119: =A1118+1 -> 32 | B1119: AL-Ghani Garden G. T. Road | C1119: 75000 | D1119: 150000
A1120: =A1119+1 -> 33 | B1120: Tufail Garden | C1120: 75000 | D1120: 100000
A1121: =A1120+1 -> 34 | B1121: Ali Alam Garden | C1121: 90000 | D1121: 150000
A1122: =A1121+1 -> 35 | B1122: Rizwan Garden | C1122: 150000 | D1122: 225000
A1123: =A1122+1 -> 36 | B1123: Lahore Medical Houseing Scheme Phase | C1123: 125000 | D1123: 200000
A1124: =A1123+1 -> 37 | B1124: Al-Karim Garden | C1124: 90000 | D1124: 150000
A1125: =A1124+1 -> 38 | B1125: Al-Rehman Garden Phase & G. T. Road | C1125: 90000 | D1125: 150000
A1126: =A1125+1 -> 39 | B1126: Moeez Town | C1126: 12500 | D1126: 200000
A1127: =A1126+1 -> 40 | B1127: Al-Ahmed Garden G. T. Road | C1127: 90000 | D1127: 150000
A1128: =A1127+1 -> 41 | B1128: Garision Garden (Kotly Ghasi) | C1128: 125000 | D1128: 200000
A1129: =A1128+1 -> 42 | B1129: Canal View Houseing Scheme | C1129: 100000 | D1129: 175000
A1130: =A1129+1 -> 43 | B1130: Abdullah Garden | C1130: 90000 | D1130: 150000
A1131: =A1130+1 -> 44 | B1131: Al Raheem Garden | C1131: 90000 | D1131: 150000
A1132: Rates of Cultivable Land falling in Wahga Town, Lahore
A1133: S. No. | B1133: Name of Locality | C1133: Rate Per Kanal
A1134: 1 | B1134: Lakho Dair | C1134: 275000
A1135: =A1134+1 -> 2 | B1135: Mehmood Booti Bund Road (Both Side) | C1135: 375000
A1136: =A1135+1 -> 3 | B1136: Moman Pura (Both Side) | C1136: 275000
A1137: =A1136+1 -> 4 | B1137: Kotli Ghasi Bund Road (Both Side) | C1137: 475000
A1138: =A1137+1 -> 5 | B1138: Lidhar | C1138: 450000
A1139: =A1138+1 -> 6 | B1139: Baghbanpura | C1139: 425000
A1141: Note:--- Error & omission excepted. Let us know if you find any mistake in Valuation Table.
A1143: Thursday July 01, 2010
A1145: Reproduced by: M/s. Nasir Law Associates (Jurists' House)
A1146: for the convenience of general public.
A1147: Contact: 042-35060468, 0333-4076420, 0312-4624078, & 0321-4624078
A1149: Back